id,created_at,text
1.04E+18,9/22/2018 16:06,when well-meaning but na xc xafve ppl tell me things like i don t think you re autistic or you don t seem autistic to
1.04E+18,9/22/2018 15:37,i was diagnosed autistic when i was before that i was diagnosed with depression at borderline personality
1.04E+18,9/11/2018 13:01,i have years experience being autistic and zero years experience being neurotypical so i'd pre
1.04E+18,9/6/2018 15:42,it's and there are still people who insist that your zodiac sign has no bearing on your personality but that y
1.03E+18,8/17/2018 18:53,rt rt if you would watch a tv cookery show where the presenter chef nis disabled talks openly about it and mental health
1.03E+18,8/14/2018 2:29,on my nd birthday i got breakfast at waffle house and ordered chocolate pie to go with it i mentioned it was my
1.03E+18,8/14/2018 2:07,my bf where's a deer's heart nme what nmy bf where's a deer's heart is it on the left nme idk any
1.03E+18,8/6/2018 18:44,me just bc men care about each other does not mean they're gay stop actin like straight dudes ca not be affection
1.02E+18,8/1/2018 3:22,i feel so seen right now
1.02E+18,7/31/2018 5:07,reasons spaghetti is good n you can throw it at the wall to see if it's done n you can pretend you're dr zoi
1.02E+18,7/26/2018 15:39,my favorite movie of all time
1.02E+18,7/22/2018 23:44,rt a friend of mine saw this sign at a local farmer market and there is not one thing i don love about it
1.02E+18,7/20/2018 2:10,how could i leave off the entire harry potter series pay close attention to the politics in through
1.02E+18,7/20/2018 2:05,brave new world by aldous huxley nthe divergent trilogy by veronica roth nrunning man by richard bachman n nif you have
1.02E+18,7/20/2018 2:04,the illuminatus trilogy by robert shea and robert anton wilson nsuper sad true love story by gary shteyngart nget jir
1.02E+18,7/20/2018 1:59,thank you for coming to this meeting of mouse's book club i have compiled a summer reading list to keep you entert
1.02E+18,7/14/2018 18:20,this thread is so beautiful ni'm a non-binary artist zinester the non-binary flag was color inspiratio
1.02E+18,7/14/2018 12:38,rt autistic new yorkers share their stim-toy stories with aftereffect
1.02E+18,7/14/2018 12:25,rt why should we pay fast food workers an hour anyone can do that jo say people who have never done that job wou
1.02E+18,7/13/2018 1:03,q we don t want humans around here because humans kill anything they don t understand you re dangerous now go a
1.02E+18,7/8/2018 22:29,as a kid in the s i saw so many barbie cakes at birthday parties
1.01E+18,7/2/2018 20:49,kombucha is like that taste that's left in your mouth after you drink too much cheap booze and throw up in your friend's backyard
1.01E+18,6/27/2018 23:53,what if the rapture already happened but only bees were deemed worthy
1.01E+18,6/26/2018 0:40,i'm interested in seeing a present-day american psycho sequel where pat bateman is an aging boomer who thinks he's
1.01E+18,6/25/2018 0:59,rt people who don identify with the gender they were assigned at birth have been working for centuries to guarantee their lib
1.01E+18,6/21/2018 15:13,listening to a year-old man who never got his driver's license and still lives with his mama talk about how he h
1.01E+18,6/21/2018 2:48,today a guy told me netflix does not have all of freaks amp geeks bc they only have one season i told him there only
1.01E+18,6/20/2018 16:01,where are all the celebrities who cared so much about pipelines a year and a half ago where is all the outrage abo
1.01E+18,6/20/2018 15:56,i'm glad so many people gave a shit about what happened at standing rock but i ca not help wondering why the pipeli
1.01E+18,6/19/2018 17:45,me a gifted student who graduated with honors turns off light wow it s dark now
1.01E+18,6/18/2018 14:06,last night i played a board game with an intellectual-type dude and he went on a rant about how every card in the
1.01E+18,6/17/2018 17:27,still me babbling nonsensically if you do not like it we'll have go to the mattresses watch for oranges they sy
1.01E+18,6/17/2018 17:17,me grumbles about toxic masculinity in western culture n nalso me what do you mean you've never seen the godfathe
1.00E+18,6/5/2018 19:57,while playing through earthbound yet again a thought occurred to me has anyone tried searching washington dc or
1.00E+18,6/1/2018 1:17,liberals cancel the show roseanne because the star made a racist tweet nalso liberals you ca not cancel samantha b
