id,created_at,text
1.03E+18,8/29/2018 19:45,what s the point anymore i m alone i ll always be alone fuuuuuuuck the friends i do have
1.03E+18,8/29/2018 9:33,i just broke another vibrator ad
1.03E+18,8/18/2018 11:06,plus i'll be able to take nudes outside at my new place and no one will care
1.03E+18,8/18/2018 11:06,this house is aiight but the lighting is shit and the maintenance guys do not give two fuckity fucks about doing their jobs
1.03E+18,8/18/2018 11:06,i honestly hope that after i move i'm able to take much better pictures xf xf xa xe xf xf xf xb
1.03E+18,8/17/2018 19:42,i also had soooooo many interesting dreams last night n none of which involved odin in drag
1.03E+18,8/17/2018 19:15,rt so yll just think drinking the blood of jesus and eating his flesh isn witchcraft oh okay
1.03E+18,8/17/2018 19:14,so many feels
1.03E+18,8/15/2018 17:39,rt strippers who do pole tricks in strapless pleasers are braver than the marines
1.03E+18,8/15/2018 17:37,i watch star trek tng and want to be ballsy enough to shave my eyebrows off like the amazing whoopi goldberg but alas i am not
1.03E+18,8/15/2018 6:54,i've said it before and i'll say it again if i could live off fruit i would af
1.03E+18,8/15/2018 5:59,i finally got my patreon launched but waiting til the am to make my first official post s to say i'm nervous is
1.03E+18,8/15/2018 2:40,i really wish i could pay someone in kush to do my nails smoke ya down do some creative shit listen to rap smok
1.03E+18,8/13/2018 9:43,rt men on the internet your teeth are disgusting bucked tooth ass bitch n nmen in the club you have the most beautiful smi
1.03E+18,8/13/2018 9:41,i just got messy in it like i get messy in pussy if i'm lying i'm dying af
1.03E+18,8/13/2018 9:39,i'm convinced mango is the fruit of the goddesses xf xf xf xb
1.03E+18,8/10/2018 10:09,killing this bowl and laying back down a
1.03E+18,8/10/2018 10:07,i have to be awake and a functional human being in hours a ni have not slept in two days nand i have a migraine ad n npray for me fam f xf xf xf xb
1.03E+18,8/10/2018 9:41,rt that awkward moment when you're talking to your friend in the dressing room and you cant decide whether to look in the m
1.03E+18,8/10/2018 9:41,shit i'll take this any day af
1.03E+18,8/10/2018 9:30,woop woop firsttweet n nhowdy from your local stripper xf xf xf xbc ni love weed and cats b nand this is my undercover twitt
