id,created_at,text
1.07E+18,11/26/2018 15:06,everyone knows that tho
1.07E+18,11/26/2018 15:02,twitter does not lie
1.07E+18,11/26/2018 15:01,yes yes it is i do not return your crush a
1.07E+18,11/26/2018 14:59,inari stop this nonsense smh
1.07E+18,11/26/2018 14:58,inariiiiiiiiii
1.07E+18,11/26/2018 14:54,drumsticks
1.07E+18,11/26/2018 14:53,yusuke explain
1.07E+18,11/26/2018 14:51,dank xf xf xa x
1.07E+18,11/26/2018 14:46,nononononononononononononononononononononononononononononono
1.07E+18,11/26/2018 14:45,rt ladies if he n n-never texts you first n-never uses his real name n-claims a house cat insists he sleep after a single
1.07E+18,11/26/2018 14:44,he said my damn video game guys he could not beat the boss level
1.07E+18,11/26/2018 0:19,i will not be your wife now get out
1.07E+18,11/26/2018 0:13,look ma n nim flipping the bird
1.07E+18,11/25/2018 16:06,rt hey guys admin here recently i have joined in a persona project called midnight channel the musical currently
1.07E+18,11/25/2018 16:05,guys they did surgery on a grape
1.07E+18,11/25/2018 14:04,it is he yusuke the king of breaking his own neck
1.07E+18,11/25/2018 2:20,he broke the chain how dare u break the chain
1.07E+18,11/25/2018 2:19,gramps they did surgery on a grape
1.07E+18,11/25/2018 2:19,they did surgery on a grape
1.07E+18,11/25/2018 2:16,rt bbbb come to americaaaaaaaaaaaaa
1.07E+18,11/25/2018 2:16,hey they usually announce stuff with this keep your hopes up
1.07E+18,11/25/2018 1:56,rt b xe x xbd xe xbd x xe x x xe xf xc xe x x p
1.07E+18,11/25/2018 1:56,i n n xe xa xaa am straight n n xe xa xaa am bi n n xe xa xaa am gay n n am groot
1.07E+18,11/24/2018 21:13,the same poses n nthe same headshape n nthe same eyecolor n ncoincidence n ni think not
1.07E+18,11/24/2018 17:52,rt xe x xbc xe x x xe x xb xe x xe xe xa xb xe x xba xe x xe xe xe xa xe x xe xe xa xb xe x xb xe x xb xe x x xe x xf xe x x xe x xba xe x x xe x xb xe x x xe x x xe x xf xe xbf xb xe x x xe x xa xe x xf xe xb xa xe x xb xe xb xb xe x x xe x xe xef xbc x xef xbc x
1.07E+18,11/24/2018 13:14,that was a pretty sheety joke you made
1.07E+18,11/23/2018 16:54,she sang true story actually
1.07E+18,11/23/2018 14:14,daughtership ended with sojiro neo featherman hawk is my father now
1.07E+18,11/23/2018 14:07,futabafriday n nkaraoke with my fellow social outcasts naoya and marie srsly tho naoya what are you doing
1.07E+18,11/22/2018 23:14,rt busy with the family but i could not help but sketch something for today whatever your plans are be safe and have fun
1.07E+18,11/22/2018 18:10,rt like hug for renren n rt one kiss on the forehead for renren
1.07E+18,11/22/2018 15:59,bbbbb
1.07E+18,11/22/2018 15:56,his proficiency is so good that he can give me a princess braid for cosplay
1.07E+18,11/22/2018 15:19,rt happy thanksgiving aka turkey day n nthe children each have a turkey for you n n wait marie why is that turkey cooked n nm
1.07E+18,11/22/2018 14:34,this is not over inari n nit is not over
1.07E+18,11/22/2018 14:30,to all the americans happy thanksgiving day n ni i live in japan n n i'm gonna say it anyway n ni'm thankful for e
1.07E+18,11/22/2018 14:15,me and yusuke do this everyday except we switch places
1.07E+18,11/22/2018 13:26,fuck i owe ryuji a hundred yen now why did i make that bet
1.07E+18,11/22/2018 13:23,wow yusuke really setting the bar low there
1.07E+18,11/22/2018 8:37,rt
1.07E+18,11/22/2018 8:35,e
1.07E+18,11/22/2018 4:01,rt my children in d aka the socially inept trio n nmodel rips for marie futaba and leblanc xelandis nxnalara naoya edit
1.07E+18,11/21/2018 21:25,two dorks in their natural habitat
1.07E+18,11/21/2018 16:16,i was just walking through shibuya trying to get some new video games and then i see ren holding up this sign n n
1.07E+18,11/21/2018 1:34,but i have ligma xf xf xa x xf xf xa x xf xf xa x
1.07E+18,11/21/2018 1:33,left ren's harem to become leader of akeshu clu
1.07E+18,11/21/2018 1:32,he did he totally did
1.07E+18,11/21/2018 1:26,i purely hypothetically dropped out of ren
1.07E+18,11/21/2018 1:19,i am futaba sakura and i approve of this message
1.07E+18,11/21/2018 0:26,we all did hmph not inviting us to the wedding
1.07E+18,11/21/2018 0:16,wait really huh was he playing skyward sword
1.07E+18,11/21/2018 0:15,he is not responding to you either akechi weird
1.06E+18,11/20/2018 21:30,rt xe xb xa xe x x xe xb xa xe x x xe x xf xe x x xe x xb xe xb x xe x x xe x xf xef xbc x xef xbc x xef xbc x xef xbc xaaa
1.06E+18,11/20/2018 21:30,rt xe x x xe x xb xe xaf x xe x xfa xe x xfe xe xb xbb xe xf xc xe x x xe x xf
1.06E+18,11/20/2018 21:27,i'm still wondering why ren is not answering my texts though maybe he's been playing skyward sword all day
1.06E+18,11/20/2018 18:27,i wanted to be flower girl a
1.06E+18,11/20/2018 18:18,rt if you own a says account dont make a ko-fi or any other donation system the likes and laughter you cause with your account
1.06E+18,11/20/2018 12:45,gosh darnit i wish but i live across the country q-q
1.06E+18,11/19/2018 21:26,got it first try lez go
1.06E+18,11/19/2018 21:25,rt like and retweet when you get it
1.06E+18,11/19/2018 21:24,rt if this gets over retweets i'll convince to say fuck
1.06E+18,11/19/2018 21:24,why do you do these things to me inari
1.06E+18,11/19/2018 15:52,rt tried my copic markers at an old sketch i found i'll have more spiderman stuff soon n npersona art
1.06E+18,11/19/2018 1:35,rt an ann for your troubles day xe xc xa n nmerch haul
1.06E+18,11/19/2018 1:34,rt anyways i'm shujin uniform futaba today
1.06E+18,11/19/2018 1:34,shinji delete that delete delete delete deleeeeeete
1.06E+18,11/19/2018 1:32,smh my english voice is amazing you're missing out aaa
1.06E+18,11/19/2018 1:29,rt f xe xa xcfcd xe x x xe xc xa xe x xf xe x xb xe xad xaf xe xa xa xe x x xe x xb xe xf xc xe x x xe xf xaf xe x xb xe x xb xe x xfe xe x x xe x x xe x x n xe x x xe x x xe xad xaf xe xa xa xe xa x xe x xfa xe x x xe x x xe x xb xe x xaw
1.06E+18,11/18/2018 14:25,rt these are my children n nnaoya the forgotten nmarie the hated nfutaba the shut-in n nthey are the socially inept squad
1.06E+18,11/18/2018 14:22,ahem n n n nfour hundred followers n nyou guys are awesome i am totally leveling up n nyo let's keep farming for s
1.06E+18,11/18/2018 12:36,ryuji said fuck everyone ryuji said fuck the world is ending the sun is exploding akechi hates pan
1.06E+18,11/18/2018 12:02,rt you ca not tell me what to say
1.06E+18,11/17/2018 22:33,us navis are too dank for you nbs
1.06E+18,11/17/2018 16:01,the subway
1.06E+18,11/17/2018 14:44,you really need to wat h your money
1.06E+18,11/17/2018 14:40,rt i'll guide you to victory joker n nthank you for making this game nhope u like the first photo i will upload
1.06E+18,11/16/2018 15:47,spend your money wisely young padawan
1.06E+18,11/16/2018 15:45,rt persona xe xb xbb xe xf xc n xe xbb xaf xe x xb xe x x n n xe xb xbb xe xba xbac xef xbc xa xe x x xe x xf xe x x xe x x n xe xf xc xe x x xef xbc xa xe xa xa nphoto
1.06E+18,11/16/2018 12:58,he should really start spending his money on food rather that lobsters and paints
1.06E+18,11/16/2018 11:37,headpats for you lavenza
1.06E+18,11/16/2018 11:36,rt i might be in this spiderman x persona mood for a minute it's fun n npersona spiderman art
1.06E+18,11/15/2018 22:09,bwahahahahaha
1.06E+18,11/15/2018 19:55,i'm a better hacker
1.06E+18,11/15/2018 19:45,everything n neverything inari
1.06E+18,11/15/2018 18:31,let me teach you instead for i am superior
1.06E+18,11/15/2018 1:26,rt i will not satisfy me to simply say how much stan lee and his work meant to me instead i will use what he taught us t
1.06E+18,11/14/2018 14:09,aaaaaand there's the door
1.06E+18,11/14/2018 12:38,i wonder if i can make a profit off of that
1.06E+18,11/13/2018 23:57,oh nice police cars are heading your way
1.06E+18,11/13/2018 23:55,gasp my electronics n n jk my dude you know they have computers everywhere right
1.06E+18,11/13/2018 23:53,thank god ni have hotspot
1.06E+18,11/13/2018 23:52,rt when we told futaba she could have fun with her dancing outfit we did not expect this pd
1.06E+18,11/13/2018 23:52,i will splatoon your face ryuji mwehehe
1.06E+18,11/13/2018 23:51,i'll take your credit card fite me
1.06E+18,11/13/2018 23:49,dont he was enjoying it too much he even said that he owned it like a queen
1.06E+18,11/13/2018 23:14,p s i was lying about the whole likes thing n ni made do it anyway
1.06E+18,11/13/2018 21:27,futaba's room and futaba herself were ripped from p the room ripped by k-keii futaba ripped and rigged by twos
1.06E+18,11/13/2018 21:23,likes and i'll force ren to do it
1.06E+18,11/13/2018 14:18,inari you have issues
1.06E+18,11/13/2018 13:00,i have a life outside of ren's that's right do not you guys remember when n n omitted because ren was not present
1.06E+18,11/12/2018 22:30,rest in peace stan lee he left too soon thank you for making all of us happy with your creations
1.06E+18,11/12/2018 16:05,stole her bubblegum no takebacks
1.06E+18,11/12/2018 15:03,eh probably
1.06E+18,11/12/2018 13:00,it's ann's birthday everybody wooooooo n
1.06E+18,11/12/2018 1:21,god taught us to read in between the lines yosuke
1.06E+18,11/11/2018 19:20,beef ramen bowl n n interesting
1.06E+18,11/11/2018 19:17,le gasp ramen is love ramen is life
1.06E+18,11/11/2018 18:42,oh ya jelly
1.06E+18,11/11/2018 18:19,when did you become a trashcan
1.06E+18,11/11/2018 18:02,if our goddess miku says to eat it after putting it in the fridge we eat it after putting it in the
1.06E+18,11/11/2018 17:50,let it sleep in the fridge and freeze lala-san n nlet it freeeeeeze
1.06E+18,11/11/2018 16:29,pocky day n npffft do not mind me just blaring the hatsune miku pocky commercial
1.06E+18,11/11/2018 14:03,whaaaat but i was gonna give him extra pancakes p
1.06E+18,11/11/2018 2:54,i adopted you n nmwahaha
1.06E+18,11/10/2018 17:01,rt i wanted my first doodle with copic markers to be special so i made this to support my friend far right o
1.06E+18,11/10/2018 13:41,rt i want to try something fun for a future project comment this with names of vg characters so that it completes this pr
1.06E+18,11/10/2018 13:39,i love this so much
1.06E+18,11/10/2018 1:49,someone decided to recarm you last minute and hid your body
1.06E+18,11/10/2018 1:23,yosuke is kronk confirmed
1.06E+18,11/9/2018 22:14,rt futaba can be really in sync with her teammates i guess that's the benefit of being the navigator she's come into her ow
1.06E+18,11/9/2018 19:44,rt curious fact i actually cosplayed futaba for the persona portuguese launch at fnac ni want to get a new wig but mako
1.06E+18,11/9/2018 17:42,rt have some ren and futaba pics nfutabafriday
1.06E+18,11/9/2018 17:39,rt whenever futaba is done and out of school for the day she treats herself to sojiro's curry futabafriday
1.06E+18,11/9/2018 17:39,a day dedicated to me allows me to spam likes and retweets n nfutaba friday is the exception alexa unleash the roombas
1.06E+18,11/9/2018 17:38,rt i ve been with you long enough to know when you re not telling me things n nshufuta renamamiya futabasakura xe xb xbb xe xf xc
1.06E+18,11/9/2018 17:30,best ren harem member
1.06E+18,11/9/2018 15:04,rt this is a good image
1.06E+18,11/9/2018 14:58,rt hello it's futabafriday i hope your day will be as wholesome and as wonderful as the sweet neet herself
1.06E+18,11/9/2018 14:45,it's futabafriday once again n n m-my hair w-whaaaat it's not dyed pfft t-totally not what are you talki
1.06E+18,11/9/2018 13:49,plot armor my dude plot armor
1.06E+18,11/9/2018 13:47,if you're dead how are you typing n n xf xf xa x xf xf xa x xf xf xa x
1.06E+18,11/9/2018 13:46,i'd ask someone to recarm you but i think my knowledge needs to be lower to do that
1.06E+18,11/9/2018 13:35,i do it's called dumb ways to die n n yeah some dumbass was playing with the toaster in the bathtub it did not end well
1.06E+18,11/9/2018 2:26,i'll test it when i can use your paints to graffiti your place and your face p
1.06E+18,11/9/2018 2:14,super ultra double move
1.06E+18,11/9/2018 2:08,umm duh
1.06E+18,11/9/2018 1:56,it means i deposited enough money for you two your date's on saturday glhf
1.06E+18,11/9/2018 1:50,i met this girl online while i was playing an mmo her name's eriko apparently knows na
1.06E+18,11/9/2018 1:39,eriko n nshe really wants you to do her n njust saying
1.06E+18,11/9/2018 1:09,if you break the rules we break them back alls fair in cheating and war
1.06E+18,11/8/2018 21:53,and months after the phantom thieves shoot god in the head i upload it to youtube a
1.06E+18,11/8/2018 16:15,and wash your hands with vegetables
1.06E+18,11/8/2018 16:12,hey teddie wanna team up we split the money
1.06E+18,11/8/2018 16:09,it's not copying if i hack
1.06E+18,11/8/2018 15:15,nah bro shes fine
1.06E+18,11/8/2018 15:14,rt someone help me na clone of teddie just stole my money
1.06E+18,11/8/2018 15:14,i put the fun in no refunds a
1.06E+18,11/8/2018 15:02,nope p
1.06E+18,11/8/2018 14:59,right now thanks for helping me afford my new equipment
1.06E+18,11/8/2018 14:56,too late got it here's your hug
1.06E+18,11/8/2018 14:49,__ n uwu u want this n gt n n __ n need credit card info st n gt b lt n
1.06E+18,11/8/2018 13:11,if ya ca not spell mocking it only proves my point n
1.06E+18,11/8/2018 12:58,nah dude the floor's going easy on you it wants to make you believe you're winning p
1.06E+18,11/8/2018 0:09,hehehehehehehe
1.06E+18,11/5/2018 12:55,thanks for sticking around guys i'm feeling super charged up now wooo
1.06E+18,11/5/2018 12:11,our lord and savior kirby please save this poor soul named numbskull amen
1.06E+18,11/5/2018 12:08,i'd rather have a dead guardian than a guardian who listens to ryuji p
1.06E+18,11/5/2018 12:00,did not did you see how i reacted
1.06E+18,11/5/2018 11:55,fight fight fight fight
1.06E+18,11/5/2018 11:45,i'd like to have a different guardian now thanks
1.06E+18,11/4/2018 23:35,thanks for your credit card information i'll put it to good use
1.06E+18,11/4/2018 22:46,futaba public service announcement n nligma is now considered illegal nuse it and i will get your credit card info nmw
1.06E+18,11/4/2018 21:13,oooooooo naoya got friendzoned
1.06E+18,11/4/2018 2:24,nopenopenopenopenopenopenopenopenopenopenopenope
1.06E+18,11/4/2018 2:23,u cool so i'll let it slide
1.06E+18,11/4/2018 2:22,ryuji explain
1.06E+18,11/4/2018 2:22,affinitweet stolen kiss nryuji_runs would kiss you around the corner f nand you who would do it nvia
1.06E+18,11/4/2018 2:22,affinitweet valentine nthis year you're mine g_dunkle xe xd xa xef xb xf nand you whom will be yours nvia
1.06E+18,11/4/2018 2:21,affinitweet secret crush nmidnightglade secretly loves you b nwho loves you in secret nvia
1.06E+18,11/4/2018 0:18,she's learning n n perfect
1.06E+18,11/4/2018 0:05,no u
1.06E+18,11/3/2018 10:33,playing and replaying all the kingdom hearts games
1.06E+18,11/2/2018 15:25,attaaaaaaaaaaaaaack
1.06E+18,11/2/2018 15:08,worldoflight kirby churchofkirby kirbyism kirbyissavior
1.06E+18,11/1/2018 21:10,prometheus is my ultimate persona n nnah bro kirby is my ultimate persona
1.06E+18,11/1/2018 0:17,you are learning i shall teach you the way of the memes chihaya-san mwehehehe
1.06E+18,11/1/2018 0:16,seems futaba has returned from her trick-or-treating adventures now then i must return to my days as a persona
1.06E+18,10/31/2018 20:38,aww hell yeah time for trick-or-treating empty your bags plebs
1.06E+18,10/31/2018 17:14,oh no he's ascended to stage of ligma everyone run before you get infected
1.06E+18,10/31/2018 11:55,futabalogs n nfor some reason i got rushed into a library and asked to get a book of where i was from how dare t
1.06E+18,10/31/2018 10:46,today is the day i'm going to go to school for the first time ever n nwish me luck on this halloween to remem
1.06E+18,10/31/2018 10:46,congratulations erika aaaaaa i'm so happy for yoooouuuu
1.06E+18,10/30/2018 20:40,rt kidnapper we have your daughter n n we do not have a daughter n nkidnapper then who just asked me to let
1.06E+18,10/30/2018 18:33,thank you sojiro the world has been cleansed
1.06E+18,10/30/2018 18:32,yosuke what are you doing why are you doing it and do we need to hold an intervention
1.06E+18,10/29/2018 20:04,amazing panther though i think you lil mona needs
1.06E+18,10/29/2018 12:23,it is he just wont admit it
1.06E+18,10/29/2018 10:39,funny how you're claiming it's only for running equipment
1.06E+18,10/29/2018 10:37,not my fault someone keeps messing with my phoenix featherman rangers r figures
1.06E+18,10/28/2018 18:37,admin there are many things wrong with this shitpost plez forgive me tt tt
1.06E+18,10/28/2018 17:12,halloween's in three days driving people is my job as a shadow e
1.06E+18,10/28/2018 16:47,so you were interacting with a ghost then tch his harem extends to the afterlife now
1.06E+18,10/25/2018 23:57,rt rt and i'll put your pfp into these character slots
1.06E+18,10/25/2018 17:45,screeeeeeeeee
1.06E+18,10/25/2018 11:38,inariiiiiiii stoooooooooop
1.06E+18,10/25/2018 11:37,you know it
1.06E+18,10/24/2018 22:26,the real joke is that i drew this in a church classroom e
1.06E+18,10/24/2018 19:43,exactly
1.06E+18,10/24/2018 16:18,seriously atlus he should be a brontosaurus get it right
1.06E+18,10/24/2018 15:38,rt never gonna call out anime artists out for not being able draw older women anymore just kidding i totally will but agin
1.05E+18,10/23/2018 14:08,the only one who should go is the one saying any of us should go n neee
1.05E+18,10/23/2018 14:07,heart stolen hacker equipment upgraded sojiro credit card reloaded woo
1.05E+18,10/21/2018 0:21,i suggest you don na naorin got the nav so i training him to be a phantom thief
1.05E+18,10/20/2018 20:03,sorry this hacker has to upgrade her stuff see ya guys
1.05E+18,10/20/2018 3:26,rt these are my shadow babs kazuya and necronomicon n nhurt them and i hurt you n nhisssss
1.05E+18,10/20/2018 3:00,i am the pharaoh of my tomb
1.05E+18,10/19/2018 18:13,alriiiiiiight see sojiro we rich
1.05E+18,10/19/2018 18:09,hmmmm how about club penguin coins
1.05E+18,10/19/2018 18:02,the package of lol weed should arrive in one business day now pay up
1.05E+18,10/19/2018 17:36,but sojiroooooooooooooo
1.05E+18,10/19/2018 17:24,it called xe x xlol weed xe x x
1.05E+18,10/19/2018 17:24,hugs
1.05E+18,10/19/2018 15:02,rt thinks of all the possible colors futaba could dye her hair with nfutabafriday
1.05E+18,10/19/2018 14:38,help i broke the ats true xe x x button
1.05E+18,10/19/2018 12:50,guess who birthday it is n nhappy birthday yukari-chan woo
1.05E+18,10/19/2018 12:36,n-nothing
1.05E+18,10/19/2018 11:25,at least that is what my true self believes after all
1.05E+18,10/19/2018 1:07,do it i dare you
1.05E+18,10/19/2018 0:48,pfffft you xe x xre my parent and my child now
1.05E+18,10/19/2018 0:30,children grand children and wife ai you must stop this nonsense at once
1.05E+18,10/19/2018 0:23,i married to you now
1.05E+18,10/19/2018 0:21,okay n nso n nmy parents are and napparently i married to nand my
1.05E+18,10/19/2018 0:00,oy oy oy oy hands off sojiro credit card that my money
1.05E+18,10/18/2018 23:59,p-polygamy what is going on
1.05E+18,10/18/2018 23:55,wait so i have children and a husband now that isn
1.05E+18,10/18/2018 23:21,what the fuck xe x x
1.05E+18,10/18/2018 17:18,shhhhh i equipped it with tm in generation
1.05E+18,10/18/2018 16:57,because you activated my trap card i sunk your battleship and cast magic missile while adopting your goblin tribe
1.05E+18,10/18/2018 15:03,hisssssss
1.05E+18,10/18/2018 14:55,e
1.05E+18,10/18/2018 14:54,hmmmm n ni xe x xll let it slide
1.05E+18,10/18/2018 14:51,see that depends
1.05E+18,10/18/2018 14:51,oh oh and they need to make memes
1.05E+18,10/18/2018 11:14,b n n n ni found the devil reincarnate
1.05E+18,10/18/2018 11:09,pffft nah i not homeschooled n n wow this is i mm i just xe x xnope yeah this is a thing wow
1.05E+18,10/18/2018 1:37,rt best forgotten senpai boi and best hermit-crab kouhai girl n nnaoya and futaba wooooo
1.05E+18,10/18/2018 1:28,alright here come the buffs
1.05E+18,10/17/2018 22:20,in my defense ya'll need to stop making tik tok cringe compilations memes i was just cleansing your souls
1.05E+18,10/17/2018 15:33,then i go on a secret operative mission to bring tech back
1.05E+18,10/17/2018 15:27,then we go all this is sparta on that bitch
1.05E+18,10/17/2018 12:59,hey i'm only trying to protect my pupil in gaming what can i say
1.05E+18,10/17/2018 12:56,let me mess with the three stooges a little longer shinji
1.05E+18,10/17/2018 12:55,i kid i kid it from mementos but if you don want the money
1.05E+18,10/17/2018 12:53,transferred the transaction was a success
1.05E+18,10/17/2018 12:46,nah i good thanks
1.05E+18,10/17/2018 12:41,oh look the three stooges gramps gramps and dun
1.05E+18,10/17/2018 9:54,whaaaaaaaaaaaa nooooooooooooooo
1.05E+18,10/17/2018 1:32,but in all seriousness please be careful with those types of messages on psn bad things will happen so please be safe
1.05E+18,10/16/2018 18:43,xf xf xa x xf xf xa x xf xf xa x
1.05E+18,10/16/2018 18:02,hehehehehehehehehehehehehehe n nyou're welcome gt d
1.05E+18,10/16/2018 16:42,if we keep it i wo not use your credit card
1.05E+18,10/16/2018 16:34,yes
1.05E+18,10/16/2018 15:27,b-but sojirooo it's
1.05E+18,10/16/2018 14:49,i wanna keep them a
1.05E+18,10/16/2018 11:46,welcome to futaba hacks here's a sum-up of what goes on around here good luck have fun n noooo you can ask me qu
1.05E+18,10/16/2018 10:49,chill out ryuji i know you can say fuck but you don need to take it out on me be cool about it yeah
1.05E+18,10/16/2018 10:35,we don we dead inside
1.05E+18,10/16/2018 0:44,really then where did all those weird purchases come from not to mention the v-bucks
1.05E+18,10/16/2018 0:10,pfft yeah where do you think he gets all those things
1.05E+18,10/15/2018 23:46,i didn use your credit card i used ren duh besides i sold the sky landers for a hella ton of yen e
1.05E+18,10/14/2018 16:38,fiiiiiiine
1.05E+18,10/14/2018 16:33,pharaoh futaba yes
1.05E+18,10/14/2018 16:27,hell yeah blaze it
1.05E+18,10/14/2018 15:07,thank you kindly for followers i hope to create content that will brighten everyone's day for as long as possi
1.05E+18,10/14/2018 13:57,e
1.05E+18,10/14/2018 13:27,shaddup shinjiro come back when you a main character
1.05E+18,10/14/2018 13:25,this is accurate
1.05E+18,10/14/2018 0:05,happy birthday
1.05E+18,10/13/2018 23:37,sent it to you through email ann like what ya
1.05E+18,10/13/2018 3:27,but sojiroooo
1.05E+18,10/13/2018 1:08,whoa a fluffy kitty so soft oo
1.05E+18,10/13/2018 1:01,hehehe they have way worse ones
1.05E+18,10/13/2018 1:00,nyani
1.05E+18,10/13/2018 0:15,rt married shutaba for futabafriday n nwalking on the beach with your hero it's like something out of a fairytale huh
1.05E+18,10/13/2018 0:15,shhhhhhhhh the pharaoh says what the pharaoh says
1.05E+18,10/12/2018 18:33,i support your ship mwehehe
1.05E+18,10/12/2018 18:25,nah it common knowledge that he has a harem and i a part of it kek
1.05E+18,10/12/2018 18:23,fight fight fight fight
1.05E+18,10/12/2018 18:20,over my dead body will i ever date inari p
1.05E+18,10/12/2018 18:09,um no it means the internet has bailed on us run ntop anime betrayals
1.05E+18,10/12/2018 18:08,yes i xe x xve been spamming divine judgement on them
1.05E+18,10/12/2018 18:08,good question inari good question
1.05E+18,10/12/2018 17:54,it a blush of cringeeee
1.05E+18,10/12/2018 17:51,aaaaaaaaaaaaaa face the wrath of the pharaoh
1.05E+18,10/12/2018 15:11,ah see i tried but he kept evolving into weird phases n n n n eh can hurt to try again
1.05E+18,10/12/2018 15:09,how can i curse someone who is already curse dunkle
1.05E+18,10/12/2018 15:05,hnnnnnnnnnnnnnnng
1.05E+18,10/12/2018 14:45,how about no
1.05E+18,10/12/2018 13:58,stooooooooooooop
1.05E+18,10/12/2018 13:48,ewwwwwwwwwww
1.05E+18,10/12/2018 13:43,come to the dark side hifumi we have shogi and cookies
1.05E+18,10/12/2018 11:43,oh god bonehead and inari oh no
1.05E+18,10/12/2018 11:22,if i was a male phantom thief which one would i be xf xf xa x xf xf xa x xf xf xa x
1.05E+18,10/12/2018 3:05,wanna
1.05E+18,10/12/2018 2:00,nice ann folder ya got there kirakira would be a shame if someone were to leak it
1.05E+18,10/12/2018 0:37,futaba's life hacks nif you want a good laugh hack into your friend's phones and make shortcuts to different words
1.05E+18,10/11/2018 22:37,she an or
1.05E+18,10/11/2018 22:37,s
1.05E+18,10/11/2018 22:27,nah she obviously a cryptid
1.05E+18,10/11/2018 22:24,she not a persona she the one who gave me admin privs duh
1.05E+18,10/11/2018 22:12,n-necronomicon what have they done to you
1.05E+18,10/11/2018 20:04,i in love with the red phoenix featherman ranger and his name is ryuji n nthen ryuji would come in to kick my as
1.05E+18,10/11/2018 13:15,but what if the concrete was liquid concrete xf xf xa x xf xf xa x xf xf xa x
1.05E+18,10/11/2018 10:31,in my defense they are worldwidely known for being seafood
1.05E+18,10/11/2018 10:10,rt worldmentalhealthawarenessday nthe world is a dark place and there will always be dark times but at the darkest
1.05E+18,10/11/2018 10:01,excuse me inari
1.05E+18,10/10/2018 21:33,i have anxiety depression and multiple personality disorder n nbut i xe x xm still alive and breathing no matter what l
1.05E+18,10/10/2018 18:08,rt let's never forget the time futaba hijacked the entire broadcasting system of japan nnationwide nfor a calling card ht
1.05E+18,10/10/2018 11:24,umm obviously you a bus no questions asked
1.05E+18,10/10/2018 11:24,how about no
1.05E+18,10/9/2018 23:48,fiiiiiiine i xe x xll let it slide
1.05E+18,10/9/2018 23:28,oh look he ran away
1.05E+18,10/9/2018 23:22,aaaaaaaaaaaaaaaaaaaand he's hit a good one boys look at those cheesy jokes fly they're out of the ball
1.05E+18,10/9/2018 22:42,for the last time i wanted my coffee black you keep giving it to me with cream you should not be proud of that old man
1.05E+18,10/9/2018 22:21,worst father of the year
