id,created_at,text
1.05E+18,10/9/2018 21:16,mwehehehe that's right plebs i am officially best girl bow before me ahahaha
1.05E+18,10/9/2018 21:04,rt last year i drew witch makoto n nthis year werewolf futaba
1.05E+18,10/9/2018 20:05,that is acceptable for that is what i am thank you
1.05E+18,10/9/2018 20:05,sojiro how could you
1.05E+18,10/9/2018 15:29,you'll never know until the next time
1.05E+18,10/9/2018 15:27,mwehehe n nthis time
1.05E+18,10/9/2018 15:12,aha i see n nyou have won this time
1.05E+18,10/9/2018 14:54,you shall be cursed
1.05E+18,10/9/2018 14:51,no one calls me a monster no one hmph
1.05E+18,10/9/2018 13:15,ann there is a difference between the two get it right
1.05E+18,10/9/2018 12:13,how about no
1.05E+18,10/9/2018 1:21,who is my true self making friends with and why do i keep hearing futaba refer to her as jailtime
1.05E+18,10/8/2018 17:21,for my first pharaoh cursed victim whenever ren says the word dirty laundry it ll always turn into acid you ha
1.05E+18,10/8/2018 0:22,my rage in it of itself ensured that my name could not be seen by mere mortals n n aka admin forgot owo
1.05E+18,10/7/2018 22:38,you can if you arrest him in his sleep n n xf xf xa x xf xf xa x xf xf xa x
1.05E+18,10/7/2018 22:21,oh mona little did you know that he would be dreaming about strengthening his harem
1.05E+18,10/7/2018 22:20,fbi open up
1.05E+18,10/7/2018 22:07,thank god
1.05E+18,10/7/2018 21:30,if you like despacito i will curse you
1.05E+18,10/7/2018 17:50,rt more futaba cosplay seriously i love this
1.05E+18,10/7/2018 11:55,ryuji that that not xe x x n nagh yeah sure fine humans control weather now got it
1.05E+18,10/7/2018 11:53,this one seems like the cool guy that could be a player i like the final version because he seems like
1.05E+18,10/6/2018 19:09,people keep saying i a mini-ren n nwell let just say that with a key item certain things happen to you that cau
1.05E+18,10/6/2018 12:09,i question why my true self decides to follow these accounts
1.05E+18,10/6/2018 12:06,press f to pay respect for the lack of cheese
1.05E+18,10/6/2018 1:28,poseidon bows before her
1.05E+18,10/6/2018 1:24,looks they might be looking at this conversation right now
1.05E+18,10/5/2018 22:15,friendly futaba-minder no matter what may happen no matter what stands in your way never lose sight of what's
1.05E+18,10/5/2018 20:38,wait really akechi i thought you were married to pancakes
1.05E+18,10/5/2018 20:30,shhhh i intimidating the assholes
1.05E+18,10/5/2018 18:20,futaba rules of life n nrule if someone pisses you off challenge them to final destination no items and fox
1.05E+18,10/5/2018 13:43,futabafriday more like phantomfutabafriday n nlet get our egyptian futaba on this friday
1.05E+18,10/5/2018 11:17,it very comfortable i don know what you talking about
1.05E+18,10/4/2018 21:56,that max charm of his is really causing trouble
1.05E+18,10/4/2018 18:29,seems that morgana yelling at all of you to go to sleep has definitely hurt him in this
1.05E+18,10/4/2018 17:12,rt meanwhile in shibuya n n p naoya sprite created by bluerainbow on tumblr q w q
1.05E+18,10/4/2018 17:03,rt nyc trip cosplaying futaba and it just so happens to be nycc weekend so xf xf xa x xf xf xa x
1.05E+18,10/4/2018 13:11,risen from the ashes of her roasted remains futaba returns to play around with her newfound magic and cast a spell
1.05E+18,10/4/2018 11:10,skeletor i thought you were dressed up as a dumbass
1.05E+18,10/4/2018 10:24,oh wow an everyone at this hour n n oh and i guess that emergency presidential alert too
1.05E+18,10/4/2018 1:19,at least i live within a pyramid unlike the cave you live in
1.05E+18,10/4/2018 0:51,he old i think his brain rotting
1.05E+18,10/3/2018 22:02,hm it seems he s hit his fuck limit for the next decade
1.05E+18,10/3/2018 16:32,that way you can boil them for ever longer and waste more of your precious time
1.05E+18,10/3/2018 1:43,if he dresses up as bowsette do i have permission to leak his files this time
1.05E+18,10/2/2018 14:07,inktober n nit funny how you assume that i dead i xe x xll only be tranquil once i get my revenge n nmore spo
1.05E+18,10/2/2018 11:01,rt more og meeting au ft the sakura fam n nadult confidant au
1.05E+18,10/2/2018 10:13,admin you guys really like shadow futaba whoa
1.05E+18,10/2/2018 1:20,kekekekekek then do not hate the player hate the game old man
1.05E+18,10/2/2018 1:18,i do not know if i should be disappointed especially if this is coming from you sojiro n n nope
1.05E+18,10/2/2018 1:17,of course after all i helped her come to her senses last time now i'm just here to make sure she
1.05E+18,10/2/2018 1:13,hm panic and why is that my presence is only for this month should not we cherish this opportuni
1.05E+18,10/2/2018 1:06,ah nijima-san happy spooktober to you too it's nice to see you again
1.05E+18,10/2/2018 1:03,the fact that she keeps saying she's a flattie and wants to grow them seems to contradict such stat
1.05E+18,10/2/2018 0:56,spread the word my disciple gt d
1.05E+18,10/2/2018 0:55,twitter's had too much fun with that as had futaba herself
1.05E+18,10/2/2018 0:47,this is shadow futaba i'm taking over my true selves account just because i do not want her wearing whatever the he
1.05E+18,10/1/2018 23:34,you leveled up exp
1.05E+18,10/1/2018 21:55,inktober n npoison apples are definitely my go to mwehehe n nextra exp to those who know who gravestone that
1.05E+18,10/1/2018 15:12,but mona would've listened to ann because she's his lady and he loves her kek
1.05E+18,10/1/2018 15:11,one has a harem and is a doormat on valentine's day and the other is mar
1.05E+18,10/1/2018 13:24,yusuke i do not want lobsters we've said this thousands of times dammit get some help
1.05E+18,10/1/2018 12:25,easy urban dictionary it n noh but here's the eye bleach for later
1.05E+18,10/1/2018 12:24,ya see i would hack into the mainframe just to get the laser walls down
1.05E+18,10/1/2018 12:21,aaaaaaaaaaa noooo i can't have both of them in my room they'll mess it up and be weird
1.05E+18,10/1/2018 12:09,september th vs october st be like
1.05E+18,10/1/2018 12:02,nopenopenopenopenopenopenopenope
1.05E+18,10/1/2018 11:26,trick or treat n nhuh you already had multiple treats n nson of a bitch you're getting tricks from me y
1.05E+18,10/1/2018 0:39,you both are real lewd can you get a room
1.05E+18,9/30/2018 23:32,followers that fast whoa i dunno what to say should i do something special for you guys i have no clue w
1.05E+18,9/30/2018 23:06,he would definitely put the bunny back in the booooooooooox
1.05E+18,9/30/2018 17:39,should xe x xve asked earlier because now i can kek
1.05E+18,9/30/2018 17:35,yes yes i did
1.05E+18,9/30/2018 14:38,well its not my fault that ren had to be a smartass on the signup page
1.05E+18,9/30/2018 14:38,oh really now huh that explains a lot of things
1.05E+18,9/30/2018 14:33,um excuse me i use ren account for that not yours
1.05E+18,9/30/2018 14:14,false i see your order forms on amazon
1.05E+18,9/30/2018 13:20,i wiiiiiish but persona users can have a palace n n but he can have his computer files leaked
1.05E+18,9/30/2018 13:19,took me two hours to make but i did a thing n admin
1.05E+18,9/30/2018 13:18,ooooo sounds interesting i wanna try owo
1.05E+18,9/30/2018 12:54,sweet mother of xe x xren that xe x xs not what they meanth i give up your ligma got to your brain cells
1.05E+18,9/30/2018 12:08,i feel like i should be surprised buuuuuut his fault that he didn check the wires
1.05E+18,9/29/2018 17:35,i regret letting this guy taking me to the movies aaaaa that woman's eyes as she was set on fire
1.05E+18,9/29/2018 17:22,depends on your definition of a compliment
1.05E+18,9/29/2018 13:46,oh i totally love it that explains why i threw it in the digital trash bin set fire to the digit
1.05E+18,9/29/2018 1:45,n nprops to lavenza and shinya for the nice calendar and the smooooth hd borders ma
1.05E+18,9/29/2018 1:41,spoopy friday for me please do not tell sojiro that ren took me out at midnight though he's gonna kill meeeeee
1.05E+18,9/28/2018 15:40,dye your hair back to black he said he xe x xll consider putting it on then
1.05E+18,9/28/2018 10:17,and then ryuji realized he fucked up after meowing for so long in public when the video was uploaded
1.05E+18,9/27/2018 19:53,but are you xf xf xa x xf xf xa x xf xf xa x
1.05E+18,9/27/2018 18:58,v me putt-putt cd-rom adventure
1.05E+18,9/27/2018 18:35,v me moshi monsters
1.05E+18,9/27/2018 18:15,v me club penguin game day
1.05E+18,9/27/2018 18:12,what if yes kek
1.05E+18,9/27/2018 18:01,ur mum ain in this level p
1.05E+18,9/27/2018 17:33,where are the boos i have come prepared
1.05E+18,9/27/2018 17:32,you noobs will loose for i am the master of kahoot mwehehehe
1.05E+18,9/27/2018 12:20,the court has found you guilty your penalty n n death mwehehe n n jk jk you too sexy to die
1.05E+18,9/27/2018 12:19,guys i d-dying from ligma ni couldn get the sugondese n-not even p-plugma can save me now
1.05E+18,9/27/2018 10:15,r-ryuji t-that not xe x xi mean tha-aaaaaaaaaa even i know that xe x xs not how it is and i don xe x xt even go to school
1.05E+18,9/27/2018 10:14,mwehehehehe you can never stop me the almighty oracle try me noob
1.05E+18,9/27/2018 2:06,kek where do you think i've been living on the internet all my life makoto oo
1.04E+18,9/26/2018 14:13,lies you have ligma now go to sawcon for the sugondese medicine and get yourself some plugma while you xe x xre at it
1.04E+18,9/26/2018 13:44,help i xe x xve been infected
1.04E+18,9/26/2018 12:09,i xe x xm late but i want to wish happy birthday to a fellow phantom thief xe x xs admin n nsend this guy som
1.04E+18,9/26/2018 12:06,goddammit sakamoto could you be anymore louder
1.04E+18,9/25/2018 14:03,futaba's rules of the internet n nrule galatians nremember kids do not say you're part of the phantom thieves or
1.04E+18,9/25/2018 10:28,shit i thought all of twitter knew we were phanto xe x xi mean nothing
1.04E+18,9/25/2018 10:27,wait what you xe x xre part of the xe x xi mean
1.04E+18,9/25/2018 10:26,sojiro knows my codename though
1.04E+18,9/25/2018 10:24,i have officially leveled up woo n nthanks for followers you plebs are not as bad as i thought kek
1.04E+18,9/25/2018 10:06,bwahahahaha i pay to see ryujette hahahaha
1.04E+18,9/24/2018 17:45,touch xc xa
1.04E+18,9/24/2018 17:44,psh fool you nah why would i be trying to fool you
1.04E+18,9/24/2018 17:43,i mean what i-i was doing p-phoenix featherman checkups hahahahahahaha
1.04E+18,9/24/2018 17:41,it was them not me i was just doing my routine phantom thief check-ups
1.04E+18,9/24/2018 14:58,the super crown is a curse to the world of mario
1.04E+18,9/24/2018 11:17,futaba's rules of the internet n nrule when life gives you lemons bleach your eyes exit the fanfiction webs
1.04E+18,9/24/2018 11:15,rule of the internet if it exists on the internet there is definitely going to be porn of it
1.04E+18,9/24/2018 1:39,set me the fuck free sojiro the wi-fi here sucks
1.04E+18,9/23/2018 15:13,i am the night cue cool music
1.04E+18,9/23/2018 2:31,he stupid but his stupidness sometimes interests me
1.04E+18,9/23/2018 2:28,p
1.04E+18,9/23/2018 2:27,can love me if you disowned me old man
1.04E+18,9/23/2018 2:26,screw you too gramps
1.04E+18,9/23/2018 2:22,have i been disowned i will triumph against this bongo cat i challenge him to a game of osu to save my pride
1.04E+18,9/22/2018 14:40,runs
1.04E+18,9/22/2018 14:40,sheesh ryuji grow up will you
1.04E+18,9/22/2018 14:23,it also leg day when you running away from a hacker who can easily leak your porn files
1.04E+18,9/22/2018 14:20,yeah don be so mean to ann ryuji
1.04E+18,9/22/2018 14:03,ya know i was referred to you by a certain skull-head i wasn aware you watch this stuff shame
1.04E+18,9/22/2018 14:02,mwehehe suck it ple
1.04E+18,9/21/2018 13:45,how about we expose naoya's maki file and see who ca not hack anymore i challenge you to a duel
1.04E+18,9/21/2018 13:43,mwehehe found a victim for my first leaking hoo boy
1.04E+18,9/21/2018 13:38,ikr
1.04E+18,9/21/2018 13:35,a day dedicated for me woo i feel like i totally leveled up now where that trophy in the top left of my screen
1.04E+18,9/21/2018 13:32,ryuji i know what you watch at midnight and it disgusting don make me leak your xe x xschool xe x x files
1.04E+18,9/21/2018 12:33,things that explain why he does not have a girlfriend what is up with you guys stop
1.04E+18,9/21/2018 12:31,oh right you still do not understand how to use modern tech dude we need to meet at leblanc becau
1.04E+18,9/21/2018 12:06,trust me the camera in your computer has that information for you ya really need to tape that up
1.04E+18,9/21/2018 11:18,like your love life seriously you may wanna revoke your midnight channel subscription kids can see that you know
1.04E+18,9/21/2018 11:12,i checked and no it not on but your house is on fire nwanna load your save file to try and stop your house from burning p
1.04E+18,9/20/2018 21:33,got my admin privs and i'm in let's see what twitter's really about now mwehehe
