id,created_at,text
502576709066293248,2014-08-21 22:03:19,"b'Rover Company: Rover Company specializes in high-quality, durable PVC pet products that will last a lifetime. ... http://t.co/BLdXg4CiG8'"
411130340116135936,2013-12-12 13:48:06,b'Kupa \xc3\x87ekme Makinesi: Eskiden yanan kolonyal\xc4\xb1 pamuklar ve \xc3\xa7ay bardaklar\xc4\xb1 yap\xc4\xb1lmaya \xc3\xa7al\xc4\xb1\xc5\x9f\xc4\xb1lan bu terapiyi en pra... http://t.co/lOK25iPzvH'
389096990585282562,2013-10-12 18:35:26,b'Kupa \xc3\x87ekme Seti: Kupa \xc3\xa7ekme adetlerini bir\xc3\xa7o\xc4\x9fumuz biliyor ve tabir-i caizse koca kar\xc4\xb1 tedavisi olarak adland\xc4\xb1r... http://t.co/uH53gNr55s'
388303758607650817,2013-10-10 14:03:25,b'Yeni Pvp Serverler: Birbirinden \xc3\xb6zle karakterler ile g\xc3\xb6revleri tek tek yerine getirip muhte\xc5\x9fem bir deneyime or... http://t.co/d7U9G3FnCn'
387622809045708800,2013-10-08 16:57:34,"b'Comcast Internet Service Provider: Providing the best in home phone, digital cable, and high-speed internet services. http://t.co/hFbzKpRFwo'"
386261355352686592,2013-10-04 22:47:38,b'Metin2 Pvp Serverler: Farkl\xc4\xb1 karakterlerin en \xc3\xb6zel silahlar ile kar\xc5\x9f\xc4\xb1m\xc4\xb1za \xc3\xa7\xc4\xb1kt\xc4\xb1\xc4\x9f\xc4\xb1 ve g\xc3\xb6rev zorluk seviyesinin ... http://t.co/V2R8LkiWwq'
383668798131146752,2013-09-27 19:05:44,"b'Seo Nedir ?: SEO, \xc4\xb0ngilizce \xe2\x80\x9csearch engine optimizer\xe2\x80\x9d T\xc3\xbcrk\xc3\xa7esi ise (arama motoru optimizasyonu) teriminin k\xc4\xb1sa... http://t.co/AJnxvVTf0C'"
381854536639344640,2013-09-22 18:56:30,b'E\xc4\x9flenceli M\xc3\xbczik Sitesi: M\xc3\xbczik hayat\xc4\xb1m\xc4\xb1z i\xc3\xa7in \xc3\xb6nemli olan g\xc3\xbcn i\xc3\xa7erisinde streslerden kurtuldu\xc4\x9fumuz bir haldedir... http://t.co/uLrdEfGWaX'
381044335057195009,2013-09-20 13:17:03,"b'Webmaster Kit\xe2\x80\x99s 2013: \xc2\xa0 \xc2\xa0 Webmaster Kit\xe2\x80\x99s\xc2\xa0Kodlabs taraf\xc4\xb1ndan haz\xc4\xb1rlanan bir SEO arac\xc4\xb1d\xc4\xb1r, program ile web site... http://t.co/bRYCC5V0Ke'"
380369328090001408,2013-09-18 16:34:49,b'En ucuz ukash sitesi: Ukash kart t\xc3\xbcm d\xc3\xbcnyada en fazla tercih edilen \xc3\xb6n \xc3\xb6demeli kart durumundad\xc4\xb1r. Hen\xc3\xbcz \xc3\xbclkemi... http://t.co/NG1EjEguIv'
380275916812726272,2013-09-18 10:23:38,b'En iyi koxp probot: Son y\xc4\xb1llarda internet ba\xc4\x9flant\xc4\xb1s\xc4\xb1n\xc4\xb1n \xc3\xbclkemizde ve d\xc3\xbcnyada bir salg\xc4\xb1n misali yay\xc4\xb1lmas\xc4\xb1n\xc4\xb1n ar... http://t.co/wo7WpvARnA'
378870658383355905,2013-09-14 13:19:38,b'En ucuz ukash: \xc4\xb0nternetten yap\xc4\xb1lan al\xc4\xb1\xc5\x9fveri\xc5\x9flerde ki\xc5\x9fisel bilgi g\xc3\xbcvenli\xc4\x9fi son y\xc4\xb1llar\xc4\xb1n en \xc3\xa7ok \xc3\xb6nemsenen konula... http://t.co/GYACo6ZLrq'
377580822997389312,2013-09-10 23:54:17,b'M\xc3\xbczik Dinle: G\xc3\xbcn\xc3\xbcm\xc3\xbczde m\xc3\xbczik \xc3\xb6nemli bir par\xc3\xa7ad\xc4\xb1r. Bu sayede bir\xc3\xa7ok ki\xc5\x9fi stresi m\xc3\xbczik ile atmaktad\xc4\xb1r. M\xc3\xbczik din... http://t.co/Dv5yLKFLup'
377537704348876802,2013-09-10 21:02:57,b'Al\xc4\xb1\xc5\x9fveri\xc5\x9f Keyfi Nas\xc4\xb1l Bir \xc5\x9eeydir?: \xc2\xa0 Herkesin farkl\xc4\xb1 farkl\xc4\xb1 hobileri vard\xc4\xb1r ama al\xc4\xb1\xc5\x9fveri\xc5\x9f bamba\xc5\x9fka bir olayd\xc4\xb1r... http://t.co/p1XRuGB2fN'
374598665400111105,2013-09-02 18:24:16,b'Online Al\xc4\xb1\xc5\x9fveri\xc5\x9f Hakk\xc4\xb1nda Her \xc5\x9eey: Her \xc3\xbclkenin kendine g\xc3\xb6re g\xc3\xb6renekleri ve gelenekleri vard\xc4\xb1r. Baz\xc4\xb1lar\xc4\xb1 eksi v... http://t.co/IUSokChXwO'
327821797355581441,2013-04-26 16:29:41,b'Backing Up Google Apps with Spanning: Find out how to back up your Google Apps data at http://t.co/cKcKOK5cnX. ... http://t.co/Uko2I9pLJU'
327645072688562176,2013-04-26 04:47:27,"b'degree in animation: Learn 3D animation from MAAC. We offer courses like VFX, Multimedia &amp; Gaming Course, Grap... http://t.co/iS5R4dytox'"
324122095896379392,2013-04-16 11:28:24,b'A Price Comparison engine in India: http://t.co/YZ7T39hIBn helps you to compare prices on wide range of popular... http://t.co/str0mLkY4V'
286380036808925184,2013-01-02 07:54:56,"b""Emotional Intelligence: TalentSmart is the world's premier provider of emotional intelligence. More than 75% of ... http://t.co/eOEuv3UB"""
283660141793009664,2012-12-25 19:47:02,"b'hardwood flooring: Contact Easy Step flooring \xe2\x80\x93 your one stop destination for high quality solid oak, hardwood a... http://t.co/cztWY8kO'"
281073596560969728,2012-12-18 16:29:02,"b'Accessories for Rent and Sale: Buy and Rent Accessories like Anchors and Marine Engines, Winches, Propellers etc... http://t.co/5tRUD0qV'"
276412571731496960,2012-12-05 19:47:47,"b'Alexander Heights Fredericksburg: Welcome to Alexander Heights, Fredericksburg\xe2\x80\x99s premier apartment home communit... http://t.co/6Y7WppcM'"
270603279099101184,2012-11-19 19:03:43,b'manchester escort: Manchester Escorts are the most incredibly beautiful ladies in the City of Manchester. This o... http://t.co/TQnbhTbT'
266666181858045953,2012-11-08 22:19:06,"b'Mathematics &amp; Engineering Research: Find original research in Engineering, Mathematical Sciences, Physical Sciences. http://t.co/XWkLe4p4'"
266263437422776320,2012-11-07 19:38:45,b'Apartment Movers: Moving Guru provides you with a list of moving companies in your area which include self servi... http://t.co/709U9DEM'
265465403680112640,2012-11-05 14:47:39,b'Leadership Coaching: PI Worldwide offers leadership skills development training and a range of leadership assess... http://t.co/wkPa43QU'
261564001945800704,2012-10-25 20:24:52,b'Claiming Tax Back: Want to know how to claim tax back online? Tax Day provides services for claiming tax back on... http://t.co/xuPzZj3r'
260444133636841472,2012-10-22 18:14:54,b'government education grants: Americas Got Grants will be of immense assistance for you when it comes to obtainin... http://t.co/1ZHhG0G7'
259266218438062080,2012-10-19 12:14:18,b'chester escorts: Exclusive escort agency based in Chester specializing in high class escorts and five star model... http://t.co/TWUdD4kW'
258849604341202944,2012-10-18 08:38:49,b'South Sea Pearl Pendant: Laguna Pearl offers stylish South Sea pearl pendants adorned with SI quality diamonds a... http://t.co/WdGA4qy4'
256130216479584258,2012-10-10 20:32:56,"b""Current Transducers: Setra Systems offer latest current transducers that help overcome today's technological cha... http://t.co/2WfUTpGa"""
253501676722470913,2012-10-03 14:28:04,b'Black Pearl Earrings: Impressive Tahitian South Sea Black Pearl Earrings collection on huge discounts only at Th... http://t.co/53JtUPz4'
252787205142102016,2012-10-01 15:09:00,"b'Land Registry: Land Registry Online to obtain Title Regsiters, Title Plans, Find the owners names of any propert... http://t.co/oeiGSVIe'"
251615674085027840,2012-09-28 09:33:46,b'Social Media Analytics: See how consumers behave on social media &amp; derive great marketing insights from this. Bl... http://t.co/tkvxcDrk'
250933975420387328,2012-09-26 12:24:56,"b'Stock Market Training Courses: Pristine, an elite trading school, provides you with the most comprehensive stock... http://t.co/2DmTtpR9'"
250925777275727872,2012-09-26 11:52:21,"b'Hach ORP pH Meter: Designed for your water applications, the Hach  ORP &amp; pH meter is an advanced meter that take... http://t.co/cI9UOTCr'"
249092626173796352,2012-09-21 10:28:04,"b'Buy Lobster: http://t.co/cDuK34Uy ships the finest quality of live Lobsters, lobster tails, lobster bisque, lobst... http://t.co/q5sLLcjq'"
248143209270755328,2012-09-18 19:35:26,"b'e surv: e.surv is keeping the U.K. updated about the latest happening in the Real Estate Market, join the bandwa... http://t.co/eEhTOScO'"
246179362867671041,2012-09-13 09:31:48,b'Top PPC Management Company In London: DigitalClicks offers a wide range of Pay Per Click (PPC) services for your... http://t.co/R7W2Fo3g'
245964865439666178,2012-09-12 19:19:28,"b""Software For Planning Events: Certain's event planning software enables meeting professionals to realize more va... http://t.co/ClnO5HU0"""
244258479185989632,2012-09-08 02:18:54,"b'tax accounting services: When you contact Resolute Tax Services, we will connect you with one of our trained tax... http://t.co/MAgWD0ir'"
241980236965756928,2012-09-01 19:25:58,b'USA Restaurants: USA Restaurants directory. http://t.co/jOshMuIz'
241236920196272128,2012-08-30 18:12:18,b'Digital Cutting Tables from Esko: The Kongsberg digital cutting tables define the standards in productivity and ... http://t.co/oi5r7gXs'
241228586315571200,2012-08-30 17:39:11,b'applying for government grants: Thinking of applying for Government Grants? Wondering how to get Government Gran... http://t.co/myubQlnk'
240339565355884544,2012-08-28 06:46:32,b'Small Business Grants: Get clear information on small business grants to start or expand your business. Learn ho... http://t.co/yoNyNmUy'
240315817781231617,2012-08-28 05:12:10,"b'Mouse Trap: ePestSolutions has a wide variety of rodent control products such as mouse traps, mouse baits, mouse... http://t.co/r96dPcLL'"
239113809585926144,2012-08-24 21:35:49,b'wifi security: TheCloud offers public wifi security hubspots that provides easy and simple network connectivity ... http://t.co/KzEQwG16'
238377452131467264,2012-08-22 20:49:48,"b'Blackburn Bike Fenders: Blackburn Design\xe2\x80\x99s bike fenders are available as full cover sets, fender combos, and fro... http://t.co/WBhZYkax'"
238366621612273664,2012-08-22 20:06:45,"b""l\xe2\x80\x99Agence Mensour Agency Ltd.: l'Agence Mensour Agency Ltd. \n\n                    - Represents bilingual... http://t.co/8I4hpIkt"""
238100690021527553,2012-08-22 02:30:02,"b""Document Translation: Acclaro's Website translation services helps optimize your website for global use, using m... http://t.co/Z7cDMoXS"""
237877561806434305,2012-08-21 11:43:24,"b""Today\xe2\x80\x99s Dietitian: Today's Dietitian \n\n                    - A magazine specifically for registered die... http://t.co/mkjHL2LI"""
237869692235169793,2012-08-21 11:12:08,b'Wisconsin Homecare Organization: Wisconsin Homecare Organization \n\n                    - Statewide trad... http://t.co/MvQRpSzi'
237599532207185920,2012-08-20 17:18:37,"b'Home Security Jacksonville Beach: Atlantic Companies is a Cedia certified system integrator, designing, installi... http://t.co/C9Oe4qXK'"
236645645065261056,2012-08-18 02:08:13,b'Western Regional Examining Board: Western Regional Examining Board \n\n                    - Developer an... http://t.co/k7ZslKtH'
236570888995213313,2012-08-17 21:11:09,"b'http://t.co/xCltPE9p: Liberty Tax is one of the largest professional tax preparer in the nation with over 3,800 l... http://t.co/0rSjIDsv'"
236465727043928066,2012-08-17 14:13:17,"b'The Art Of Noh: The Art Of Noh \n\t\t\t\n                    - A weblog on computer security, viruses, worms, trojans... http://t.co/n7dFbP2D'"
236457921536471040,2012-08-17 13:42:16,"b'SecurityFocus: SecurityFocus \n\n                    - Article about spyware keyloggers, how they work, h... http://t.co/FtB122hs'"
236450102833729536,2012-08-17 13:11:12,"b'WorJus Consulting: WorJus Consulting \n\n                    - Outsourced network and system design, admi... http://t.co/82ycgjoS'"
236445892226457601,2012-08-17 12:54:28,b'Kunal Premnarayan: Kunal Premnarayan is the Director of the ICS Group. South Africa-based hospitality major Mant... http://t.co/zMUkfzPr'
236199709193170945,2012-08-16 20:36:13,"b'WxChecksums: WxChecksums \n\n                    - Calculates and verifies checksums. (C++) [Windows, GNU/Linux] http://t.co/fJPTW5lA'"
236191921658286080,2012-08-16 20:05:17,b'WebGenie Software: WebGenie Software \n\n                    - Electronic Commerce(Ecommerce)Software to ... http://t.co/gUykjJau'
236183981291343872,2012-08-16 19:33:43,"b'ZDS Corporation: ZDS Corporation \n\n                    - Provides tools, scripts, and articles for use ... http://t.co/YtH4Lu51'"
235910053482356738,2012-08-16 01:25:14,b'Teoco Corporation: Teoco Corporation \n\n                    - Provides  solutions for  distributed infor... http://t.co/P7FBnGQO'
235894405104545793,2012-08-16 00:23:03,b'The Kermit Project: The Kermit Project \n\n                    - A protocol that transfers text and binar... http://t.co/lvs4y0cE'
235886562896932865,2012-08-15 23:51:53,b'Peter Zackariasson: Peter Zackariasson \n\n                    - Online presentation of research in to ga... http://t.co/so1pOonZ'
235878757393629184,2012-08-15 23:20:52,b'Wacom Asia Pacific: Wacom Asia Pacific \n\n                    - Produces various types of graphics tablets. http://t.co/S7SMGnUl'
235838502934302720,2012-08-15 20:40:55,"b'Resolution Technologies Corp.: Resolution Technologies Corp. \n\n                    - International, ful... http://t.co/DuRohSRE'"
235822813922082816,2012-08-15 19:38:34,"b'Whittlestone: Whittlestone \n\n                    - Breast pumps and feeding information, including supp... http://t.co/roBbe6ks'"
235807083000365056,2012-08-15 18:36:04,b'URBNET: The Urban Entertainment Network: URBNET: The Urban Entertainment Network \n\n                    ... http://t.co/yMLPoVF5'
235781841112666112,2012-08-15 16:55:46,"b'Zuvela, Tony: Zuvela, Tony \n\n                    - Australian single panel Cartoonist and creator of Be... http://t.co/iPxYi3Fq'"
235766130457853952,2012-08-15 15:53:20,"b'Zorach, William and Marguerite: Zorach, William and Marguerite \n\n                    - Biographies and ... http://t.co/CnNwcnkq'"
235561114417635328,2012-08-15 02:18:40,b'Looking For Short Screenplays (Downtown): we are stop faith look for physiological saga as well as romantic come... http://t.co/FTZ1xCyv'
235059840685309952,2012-08-13 17:06:47,"b'united air temp: United Air Temp provides the best quality heating, cooling, and plumbing services in the indust... http://t.co/XBJEUWdZ'"
235057839897473025,2012-08-13 16:58:50,"b'Topix: Investment Banking: Topix: Investment Banking \n\t\t\t\n                    - News about investment banking, c... http://t.co/EJE3Nbsf'"
235026614340177920,2012-08-13 14:54:46,"b'Wakefield &amp; Associates, Inc.: Wakefield &amp; Associates, Inc. \n\n                    - Aurora, CO agency co... http://t.co/3AF2gMku'"
235018804432887812,2012-08-13 14:23:44,"b'Yeske and Company: Yeske and Company \n\n                    - Offers articles, market updates, discussio... http://t.co/wYbMqgBO'"
234819946952155137,2012-08-13 01:13:32,b'Yaskawa Electric Europe GmbH: Yaskawa Electric Europe GmbH \n\n                    - Germany. Design and ... http://t.co/A6gNiZOh'
234432271535468544,2012-08-11 23:33:03,"b'closet storage systems: Get organized today, with a custom closet system designed to your specific needs at the ... http://t.co/lSxaq9EX'"
234049399263748097,2012-08-10 22:11:39,b'Xinhui Hommy Enterprise: Xinhui Hommy Enterprise \n\n                    - Producers of aluminum and trav... http://t.co/NkgmKyiN'
234041640539549696,2012-08-10 21:40:50,b'Vulcan Materials Co.: Vulcan Materials Co. \n\n                    - Producer of construction aggregates ... http://t.co/UJYyVvVq'
234033376691109889,2012-08-10 21:07:59,b'University Tickets: University Tickets \n\n                    - Provider of services to help colleges an... http://t.co/7wVlNLs9'
234025643837378561,2012-08-10 20:37:16,b'fOCUS Pharmaceuticals: fOCUS Pharmaceuticals \n\n                    - A generic pharmaceutical research ... http://t.co/T8bo7ucg'
234017887235481600,2012-08-10 20:06:26,"b'ivd aluminum coating, vacuum cadmium plate: ivd aluminum coating, vacuum cadmium plate \n\n              ... http://t.co/qAdgijE8'"
234010150665609218,2012-08-10 19:35:42,b'Worthington Industries: Worthington Industries \n\n                    - Diversified metal processing com... http://t.co/J0brbqAz'
233986384917061632,2012-08-10 18:01:16,"b'http://t.co/O2qxfA4k: http://t.co/O2qxfA4k \n\n                    - Offers strategic planning, web site de... http://t.co/mXUjetpT'"
233944765585031168,2012-08-10 15:15:53,b'http://t.co/6EGEJrJS: http://t.co/6EGEJrJS \n\n                    - A career services provider for job see... http://t.co/1PoWXSP3'
233751969188175872,2012-08-10 02:29:47,b'top rated internet casino:  http://t.co/37f1rkW3'
233705316288712704,2012-08-09 23:24:24,"b""Improving Communication Skills: Need public speaking training? Communicate effectively with Roger Love's the Per... http://t.co/yzZg7EOz"""
233576681179332608,2012-08-09 14:53:15,"b'World Militaria: World Militaria \n\n                    - Militaria from WWI and WWII, Nazi German, Adol... http://t.co/RWshPvSd'"
233561005970558977,2012-08-09 13:50:57,b'USA Classifieds: Free USA classifieds. Post your ads. http://t.co/p7P1k4wt'
233439691188346880,2012-08-09 05:48:54,"b'i2 Technologies, Inc.: i2 Technologies, Inc. \n\n                    - Provides software solutions for op... http://t.co/UGFi6VO1'"
230359653870075904,2012-07-31 17:49:56,b'Writers Wanted: Writers Wanted \n\n                    - A site that will post submitted stories. http://t.co/rbGWBkMD'
230336104681852928,2012-07-31 16:16:21,"b'The Los Dos Bros: The Los Dos Bros \n\n                    - Melodic group blending pop rock, jazz and cl... http://t.co/jWNARafO'"
230328295743442946,2012-07-31 15:45:19,b'Wired for Books: Wired for Books \n\n                    - An interactive book discussion site featuring ... http://t.co/KizOr7TY'
230312730253488129,2012-07-31 14:43:28,b'Tribu-Design: Tribu-Design \n\n                    - Decorative arts and design of the 20th century. http://t.co/kOGkrbvw'
230304878755450880,2012-07-31 14:12:16,b'Voice of the Shuttle: Classical Studies: Voice of the Shuttle: Classical Studies \n\n                    ... http://t.co/0FEkB3m7'
230100884707745793,2012-07-31 00:41:40,b'Yorkshire Training Centre: Yorkshire Training Centre \n\n                    - Psychotherapy and counsell... http://t.co/dFvvCdKK'
230018430999330818,2012-07-30 19:14:02,"b'key largo rentals: At Florida Keys Vacation Rentals, find the perfect vacation home rental as well as condo rent... http://t.co/53Ia4h15'"
228946834444402689,2012-07-27 20:15:53,"b'Qxest Web Studio: Qxest Web Studio \n\n                    - Web site design, hosting and promotion services. http://t.co/5FCWSGNR'"
228942274053144577,2012-07-27 19:57:46,b'Record webcam videos online: Record webcam videos online and share with your friends and family. http://t.co/Skq9DnN0'
228938415289286657,2012-07-27 19:42:26,b'Ozone Search Engine Marketing Corp.: Ozone Search Engine Marketing Corp. \n\n                    - Search... http://t.co/mHedkMsT'
228934552175906816,2012-07-27 19:27:05,b'au pair agency uk: Childcare International is one of the most trusted au pair and nanny agencies in London with ... http://t.co/vCcyDf98'
228930590475431936,2012-07-27 19:11:20,"b'Victoria Majors Jones, CPA: Victoria Majors Jones, CPA \n\n                    - Tax and accounting infor... http://t.co/pW7seLEP'"
228645529779830784,2012-07-27 00:18:36,"b""Media industry news: IHS iSuppli's Media portal provides the most complete and insightful analysis of global tec... http://t.co/rHogGSHB"""
228644336655540224,2012-07-27 00:13:52,b'World Agricultural Group: World Agricultural Group \n\n                    - Publishes articles on agricu... http://t.co/oSgzSXpS'
228636616737058816,2012-07-26 23:43:11,b'http://t.co/ovXOrocA: Issues: http://t.co/ovXOrocA: Issues \n\n                    - Library of online info... http://t.co/Y77PlqBq'
228613244313546752,2012-07-26 22:10:19,b'Mark Fail: This is an example search description for displaying this product http://t.co/mJtxtOcM'
228076256191713280,2012-07-25 10:36:31,"b'buckaz on ""Updating My Blog from another computer"": Thank you, i\'ve got it. http://t.co/GU4GWsUI'"
228072600134356992,2012-07-25 10:21:59,b'Mountain Lion Arrives Today and Two Other Stories You Need to Know:  http://t.co/dBrPCh5D'
228068194835918848,2012-07-25 10:04:29,"b'Arie Putranto on ""Updated WordPress, Theme Destroyed"": Indeed, you\'re not making mistake by upgrading. http://t.co/2jGndtf2'"
228065653830082560,2012-07-25 09:54:23,b'Newbie needs help: MS or Research and general questions.: Hi everyone! I just graduated from a college in MS and... http://t.co/xRXJslfV'
228058355455889408,2012-07-25 09:25:23,"b'Open Question: i have an excellent idea for a new oreo flavor! HOW do I contact them?: so, I have this great ide... http://t.co/Y4E7fRP6'"
228049686790041600,2012-07-25 08:50:56,b'Combine class and method parameterized type: I have an interface like this: public interface BatchSynchronisedPo... http://t.co/6hyCIpzT'
228018990180614144,2012-07-25 06:48:58,b'Open Question: do i need to take permisssion if i want to give a link of any website in my website?: http://answ... http://t.co/WdlLFqD0'
228018132399304704,2012-07-25 06:45:33,b'How to Enable the Cross Currency Functionality In Payables &amp; Receivables: Hi All ... http://t.co/WeAwXwXa'
228018132206366720,2012-07-25 06:45:33,b'Open Question: im getting braces put on my front top and bottom in my next few dental visits HELP!?: I have tons... http://t.co/NjgeFdFK'
228017669331378176,2012-07-25 06:43:43,b'Peg Perego Recalls Strollers \xe2\x80\x93 MyHealthNewsDaily: CBC.ca Peg Perego Recalls Strollers MyHealthNewsDaily The US C... http://t.co/zU2c1wux'
228012518927384576,2012-07-25 06:23:15,b'Regarding mail sending when browser closing using php: I am doing eCommerce website site.if client leave the pro... http://t.co/DMfnFjcp'
228000741032357888,2012-07-25 05:36:27,"b""Qualcomm\xe2\x80\x99s Quad-Core Screamer: Hands On, Benchmarked: Qualcomm's new APQ8064 is the fastest ARM-based processor ... http://t.co/a1GW3ChG"""
227993890064592896,2012-07-25 05:09:13,"b'LA City Council bans medical marijuana dispensaries, mostly \xe2\x80\x93 Los Angeles Times: Politico LA City Council bans m... http://t.co/uL6iiHfE'"
227986440888393728,2012-07-25 04:39:37,b'Open Question: Can I get temporary silver tooth caps?: Is it possible to get temporary silver tooth caps to wher... http://t.co/oFmVF6F6'
227981100234989568,2012-07-25 04:18:24,b'android HTTPPost List post to php?: I have been searching for hours and I am still unclear on HTTPPost method. I... http://t.co/NtlnJRXW'
227969392120590337,2012-07-25 03:31:53,b'Meet the Woman Who Tried to Marry Off Her Niece on eBay:  http://t.co/bqjn0v0S'
227962316937895937,2012-07-25 03:03:46,b'Open Question: What is the difference between a splint and a regular removable retainer?: I got my braces remove... http://t.co/k7FfuLB1'
227962316908556288,2012-07-25 03:03:46,b'JAVA merging 2 classes together: I would like to merge my Vote4Cash class with my commands class. My vote4cash c... http://t.co/3mU6wZEa'
227947801651318785,2012-07-25 02:06:05,b'Open Question: Whats a good brand of Solid State Drives (SSD)?: Working on a new build and was going to use an S... http://t.co/OTIXYYT4'
227938193989844993,2012-07-25 01:27:54,b'CBO Cuts Cost Estimate for ACA \xe2\x80\x93 MedPage Today: USA TODAY CBO Cuts Cost Estimate for ACA MedPage Today By Joyce ... http://t.co/I8QEy6Vc'
227930879652155393,2012-07-25 00:58:51,b'Submitting information from one servlet to another: i have a little bug that i hope someone can solve for me. se... http://t.co/Nn00EMdM'
227917986936258560,2012-07-25 00:07:37,"b'sonnycar on ""[Plugin: Cool Video Gallery] updated wordpress and CVG, now it\xe2\x80\x99s not working"": Hello, I just update... http://t.co/OWZyrweJ'"
227908328590815232,2012-07-24 23:29:14,b'Apple Falls Victim to Its Own Hype Cycle:  http://t.co/lYbAD1Ty'
227900915703750656,2012-07-24 22:59:47,b'URL Redirection: URL Redirections: A 301 indicates an HTTP status code of \xe2\x80\x9cMoved Permanently.\xe2\x80\x9d A 302 indicates a... http://t.co/N2odjv7c'
227898920959889408,2012-07-24 22:51:51,"b'Copy data from one schema to another schema table: Hi all, ... http://t.co/qoyWfk2B'"
227893124159139841,2012-07-24 22:28:49,b'Search friendly domain names: Search friendly domain name is best. Domain name should be related to your website... http://t.co/Wo2eA583'
227892467624726528,2012-07-24 22:26:12,"b""Open Question: Ways To Transport To My New School?: I'm planning on transporting to a new school soon. But i nee... http://t.co/ovsbdPqo"""
227891007998529537,2012-07-24 22:20:24,b'CDC: Little Change in Risky Teen Sex: Progress in getting teens to have safer sex largely has stalled over the l... http://t.co/hpDakYBd'
227870495767425024,2012-07-24 20:58:54,b'Retrieve keywords meta tag content with Simple HTML Dom?: I am using Simple HTML Dom to scrape keywords off remo... http://t.co/6iEj3jCV'
227867258251251713,2012-07-24 20:46:02,"b'Man ""cured"" of AIDS: Timothy Ray Brown \xe2\x80\x93 CBS News: CBC.ca Man ""cured"" of AIDS: Timothy Ray Brown CBS News Timoth... http://t.co/cDPReDrH'"
227859638832480256,2012-07-24 20:15:45,b'Open Question: Bad teeth (rotten root)?: I have a morbid fear of the dentist but last night I was up with tootha... http://t.co/AFGapJzv'
227853421007491075,2012-07-24 19:51:03,"b'Look Out, Netflix: Verizon and Redbox Gear Up to Launch Competitor:  http://t.co/1cQhWCep'"
227853280460558336,2012-07-24 19:50:30,b'Open Question: What kinds of job can I get with comptia A+?: How is the job market for someone with it and do yo... http://t.co/zzRKroo3'
227843475670958080,2012-07-24 19:11:32,"b'Why a nightlight could cause mild depression: Constant exposure to dim light at night can cause depression, a ne... http://t.co/ngVOAYSw'"
227830656611266560,2012-07-24 18:20:36,b'mySQL on duplicate key multiple update: im trying to create a simple SQL INSERT otherwise UPDATE statement but t... http://t.co/4CdOSBVp'
