id,created_at,text217055284827398145,2012-06-25 00:43:07,"b'Open Question: I\xe2\x80\x99m 14 &amp; my teeth have been straight my whole life, my bottom teeth are not anymore. Would braces... http://t.co/ybNhSJmM'"
217048777935167488,2012-06-25 00:17:15,b'Money Manager Settles Madoff-Related Case: Money manager J. Ezra Merkin has agreed to pay about $410 million to ... http://t.co/Cc476zQ1'
217028103074095104,2012-06-24 22:55:06,"b'brotherleeroy on ""Change title text color"": I think there\'s another way using tags. http://t.co/2MEForjW'"
217024015917776897,2012-06-24 22:38:52,"b""backingMapContext.getBackingMapEntry() fails: I have an interceptor on cache A, and I'm trying to retrieve an en... http://t.co/8hnDaCID"""
217016150893146112,2012-06-24 22:07:36,b'Open Question: what is my sound card?: i looked all over and i have one in the computer but the software is not ... http://t.co/hIWwY0Ze'
217011124871249920,2012-06-24 21:47:38,b'Foxes may hold key to Lyme disease spread \xe2\x80\x93 http://t.co/Qc0zJpQD: Toronto Star Foxes may hold key to Lyme disease... http://t.co/oAo3L13w'
216986091771793409,2012-06-24 20:08:10,"b'Van Gogh\xe2\x80\x99s \xe2\x80\x98Starry Night\xe2\x80\x99 Is Beautifully Recreated From 7,000 Dominoes [VIDEO]: What would celebrated painter Vi... http://t.co/2c17tOMq'"
216977180427689985,2012-06-24 19:32:45,"b'new to snnetwork: Greetings All, Im new here. I had some questions hopefully someone could help with. http://t.co/KBLQL0xD'"
216977162899689472,2012-06-24 19:32:41,"b""Open Question: Purchased something online but they haven\xe2\x80\x99t charged yet from debt card?: I'm not sure why they ha... http://t.co/UROoMeU5"""
216969038570598400,2012-06-24 19:00:24,"b'FORALL insert error: Hi, ... http://t.co/FgCoWHYm'"
216965668250189824,2012-06-24 18:47:00,"b'TYPO3 Extbase Controller/Model Validation fails: Environment: Mac OS X Lion, PHP 5.3.10, MySQL 5.X, TYPO3 4.7.1,... http://t.co/1Efg6yUa'"
216948492168466432,2012-06-24 17:38:45,b'How stocks will fare in court ruling on health law \xe2\x80\x93 CBS News: USA TODAY How stocks will fare in court ruling on... http://t.co/J6u9LYtS'
216937958283026432,2012-06-24 16:56:54,b'Open Question: car led wiring help (01 honda accord)?: im trying to instal some led lighting in the rear window ... http://t.co/nkrKCW8w'
216919604432347137,2012-06-24 15:43:58,b'Who has been rejected: You know I have been hearing good news of people acceptance to school but I know not ever... http://t.co/qNWitVkX'
216915179554877440,2012-06-24 15:26:23,b'45% of Executives Think Social Media Has a Positive Impact on the Workplace:  http://t.co/yBdhf1qX'
216911627155542016,2012-06-24 15:12:16,"b""Open Question: My teeth are overwhitened\xe2\x80\xa6?: At first I didn't care but now it's really bugging me. They look flu... http://t.co/7aF8IgPw"""
216910193911545856,2012-06-24 15:06:34,b'Architecture Patterns: Domain Model and Friends: An experienced developer gives us this great article with insig... http://t.co/7tfgjoFq'
216906312762658819,2012-06-24 14:51:09,b'Why prefix variables names with a colon?: PROCEDURE calc_avg_sales ... http://t.co/zzd86OuD'
216899391888433152,2012-06-24 14:23:39,b'Jailbreak Tweaks Bring OS X Mountain Lion Notification Center to iOS: MountainCenter is a new jailbreak tweak th... http://t.co/Fvzd7pQW'
216892908824039424,2012-06-24 13:57:53,"b""Finger-pointing starts over Obama\xe2\x80\x99s health care law \xe2\x80\x93 USA TODAY: USA TODAY Finger-pointing starts over Obama's h... http://t.co/QFCs3oJx"""
216882365253943296,2012-06-24 13:16:00,"b'Open Question: What does \xe2\x80\x98p.p\xe2\x80\x99 on facebook mean?: a lot of people are taking pictures with their pinkys, fourth ... http://t.co/0sk2MBx1'"
216861768721514496,2012-06-24 11:54:09,b'Patient drug shortage concerns: Patients struggle to obtain drugs for common life-threatening conditions in 80% ... http://t.co/gSg3K496'
216859401624092672,2012-06-24 11:44:45,"b'FlexField Validation based on Form Status: Hi , ... http://t.co/ZqrmHMzH'"
216856216117321728,2012-06-24 11:32:05,"b'Open Question: Is there some thing I can use instead of floss?: When ever I use floss it cuts my gums, so I stop... http://t.co/dUS01qsh'"
216851163906179073,2012-06-24 11:12:01,b'Open Question: How to get rid of hairs under my eyes?: Im a hairy as an animal and got so much hair under my eye... http://t.co/7jbhffHc'
216844478621818882,2012-06-24 10:45:27,b'Does Twilight\xe2\x80\x99s Renesmee Look as Dumb as Her Name?: http://t.co/utlUR5kM http://t.co/VL3CQpZD'
216839302695485441,2012-06-24 10:24:53,"b'PHP coding =&gt; Mail \xe2\x80\xa2 Check Box Problem!: Hi Everyone, I have used PHP Solutions by David Powers to put together ... http://t.co/xkG9MEH3'"
216819564917424128,2012-06-24 09:06:27,b'Open Question: Does moving addresses affect credit rating?: I have found some conflicting information on the Web... http://t.co/okiZLrVo'
216799152565256193,2012-06-24 07:45:20,"b'West Nile activity intensifying, Sacramento-Yolo officials say \xe2\x80\x93 Sacramento Bee: KHTS Radio West Nile activity i... http://t.co/abBqhWfI'"
216797739302912001,2012-06-24 07:39:43,"b""Open Question: I\xe2\x80\x99m sooooo scared!!!!! Getting braces Thursday! HELP!!!!!!!?: I'm so flipping scared omg. I have ... http://t.co/SDFYXDvj"""
216796632065392640,2012-06-24 07:35:19,"b'Delivery Manager API failure handling: Hello, ... http://t.co/ZfeUEMFH'"
216784381350645762,2012-06-24 06:46:38,b'Maven for PHP won\xe2\x80\x99t find the right archetype: I try to create a new php project with maven by using this command... http://t.co/8RLwazks'
216775802577096704,2012-06-24 06:12:33,b'Most Americans oppose health law but like provisions \xe2\x80\x93 Chicago Tribune: Baltimore Sun Most Americans oppose heal... http://t.co/wI8OvqZE'
216773347437064192,2012-06-24 06:02:48,"b'Apple\xe2\x80\x99s Retail Army, Long on Loyalty but Short on Pay: Apple Stores stores take in more money per square foot th... http://t.co/VvI7AWZb'"
216773012706426880,2012-06-24 06:01:28,"b'dbca Error-UnsatisfiedLinkError exception loading native library: njni11: HI, ... http://t.co/fDI2gX0i'"
216760863770673152,2012-06-24 05:13:11,"b'Jim R on ""Need help creating a simple plugin add_action(\xe2\x80\x98publish_post\xe2\x80\x99\xe2\x80\xa6.)"": I had created this plugin with some ... http://t.co/nNtt49Dv'"
216750328199122945,2012-06-24 04:31:19,b'Open Question: What characteristics do dental offices look for in a dental hygienist?: This question is for dent... http://t.co/WTqimqRv'
216748421866983425,2012-06-24 04:23:45,"b""Open Question: What happens if you don\xe2\x80\x99t pay a cash advance back will it affect your credit?: I can't pay them .... http://t.co/998jiUyM"""
216721167334121473,2012-06-24 02:35:27,b'The AIDS memorial quilt at the 25-year mark \xe2\x80\x93 Washington Post: USA TODAY The AIDS memorial quilt at the 25-year ... http://t.co/pkT9aL7j'
216718578974605312,2012-06-24 02:25:10,b'UK\xe2\x80\x99s Top Sports Stars Caught in Tax Crackdown: http://t.co/7bIlccBj http://t.co/S3YAk2EI'
216709119879557120,2012-06-24 01:47:35,b'Open Question: Should I help get my cousin on at my job?: Over the past 8 months I was unemployed and desperatel... http://t.co/AFnpGgL9'
216706094674874369,2012-06-24 01:35:33,b'Custom menu for registered customers error: I am getting an error when i try to show a diff set of menu if a cus... http://t.co/3FJxdloK'
216702774853906433,2012-06-24 01:22:22,b'Google Announces Sharp Price Cuts for Google Maps [VIDEO]: Google announced lower prices for sites and apps that... http://t.co/aYyqrLo5'
216697387278802946,2012-06-24 01:00:57,b'Sunday Conversation: HIV: \xe2\x80\x98It changed the way Americans think\xe2\x80\x99 \xe2\x80\x93 Houston Chronicle: AFP Sunday Conversation: HIV... http://t.co/aStaoILU'
216695624349921280,2012-06-24 00:53:57,b'Open Question: What can cause a small raised bump on the gums and might make more come out?.?: It has been there... http://t.co/CKzwRJhJ'
216695035792605184,2012-06-24 00:51:37,b'Re: Watch UFC 147 Silva vs. Franklin II Liv e St ream Online Free: Watch UFC 147 Online Silva vs. Franklin II Fr... http://t.co/swMaARny'
216674599025377283,2012-06-23 23:30:24,b'Is it possible to get image URLs from the start of a string in PHP?: I have an example string as follows $string... http://t.co/RqQTF7Nn'
216672283220127746,2012-06-23 23:21:12,"b'Open Question: Am i entitled to free dental care on the NHS?: I am 19, still officially in full time education (... http://t.co/g4FdgMQt'"
216666230533259264,2012-06-23 22:57:09,"b'Lesley Brown, Mother of First Test-Tube Baby, Dies at 64: The birth of Mrs. Brown\xe2\x80\x99s daughter using the in vitro ... http://t.co/5X1c3Cud'"
216659014757523456,2012-06-23 22:28:29,b'mySQL &amp; php coding \xe2\x80\xa2 Need products to show in grid instead of a row on php page: OK so I have been following som... http://t.co/SjTRN9jl'
216655927699451904,2012-06-23 22:16:13,"b""How to reopen debugger tabs in Java: I am in Eclipse and want to debug a program. I'm coding in Java if that hel... http://t.co/jkYvPIQU"""
216638302596509696,2012-06-23 21:06:10,"b""Open Question: Do I need to get another liscense moving from TX from CA?: I'm moving in a month!!! I 16 and have... http://t.co/eKliLowz"""
216625211188060160,2012-06-23 20:14:09,"b'Open Question: I just got an upper and lower partial.?: Feels like I have my teeth, their teeth, and everybody e... http://t.co/2sNauGIn'"
216624318203961344,2012-06-23 20:10:36,"b'move old log files to archive location: Hello All, ... http://t.co/lnmTTzKl'"
216619470108622848,2012-06-23 19:51:20,b'Changing Requirements Send Nurses Back to School: With more hospitals requiring nurses to have a bachelor\xe2\x80\x99s degr... http://t.co/MovcMzYd'
216616357721153537,2012-06-23 19:38:58,b'Google Celebrates Alan Turing with a Turing Machine Doodle: Alan Turing is being honored with a Google doodle th... http://t.co/wKMDkm6c'
216596564775419904,2012-06-23 18:20:19,b'Scrape a site content With a Secure Login: I am trying to scrape the contents of the a site with login secured b... http://t.co/09Qu9IgM'
216590852728954880,2012-06-23 17:57:38,"b'Open Question: Attractivness question! V. Important, Thanks!?: I am really sorry to ask this question and I assu... http://t.co/gZMy9T8m'"
216585872521445376,2012-06-23 17:37:50,b'Open Question: What are some of the best toothpastes?: i went to the store and there was some that cost like 8 d... http://t.co/EVjkONZB'
216584882917359616,2012-06-23 17:33:54,b'6 Mobile Apps for Your Job Hunt:  http://t.co/U9pODf4o'
216565395023347714,2012-06-23 16:16:28,"b'twosaucysisters on ""[Plugin: Easy Recipe] How-to"": Hi, My sister and I are new to blogging and are really confus... http://t.co/pL6lCDx0'"
216559421030010880,2012-06-23 15:52:44,b'Open Question: What will happen if I lied about my leave of absence?: Let\xe2\x80\x99s say I reported my leave of absence w... http://t.co/OGLutyoT'
216554302750195712,2012-06-23 15:32:23,b'Funny MCAT Testing Story: I went to a Prometric Testing Center this past Thursday to take my MCAT. I woke up a l... http://t.co/zQLGeoVl'
216553048179359745,2012-06-23 15:27:24,b'Domain polycy files on java phones: Anybody knows there are any tools available to view domain policy files on J... http://t.co/8UoxKVbT'
216549786961199104,2012-06-23 15:14:27,b'Greece Outlines Plan to Ease Debt Burden: http://t.co/p2zTSnQ3 http://t.co/aE18Qn7X'
216535543377444864,2012-06-23 14:17:51,b'Open Question: Which has better job opportunities B.sc IT or B.sc computer science?: pls help me i am confused http://t.co/Qpe8bDxA'
216533422359846912,2012-06-23 14:09:25,b'Protecting my PHP script with HTTPS: I have set up a simple PHP script on my server http://t.co/cqZyKdVR... http://t.co/80iHccqf'
216524737671741440,2012-06-23 13:34:54,"b'Deadly Bird Flu May Be Five Steps From Pandemic, Study Finds \xe2\x80\x93 San Francisco Chronicle: BBC News Deadly Bird Flu... http://t.co/B06ufZTy'"
216521821065973760,2012-06-23 13:23:19,"b'Sql Optimization: Hi SQL Experts, ... http://t.co/mRhukRz0'"
216500948980350977,2012-06-23 12:00:23,"b""\xe2\x80\x98H5N1 Bird Flu Pandemic Potential Revealed\xe2\x80\x99 \xe2\x80\x93 Medical News Today: BBC News 'H5N1 Bird Flu Pandemic Potential Rev... http://t.co/Kv71Lh7g"""
216491289821188097,2012-06-23 11:22:00,b'Open Question: I\xe2\x80\x99m 13 and im about to lose 4 baby teeth help ?!?! :(?: On my bottom row of teeth 4 baby teeth ar... http://t.co/CMQLLH2t'
216486993306202112,2012-06-23 11:04:55,"b'Judge Dismisses Apple vs. Motorola Patent Case: Couple of days back, we reported that while\xc2\xa0Federal Judge Richar... http://t.co/7GauHDiR'"
216482464057671680,2012-06-23 10:46:56,"b'Parsing path of a location and matching it with other table: Hi, ... http://t.co/BlhmDSUV'"
216478112777637888,2012-06-23 10:29:38,b'Extract ID of field as data is inserted into database: I need to implement a system where data is inserted into ... http://t.co/Sp7NHgn3'
216469562554720256,2012-06-23 09:55:40,b'Study Suggests Confusion Can Be Beneficial For Learning: Most of us assume that confidence and certainty are pre... http://t.co/Zgt49VTO'
216456884306198528,2012-06-23 09:05:17,"b""Open Question: I\xe2\x80\x99m 5\xe2\x80\x9d4 and half and i want to become a stewardess?: I'm currently 14 years old and my height is ... http://t.co/APBTfCRm"""
216444595259703296,2012-06-23 08:16:27,"b""Open Question: How much $ i need to spend on dentist? ?: I'm planning to go dentist cos my wisdom tooth broken &amp;... http://t.co/PmgjxXQK"""
216435640726855681,2012-06-23 07:40:52,b'error while creating tablespace!: i am using readhat linux... and created a new db and want to create a new tabl... http://t.co/eDyl4MkK'
216424284149661696,2012-06-23 06:55:44,b'Do You Suffer From Social Media FOMO? [INFOGRAPHIC]: Do you know FOMO? http://t.co/D96enXha'
216423615112028160,2012-06-23 06:53:05,"b""Check if a option in a form that was selected is the same as a variable in an array: I'm trying to validate some... http://t.co/pPeoh1PY"""
216422678725263360,2012-06-23 06:49:22,b'Surgery saved her life before birth \xe2\x80\x93 http://t.co/eESGuNsH: http://t.co/eESGuNsH Surgery saved her life before bir... http://t.co/5dZ1O7kt'
216413104664358914,2012-06-23 06:11:19,"b""Open Question: I got a question about my teeth? Picture included?: I've been doing a lot of research on dental b... http://t.co/yz45PHOi"""
216404249800753152,2012-06-23 05:36:08,b'Adding Facebook login to a GWT Google maps project: I have a GWT google maps project which looks like the image ... http://t.co/HpWBk2Pj'
216386394799607808,2012-06-23 04:25:11,"b""Open Question: how can i make 50 dollars before july 10?: okay so i am 14 years old, don't have a drivers permit... http://t.co/b9NkiS24"""
216377718818877440,2012-06-23 03:50:42,b'Steam for Schools Brings \xe2\x80\x98Edutainment\xe2\x80\x99 Factor with Portal 2: Did education just become a lot more fun? http://t.co/UC4nY8z3'
216368925213081600,2012-06-23 03:15:46,"b'sandystyle on ""[Plugin: FG Joomla to WordPress] Fatal error: Class \xe2\x80\x98PDO\xe2\x80\x99 not found"": I have this error Fatal err... http://t.co/iVsdPR64'"
216364732859428864,2012-06-23 02:59:06,b'Trying to do a insert activity and fire a  skill buildmodal window  on butt: I am trying to do insert activity o... http://t.co/JqsXPmDp'
216352445197070337,2012-06-23 02:10:17,b'Report: Most Employers Hope Supreme Court Will Strike Down Health Care Reform \xe2\x80\x93 Daily Disruption: Baltimore Sun ... http://t.co/DwpEYTmX'
216350491389603843,2012-06-23 02:02:31,b'Open Question: Can a rotten tooth cause Diarrhoea?: I have a rotten tooth in my mouth that i have had for a whil... http://t.co/oAopSsa5'
216338692632100864,2012-06-23 01:15:38,b'Texas AG Accuses Google of Withholding Data in Antitrust Probe: Texas Attorney General Greg Abbott has filed sui... http://t.co/9cnbvkBm'
216331806549618688,2012-06-23 00:48:16,b'Open Question: tethering question about iphone4s?: I know if I tether it will use up data but say I was tetherin... http://t.co/XSwJkv1s'
216306182250434560,2012-06-22 23:06:27,"b'attosoft on ""[Plugin: Auto ThickBox Plus] only the cover for a gallery ?"": In first solution, you need to write ... http://t.co/5FeVAdiz'"
216294330829246466,2012-06-22 22:19:21,"b'Concatination values from different database: select distinct ENTITLEMENT.ENTITLEMENT_ID as Entitlement_ID,APPRO... http://t.co/zvejFsTF'"
216292794036260864,2012-06-22 22:13:15,"b'Open Question: Force moving apps to sd on Lg Optimus Slider?: Please, i have tried almost everything. I am runni... http://t.co/FitwiFgN'"
216281598704881664,2012-06-22 21:28:46,b'40 Zimbabwe lawmakers undergo circumcision \xe2\x80\x93 New York Daily News: New York Daily News 40 Zimbabwe lawmakers unde... http://t.co/963TWQyc'
216275835806683136,2012-06-22 21:05:52,"b'Wooga Ditches HTML5 Service, Pulls from Facebook: Social game developer Wooga is putting a pin in its HTML5 gami... http://t.co/avJk6WQr'"
216271605091930112,2012-06-22 20:49:03,"b""Open Question: How to take care of my teeth with braces?: I got braces monday and now its friday i haven't been ... http://t.co/5MAHcoCM"""
216270926923304961,2012-06-22 20:46:21,"b""Sandboxing JavaScript execution in Java: Following my last question , I'd like to know if it is possible to sand... http://t.co/IkqFdxWf"""
216253690976288769,2012-06-22 19:37:52,"b'rogeratk on ""[Plugin: WordPress SEO by Yoast] \xe2\x80\x98News Sitemap\xe2\x80\x99 Module Incompatible With Latest Version"": thanks..f... http://t.co/DdJIzdYk'"
216238059879006210,2012-06-22 18:35:45,"b""Open Question: Would this work to get turntable working again?: Hi, I'm 15 years old and know basically nothing ... http://t.co/F2mQN9E1"""
216234950591135745,2012-06-22 18:23:24,b'Drinking Alcohol During Pregnancy: Is It Safe? What Are the Effects?: WebMD discusses the myths and facts about ... http://t.co/N9kaSp8a'
216230354212757504,2012-06-22 18:05:08,"b""getting default DN from openssl.cnf: I'd like to be able to get the default DN from openssl.cnf. http://www.php.... http://t.co/vrgGjeVj"""
216228580412231681,2012-06-22 17:58:05,"b""Why It\xe2\x80\x99s Not So Hard to Develop for Multiple Mobile Platforms: In Mashable 's new video series, Behind the Launc... http://t.co/gpj4dV2b"""
216224091135422465,2012-06-22 17:40:15,b'GoTo Next Iteration in For Loop in java: Is there a token in java that skips the rest of the for loop? Something... http://t.co/wkGs4fzD'
216216331022897153,2012-06-22 17:09:25,"b'SQL insert works, SQL delete doesn\xe2\x80\x99t: Hello, ... http://t.co/Os4yQEkJ'"
216201105762291714,2012-06-22 16:08:55,b'Video Games and ADHD: What\xe2\x80\x99s the Link?: WebMD reports on video games and ADHD. http://t.co/uv1jrXsL'
216197128471588864,2012-06-22 15:53:06,"b'Flipboard Releases Android App: As promised, Flipboard today launched an Android version of its news reader, and... http://t.co/z2JLQGEk'"
216172046810480643,2012-06-22 14:13:26,"b'All the \xe2\x80\x992%\xe2\x80\x99 want is to gain weight: Like many 23-year-olds, Amanda Eang is self-conscious about her body, weari... http://t.co/HCWHggQ2'"
216171009240342530,2012-06-22 14:09:19,b'Open Question: nice prom dress???? What do you think?: Grey ruffle bandeau dress - http://t.co/siOY4VXF http://t.co/7a2tdNnh'
216160661720403968,2012-06-22 13:28:12,"b'Append a string to the Last record: Hi, ... http://t.co/3xWg7KHG'"
216155005336567809,2012-06-22 13:05:43,"b""Drupal 7 Images in node template: I'm using drupal 7.x and am creating a node content-type template. http://t.co/r2tPDSQv"""
216149376429588480,2012-06-22 12:43:21,"b'Twitter Blames Outage on \xe2\x80\x98Cascading Bug\xe2\x80\x99: Twitter last night blamed a ""cascading bug"" for the Thursday outage th... http://t.co/EKyWkqt1'"
216140600955764736,2012-06-22 12:08:29,"b""Inspection Technologies: Librestream's remote visual inspection systems allow a technician to assess the status ... http://t.co/sYnXVIdl"""
216140497792663553,2012-06-22 12:08:05,b'European Medicines Agency criticizes Roche for not reporting possible side \xe2\x80\xa6 \xe2\x80\x93 Washington Post: French Tribune E... http://t.co/B08h8rIZ'
216140206116569088,2012-06-22 12:06:55,b'Open Question: after 10 days removed my wisdom tooth i had pain at the same time a small bulge in near the surge... http://t.co/TVOJFg6Z'
216129131258200064,2012-06-22 11:22:55,"b""Auto commit: Hello, My users don't want to press the commit button. http://t.co/kOIEMagZ"""
216123196213174273,2012-06-22 10:59:20,"b""How to put facebook profile picture into a coordinates of a picture?: I have extracted the user's facebook profi... http://t.co/LsaCjpfH"""
216117756645478400,2012-06-22 10:37:43,b'Microsoft Surface to Be Wi-Fi-Only at First [REPORT]:  http://t.co/SY6o9sl2'
216100696418816000,2012-06-22 09:29:55,b'Study shows how easily pandemic H5N1 bird flu could evolve \xe2\x80\x93 The Guardian: The Guardian Study shows how easily p... http://t.co/ZulcdEO2'
216099634253266944,2012-06-22 09:25:42,b'Open Question: What are best resources to learn Facebook marketing?: http://t.co/ziNzDPzO... http://t.co/fOFxteN3'
216083893093273600,2012-06-22 08:23:09,b'Open Question: HOW MUCH DOES IT COST FOR 1 DAY IN A PRIVATE HOSPITAL IN AUSTRALIA?: I have just found out last m... http://t.co/e3x3CyMi'
216069608338239489,2012-06-22 07:26:23,"b""Nokia: Windows Phone 7 Will Live On: Even with the announcement of Windows Phone 8, Windows Phone 7.5 isn't dead... http://t.co/xiu2MVZw"""
216067627188109312,2012-06-22 07:18:31,b'Open Question: how do i make an apple id account without using a credit card?: i have the latest itunes installe... http://t.co/8wmjtAPw'
216060658255540224,2012-06-22 06:50:49,b'Bird flu paper released after terror fears allayed \xe2\x80\x93 San Francisco Chronicle: BBC News Bird flu paper released a... http://t.co/b7W0gNWW'
216057120691462144,2012-06-22 06:36:46,b'Delete a File given an url using java: URL urlImage = new URL(candidateImagePath); BufferedImage image = ImageIO... http://t.co/fIdARA9q'
216051979816931330,2012-06-22 06:16:20,"b'PHP coding =&gt; General \xe2\x80\xa2 Slideshow in for loop: Hi there, i need to display slideshow in a for loop. So that i ca... http://t.co/6IYpUo8t'"
216038493175037952,2012-06-22 05:22:45,b'62% of Library Users Don\xe2\x80\x99t Know They Can Check Out E-Books [STUDY]:  http://t.co/X2Kn9Trr'
216037041895522304,2012-06-22 05:16:59,"b'Open Question: How do you no if U have a ""dry pocket"" after having a wisdom tooth pulled?: http://answers.yahoo.... http://t.co/26VS66TK'"
216028354485297152,2012-06-22 04:42:27,b'Open Question: Purchases don\xe2\x80\x99t show up \xe2\x80\x93 Vanilla Visa Gift Card?: I have purchased a few things in the past hour... http://t.co/XzuvscXM'
216013071062286336,2012-06-22 03:41:44,b'Parks chief apologizes to cancer survivor who wants to swim topless \xe2\x80\x93 The Seattle Times: The Seattle Times Parks... http://t.co/eqPzMCaX'
216004390241304579,2012-06-22 03:07:14,"b'tutornotes on ""[Plugin: Custom Permalinks] Cause looping issues"": I remembered that Custom Permalinks have relea... http://t.co/ElvYgIdC'"
215998915667955712,2012-06-22 02:45:29,b'Reports Tip Smaller iPhone Dock Connector (Again): More reports about a revamped dock connector for the iPhone e... http://t.co/GfV8BFuX'
215996607848648705,2012-06-22 02:36:18,b'Open Question: How do you make teeth crooked?: FIRST BEFORE YOU READ IM NOT THE ONE WANTING TO KNOW THIS MY FRIE... http://t.co/Mqb30I6Y'
215993161196126208,2012-06-22 02:22:37,b'how to design the form in own style and insert: hi everyone i want to create a form which contains 3 blocks ... http://t.co/aXi3fZ9F'
215980960594927617,2012-06-22 01:34:08,b'Breast cancer survivor can now swim topless in Seattle\xe2\x80\x99s public pools \xe2\x80\x93 http://t.co/3VUwxU47: KEPR 19 Breast canc... http://t.co/H9M88oXY'
215979980138610688,2012-06-22 01:30:14,"b""how will i pass the string name in php?: Hi have a problem here how can i pass the string name in php? here's my... http://t.co/BgO0Oz7M"""
215963923608895488,2012-06-22 00:26:26,b'Open Question: Does no easement or restrictions mean a title on a property is free and clear?: Free and clear title http://t.co/5RoQrTn8'
215958991635890176,2012-06-22 00:06:50,"b""How to Build Your Own Cellphone [VIDEO]: As beautifully designed as the latest batch of smartphones are, they're... http://t.co/Fu7mDCtd"""
215945229163966464,2012-06-21 23:12:09,"b""Open Question: If a dentist does work on you, can they send the bill to your house?: I can't call now because th... http://t.co/CBSpqN1a"""
215945006547079169,2012-06-21 23:11:16,b'How to improve performance of a procedure that delete more than billion row: The following procedure will delete... http://t.co/Vm5IaYAT'
215941006284177408,2012-06-21 22:55:22,b'FDA Turns Down Xarelto for ACS Patients \xe2\x80\x93 MedPage Today: MedPage Today FDA Turns Down Xarelto for ACS Patients M... http://t.co/f2rWm1BI'
215932241862328320,2012-06-21 22:20:32,"b""Write to SQL Database and Excel File: I'm working with a client to create a website for a new product he's launc... http://t.co/pc4xNdq6"""
215920962154147842,2012-06-21 21:35:43,"b'client session\xe2\x80\x99s server oracle process uses more than 15 GB of memory: Hi there, ... http://t.co/ezDv2pq7'"
215909271655821316,2012-06-21 20:49:16,"b'Relocation moving services: Suddath is a company known for providing innovative, quality driven solutions for re... http://t.co/u0bsS6zr'"
215904742528921601,2012-06-21 20:31:16,"b'last friday-thursday: Hi, ... http://t.co/Er9EVgY5'"
