id,created_at,text209921158471098368,2012-06-05 08:14:38,"b'Accessing application data: I am using static fields to store application data, is that the standard way or is t... http://t.co/MtVrwFWu'"
209908633826369536,2012-06-05 07:24:52,b'Open Question: What do I need to take to the DMV?: To obtain my permit? ID? http://t.co/jvjbrxxP'
209907308606656512,2012-06-05 07:19:36,b'Apple bringing the Google battle to Maps in iOS 6: Rumors have been spreading for a while now that Apple would u... http://t.co/iPuriwkX'
209901770003066880,2012-06-05 06:57:36,"b""Proposed \xe2\x80\x98sugary\xe2\x80\x99 drink ban based on theory, not studies \xe2\x80\x93 Jackson Clarion Ledger: CBS News Proposed 'sugary' dr... http://t.co/DrrgSLid"""
209887649836711936,2012-06-05 06:01:29,b'Open Question: i have a small hole in my mouth near my gums i was wondering if anyone knew what it was?: when i ... http://t.co/qMzkioFo'
209874349581283328,2012-06-05 05:08:38,"b'davydd on ""[Plugin: Contact Form 7] Acceptance checkbox doesn\xe2\x80\x99t return the error message"": Hello, Many thanks fo... http://t.co/eYnv70ey'"
209874349245739008,2012-06-05 05:08:38,b'unable to install oracle 10g XE in windows 7: previously i had installed oracle 10g.but it stopped working. http://t.co/k75sTo70'
209850970690162689,2012-06-05 03:35:44,"b'class not found (php): Anyone tell me why I\'m getting the error ""Class \'Whois\' not found"". http://t.co/GGX3LUFE'"
209846931994845185,2012-06-05 03:19:42,"b'Exclusive: Disney to stop some junk-food ads on kids\xe2\x80\x99 TV, websites: sources \xe2\x80\x93 Chicago Tribune: The Republic Excl... http://t.co/B6oP5Hcj'"
209838221553709056,2012-06-05 02:45:05,b'Open Question: What is the minimum amount of time that someone should work at food service job before quitting?:... http://t.co/QLQ0QAZv'
209833211763752961,2012-06-05 02:25:10,b'Open Question: getting braces tomorrow at 9 am?: so i have done most of the research needed like food and pain a... http://t.co/fVPhRMaO'
209828620775063552,2012-06-05 02:06:56,"b'Facebook Will Disappear by 2020, Says Analyst: Facebook \xe2\x80\x98s sliding stock price has at least one hedge fund manag... http://t.co/HXQQbid6'"
209814761024667648,2012-06-05 01:11:51,"b""Open Question: Can you get your drivers licence if your car\xe2\x80\x99s insurance is not in effect?: so i'm getting my lic... http://t.co/X0TdRZxo"""
209809107320963072,2012-06-05 00:49:23,b'Oracle documentation on details of AWR report: A coworker of mine asked if there was any documentation from Orac... http://t.co/gDGINzrg'
209804063456493569,2012-06-05 00:29:21,b'Samsung Galaxy S III vs. iPhone 4S: Which One Breaks First? [VIDEO]: The Samung Galaxy S III has a lot of cool f... http://t.co/O7rPDsDy'
209798210519175169,2012-06-05 00:06:05,b'Experimental drug offers new way to battle certain breast cancer \xe2\x80\x93 Providence Eyewitness News: Telegraph.co.... http://t.co/eqjGsQfR'
209792479506083841,2012-06-04 23:43:19,"b""Open Question: Do braces hurt during and after you put them on?: Alright so i'm absolutely terrified in getting ... http://t.co/eUicPcDC"""
209786598903136258,2012-06-04 23:19:57,b'PHP Exploding date to values and using if statement throwing 500 errors: Here is my code. I know 500 errors are ... http://t.co/Hu4xPOiU'
209781449228955649,2012-06-04 22:59:29,"b'Open Question: Places that fix broken cellphone screens in edmonton?: I dropped my motorola spice, and smashed t... http://t.co/TbBZ7JtN'"
209766944235200512,2012-06-04 22:01:51,"b""New Drugs Unleash Immune System to Attack Tumors: Two experimental drugs that recharge the body's immune system ... http://t.co/bD1pnG5K"""
209763079301509120,2012-06-04 21:46:29,"b""AFNetworking Uploading Image: I've look at a few examples but I think my problem may be with in the PHP. I am tr... http://t.co/d1XdXDth"""
209745787624751104,2012-06-04 20:37:47,b'Open Question: took a week to get my retainer and my teeth have moved alot.?: Wore braces for 7 months and I lov... http://t.co/KJMuBwGX'
209742289331957761,2012-06-04 20:23:53,b'Open Question: I can turn left easy but when I turn right it feels stiff. Jetta 3 1998?: It has power steering a... http://t.co/1N43Nne8'
209738597673353217,2012-06-04 20:09:13,"b'SQL loader \xe2\x80\x93 Zeros adding: Hi All, ... http://t.co/U2q11fRN'"
209733272249442304,2012-06-04 19:48:03,b'How Social Media Is Changing the Sports Ticketing Market [INFOGRAPHIC]: Social media hasn\xe2\x80\x99t only revolutionized ... http://t.co/mKi8D4uE'
209711221824438272,2012-06-04 18:20:26,b'Open Question: 2001 chevy s10 fuel problems?: ok so i have a 2001 s 10 4 cylinder and for the past couple of mon... http://t.co/meA8yNRX'
209708392749600768,2012-06-04 18:09:11,"b""php xmlstring passsing to function behaves unexpected: What's the difference between function 1 and function 2. http://t.co/QjeSs3un"""
209706701094526976,2012-06-04 18:02:28,b'Open Question: hELPP!!! need the info for my coursework please help describe the various dental prosthesis that ... http://t.co/grQgDbpz'
209691364223483904,2012-06-04 17:01:31,"b'Download link for oracle 11.1.0.6: All, ... http://t.co/VbJGkvJT'"
209686991539929089,2012-06-04 16:44:09,b'Childhood cancer survivors face future risks: Women treated with chest radiation for cancer when they were girls... http://t.co/8QgW5I6D'
209678528411746305,2012-06-04 16:10:31,b'Your Mom Was Wrong: You Can Win a Gaming Scholarship: Online gaming broadcast network TwitchTV is announcing a s... http://t.co/HhabIe4u'
209664280411377666,2012-06-04 15:13:54,b'Open Question: What kind of heads can you put on a 4.6 v8 for better proformance?: I need help I am going to por... http://t.co/vXjP771i'
209660204726501376,2012-06-04 14:57:42,b'need help with query: Hello: I need to write a query on history table to find pause time. means where there was ... http://t.co/IXAwVcJY'
209656021281554432,2012-06-04 14:41:05,"b'Celgene, Bristol Drugs No Better Than Therapy Costing Less \xe2\x80\x93 BusinessWeek: Celgene, Bristol Drugs No Better Than... http://t.co/e3AguKAU'"
209653203460030464,2012-06-04 14:29:53,b'search for a string in a pdf file using php: I want to search a string from a pdf file in a way strstr() does. B... http://t.co/Jd1nwIJK'
209652036873093120,2012-06-04 14:25:15,b'Open Question: Should I wait 3 months to fill my cavities at a dental clinic or pay more for a private dentist?:... http://t.co/0jHhqSzi'
209632938151776256,2012-06-04 13:09:21,b'Open Question: what was the cutoff for previous sbi clerk exam for the state of tamilnadu?: what will be the cut... http://t.co/wlzsk1Ex'
209631679218847745,2012-06-04 13:04:21,"b""Sony Unveils Vaio Laptops, Desktops: Sony's VAIO computers are getting a new look, and extending beyond the real... http://t.co/YNCIgRly"""
209623670849679361,2012-06-04 12:32:32,b'Mashable Weekend Recap: 52 Stories You Might Have Missed: As we kicked off the first weekend of the summer seaso... http://t.co/RDSSYqEN'
209606350907518976,2012-06-04 11:23:43,"b'dhoffmann on ""[Plugin: NO CAPTCHA Anti Spam] Contactform 7 / 1.0.0"": Hi, after updating from 0.9 to 1.0 on my mu... http://t.co/Iya2xDDX'"
209597519620087808,2012-06-04 10:48:37,"b'Redirect to Branch Conditionally: Hi, ... http://t.co/N07qaJnU'"
209597401898549249,2012-06-04 10:48:09,"b""Open Question: to get braces or not to get braces, that is the question?: Hi i've had this debate with my mum fo... http://t.co/ir5nczQL"""
209585858918105088,2012-06-04 10:02:17,b'Open Question: What is Trendy Urban Wear Clothing Style?: http://t.co/RE1XESsj... http://t.co/iJhqklH7'
209577353586806784,2012-06-04 09:28:29,"b""Bayer\xe2\x80\x99s Drug Meets Chief Goals In Late-Stage Study Of Patients With GIST \xe2\x80\x93 RTT News: Bayer's Drug Meets Chief Go... http://t.co/LcykE79t"""
209558420012015616,2012-06-04 08:13:15,b'Open Question: Are braces expensive? Do you think I will need them?: I have always wanted braces and so i asked ... http://t.co/xhNtAz2V'
209551879515017216,2012-06-04 07:47:16,"b'PHP coding =&gt; General \xe2\x80\xa2 Php Select Package and computation: -- pardon me with the subject, as I dont know what t... http://t.co/OPZWTAAe'"
209537572492419072,2012-06-04 06:50:24,b'Europe\xe2\x80\x99s Next Bailout? Cyprus Gets Closer: http://t.co/wlkcnCRd http://t.co/ggjjBz8r'
209535192958894080,2012-06-04 06:40:57,"b'Problem with RowKey for programmatically populate View Objects: Hi, ... http://t.co/EaIZQMd1'"
209515130847903744,2012-06-04 05:21:14,b'Many Moms Don\xe2\x80\x99t Meet Their Own Breastfeeding Goals: Many moms who want to breastfeed exclusively for three month... http://t.co/6qQH6TqV'
209511631007395840,2012-06-04 05:07:20,b'Many Moms Don\xe2\x80\x99t Meet Their Own Breastfeeding Goals: Many moms who want to breastfeed exclusively for three month... http://t.co/UES89bS3'
209504049438011394,2012-06-04 04:37:12,"b'Wiring midi sequencers: I need to ""wire"" two sequencers : player and recorder. The player may receive midi event... http://t.co/Nh4z60vn'"
209500247616004096,2012-06-04 04:22:06,b'Open Question: Amazon question about return?: What happens when you get a request from some one to return an ite... http://t.co/TqNFBsNg'
209498700198854659,2012-06-04 04:15:57,b'Google Readies New Local-Ad Assault: Google is preparing to launch its largest-ever assault on the roughly $20 b... http://t.co/c0Qt3slz'
209497471485874177,2012-06-04 04:11:04,b'How i can create pyrocms login module in core php?: I have developed a Web Application in pyrocms and thats work... http://t.co/cl0Nfozz'
209483976228872192,2012-06-04 03:17:26,b'Experimental Drug Offers New Battle Against Certain Breast Cancer \xe2\x80\x93 http://t.co/pO1Q3hDO: USA TODAY Experimental ... http://t.co/g1Cxz1x0'
209472907318013952,2012-06-04 02:33:27,"b'Inconsistent java and sql object types: I know that this is already in the forum, but there were no answers in t... http://t.co/qyOwyebk'"
209464820095922176,2012-06-04 02:01:19,b'MD 3.89 cGPA. 3.92sGPA 33P MCAT What do you think?: My extracurriculars are limited however. They include: 30 ho... http://t.co/KSlTWGFs'
209461095277150209,2012-06-04 01:46:31,b'Open Question: Has anyone used the website http://t.co/nRnBJ5Vy. Does it work or is it a rip off stealing your mo... http://t.co/RAeFTRDE'
209444044940648449,2012-06-04 00:38:46,"b""Pricing for June 17 Verizon FiOS Upgrades Leaks: Just how much will Verizon's new 300/65 Mbps FIOS service cost ... http://t.co/EkGS0vox"""
209442567652261889,2012-06-04 00:32:54,"b'moneyfunk on ""[Plugin: Advanced Permalinks] Does not work with pagination"": I figured out the solution and wrote... http://t.co/hGql4om3'"
209433894276182016,2012-06-03 23:58:26,"b'assign value while parsing XML data into oracle table: Hello, ... http://t.co/2ErZKhgV'"
209421395430604801,2012-06-03 23:08:46,b'Health care reform forum enlightens area residents \xe2\x80\x93 http://t.co/rQys2ZLn: Plain Dealer Health care reform forum ... http://t.co/yTtINJ2l'
209404759302615040,2012-06-03 22:02:39,"b""Nintendo to Stream Pre-E3 Presentation Today, 3 p.m. (PT): What's in Nintendo's bag of tricks for its get-out-in... http://t.co/tw6BGCNw"""
209402318414815232,2012-06-03 21:52:57,"b'Open Question: When I smile or talk my teeth don\xe2\x80\x99t show, what can I do? PHOTOS?: I have really bad overbite but ... http://t.co/6rtQeQwT'"
209395816245370881,2012-06-03 21:27:07,b'Re: disabled cookies: Ashley http://t.co/Fz0Os9CS'
209382916122361856,2012-06-03 20:35:52,b'Open Question: Does my 2003 Suburban stereo have inputs for an aftermarket amp?: http://t.co/AT605il8... http://t.co/gbK0G9cY'
209374252477063168,2012-06-03 20:01:26,"b'Volunteers Celebrate, Remember, Fight Back at Brick Relay for Life \xe2\x80\x93 http://t.co/fix1nBAD: TheAlternativePress.co... http://t.co/mjUNrPTx'"
209373631426478082,2012-06-03 19:58:58,"b'Umbrella Makes 8-Bit Sounds When Rained On [VIDEO]: An umbrella isn\xe2\x80\x99t the most exciting accessory ever devised, ... http://t.co/2HNClZGk'"
209372401295835136,2012-06-03 19:54:05,"b'marikamitsos on ""[Theme: PageLines] child support?"": @Jan: The short, right to the point answer is given by Simo... http://t.co/wPYF0EAV'"
209371707964792832,2012-06-03 19:51:19,b'Java JPanel Coordinate System: I am having trouble displaying this JLabel which contains an image at the specifi... http://t.co/TSvCt53z'
209343050848272384,2012-06-03 17:57:27,"b""\xe2\x80\x98Pioglitazone Raises Bladder Cancer Risk In Diabetes Patients\xe2\x80\x99 \xe2\x80\x93 Medical News Today: Zee News 'Pioglitazone Rais... http://t.co/MDET2cf7"""
209340023915548673,2012-06-03 17:45:25,b'Want to learn more about Temple and Philadelphia\xe2\x80\xa6: I was just unexpectedly accepted to Temple 4 days ago and nee... http://t.co/oZNBUy0h'
209326647076331520,2012-06-03 16:52:16,"b'Netflix Tops iTunes as Largest Online Movie Service: Despite its missteps last year, Netflix still managed to su... http://t.co/sgEsXKhD'"
209325676342419456,2012-06-03 16:48:24,b'Import txt.gz file from external source to database using PHP: Really hope someone can help me with this... I ha... http://t.co/Y2WEtpXx'
209324954704019456,2012-06-03 16:45:32,"b'the message dimensions has become larg in jdev11.1.2.1.0: Hi, ... http://t.co/1EDuDSnw'"
209319716106420224,2012-06-03 16:24:43,"b""Study: \xe2\x80\x98Smart bomb\xe2\x80\x99 drug attacks breast cancer \xe2\x80\x93 http://t.co/3VUwxU47: http://t.co/3VUwxU47 Study: 'Smart bomb' dr... http://t.co/NMkxvpZC"""
209312662461480961,2012-06-03 15:56:42,"b""Open Question: How can I convince my mum that I need to start wearing at least a little bit of make up?: I'm 14.... http://t.co/Y7zyeBCs"""
209285578766811138,2012-06-03 14:09:04,b'Open Question: is something wrong with my retainer?: every time i take my retainer out in the morning my mouth c... http://t.co/sGwOWhKn'
209279603741696001,2012-06-03 13:45:20,b'CleverPin: Jailbreak Tweak Makes iPhone\xe2\x80\x99s Passcode Protection Smarter: If you liked the idea behind AutoProtect ... http://t.co/euCHP3B5'
209278956103413760,2012-06-03 13:42:46,b'dealing with character encoded twitter responses: Im building an application that interacts with the Twitter API. http://t.co/24dZfDLj'
209265664303706112,2012-06-03 12:49:56,b'Open Question: Why is the silvia s13 cheap at the moment?: http://t.co/rdvSMHfS... http://t.co/FvA6iHr2'
209249341368569856,2012-06-03 11:45:05,b'Ending breast cancer \xe2\x80\x93 http://t.co/3O0WYklr: http://t.co/Zcm23MCC Ending breast cancer http://t.co/3O0WYklr Thousan... http://t.co/GcyXaLyS'
209232499216367616,2012-06-03 10:38:09,b'The Dictator\xe2\x80\x99s Bloopers Revealed!: http://t.co/lUr5i6mM http://t.co/IQ1t6pBA'
209231118258552832,2012-06-03 10:32:40,"b'How can we show scrollable for region reports.: Hi All, ... http://t.co/VLPXK4Gv'"
209230803857707008,2012-06-03 10:31:25,b'Open Question: I am 23 years old can putting a retainer now push back my teeth?: I have just removed one of my b... http://t.co/Ta6cGWmE'
209216287396732929,2012-06-03 09:33:44,"b'valvova on ""[Plugin: New User Approve] Hiding / restricting admins"": The plugin works a charm for new registrati... http://t.co/ybsPgQyD'"
209210184755707904,2012-06-03 09:09:29,b'Study: Hormone pill slows growth of prostate cancer \xe2\x80\x93 Denver Post: New York Daily News Study: Hormone pill slows... http://t.co/yXnb5FDk'
209192087722278913,2012-06-03 07:57:34,"b'branch to the newly created record: Hy, ... http://t.co/ghbmlMrf'"
209187519135358976,2012-06-03 07:39:25,"b'Open Question: Credit card interest- how does it work?!!?: Hello, Ok this may be a silly question but I am so CO... http://t.co/ZhathgIb'"
209185611045814275,2012-06-03 07:31:50,b'Roche Cancer Drug Performs Well: A study involving an experimental cancer drug being developed by Roche showed i... http://t.co/ODDzt17n'
209168444191547393,2012-06-03 06:23:37,b'Open Question: Orthodontist technician?: I want to be an orthodontist or orthodontist technician. How many years... http://t.co/1IEVwOOl'
209140208405454848,2012-06-03 04:31:25,b'Open Question: I have money in my paypal account but when i want to purchase an item on ebay it\xe2\x80\x99s telling me?: i... http://t.co/UttcWhaP'
209139587371634688,2012-06-03 04:28:57,"b'Interrupting Prostate Cancer Treatment Could Shorten Life, Study Finds \xe2\x80\x93 New York Times: The Daily Star Interrup... http://t.co/xGcEZfCo'"
209138188294434816,2012-06-03 04:23:24,b'Regex \xe2\x80\x93 Convert HTML to valid XML tag: I want to write a regex function that converts HTML string to a valid XML... http://t.co/LqFfCEWw'
209137243330326528,2012-06-03 04:19:39,b'Open Question: if tooth whiteners have hydrogen peroxide in them?: can they be used to bleach hair? since hair b... http://t.co/5etkiIIn'
209132660247887872,2012-06-03 04:01:26,"b""Facebook Asks All Users to Vote on Policy Clarifications: Don't expect sweeping changes to come from Facebook's ... http://t.co/EEM7I2cE"""
209121918064918529,2012-06-03 03:18:45,"b""How do I use the ActionBar on older versions of Android?: If I'm not mistaken, the Android guidelines say you sh... http://t.co/X4WmkAyE"""
209108546841878528,2012-06-03 02:25:37,b'Emotion Runs High In Race For Cure 5K \xe2\x80\x93 Hartford Courant: Hartford Courant Emotion Runs High In Race For Cure 5K... http://t.co/e71U8ELs'
209101123196424192,2012-06-03 01:56:07,b'Open Question: How do I get nice toenails (men)?: I want nice looking toenails and I just feel my toenails are n... http://t.co/QHk6H2q4'
209086210478571520,2012-06-03 00:56:51,"b""June Android Stats: A Little More Ice Cream, Still A Lot Of Gingerbread: Gingerbread's not going anywhere anytim... http://t.co/nOrfLBCH"""
209083702125395969,2012-06-03 00:46:53,"b'ableangela on ""Subscription Plugin"": Excuse me if I am posting this in the wrong section but I would like to kno... http://t.co/V3068liJ'"
209075122030645249,2012-06-03 00:12:48,"b""In C++ or Java is there a way to get the CPU usage?: I'd like to write a little program just to display the CPU ... http://t.co/qyNCKUjX"""
209067076025982978,2012-06-02 23:40:49,"b""Open Question: Is it harder to CREATE space for dental implants when you\xe2\x80\x99re older?: I'm 28 and I'm congenitally ... http://t.co/em68vYgS"""
209062295068884992,2012-06-02 23:21:49,"b'Open Question: linksys wrt54g quit working how do i fix?: my linksys wrt54g just quit working, all i did was unp... http://t.co/C6ccc7Ji'"
209054214423445504,2012-06-02 22:49:43,"b'Painkillers Add Costs and Delays to Workplace Injuries: Narcotic painkillers, which can mask rather than treat p... http://t.co/UOrUHUZJ'"
209052587360661504,2012-06-02 22:43:15,"b'nickerlaus on ""SQL Trouble (I thnk!)"": Hi all, I hope this is the right place to post. If not, please feel free ... http://t.co/2VLTMljS'"
209028183260020736,2012-06-02 21:06:17,"b""Java code executor: When I executed my java class it turned out that I don't have some privileges when I try to ... http://t.co/YokeDmtS"""
209023696227143681,2012-06-02 20:48:27,"b'Oprah Book Club Returns in New Digital Form: Oprah Winfrey\xe2\x80\x99s book club is back, now in a lively new version 2.0 ... http://t.co/aTkWXI5A'"
209020227550326784,2012-06-02 20:34:40,b'Open Question: I have the answer for canker sores!! Just discovered it by accident.?: I have a sore inside my bo... http://t.co/ER9df2QF'
208992530619043840,2012-06-02 18:44:36,b'Reddit 101: Co-Founders Explain the Community [VIDEO]: Reddit \xe2\x80\x98s culture is enigmatic to many. http://t.co/QPn34bJJ'
208992199919153152,2012-06-02 18:43:18,b'Open Question: what do you think ? you think its safe to join?: http://t.co/GAHGfKjr http://t.co/2mgv7TiV'
208990385643585536,2012-06-02 18:36:05,"b'Jeff Farthing on ""[Plugin: Theme My Login] Profile showing up even user is not activated"": Yes, this is a known ... http://t.co/xh5t8N9I'"
208984149099421696,2012-06-02 18:11:18,b'Study: Cancer cases expected to double by 2030 \xe2\x80\x93 WMBF: CBS News Study: Cancer cases expected to double by 2030 W... http://t.co/gjRPHpn5'
208981233357697024,2012-06-02 17:59:43,"b""Open Question: Does Teeth Extraction hurt?: I'm having two upper teeth Extracted in exactly a month for my brace... http://t.co/x9grMYbK"""
208981228999815168,2012-06-02 17:59:42,"b""Java Client \xe2\x80\x93 Server Game: i have got a homework and i can't do this. Please help me to do my homework http://t.co/Fi6OO68T"""
208959689613000705,2012-06-02 16:34:06,b'Dark Chocolate Can Reduce Risk Of Heart Attacks \xe2\x80\x93 Counsel &amp; Heal: Counsel &amp; Heal Dark Chocolate Can Reduce Risk ... http://t.co/URVg143C'
208952482750152705,2012-06-02 16:05:28,"b'What to Expect From E3 2012: The biggest gaming conference of the year, E3 , is set to begin next week on Los An... http://t.co/qvgjdopM'"
208942326989598720,2012-06-02 15:25:07,"b'can any one tell me why i am getting error ""PHP Fatal error: Internal zval\xe2\x80\x99s can\xe2\x80\x99t be arrays, objects or resourc... http://t.co/8YjBPE2W'"
208941169323937794,2012-06-02 15:20:31,"b'Transient Attribute not getting updated: Hi all, ... http://t.co/nvW72PJQ'"
208936527261212672,2012-06-02 15:02:04,"b'iOS 6 to Get Redesigned iTunes Store, App Store And iBookstore: As we get closer to the WWDC 2012 Keynote , wher... http://t.co/yykEjNt2'"
208936179507273730,2012-06-02 15:00:41,"b'Open Question: on the film ""Wall Street Money Never Sleeps"" what job does jake actually do ?: just wondering cau... http://t.co/HG9NsvK0'"
208934366628417537,2012-06-02 14:53:29,b'PHP coding =&gt; General \xe2\x80\xa2 help needed please I need to run IF statement from MySQL: Hi guys I am trying to connect... http://t.co/L0ftj4SL'
208901960374558720,2012-06-02 12:44:43,"b'tscargo on ""[Plugin: All-in-One Calendar] WordPress Network Dashboard breaks after latest update"": I have just i... http://t.co/nQHoTLVe'"
208900954584662016,2012-06-02 12:40:43,b'Open Question: How is a dental hygienist different from a normal dentist?: what does a dental hygienist actually do? http://t.co/Jy0vzfAh'
208896016366321664,2012-06-02 12:21:06,b'Hundreds attend annual Relay for Life at BGHS \xe2\x80\x93 Bowling Green Daily News: CBC.ca Hundreds attend annual Relay fo... http://t.co/d7bQEms8'
208888380249997314,2012-06-02 11:50:45,b'Open Question: How did M K Ghandi\xe2\x80\x99s non-violence tactics work against the Muslims around the time of partition i... http://t.co/geikwioe'
208877562351464450,2012-06-02 11:07:46,"b'CBO \xe2\x80\x93 Wrong Cardinality Estimate: Hello, ... http://t.co/tAvNIPal'"
208862907100966912,2012-06-02 10:09:32,b'!! Live !! Waratahs vs Hurricanes Live Super Rugby Streaming: Hello Rugby Lovers !!! If your watch Rugby match b... http://t.co/bPdGfYNZ'
208857585217044481,2012-06-02 09:48:23,"b'One-way Ticket to Mars, Please: Startup Plans Space Colony in 2023: NASA\xe2\x80\x99s road map for getting to Mars may be i... http://t.co/NUXjHyrI'"
208846357631475714,2012-06-02 09:03:46,b'Open Question: How is maharaja ganga singh dental college and research center?? I mean its reputation?: http://a... http://t.co/QqpmxwjZ'
208841472177475584,2012-06-02 08:44:21,b'Open Question: How To Use Wrinkle Creams?: Wrinkle Cream Products is all about the timing. Keep a close eye out ... http://t.co/FelcqLdd'
208840829274566656,2012-06-02 08:41:48,"b'Around world, Bloomberg soda war hard to swallow \xe2\x80\x93 Silver City Sun News: The Guardian Around world, Bloomberg so... http://t.co/1ohXn1WV'"
208830812462911488,2012-06-02 08:02:00,"b""login coding: hi..can anyone help me in designing coding for login?i'm using oracle developer 6i.pliz.. http://t.co/uhZu5nNo"""
208807641894494209,2012-06-02 06:29:55,"b'JamiesWright on ""Editing header.php"": I got it to work with $fp = fopen(get_stylesheet_directory().\'/\'.""header.p... http://t.co/tz2pZHeK'"
208799425986969601,2012-06-02 05:57:17,"b""Support ?: Hi, i'm working in Support department. http://t.co/HY91yFsB"""
208794774017290241,2012-06-02 05:38:48,"b'Mets Pitch First No-Hitter in 50-Year History: Finally, 8,020 games into the team\xe2\x80\x99s 50-year history, the New Yor... http://t.co/PWi1xAV8'"
208786435459915777,2012-06-02 05:05:39,b'Open Question: i downloaded barrel From cydia and i started using it and now i cant open up any of my apps on my... http://t.co/vlq3PwDN'
208783794885505024,2012-06-02 04:55:10,"b""Open Question: Receded Gums Remedy Please?: I'm 22 years old and am experiencing receding gums. I'm very hygieni... http://t.co/47uHgoTH"""
208770153549266944,2012-06-02 04:00:58,b'New procedures restore movement in paralyzed rats \xe2\x80\x93 Fort Worth Star Telegram: Daily Mail New procedures restore ... http://t.co/syzecM3L'
208755485648756736,2012-06-02 03:02:40,"b'Open Question: i need help with my imovie!?: so im trying to do a stop motion project for my class on imovie, bu... http://t.co/SwL9L5Vp'"
208752247356653570,2012-06-02 02:49:48,b'Open Question: tmj popping and locking?: when i wake up in the morning my left side would keeping locking and po... http://t.co/Bi5oFBVg'
208747697803497473,2012-06-02 02:31:44,b'Open Question: How many hours of flight training do you need to get your private license and your commercial lic... http://t.co/7ojWHxuS'
208744450648834048,2012-06-02 02:18:49,b'Postage Stamp Vending Machine: I was given an assignment to develop an algorithm for dispensing stamps for a pos... http://t.co/xxgKKqMC'
208732253205970946,2012-06-02 01:30:21,"b""LucasArts to Unveil Dark, Mature \xe2\x80\x98Star Wars 1313\xe2\x80\xb2 at E3: LucasArts' upcoming game takes gamers into the dark bel... http://t.co/m1Z9ZZPc"""
