id,created_at,text223030116006113281,2012-07-11 12:24:58,b'Report: Facebook to Launch Job Board: Job seekers may soon have a new place to look online for employment: Facebook. http://t.co/3sS1KUNE'
223028376670191616,2012-07-11 12:18:03,b'Open Question: what does it feel like to be knocked out by jaw punch?: What does it feel like to be knocked out ... http://t.co/fvMdsyOy'
223028375814541312,2012-07-11 12:18:03,b'Calling Report from Forms -6I \xe2\x80\x93 Forms and Report: I am calling simple emp report from form using emp table. Form... http://t.co/sXSqAHNM'
223022125605322752,2012-07-11 11:53:12,b'Ouya Raises Over $2.4 Million and Two Other Stories You Need to Know:  http://t.co/hN75g5DZ'
223016178812071936,2012-07-11 11:29:35,b'Open Question: How to make stomach flat without loosing weight?: I heard easiest way is to wear a corset or get ... http://t.co/hKHQ1PuW'
223000306286473216,2012-07-11 10:26:30,"b'Open Question: Is this answer good enough for ""what is your greatest weakness"" question?: I would say sometimes ... http://t.co/WL31BZrw'"
222988574465851392,2012-07-11 09:39:53,b'Using modulus with a cakephp html helper table: I have multiple arrays with an unknow amount of items per array. http://t.co/xIFEfl5e'
222979475372113920,2012-07-11 09:03:44,b'West Nile Virus detected north of Chicago \xe2\x80\x93 Chicago Tribune: Chicago Tribune West Nile Virus detected north of C... http://t.co/2TpYnB8i'
222974543189385216,2012-07-11 08:44:08,"b""Report: San Fran Dumps Macs Over Apple\xe2\x80\x99s EPEAT Pullout: The MacBook Pro's glued-in batteries mean Apple can no l... http://t.co/4s3BZ5oJ"""
222956867968704512,2012-07-11 07:33:54,"b'CircleReader on ""preset admin menu links to create postings with specific category, tags, etc.?"": I\'ve been tryi... http://t.co/DxtK70lY'"
222956867926753280,2012-07-11 07:33:54,"b'CLIENT_TEXT_IO does not export full data: Hi everyone, ... http://t.co/x2OsfLcC'"
222956867918364672,2012-07-11 07:33:54,b'Open Question: Teeth hitting together really hard?: 7 months ago an oral surgeon told me i have tmj. But for the... http://t.co/o3EYkY0v'
222952902262669312,2012-07-11 07:18:08,"b'Open Question: Is it possible to get a tan at 8 a.m.?: I heard the hottest time of the day is from 10-3, but if ... http://t.co/kDEIAmtj'"
222931947339526144,2012-07-11 05:54:52,b'How I got Bill Gates to give away his billions \xe2\x80\x93 http://t.co/Kt0Swdar: http://t.co/Kt0Swdar How I got Bill Gates t... http://t.co/LwkTKcwW'
222917591465861122,2012-07-11 04:57:50,b'setting and retrieving session using pl/sql: How to set and retrieve session using pl/sql?Can anyone help me? http://t.co/FbZX1mi6'
222917591365201922,2012-07-11 04:57:50,b'Open Question: Which Invisalign provider should I choose?: I had 2 consultations. The first was a dentist with t... http://t.co/TKkQiUyB'
222911324412313602,2012-07-11 04:32:55,b'Android Fans Rejoice: Jelly Bean Rollout Is Underway:  http://t.co/idLe42bZ'
222901570642259969,2012-07-11 03:54:10,"b'Bloke on ""Blank screen after changing settings"": I did a manual install and followed the instructions. Yes I kno... http://t.co/E48pwtkU'"
222873327323201537,2012-07-11 02:01:56,b'Open Question: teens: how do you dress?: do you dress gangster or what? http://t.co/wp61wxw7'
222871394378186752,2012-07-11 01:54:15,"b'New Mom Battling Cancer Tells Her Story in YouTube Series: Joanna Montgomery gave birth to her first child, a he... http://t.co/d2VJ62Zq'"
222868347421868033,2012-07-11 01:42:09,b'Quitting smoking packs on more pounds than thought: By MyHealthNewsDaily staffQuitting smoking may be associated... http://t.co/lTJOZgNG'
222854042286698497,2012-07-11 00:45:18,"b""Open Question: How can I swallow properly with a tongue thrust appliance in my mouth?: I don't know how to expla... http://t.co/mO0rDfR2"""
222849381999710208,2012-07-11 00:26:47,"b'Open Question: Name me some sad books?: Books heartachingly, heartbreakingly sad. http://t.co/MCEdA0k9'"
222845926794993664,2012-07-11 00:13:03,b'jQuery not executing when multiple json values are passed: How do I pass multiple returned mysql rows through js... http://t.co/J3yjjGck'
222843642388295680,2012-07-11 00:03:59,"b'Yes, pills can prevent AIDS, review finds: Drugs used to control the AIDS virus can also be used to protect unin... http://t.co/v60FxCW3'"
222836889944735744,2012-07-10 23:37:09,b'Is it possible to create a Clone database with the same name of source db ?: Is it possible to create a Clone da... http://t.co/QtsnCuza'
222819180997644288,2012-07-10 22:26:47,"b'Pets boost infant immunity to infections \xe2\x80\x93 http://t.co/Qc0zJpQD: The Nation, Pakistan Pets boost infant immunity ... http://t.co/AyIPxR1A'"
222811682517422080,2012-07-10 21:56:59,"b'greenfairygames on ""Change *part* of header image"": Hi there, not sure if this is the right subject to post unde... http://t.co/HIbVn50O'"
222803728154099713,2012-07-10 21:25:22,b'SQL \xe2\x80\x93 How to sort and filter a course number using a parameter: Hello I am using Oracle 11gR2 SQL in a TOAD Edit... http://t.co/A3HOdXHe'
222797658237042689,2012-07-10 21:01:15,b'\xe2\x80\x98White Collar\xe2\x80\x99 Cranks Up the Heat With Interactive Social TV Game: When White Collar returns to the airwaves lat... http://t.co/tyaMfEeM'
222788432978644992,2012-07-10 20:24:36,"b'Open Question: My bracket is loose, what do I do?!?: Okay so I just looked in the mirror and noticed one of my b... http://t.co/t3N0l8fP'"
222775701751865346,2012-07-10 19:34:00,"b'Open Question: Why does my car make loud rattles?: It sounds like it clicks very quickly every time I start it, ... http://t.co/t7wtgLnH'"
222772539959672832,2012-07-10 19:21:27,b'does not not_null ever make sense?: I have inherited some code in which the previous coder wrote this: if (!not_... http://t.co/F5FP2tLJ'
222758005626773504,2012-07-10 18:23:41,b'Want to Buy a Jet? RIM Is Selling This One:  http://t.co/q5vGdDrT'
222748390793027584,2012-07-10 17:45:29,"b'Error while deploying ADF application to a standalone weblogic server: I am using Jdeveloper 11.1.1.6.0, and I a... http://t.co/wlXkKkwV'"
222746944664109056,2012-07-10 17:39:44,b'Sugar substitutes might help you stay healthy if you pay attention to what you \xe2\x80\xa6 \xe2\x80\x93 CBS News: ABC News Sugar subs... http://t.co/qhArNiy1'
222732531609513984,2012-07-10 16:42:28,b'Any difference when specifying the access modifier this way?: I see a lot of people specify them like this. prot... http://t.co/yNdd6eMz'
222727637720760321,2012-07-10 16:23:01,"b'Open Question: Strange traffic coming from localhost?: Hello everyone, I have a new site mainly running WordPres... http://t.co/kc14A4Ac'"
222725952482979841,2012-07-10 16:16:19,b'Google to Pay Record $22.5 Million to Settle Privacy Charges [REPORT]:  http://t.co/blR4RUKy'
222724603565457409,2012-07-10 16:10:58,b'Open Question: Will TMJ( Temporomandibular joint ) go away if i follow my doctor\xe2\x80\x99s instruction?: I had TMJ( Temp... http://t.co/s6U6I1l2'
222700656119648257,2012-07-10 14:35:48,b'Open Question: Do you think dentistry is a good fit for me?: Ok so I like biology and chemistry and like hands-o... http://t.co/nncAW9lQ'
222695853759004672,2012-07-10 14:16:43,b'Open Question: Target called me for an interview and said something about going to a red phone before the interv... http://t.co/4D6vLygH'
222694286515372032,2012-07-10 14:10:30,b'Google\xe2\x80\x99s Schmidt Predicts End of China\xe2\x80\x99s Internet Firewall: In a recent interview Google Chairman Eric Schmidt r... http://t.co/kVE7FnAT'
222692180391763968,2012-07-10 14:02:07,"b""mySql-java simple search console application: I'm trying to do a search program: front end - java and back end -... http://t.co/5Jm7dO0s"""
222684604602122241,2012-07-10 13:32:01,"b'Call duration from click on phone number: I my website I have a phone number, that I want that when the visitor ... http://t.co/XaFIPIZE'"
222682497102778368,2012-07-10 13:23:39,b'NHS report row minister faces AMs: The health minister is to make an urgent statement after calls for her resign... http://t.co/6t8Zrq2r'
222649867640651776,2012-07-10 11:13:59,b'Open Question: Should you floss before or after you brush your teeth?: http://t.co/t7SrPEi6... http://t.co/pmCeh57s'
222643852555714560,2012-07-10 10:50:05,"b'How to know if current program is runnin in ssl mode or not: Hello, I \xc2\xb4m new here. ... http://t.co/YAp2kFKi'"
222642294153682945,2012-07-10 10:43:54,b'Breastfeeding Fights Obesity: Breastfeeding may help women keep their weight in check and make them less likely ... http://t.co/y0lvFIdU'
222639632431595520,2012-07-10 10:33:19,b'Open Question: When will I receive my money if it was deposited on Friday and it says it takes two business days... http://t.co/euqId5Vt'
222629640785768448,2012-07-10 09:53:37,b'Why Online Success is Crucial to Paralympics 2012:  http://t.co/mLHIivSc'
222621696438439936,2012-07-10 09:22:03,"b""Unable to access certain properties of the ZF2 request object: I'm testing ZF2 beta4 at the moment, and I'm havi... http://t.co/6JbxJTYV"""
222595954010894336,2012-07-10 07:39:45,"b'Oracle Crash before uncommitted transaction: Hello All, ... http://t.co/4ALqZL4J'"
222594283843223552,2012-07-10 07:33:07,b'Stabilizer cuts need to refrigerate drugs \xe2\x80\x93 http://t.co/Qc0zJpQD: GPB Stabilizer cuts need to refrige... http://t.co/OqXHfAnL'
222589872295251968,2012-07-10 07:15:35,"b'jintara on ""lost custom theme functionality with 3.4.1 update"": updated today to 3.4.1 problem: if we use our cu... http://t.co/qymW427S'"
222585387057549312,2012-07-10 06:57:46,"b""Pre Dental UOP- what are my chances?: I'm going to apply to few dental schools but I've always wanted to go Univ... http://t.co/zMSehVVd"""
222575642204585984,2012-07-10 06:19:03,"b'Open Question: What would you get from Sephora, MAC, or the drugstore[USA]?: Tell me what you would REALLY want/... http://t.co/4dfgojSZ'"
222565870818439169,2012-07-10 05:40:13,b'All-You-Can-Read Magazine Subscription App Launches on iPad:  http://t.co/5EXbxzkT'
222563987726925824,2012-07-10 05:32:44,b'Homogenous Distrubuted Database.: what is the best practise to insert the records in Homogenous distrubuted Envi... http://t.co/A0mvhzlD'
222551842972905472,2012-07-10 04:44:28,b'Open Question: How to get nat type 2 on ps3 with a android hotspot?: http://t.co/ziNzDPzO... http://t.co/R9057jJQ'
222547902709506050,2012-07-10 04:28:49,"b'Perl Module DBI::Oracle Installation is failing: Hi, ... http://t.co/ozIVbDZr'"
222546505733652480,2012-07-10 04:23:16,b'Group holds NYC rally protesting proposed crackdown on super-sized drinks \xe2\x80\x93 Washington Post: USA TODAY Group hol... http://t.co/G0as9q4l'
222538045465964544,2012-07-10 03:49:39,"b'Open Question: Price of braces in South Africa\xe2\x80\xa6.?: Hi, I wanted to know if the price of braces is cheaper in Sou... http://t.co/SisOtPdI'"
222534156981248001,2012-07-10 03:34:12,b'Get Paid for Sharing? The Fancy Launches Affiliate Program: The Fancy will essentially start paying people to us... http://t.co/Jj14vvxJ'
222516500169375745,2012-07-10 02:24:02,b'Session state and binding variables: Hi ... http://t.co/Q8gWUiZJ'
222510580030898176,2012-07-10 02:00:30,b'pleaze help me learn php im trying to figure out how to build string: hey so im stuck on this hard problem like ... http://t.co/MdfPLgOL'
222494401795063809,2012-07-10 00:56:13,b'Apple Removes Green Certification From All Products:  http://t.co/iszYrYu0'
222488796804038657,2012-07-10 00:33:57,"b'Open Question: My manager has called me four or more times on my day off?: So I just worked three days in a row,... http://t.co/khZUO2ZE'"
222483041698848768,2012-07-10 00:11:05,b'Less time sitting \xe2\x80\x98extends life\xe2\x80\x99: Limiting the time we spend sitting to just three hours a day could add an extr... http://t.co/eIGsVKz0'
222482614290890754,2012-07-10 00:09:23,b'Open Question: What is the best treatment for a chipped off tooth during a playground accident?: So about 5 year... http://t.co/56gWJNHq'
222451328792801284,2012-07-09 22:05:04,"b'New Devices Improve Diabetes Control: By combining insulin pumps with continuous blood sugar sensors, people wit... http://t.co/X6wcHr9G'"
222445008131862528,2012-07-09 21:39:57,b'Prioritizing OLTP application using Resource Manager: Version: 11.2.0.3 ... http://t.co/XZtqqoJq'
222443504763277315,2012-07-09 21:33:58,b'Cranberries Combat Urinary Tract Infections: Cranberries -- long been touted as a folk remedy to combat urinary ... http://t.co/5Rj9fRMe'
222441564604076033,2012-07-09 21:26:16,"b'Open Question: What is the value of a 2007 ford ranger?: Basic model, 2 wheel drive with a regular cab. http://t.co/80FfpDkO'"
222439565787541504,2012-07-09 21:18:19,b'Combine several SQL querys to one: I know this is probably really simple but I have tried to find some similar e... http://t.co/nPMgvg7l'
222439254528237568,2012-07-09 21:17:05,"b'AT&amp;T Expands 4G LTE to 7 New Markets: AT&amp;T has turned on its 4G LTE network in an additional seven locations, br... http://t.co/Mw8j3Ijh'"
222411651847159808,2012-07-09 19:27:24,b'Intact Foreskin Ups UTI Risk in Very Young Boys \xe2\x80\x93 MedPage Today: MedPage Today Intact Foreskin Ups UTI Risk in V... http://t.co/wBfMXf4j'
222411275899109377,2012-07-09 19:25:55,"b""Open Question: Is 17 to old for braces?.?: Well I am getting braces.. I didn't wanna at first but my Parents say... http://t.co/IDpw8dgC"""
222409985227894785,2012-07-09 19:20:47,b'Open Question: What would you do if you only had 11k and could not find a job?: Mother to a 12 yr old boy. http://t.co/K5y5QOSK'
222407630386241536,2012-07-09 19:11:25,"b""DNSChanger Deadline; Google Promotes Marriage Equality; Facebook Kills http://t.co/Erb0XLka: Didn't have time to ... http://t.co/fAtJt0ZZ"""
222397089496305664,2012-07-09 18:29:32,"b'Interval partitioning: Hello,... http://t.co/9ptHW7id'"
222387252372844544,2012-07-09 17:50:27,"b'Open Question: Questions about braces, getting them tommorow!!?: Basically, Im getting braces tommorow, and ive ... http://t.co/MP7p74dh'"
222384167646789632,2012-07-09 17:38:11,"b'Flash Builder 4, PHP Service, not working ""Channel disconnected"": I\'m not really understanding what the issue is... http://t.co/oeEqzAwV'"
222383789144412161,2012-07-09 17:36:41,b'Microsoft\xe2\x80\x99s Windows 8 Coming in Late October: Microsoft confirmed today that Windows 8 will be released to manuf... http://t.co/ZHz587vZ'
222371611536392192,2012-07-09 16:48:18,"b'Uncircumcised Boys at Higher Risk for Infection: Study: MONDAY, July 9 (HealthDay News) \xe2\x80\x94 Uncircumcised boys are... http://t.co/uC1S5Xjn'"
222365102756724736,2012-07-09 16:22:26,b'how to read image file in bpel..: i want to pick up image files of format .jpg &amp; .png in bpel.. http://t.co/iy7NLCmC'
222355210650124289,2012-07-09 15:43:08,b'Open Question: can anyone tell what can be the options for a person who is getting all their teeth extracted?: M... http://t.co/fcXIemVC'
222347687763251201,2012-07-09 15:13:14,b'Advocates Hail New UN-Commissioned Report as Crucial Step Forward in Fight \xe2\x80\xa6 \xe2\x80\x93 Sacramento Bee: San Francisco Chr... http://t.co/Dzox9Xju'
222337831421493249,2012-07-09 14:34:04,"b'Open Question: How to open an eBay case after 45 days, or an alternative..?: I have not recieved an item from a ... http://t.co/yEd1213I'"
222336138768166912,2012-07-09 14:27:20,"b""Display data from database without refreshing (Javascript): I'm trying to get the following code to work that is... http://t.co/TPYp5i2p"""
222311634360733697,2012-07-09 12:49:58,b'Hands On: HP Compaq Elite 8300 All-in-One Desktop: HP aims to deliver big power in tight spaces with its newest ... http://t.co/SUwIBZ5h'
222299425496776704,2012-07-09 12:01:27,b'Open Question: I have a question about Invisalign teen?: I have a question about Invisalign. I have some what cr... http://t.co/igNCvxuH'
222293468398100480,2012-07-09 11:37:47,"b'clusterware installtion 10.2.0.1: Dar All, ... http://t.co/pjugMpx5'"
222275592190558208,2012-07-09 10:26:45,"b""\xe2\x80\x98Tourists\xe2\x80\x99 visit sights catering to pill trade \xe2\x80\x93 Columbus Dispatch: http://t.co/3VUwxU47 'Tourists' visit sights ... http://t.co/MeQpGcPP"""
222273813121998849,2012-07-09 10:19:41,b'Open Question: where to buy a rack and pinion?: hey i live in Queensland-Australia and i have no idea where to b... http://t.co/i5w6Hh4U'
222271588148588544,2012-07-09 10:10:50,"b""Apps Rush: Jesus Christ Superstar, Hooters Calendar Girls Live, Word Lens, SoulCraft, Blottr and more: What's ne... http://t.co/7sVUuVPb"""
222264535912955904,2012-07-09 09:42:49,"b'newbieshwa on ""wp e-commerce excluding categories from [showcategories]"": Did you ever find a fix my friend? http://t.co/o8RATWLP'"
222235656280219649,2012-07-09 07:48:04,"b'Open Question: Whats the best option for my gappy teeth?: So growing up, my dentist never suggested braces for m... http://t.co/DtXs893W'"
222229718903169024,2012-07-09 07:24:28,b'PL/SQL problem with variable: I try to write simple script to check something on remote database. Now I have: ... http://t.co/jcEVQgz5'
222223705558892544,2012-07-09 07:00:34,b'European Shares to Open Up Ahead of Brussels Meeting: http://t.co/i96kq7Qy http://t.co/gaiV2Kyn'
222212767183147008,2012-07-09 06:17:06,b'(Almost) everything you need to know about the Higgs Boson \xe2\x80\x93 Indiana Daily Student: Daily Mail (Almost) everythi... http://t.co/2HI3T6uI'
222203012913967104,2012-07-09 05:38:21,b'Open Question: what do you do to relax?: http://t.co/BjuZZP7S http://t.co/bjAJGKVk'
222190273902546945,2012-07-09 04:47:44,"b'Index is not used\xe2\x80\xa6: Hi, I have a DB with 20 M records. http://t.co/5adJ3Qjo'"
222185741101449219,2012-07-09 04:29:43,"b""PHP coding =&gt; General \xe2\x80\xa2 How to prevent the adding of views in forum: I have a project and it's a forum. My probl... http://t.co/vIpR0FNl"""
222172931730583552,2012-07-09 03:38:49,"b'Open Question: Do i have bad teeth/gums, How bad is my gum disease?: I have gum disease(Gingivitis) for almost 8... http://t.co/HqAslHaF'"
222171607672700930,2012-07-09 03:33:33,b'Open Question: Why is a package taking so long to arrive when i ordered it from a place 3 hours away?: I ordered... http://t.co/fkUzjTQ8'
222156827478069248,2012-07-09 02:34:49,"b'Parasite tied to self-harm, suicide attempts: study \xe2\x80\x93 Reuters: AsiaOne Parasite tied to self-harm, suicide attem... http://t.co/V2RQcMo1'"
222155093343088642,2012-07-09 02:27:56,"b""Open Question: Should I try out for this modeling gig on american Apparel?: I've never had any modeling experien... http://t.co/pKft5XwV"""
222153695066988545,2012-07-09 02:22:22,"b'yakuza_azl on ""Audio Upload Plugin"": I am looking for a theme/plugin that has an audio uploading feature for the... http://t.co/eYBTa8IP'"
222152654300786688,2012-07-09 02:18:14,b'Bank Accounts Figure in Drug Probe: The FBI alleges that a Mexican cocaine-trafficking cartel used accounts at B... http://t.co/owH5HCgs'
222126526026625025,2012-07-09 00:34:25,b'Oracle Post Installation Semaphore Parameters: SYS INFO: Oracle 11g R2 SUSE Linux 11. ... http://t.co/r6zSS7Cn'
222121097473179649,2012-07-09 00:12:51,"b""NBC, Google Running \xe2\x80\x98War Games\xe2\x80\x99 to Prep Olympics Streaming: The companies are hoping that they've worked out all... http://t.co/3lz7mD7t"""
222101524061503488,2012-07-08 22:55:04,b'Open Question: Stories of dentist gas?: what happened (if you remember) the first time you were gassed at the de... http://t.co/eW0ziINd'
222093908744740864,2012-07-08 22:24:48,b'Beyond the Higgs Boson: The Large Hadron Collider can make the future critical \xe2\x80\xa6 \xe2\x80\x93 Economic Times: Sydney Mornin... http://t.co/fWJvrOPB'
222089688297635840,2012-07-08 22:08:02,b'Andy Murray\xe2\x80\x99s Teary Wimbledon Speech Is Why We Love Sports [VIDEO]: Scotsman Andy Murray lost a thrilling Wimble... http://t.co/zQMIG0zO'
222084197467168768,2012-07-08 21:46:13,b'Open Question: howto shrink s bikini bottom?: 88%nylon 12%spandex http://t.co/m3DZ5fyR'
222083102481199106,2012-07-08 21:41:52,"b'waterlilly2022 on ""Trying to widen sidebar"": My website is http://t.co/q4e0hOk3 I\'m trying to widen m... http://t.co/piFpy2GI'"
222051859400110082,2012-07-08 19:37:43,"b""block all directorys but one file?: i'm using Apache and i have the following folders in the root folder /images... http://t.co/OCUKbEpa"""
222048180756414464,2012-07-08 19:23:06,b'Java alternatives with toString conversion from StringBuilder: Hi I have this piece of code where it will conver... http://t.co/z4bnnNGH'
222046939569598465,2012-07-08 19:18:10,"b'Synthetic Protein EP67 Boosts Immune System To Fight Off Flu \xe2\x80\x93 Medical News Today: The Nation, Pakistan Syntheti... http://t.co/KB0EiFwH'"
222046756194627584,2012-07-08 19:17:26,"b'Any way to make sure programs DON\xe2\x80\x99T see my step 2 score?: I just took it yesterday, and I know for a fact it did... http://t.co/os4Xw43Z'"
222042662843330561,2012-07-08 19:01:10,"b""Google Launching \xe2\x80\x98Legalize Love\xe2\x80\x99 Campaign to Promote Marriage Equality: Google's going to work to gain new groun... http://t.co/nxdumZxp"""
222036958896062464,2012-07-08 18:38:30,b'Open Question: can i fit a chatter valve to a ford fiesta zetec s tdci?: http://t.co/1KaAClX6... http://t.co/onQBB85R'
222022799286468608,2012-07-08 17:42:14,b'Open Question: If i dream my teeth fall out?: http://t.co/rbbjWoNN http://t.co/JP8U94AA'
222016322047971329,2012-07-08 17:16:30,"b'installing Oracle BPM on existing weblogic server: Hello Friends, ... http://t.co/1byym7KV'"
221999094753787904,2012-07-08 16:08:03,"b'Open Question: Does whitening toothpastes work?: I had pearly white teeth when I had baby teeth lol, but when my... http://t.co/oN0GESHJ'"
221996733339664386,2012-07-08 15:58:40,"b'Open Question: question about updating video drivers PLZ ANSWER!!! 10 points!?: okay, so i just brought a new vi... http://t.co/vxznCayo'"
221996112955973632,2012-07-08 15:56:12,"b'keesiemeijer on ""Norwegian Language for WP"": Download the Norwegian Wordpress and use the language files in: /wp... http://t.co/BKoXOa7c'"
221992598955491328,2012-07-08 15:42:14,"b""Sending variables using sockets: I've started work on a simple newtworking project which creates a new thread fo... http://t.co/MziJWFoc"""
221975556047110144,2012-07-08 14:34:31,b'Genetic attack on cancer shows promise \xe2\x80\x93 Columbus Dispatch: Columbus Dispatch Genetic attack on cancer shows pro... http://t.co/5P0KlHjl'
221967547736670208,2012-07-08 14:02:41,b'Open Question: My bottom central incisor dropping? D: pls help more (detail inside)?: i am 14 and i felt my cent... http://t.co/6JIGpUAs'
221965645837901825,2012-07-08 13:55:08,b'Libyans Hail Vote as Start of \xe2\x80\x98Freedom Era\xe2\x80\x99: http://t.co/D6yjGPh3 http://t.co/1ggSiUyO'
221940941005664258,2012-07-08 12:16:58,"b""mysql auto-increment \xe2\x80\x93 reassign after a record has been deleted: I'm using auto-increment to assign a id to ever... http://t.co/h2G9iZXS"""
221937237095481344,2012-07-08 12:02:15,"b'Unable to start http://127.0.0.1/apex: Hi all, ... http://t.co/1GDJiDxa'"
221935885560717312,2012-07-08 11:56:53,b'Georgia health care in limbo \xe2\x80\x93 Atlanta Journal Constitution: TPM Georgia health care in limbo Atlanta Journal Co... http://t.co/m58TgPbn'
221933995091427328,2012-07-08 11:49:22,b'The Most Intense Dreadlock You\xe2\x80\x99ll Ever See: http://t.co/Qh9qfrJ9 http://t.co/ekq9xJa9'
221933502239735809,2012-07-08 11:47:24,b'Open Question: Book; 50 Shades of Grey?: Has anyone read this book?? Comments? http://t.co/NMPkHfTr'
221918211791261696,2012-07-08 10:46:39,b'Open Question: how long does taking teeth xrays take?: i think i will have to take xrays for my teeth cuzz i acc... http://t.co/A8Nw8p24'
221917434645463040,2012-07-08 10:43:34,b'Working with files and folders using ZIP: We have some html code like: Some text And a variable $contents . Its ... http://t.co/pMaeJjaN'
221901691207942144,2012-07-08 09:41:00,b'A Shocking Fact About South Park\xe2\x80\x99s Kyle!: http://t.co/sW43oX24 http://t.co/XpvXXxnY'
221901201699127296,2012-07-08 09:39:03,"b""Open Question: Which motherbord is good for gaming?: hi friends, I'm a lite gamer and planning to change my moth... http://t.co/l99OnM8d"""
221876681680490496,2012-07-08 08:01:37,"b'imath on ""[Plugin: BP Checkins] Undefined index"": Hello KardiWeb, What do you mean by gravatar support ? http://t.co/W24KCZkW'"
221873066492440576,2012-07-08 07:47:15,"b""insert is very slow.: Dear DBA's ... http://t.co/Mz5Ogzu1"""
221869460166938624,2012-07-08 07:32:56,b'Technology and Child/Educational Psychology: I am hoping someone out there will be able to point me in the right... http://t.co/w2dYZPqz'
221863274646487040,2012-07-08 07:08:21,b'Officials warn of West Nile \xe2\x80\x93 Hattiesburg American: New York Daily News Officials warn of West Nile Hattiesburg ... http://t.co/5iLQwy5W'
221860384787800064,2012-07-08 06:56:52,b'Open Question: What type of metal is required for bbq grates used for business?: Almost 40 years ago my grandfat... http://t.co/dTSqe7eG'
221838984056287232,2012-07-08 05:31:50,b'US study finds mismatch between kids and vitamins \xe2\x80\x93 GMA News: PR Web US study finds mismatch between kids and vi... http://t.co/ZGRplt58'
221837079276032001,2012-07-08 05:24:15,b'Apple Withdraws Its Products From EPEAT\xe2\x80\x99s Green Certification Registry: The U.S. government backed Electronic Pr... http://t.co/DRXciTSJ'
