id,created_at,text37071872726138880,2011-02-14 08:53:17,b'Drug Rehab Utah| Alcohol Rehab Utah| Addiction Recovery Utah | Intervention | Journey Centers from Youtube http://bit.ly/g2MK1t'
37071821262032896,2011-02-14 08:53:05,b'What Is Bipolar disorder (Manic depression)? http://bit.ly/fpfPUz'
37071620426170368,2011-02-14 08:52:17,b'Just Wondering \nI need to know Can you become licensed to broker stocks/mutual funds independently? http://bit.ly/gAgiDN'
37071348631080960,2011-02-14 08:51:12,b'How do I stop snoring? http://bit.ly/envMdT'
37070988302622720,2011-02-14 08:49:47,b'Do you think i will get approved for SSI for bipolar psychosis? http://bit.ly/dKxOlG'
37069892649750530,2011-02-14 08:45:25,b'What is the definition of Assault under federal law and what is the penalty? http://bit.ly/fh7eEr'
37069660172062720,2011-02-14 08:44:30,b'How do they test you for bipolar disorder? http://bit.ly/h5en47'
37069196328173568,2011-02-14 08:42:39,b'whats the best lasik eye center to go to in spokane wa? http://bit.ly/dKijcU'
37067927232450561,2011-02-14 08:37:37,b'Anyone know how to convert a natural gas grill to propane? http://bit.ly/dFhLTH'
37065580733272064,2011-02-14 08:28:17,b'I need to know What are the long terms side effects of laser eye surgery? http://bit.ly/gQRt1s'
37064928602882048,2011-02-14 08:25:42,b'Is there such thing as a \xe2\x80\x9cWeekend Pass\xe2\x80\x9d for a Drug Treatment Center? http://bit.ly/em6K1n'
37064011287633920,2011-02-14 08:22:03,b'What do university committees look for when considering candidates for master\xe2\x80\x99s degree programs in psychology? http://bit.ly/ihhPYO'
37063249660739584,2011-02-14 08:19:01,b'I have my bachelors in Interior Design. What about my Masters? http://bit.ly/fF8A7v'
37061056316575744,2011-02-14 08:10:19,b'Are there different types of Bipolar? http://bit.ly/etiBfo'
37058174670340097,2011-02-14 07:58:52,b'Question about ultrasound technicians? http://bit.ly/h5f4zY'
37056688515186688,2011-02-14 07:52:57,"b'Alcohol, drug abuse and depression? http://bit.ly/hvNkia'"
37056544126279680,2011-02-14 07:52:23,b'Just Wondering \nWhat resources are available for spouses of people with bipolar disorder? http://bit.ly/gNa57M'
37055778128928768,2011-02-14 07:49:20,b'Any one have a child with bipolar disorder? http://bit.ly/eBi0Sg'
37054998726574080,2011-02-14 07:46:14,b'do eating sweets cause a sickle cell crisis? http://bit.ly/glv3hm'
37054595251306496,2011-02-14 07:44:38,b'i want to be a defense lawyer with my own firm. how much money would i make? http://bit.ly/eZQ5yB'
37054484324552704,2011-02-14 07:44:12,b'Chances of Prostate Cancer if Dad has Stage III at 58 years of age? http://bit.ly/gd55NB'
37054361410478080,2011-02-14 07:43:42,b'Does Bipolar disorder qualify as a mental illness for disability claims? http://bit.ly/hEFUag'
37053394094923776,2011-02-14 07:39:52,"b'Bipolar Disorder: Management of Bipolar Disorder in Adults, Children and Adolescents in Primary and Secondary Ca... http://bit.ly/e3xU12'"
37053388990451712,2011-02-14 07:39:51,b'Just Wondering \nwhat are some good gas and electricity company in los angeles? http://bit.ly/gKs308'
37050626261123072,2011-02-14 07:28:52,b'How much does Lasik eye surgery cost? http://bit.ly/gURjQn'
37047832720449536,2011-02-14 07:17:46,b'are there any free drug rehab facilities anywhere? http://bit.ly/fOpeZ8'
37046378756579328,2011-02-14 07:11:59,b'Just Wondering \nList of Bioinformatics journals? http://bit.ly/g9HMvE'
37045932218384384,2011-02-14 07:10:13,b'How do i remove bags under my eyes? http://bit.ly/h4c8C1'
37044277317992448,2011-02-14 07:03:38,b'IDENTITY THEFT PREVENTION (1of2): info from the Credit Secrets Bible http://bit.ly/gYEHuB'
37043248174202880,2011-02-14 06:59:33,b'schools in NYC for diagnostic medical sonographer? http://bit.ly/gXI9hg'
37043079001149440,2011-02-14 06:58:52,b'Can a child that is shaken develop Bipolar disorder? http://bit.ly/eBpPCi'
37042203381473281,2011-02-14 06:55:24,b'Post-Op Lasik eye surgery info? http://bit.ly/fl7ys8'
37041848887279616,2011-02-14 06:53:59,b'Can\xe2\x80\x99t work because of severe sleep apnea\xe2\x80\xa6? http://bit.ly/h3HJm4'
37041745552211968,2011-02-14 06:53:34,b'Mind Race: A Firsthand Account of One Teenager\xe2\x80\x99s Experience with Bipolar Disorder (Adolescent Mental Health Initiative) http://bit.ly/hnUzbV'
37039057699610624,2011-02-14 06:42:54,b'How can I merge two Word documents (each one page) into one (two page document)? http://bit.ly/eEfcVs'
37038708272144384,2011-02-14 06:41:30,b'Online nursing courses? http://bit.ly/fUQPl0'
37036170923737089,2011-02-14 06:31:25,"b'I need to know With gas prices going up, how come no one has considerd\xe2\x80\xa6? http://bit.ly/gLi3CJ'"
37034911546220544,2011-02-14 06:26:25,b'Does anyone know where to get cheap colored contact lenses on line? http://bit.ly/gdUoGl'
37034857607462912,2011-02-14 06:26:12,b'Please answer this about the BRAIN\xe2\x80\x99s RESPIRATORY center? http://bit.ly/fu51eL'
37031716988125184,2011-02-14 06:13:44,b'Can somebody buy the futures of a\xe2\x80\xa6\xe2\x80\xa6? http://bit.ly/h4Nn2E'
37031038064533504,2011-02-14 06:11:02,b'Can I have laser eye surgery with a severe astigmatism? ? http://bit.ly/fjQm0R'
37030601961766912,2011-02-14 06:09:18,b'I don\xe2\x80\x99t see a melt peak? http://bit.ly/ebU9cr'
37030243780792320,2011-02-14 06:07:52,b'British gas left me with no electic for 3 days !? http://bit.ly/fSgMhC'
37030182648807427,2011-02-14 06:07:38,b'At what age can the Correctional Laser surgery for they eye be done? http://bit.ly/gcixmY'
37029348825370624,2011-02-14 06:04:19,"b'When you wear contact lens, how do you keep it really comfortable? http://bit.ly/ghiMNf'"
37025443710238721,2011-02-14 05:48:48,b'I need to know Is human genetic engineering illegal? Should I sacrifice my anonymity to report this? http://bit.ly/fjNuPp'
37024807337857025,2011-02-14 05:46:16,"b'Among females who are bipolar disorder type 1, is there a relationship between depression and menstruating? http://bit.ly/f4bwUg'"
37024726345846784,2011-02-14 05:45:57,b'I need to know How can you tell which Online Masters degree programs at online schools are the best? http://bit.ly/fmqlfo'
37023986109906944,2011-02-14 05:43:00,b'A Pap test is used for early detection of? http://bit.ly/eGR3Ve'
37023927876190208,2011-02-14 05:42:46,b'Do any schools have online doctorate or phd programs? http://bit.ly/fETq1t'
37023823727427584,2011-02-14 05:42:22,b'Buy Snorepin \xe2\x80\x93 The Smarter Solution Against Snoring and Sleep Apnea (Advanced Design Save Your Lungs) Best Price http://bit.ly/eBh2cL'
37023226525646848,2011-02-14 05:39:59,b'Has anyone been to Chelsea Eye Sugery in New York City for Lasik Surgery? Any feedback would be great!!!? http://bit.ly/fk0GzL'
37022635158142976,2011-02-14 05:37:38,b'Do I have Insomnia or Sleep Apnea? http://bit.ly/et1JmH'
37019984089579520,2011-02-14 05:27:06,b'Who here has had Laser Eye Surgery done in Canada? http://bit.ly/g2l9Z4'
37019892154630144,2011-02-14 05:26:44,b'Is this text grammatically correct and understandable? http://bit.ly/fOhDTv'
37019183510200320,2011-02-14 05:23:55,b'What are the organizations or institutions in Bishop that offer help on drug abuse? http://bit.ly/gKUAUR'
37019032737554432,2011-02-14 05:23:19,"b'Lasik surgury\xe2\x80\xa6I am looking at custom lasik from TLC for $4,200? http://bit.ly/eRo3Zm'"
37018779598716928,2011-02-14 05:22:19,b'What are the penalties if convicted of Misdemeanor (Grand Theft-Stolen Car) for a 15 year old.? http://bit.ly/gNmina'
37018720001855488,2011-02-14 05:22:05,b'Briggs & Stratton 85310 2-Compartment 1-1/2 Gallon Gas and 2-1/2 Quart Oil Fuel Can http://bit.ly/dYYsDy'
37018631573340160,2011-02-14 05:21:44,b'How to cope with ADD & Bipolar Disorder? http://bit.ly/hesu0O'
37018166483755008,2011-02-14 05:19:53,b'can i take a bachelors degree in nursing as a major for veterinary medicine? http://bit.ly/gRxn1o'
37016985556492288,2011-02-14 05:15:11,b'My parents are checking me into a alcohol rehab center. What should I expect? http://bit.ly/hMKEhE'
37016561701101568,2011-02-14 05:13:30,b'how much does a lasik surgery in europe cost? http://bit.ly/gZOcwe'
37015308648583170,2011-02-14 05:08:31,b'what is the average annual salary for a criminal defense lawyer? http://bit.ly/g4JQm6'
37015253443149824,2011-02-14 05:08:18,b'Just Wondering \nHow could I stop snoring? http://bit.ly/dZVB75'
37015217648959488,2011-02-14 05:08:10,b'I need to know Is Bipolar disorder hereditary? http://bit.ly/dZt6Ka'
37014887993446400,2011-02-14 05:06:51,b'which is the best to university to study master degree courses thro distance education especialy for MBA? http://bit.ly/i05XZw'
37014588830515200,2011-02-14 05:05:40,b'\xe2\x80\x9cThe Secrets to Sleeping Soundly\xe2\x80\x9d http://bit.ly/hydeEV'
37014445351768066,2011-02-14 05:05:06,b'where to buy cool cheap contact lenses? http://bit.ly/ftO5rG'
37013862456762368,2011-02-14 05:02:47,b'Pre-Law major or Criminal Justice major? Which do i choose if i plan on being a lawyer? http://bit.ly/eOteeF'
37012649904443392,2011-02-14 04:57:58,b'ultrasound technician school? http://bit.ly/glEJdI'
37012643331964928,2011-02-14 04:57:56,b'Bipolar Disorder \xe2\x80\x93 Family Support http://bit.ly/g2XzcI'
37012521298690048,2011-02-14 04:57:27,b'sleep apnea? http://bit.ly/hwOhFd'
37011383782481920,2011-02-14 04:52:56,b'How and where do you buy contact lenses? http://bit.ly/hcOXET'
37011195399512064,2011-02-14 04:52:11,b'Buy Coping With The Ups and Downs With Bipolar Disorder \xe2\x80\x93 Bipolar Disorder Uncovered Best Price for Sale http://bit.ly/dZC4xf'
37010339497250818,2011-02-14 04:48:47,b'are there any online trading companies that will allow you to fund your account with a credit card? http://bit.ly/e7QJuj'
37009628747276288,2011-02-14 04:45:57,b'What causes eye floaters? Can they be removed? http://bit.ly/gbpSDp'
37007410199535617,2011-02-14 04:37:08,b'I need to know How do I tell my mother I think i\xe2\x80\x99m bipolar? http://bit.ly/i01IQO'
37006897156464641,2011-02-14 04:35:06,b'Where can I order a large hibachi grill like the ones used in a professional restaurant? http://bit.ly/h5UP1S'
37005889927905280,2011-02-14 04:31:06,b'What is the explanation for why homosexuals\xe2\x80\xa6.? http://bit.ly/fcWfav'
37001218731540480,2011-02-14 04:12:32,b'Important Decision to Make: SURGERY.? http://bit.ly/gr1Fdx'
37000074072432640,2011-02-14 04:07:59,"b'I need to know Prostate cancer screening with a finger, because? http://bit.ly/gmmz7Z'"
36998977408737280,2011-02-14 04:03:38,b'Is there anyone out there taking lithium for bipolar disorder who has also managed to lose weight? http://bit.ly/fu6Ht7'
36994103895924738,2011-02-14 03:44:16,b'Just Wondering \nDoes myopia/ astigmatism return after LASIK eye surgery? http://bit.ly/gNYr4n'
36991779685269504,2011-02-14 03:35:02,b'Buy Connecting the Pieces: The Discovery of Early-Onset Bipolar Disorder Best Price http://bit.ly/fqG4M7'
36986191236571136,2011-02-14 03:12:49,b'Is it necessary to cite things that aren\xe2\x80\x99t common sense? http://bit.ly/fz6vYR'
36984533962199041,2011-02-14 03:06:14,"b'I need to know If a person took out a loan with a finance company in which a car was used as collateral dies,who... http://bit.ly/ewhaeu'"
36984511392653312,2011-02-14 03:06:09,"b'Just Wondering \nhow would you summarize this article, because i dont get it? http://bit.ly/eDENDn'"
36983026030215168,2011-02-14 03:00:15,b'Automated systems for real-time PCR analysis http://bit.ly/fT8UHk'
36981014525906944,2011-02-14 02:52:15,b'How do I stop my snoring? http://bit.ly/dMtbgB'
36980925547941888,2011-02-14 02:51:54,b'How do wood pellet stoves compare (in efficiency and fuel price) to a electric heater or fireplace? http://bit.ly/e5B9tu'
36976570933448705,2011-02-14 02:34:36,b'What do you think of Andrew McCarthys Letter to Eric Holder? http://bit.ly/eSL5Co'
36976475861164032,2011-02-14 02:34:13,b'5 quick facts about bipolar? http://bit.ly/g7td4S'
36975999329501185,2011-02-14 02:32:19,b'Just Wondering \nWhere does PA stand on Marijuana? http://bit.ly/fIk8Ir'
36975855775252480,2011-02-14 02:31:45,"b'can a pregnant woman get a paternity test before she gives birth? If so, how early on? http://bit.ly/fq2DxI'"
36975468016050176,2011-02-14 02:30:13,"b'When diagnosing bipolar disorder, what is the underlining factor that makes it disputable? http://bit.ly/hgOJ22'"
36975467156217856,2011-02-14 02:30:12,b'I need to know Can a mental disorder (Bipolar) blind your true feelings? http://bit.ly/i1XWXz'
36975430653181952,2011-02-14 02:30:04,b'How can I keep Bipolar Disorder from affecting my job? http://bit.ly/eHZwTp'
36974134315454464,2011-02-14 02:24:55,"b'Just Wondering \njut one paragram to explain the main idea and prbolem about this article, please!? http://bit.ly/g3Tn2B'"
36973130719174656,2011-02-14 02:20:55,b'How To Become a Diagnostic Medical Sonographer from Youtube http://bit.ly/fU9sod'
36972848908079104,2011-02-14 02:19:48,b'Is there a way to manage Bipolar Disorder without medication? http://bit.ly/eWghHQ'
36969703012311040,2011-02-14 02:07:18,b'What are some discussion questions on Bipolar Disorder? http://bit.ly/fZVllP'
36968237094674433,2011-02-14 02:01:29,b'Post Lasik Operation Questions / Concerns.? http://bit.ly/ftuXG4'
36967227689271296,2011-02-14 01:57:28,b'What CAUSES glaucoma? http://bit.ly/fSw5Cw'
36964472547442688,2011-02-14 01:46:31,b'Should private christian school teachers be allowed to paddle kids as discipline.? http://bit.ly/f8AzDO'
36962798906900480,2011-02-14 01:39:52,b'Pre-Employment Screening Problems \xe2\x80\x93 Background Check? http://bit.ly/fLEEgY'
36961370482155520,2011-02-14 01:34:12,b'Just Wondering \nwhy are homes in the USA \xe2\x80\x93 such as Florida \xe2\x80\x93 so cheap? http://bit.ly/eAo030'
36957990384828416,2011-02-14 01:20:46,"b'Just Wondering \nDo Drug, alcohol treatment center falsely diagnose people as needing treatment solely for profit? http://bit.ly/hHfwQz'"
36957742291746817,2011-02-14 01:19:47,b'Just Wondering \nWhat does it take to obtain a CCNA certification? http://bit.ly/fvKbQx'
36955613028163585,2011-02-14 01:11:19,b'Cooking costs comparison \xe2\x80\x93 coil and gas stoves.? http://bit.ly/gzf8rG'
36955032427433985,2011-02-14 01:09:00,b'sleep apnea? http://bit.ly/fykUaI'
36954492754726913,2011-02-14 01:06:52,b'can symptoms of bipolar disorder appear at age 18? http://bit.ly/f2rS7d'
36954455060516865,2011-02-14 01:06:43,b'I need to know How do you get bags under your eyes? http://bit.ly/hyMPdt'
36952053217501184,2011-02-14 00:57:10,b'What are some symptoms of sleep apnea? http://bit.ly/ga2kAb'
36950641863557120,2011-02-14 00:51:34,b'What famous people can you name with borderline personality disorder (BPD)? http://bit.ly/dJrlzT'
36942334746697728,2011-02-14 00:18:33,b'I need to know How did having a hysterectomy effect your Bipolar disorder? http://bit.ly/flb47Y'
36939894165078016,2011-02-14 00:08:51,"b'I want laser eye surgery, Do I qualify, and what are the costs? http://bit.ly/fQIqll'"
36938962941513729,2011-02-14 00:05:09,b'What felony or misdemeator would contempt of court be? http://bit.ly/f8Yike'
36938763871453184,2011-02-14 00:04:22,b'How would I hedge against a future fall in electricity prices? http://bit.ly/hXwRjT'
36938588033650688,2011-02-14 00:03:40,"b'Sleep Apnea\xe2\x80\xa6 how soon can I expect to feel better, and just what will \xe2\x80\x98feel better\xe2\x80\x99 feel like? http://bit.ly/gfgJU5'"
36938541481066496,2011-02-14 00:03:29,"b'Just Wondering \nWhich form of plasmids ,linear, supercoiled or circular is used as a cloning vector after RE digestion? http://bit.ly/euJH27'"
36938328167157760,2011-02-14 00:02:38,b'What are some legit online graduate degrees accept people with 2.5 gpa? http://bit.ly/fpPczh'
36937044139712512,2011-02-13 23:57:32,b'Just Wondering \nHow do I tell my mother I think i\xe2\x80\x99m bipolar? http://bit.ly/fi6YNc'
36936792661819392,2011-02-13 23:56:32,b'I need to know is custom lasik working for you? http://bit.ly/gVm3Zk'
36936064711000064,2011-02-13 23:53:38,b'What is the best route to take to become a Diagnostic Medical Sonographer (Utrasound Tech)? http://bit.ly/gqtACg'
36933977671467008,2011-02-13 23:45:21,b'Could these be signs of Bipolar Disorder? http://bit.ly/gUBBdZ'
36933976794861568,2011-02-13 23:45:20,b'Am I Bipolar Disorder? http://bit.ly/fch2tC'
36933830963105792,2011-02-13 23:44:46,b'How can I eliminate my snoring? http://bit.ly/i86c4z'
36933629141581824,2011-02-13 23:43:58,b'Hemochromatosis diagnosis? http://bit.ly/hTpoz7'
36933084880306176,2011-02-13 23:41:48,b'Reasons why an artist with a college education/degree is better off than one without? http://bit.ly/hWO4G9'
36933076600754176,2011-02-13 23:41:46,b'Just Wondering \nWould a eye surgery doctor know alot about eye diseases or and eye doctor who specialize in eye ... http://bit.ly/eMtIow'
36932772954116096,2011-02-13 23:40:33,b'lasik eye surgery cost? and\xe2\x80\xa6? http://bit.ly/g0jVR1'
36932033770954752,2011-02-13 23:37:37,b'What is a good price for natural gas? http://bit.ly/es1GDI'
36930945663639552,2011-02-13 23:33:18,b'i need to know some information on child hood sleep apnea. also find a doctor that deals with it.? http://bit.ly/dEjRH9'
36930507635687424,2011-02-13 23:31:33,b'Is surgery to cure sleep apnea safe? http://bit.ly/fTDMt1'
36929369976864769,2011-02-13 23:27:02,b'Can substance abuse treatment facilities release information to authorities? http://bit.ly/iaf6zV'
36927845875847168,2011-02-13 23:20:59,b'Blurry vision after Lasik? http://bit.ly/fQvznd'
36927074115518464,2011-02-13 23:17:55,b'Laws For Felons in Texas? http://bit.ly/e8X11F'
36925674375610368,2011-02-13 23:12:21,b'Im working on an undergrad degree in Economics will it be possible to go into a business masters degree? http://bit.ly/gS2Jxd'
36925673582895104,2011-02-13 23:12:21,b'How much does a masters degree in school psychology at St. Johns University cost? http://bit.ly/gbziPi'
36925670466527234,2011-02-13 23:12:20,b'Just Wondering \nDo 3 domestic violence offenses become a Felony on the 3rd offense in the state of Ohio? http://bit.ly/hC2HXF'
36925065123594240,2011-02-13 23:09:56,b'Aren\xe2\x80\x99t there any other meds other than lithium that can treat bipolar disorder? http://bit.ly/fZHoMh'
36923971010043904,2011-02-13 23:05:35,b'The best Lasik surgeon or institute in Michigan? http://bit.ly/fyxpIP'
36923668021911553,2011-02-13 23:04:23,b'are restless leg syndrome and sleep apnea related? http://bit.ly/gNVc5H'
36923365612593152,2011-02-13 23:03:11,b'how much does it cost to heat a small 1br apartment in albany ny (upstate) and hot water.? http://bit.ly/fsVbCk'
36923349846204416,2011-02-13 23:03:07,"b'I am looking for an unsecured personal loan and have poor credit. I am looking for a loan of 14,000? http://bit.ly/hTIGmK'"
36923242769809408,2011-02-13 23:02:41,b'Compare Physics mechanics and physics C: electricity and magnetism? http://bit.ly/dM8mvv'
36922395230994432,2011-02-13 22:59:19,b'Would an laser vision correction be good for me if I have ptgyeriums? http://bit.ly/gxVTF3'
36922394467639296,2011-02-13 22:59:19,"b'Has anyone had the experience of getting eye laser surgery? If so, what are the pros and cons? http://bit.ly/hFPxEX'"
36922180960788480,2011-02-13 22:58:28,b'Can you have lasik/laser eye surgery while pregnant? http://bit.ly/h4gJ7i'
36921567975837697,2011-02-13 22:56:02,b'I need to know How much does lasik surgery cost if you don\xe2\x80\x99t have insurance? I live in the tri state area.? http://bit.ly/fEaItu'
36921567149563905,2011-02-13 22:56:02,b'Just Wondering \nDoes myopia/ astigmatism return after LASIK eye surgery? http://bit.ly/hisuWC'
36919940011266048,2011-02-13 22:49:34,b'what is the fine for putting on your own CNG conversion? http://bit.ly/fw5jEP'
36919788521390080,2011-02-13 22:48:58,b'What would you do if you were in this situation\xe2\x80\xa6? http://bit.ly/eLvp81'
36919185661497346,2011-02-13 22:46:34,b'Why Alcohol Treatment Programs Fail http://bit.ly/fwWJRv'
36919184864575488,2011-02-13 22:46:34,b'In your opinion is alcoholism a disease or a choice? http://bit.ly/e1f041'
36917666706890752,2011-02-13 22:40:32,b'HELP PLEASE! I am helping a friend that is sick with homework.? http://bit.ly/gppdFg'
36917215802425344,2011-02-13 22:38:44,b'I file assault and battery charges at local police dept. One report was ready the other one was not there? http://bit.ly/fYaDpE'
36917022902198272,2011-02-13 22:37:58,b'Buy Bears\xe2\x80\x99 Guide to Earning Degrees by Distance Learning http://bit.ly/hqbZK1'
36917012072497152,2011-02-13 22:37:56,b'I think i may be bipolar..do my symptoms/behaviors seem like it? http://bit.ly/idOXa7'
36917011388829696,2011-02-13 22:37:56,b'I need to know would you be friends again with someone who has bipolar disorder? mild-medium form of disorder? http://bit.ly/hFkcS4'
36914483699912705,2011-02-13 22:27:53,b'Does any one know anything about lithium in bipolar treatment? http://bit.ly/hws6xU'
36906808534634496,2011-02-13 21:57:23,b'laser lasik eye surgery? http://bit.ly/h72egU'
36904719662190592,2011-02-13 21:49:05,b'Snoring Remedies Tried And Tested? http://bit.ly/hxGVuW'
36899637180768256,2011-02-13 21:28:53,b'I need to know How to pass a drug screen for (medical) Marijuana? http://bit.ly/fDmSaK'
36899494213713920,2011-02-13 21:28:19,b'Do I have a legal right in a divorce to have a dna testing to verify if my spouse is the father of a child? http://bit.ly/gJDgdz'
36898480672743424,2011-02-13 21:24:17,"b'Are gas prices high due to corruption, or are we being told the truth? http://bit.ly/hy4zTX'"
36897624342659073,2011-02-13 21:20:53,b'why is it so difficult to find coloured toric contact lenses? http://bit.ly/hG4oW7'
36897308750643200,2011-02-13 21:19:38,b'What is the most natural-looking and and comfortable colored contact lenses?? http://bit.ly/dHTrZY'
36896910891556864,2011-02-13 21:18:03,b'Co Worker Problems? http://bit.ly/gFNom4'
36896389619253248,2011-02-13 21:15:59,b'can depression be treated with weed? what about bipolar disorder or hypomania? http://bit.ly/hJEx6h'
36896380182077440,2011-02-13 21:15:57,b'how much schooling is there in becoming an ultrasound technician? http://bit.ly/hah9Yq'
36894268580696064,2011-02-13 21:07:33,b'Just Wondering \nI need to know How high do gas prices have to go? http://bit.ly/eupRqJ'
36893931509649408,2011-02-13 21:06:13,b'has anyone used any stop snoring product that worked? http://bit.ly/f6Xu5Z'
36893477388161025,2011-02-13 21:04:25,b'Do I seem to have bipolar disorder? (symptoms below)? http://bit.ly/fLqDyx'
36893073015308289,2011-02-13 21:02:48,b'Whats the difference between bipolar 1/2 and Severe bipolar depression with psychotic features? http://bit.ly/ht2QHS'
36891700064428032,2011-02-13 20:57:21,b'Natural Strategies For Cancer Patients http://bit.ly/gvSER5'
36890858187915264,2011-02-13 20:54:00,b'I need to know Retinal detachment operations were done on eye 2 yrs ago but still xperiencing pressure on eye. I... http://bit.ly/id8MhT'
36890758136987648,2011-02-13 20:53:36,b'Does a Sleep Apnea Machine Stop Snoring? http://bit.ly/gDIKG0'
36890528935051264,2011-02-13 20:52:42,"b'Is there a drug rehab center in Bloomington, California? http://bit.ly/fdaJvr'"
36888978883870721,2011-02-13 20:46:32,b'I need to know I recently go new contact lenses but when I wear them everything seems too bright ? http://bit.ly/hp6HTC'
36887945491259393,2011-02-13 20:42:26,b'Can you take a tax dedcution on any loan or just property loans? http://bit.ly/i0Yd2O'
36886385637990400,2011-02-13 20:36:14,b'What is a good Senior Thesis Topic in criminal justice relating to domestic violence? http://bit.ly/h0Anzr'
36882574483656704,2011-02-13 20:21:05,b'average electric bill in Kentucky? http://bit.ly/i90DxL'
36881639472627712,2011-02-13 20:17:22,b'How can i open a substance abuse center for kids? http://bit.ly/dUI6GV'
36881638742822912,2011-02-13 20:17:22,b'Do insurance dependents need permission from primary subscriber first? http://bit.ly/hgJ01O'
36876486933745664,2011-02-13 19:56:54,b'Which contact lenses are more economical? http://bit.ly/gTzWIX'
36875284934303745,2011-02-13 19:52:07,b'Orthogonathic surgery: How do I get my Health insurance to pay for it? http://bit.ly/h9oVMc'
36871235132461056,2011-02-13 19:36:02,b'Two Year Community College? Most beneficial Degree? http://bit.ly/gOKVHY'
36871010602975232,2011-02-13 19:35:08,"b'I need to know Reasons, and tips to help stop snoring!? http://bit.ly/eyF0RK'"
36870994735927296,2011-02-13 19:35:04,b'Where can I find Canon utility software for RAW image data? http://bit.ly/e4MM1L'
36870642556993536,2011-02-13 19:33:40,b'Are there any NCATE accredited colleges with ONLINE masters programs for teaching? http://bit.ly/eaCjm9'
36870242881773568,2011-02-13 19:32:05,b'Can people who have had cataract surgery have laser correction? http://bit.ly/eqwsYi'
36870120013832192,2011-02-13 19:31:36,b'I need to know Is there any good way to treat Manic-Depression(Bipolar Disorder) without medication? http://bit.ly/eWAu2h'
36870118726180864,2011-02-13 19:31:35,b'How can I avoid depression symptoms? http://bit.ly/fbTSFW'
36870118008950784,2011-02-13 19:31:35,b'Any hope for treatment refractory bipolar disorder? http://bit.ly/eBWNOs'
36870117178474497,2011-02-13 19:31:35,b'What famous people can you name with borderline personality disorder (BPD)? http://bit.ly/hWjH3i'
36869780719800320,2011-02-13 19:30:15,b'I need to know Sleep apnea question please help!? http://bit.ly/egQa3G'
