id,created_at,text37920288926597120,2011-02-16 17:04:36,b'Sentencing for Juvenile Convicted of Level 9 Felony? http://bit.ly/frDEIV'
37913932052176896,2011-02-16 16:39:20,"b'I am writing a research paper on Bipolar Disorder, but I need a topic to do it on about Bipolar Disorder.? http://bit.ly/ffU8BT'"
37912018224680960,2011-02-16 16:31:44,b'Would you rather look good or have health problems? http://bit.ly/f7UOHd'
37911033372737536,2011-02-16 16:27:49,b'How should prosecutors prioritize the types of criminal cases they emphasize? http://bit.ly/fG2J3s'
37901871280562176,2011-02-16 15:51:24,"b'Since the US is bankrupt, why are we? http://bit.ly/gLLqnQ'"
37900252157575168,2011-02-16 15:44:58,b'Recovery from Lasik PRK Wavefront surgery.? http://bit.ly/fYajXe'
37895444084293632,2011-02-16 15:25:52,"b'I am considering lasik surgery for my astigmatism. My vision beyond arm\xe2\x80\x99s length is 20/15. But up close, blur. http://bit.ly/e64eNu'"
37883298403319808,2011-02-16 14:37:36,b'Certificate vs Degree in Ultrasound Sonography? http://bit.ly/eFvhRH'
37883183420669952,2011-02-16 14:37:09,b'What causes snoring and what are the cures (both medical and traditional)? http://bit.ly/dHxF77'
37880403167547392,2011-02-16 14:26:06,b'What are the symptoms of Bipolar disorder? http://bit.ly/giMsGA'
37880363510407168,2011-02-16 14:25:57,b'What resources are available for spouses of people with bipolar disorder? http://bit.ly/edohNA'
37872585987334144,2011-02-16 13:55:02,"b'A student decides to replace all her calorie intake with alcohol, after many month of alcohol abuse\xe2\x80\xa6..? http://bit.ly/dKlC09'"
37870380345462784,2011-02-16 13:46:16,b'Is Glaucoma linked to MS? http://bit.ly/ihGtsn'
37870369087954944,2011-02-16 13:46:14,b'Is there a minimum age for laser eye surgery? http://bit.ly/gplwmt'
37869906489778176,2011-02-16 13:44:23,b'Online degree programs? http://bit.ly/fSgM6y'
37867941714206720,2011-02-16 13:36:35,b'Have you ever used tape on your husband\xe2\x80\x99s mouth to stop snoring? Does it work? http://bit.ly/h3F2eK'
37867292658245632,2011-02-16 13:34:00,b'I need to know Can someone assist me in some ideas for a subtopic or topic for a research paper on \xe2\x80\x9cBipolar Disorder.\xe2\x80\x9d? http://bit.ly/fPgTPn'
37865502986477569,2011-02-16 13:26:54,b'I need to know Can assault charges be filed against this person? http://bit.ly/fVJ7bd'
37864339553656832,2011-02-16 13:22:16,"b'Just Wondering \nRe:Energy suppliers:- Which gas and electric supplier is the best for Manchester, NW England? In... http://bit.ly/gdZpRs'"
37863763998670848,2011-02-16 13:19:59,b'Why dont the US govt declare oil a public utility and regulate astronomical gas prices destroying our economy? http://bit.ly/hIm0kc'
37862076395290624,2011-02-16 13:13:17,"b'Evidence-Based Treatments for Alcohol and Drug Abuse: A Practitioner\xe2\x80\x99s Guide to Theory, Methods, and Practice (P... http://bit.ly/hsrChz'"
37861208350527488,2011-02-16 13:09:50,b'Cheap Contact Lenses Colored and Plain? http://bit.ly/dGxPS7'
37860686642028544,2011-02-16 13:07:45,b'How to Diagnose Sleep Disorders : Obstructive Sleep Apnea Treatment http://bit.ly/hf42ML'
37859883105656833,2011-02-16 13:04:34,b'Bipolar Books? http://bit.ly/g5BzlL'
37858022852141056,2011-02-16 12:57:10,b'I need to know Issues with bipolar disorder and social anxiety? http://bit.ly/enrRzU'
37857884666593281,2011-02-16 12:56:37,b'I need to know help with trade discount homework? http://bit.ly/dNAxkQ'
37857776306757632,2011-02-16 12:56:11,b'Just Wondering \nWhat about lasik eye surgery? http://bit.ly/dNUufR'
37856423807295488,2011-02-16 12:50:49,b'Why is there a \xe2\x80\x9clag\xe2\x80\x9d between RNA and protein synthesis? http://bit.ly/gEyDzv'
37856379536408577,2011-02-16 12:50:38,b'Just Wondering \nI need to know Anyone know of a (good)school that offers a Computer Science degree completely th... http://bit.ly/fssnV0'
37856004418838528,2011-02-16 12:49:09,b'What is the highest near sighted prescription you can get a soft contact lens in? http://bit.ly/e2LUUj'
37855890631561216,2011-02-16 12:48:42,b'Is laser eye surgery 100% safe? http://bit.ly/ejnpFn'
37852977267998720,2011-02-16 12:37:07,b'US Navy Administrative Discharge? http://bit.ly/hpEBMM'
37852467848810496,2011-02-16 12:35:06,b'How do I use a foreign stock market like the one in HongKong? http://bit.ly/fvV2BT'
37851831270899712,2011-02-16 12:32:34,b'Are manic depression and Bipolar disorder really the same thing? http://bit.ly/fR7IRG'
37849919574245376,2011-02-16 12:24:58,b'Aggravated assault? http://bit.ly/eMGx95'
37848696141914112,2011-02-16 12:20:07,"b'I need to know How much does it cost to get lasik surgery done in kerala, India? http://bit.ly/hL3Mkq'"
37847396578754560,2011-02-16 12:14:57,b'I need replacement cast iron grill piece for my OLD Charbroil BBQ. I dropped and broke one of the 3? http://bit.ly/fFEGuh'
37845466460725248,2011-02-16 12:07:16,b'My parents are checking me into a alcohol rehab center. What should I expect? http://bit.ly/ejfeYM'
37845372919349248,2011-02-16 12:06:54,b'About Lasik? http://bit.ly/eu4HM7'
37844579621277696,2011-02-16 12:03:45,b'misdemeanor charges ? http://bit.ly/fXljpo'
37844464915456000,2011-02-16 12:03:18,"b'Is an oxygen concentrator normal treatment for sleep apnea, and can oxygen cause headaches? http://bit.ly/gulhhy'"
37844464282116096,2011-02-16 12:03:18,b'my pcp dosent think sleep apnea is a good reason for weight loss surgery. what do i do? http://bit.ly/i3Wpbd'
37844437417590784,2011-02-16 12:03:11,b'Gas prices? http://bit.ly/hGzIpG'
37842507320532994,2011-02-16 11:55:31,b'Is there a minimum age for laser eye surgery? http://bit.ly/eg8soS'
37842257977548800,2011-02-16 11:54:32,b'How will the additional costs affect my bank balance? http://bit.ly/fwJ2ce'
37841191579951104,2011-02-16 11:50:17,b'Just Wondering \nYou were told that genes code for proteins. Which statement below best indicates that genes spec... http://bit.ly/fIRoHz'
37841058251407360,2011-02-16 11:49:45,b'Can someone give some advice on how to save on my electricity bill? http://bit.ly/hcAlGb'
37839765487230976,2011-02-16 11:44:37,b'Can I get Natural Touch Baby Blue contact lenses directly through my eye doctor? http://bit.ly/fhCqlz'
37837443549892608,2011-02-16 11:35:24,b'Are online colleges good or Which is a better online college? http://bit.ly/f1SIow'
37837165803077632,2011-02-16 11:34:17,b'what are some good ways to stop snoring at night? http://bit.ly/fisDOx'
37836112172945408,2011-02-16 11:30:06,b'fathers rights (UK)? http://bit.ly/gv4BGJ'
37835925052461056,2011-02-16 11:29:22,"b'Lasik surgury\xe2\x80\xa6I am looking at custom lasik from TLC for $4,200? http://bit.ly/ee40Sy'"
37834972706373632,2011-02-16 11:25:35,b'What medical questions would a seven grade science student ask about sickle cell anemia and achondroplasia? http://bit.ly/hJofz0'
37834546623815680,2011-02-16 11:23:53,b'Is there any good way to treat Manic-Depression(Bipolar Disorder) without medication? http://bit.ly/gynIvM'
37834381976408064,2011-02-16 11:23:14,b'I need to know My aunt (dads sister) and 2 cousin all have bipolar disorder. What is the likelihood that will have it? http://bit.ly/dOwPPp'
37833831050379264,2011-02-16 11:21:02,b'I need to know Which firm in the uk do people recommend for laser eye surgery? Price is not an issue just want a... http://bit.ly/hG8MJl'
37833157227053057,2011-02-16 11:18:22,b'has anyone had problems with southern electirc? (gas and electricity supplier uk)? http://bit.ly/i8zg15'
37832852301152256,2011-02-16 11:17:09,"b'Just Wondering \nMy friend has symptoms of bi-polar/manic depression or hyperthyroidism, but doesnt. What could it be? http://bit.ly/ifEq3O'"
37832851701374977,2011-02-16 11:17:09,"b'Hello,my mom has bipolar disorder for 30 years. what are the best treatment options? http://bit.ly/fTZ0bY'"
37832636969783296,2011-02-16 11:16:18,b'MD300W1 Sleep Monitor for Sale http://bit.ly/em5yJo'
37832593021870080,2011-02-16 11:16:07,b'Just Wondering \nCould these factors cause Bipolar Disorder? http://bit.ly/ieQplB'
37831697676378112,2011-02-16 11:12:34,b'What should I expect to pay for corrective eye surgery (e.g. Lasik)? http://bit.ly/gb4L8h'
37830089110458368,2011-02-16 11:06:10,b'Buy Sleep Apnea With CPAP Machine and Sleep Study http://bit.ly/hDvLzT'
37827350150250496,2011-02-16 10:55:17,b'I need to know In your opinion what is a better way to trade currencies for a living; spot-forex or currency opt... http://bit.ly/hQb1Lo'
37827152405602304,2011-02-16 10:54:30,b'Are you happy with how life is? Help to test a depression test? http://bit.ly/gXDHok'
37826752235446272,2011-02-16 10:52:55,b'Did I leave any points out of my outline for my paper on \xe2\x80\x9ceffects of alcoholism on the family\xe2\x80\x9d? http://bit.ly/edCV4z'
37826381115035649,2011-02-16 10:51:26,b'Anyone with severe side effects after radioactive seed implants 4 prostate cancer like vesiculorectal fistula? http://bit.ly/fcMUnH'
37826379479252992,2011-02-16 10:51:26,b'Can the prostate gland really be shrunk by taking certain pills? http://bit.ly/g8VgrN'
37826327583137792,2011-02-16 10:51:13,b'Is it hard to live in the UK because of gas prices? http://bit.ly/fvbDMm'
37826326903656448,2011-02-16 10:51:13,b'Where can I buy a very good gas or electric scooter for a reasonable price? http://bit.ly/gWGv6V'
37826216446664704,2011-02-16 10:50:47,b'Does anyone know about no credit check no income check student loans? http://bit.ly/gHi0Cv'
37826215767179264,2011-02-16 10:50:47,b'Where can i get fast cash loan guaranteed for at least $1500 ? http://bit.ly/eYMA7y'
37825887185412096,2011-02-16 10:49:28,b'I need to know Is Bipolar Disorder a disease? http://bit.ly/gUDCXc'
37825886346547200,2011-02-16 10:49:28,b'Just Wondering \nI need to know What is bipolar mixed affective disorder? in simple terms? http://bit.ly/fqzQHJ'
37825765676417024,2011-02-16 10:48:59,b'Game Engine Architecture http://bit.ly/gjGLWm'
37825521534373888,2011-02-16 10:48:01,b'anyone know a site where i can buy wild-eye contact lenses (or other decorative lens) without a prescription? http://bit.ly/eRq38e'
37825348318011392,2011-02-16 10:47:20,b'50mw 532nm Astronomy Green Laser Pointer http://bit.ly/f7xTKx'
37823910787420160,2011-02-16 10:41:37,b'Is an online Masters Degree worth anything? http://bit.ly/gfCZrO'
37823640745549824,2011-02-16 10:40:33,b'I need to know What is the meaning of Log ratio? http://bit.ly/hcoXhO'
37821219424178177,2011-02-16 10:30:56,b'What causes Bipolar Disorder? http://bit.ly/emt8Os'
37819642881777664,2011-02-16 10:24:40,b'Did you see this???? More good news!!!!? http://bit.ly/igvmve'
37814712494194688,2011-02-16 10:05:04,b'what is the easiest way to become a diagnostic medical sonographer in san diego ca? http://bit.ly/hWri7k'
37801175470317568,2011-02-16 09:11:17,b'can you get DNA test for your baby\xe2\x80\x99s father while your still pregnant? http://bit.ly/hqZcTZ'
37791658594537472,2011-02-16 08:33:28,b'is there any risk to tape your lips together to prevent snoring? http://bit.ly/ickIFr'
37788789732540418,2011-02-16 08:22:04,b'what would a judge give to a person for 2 domestic assault charges but its a misdemeanor? http://bit.ly/hra9Xp'
37787873969176576,2011-02-16 08:18:25,b'Just Wondering \nwhy does media compare the U.S. to the city of OSLO when comparing gas prices? differences are n... http://bit.ly/f5aSUi'
37787056419635200,2011-02-16 08:15:10,b'what do u think about aiding and abeting criminal law? http://bit.ly/gp8usz'
37786961120854016,2011-02-16 08:14:48,"b'Has anyone out there had experience with sleep apnea,CPAP or surgery for sleep apnea?? Please share..? http://bit.ly/hDa3aG'"
37786960399433729,2011-02-16 08:14:48,"b'Get It Up! Revealing the Simple Surprising Lifestyle that  Causes Migraines, Alzheimer\xe2\x80\x99s, Stroke, Glaucoma, Slee... http://bit.ly/fAHaOT'"
37786807307337728,2011-02-16 08:14:11,b'What are the main symptoms of bipolar disorder? http://bit.ly/gZQn16'
37786417283211264,2011-02-16 08:12:38,b'what are the marijuana laws in California if busted with possession? http://bit.ly/exM68k'
37785581547163648,2011-02-16 08:09:19,"b'Just Wondering \nThere\xe2\x80\x99s a welding shop down the street from me, and they are advertising cheap Lasik surgery, should I? http://bit.ly/eoyPsT'"
37785470326804480,2011-02-16 08:08:52,b'Does anyone know of an alcohol treatment center that accepts people with mobility issues? http://bit.ly/fHLt0U'
37785132102324224,2011-02-16 08:07:32,b'Have you had lasik surgery? Were there any complications from it? http://bit.ly/ffz5HF'
37784851339804672,2011-02-16 08:06:25,b'CA-125 Blood test came back slightly elevated\xe2\x80\xa6passing clots with period started 1 week early.? http://bit.ly/igBHoY'
37783062355906560,2011-02-16 07:59:18,b'I need to know Why is it that I am always fixated on the fact that I have bipolar disorder? http://bit.ly/fuOP6w'
37781543707480064,2011-02-16 07:53:16,b'Is marijuana a good treatment for bipolar disorder? http://bit.ly/f6U8zC'
37780326931505152,2011-02-16 07:48:26,b'Just Wondering \nI need to know How do u make a person stop snoring?!?!? http://bit.ly/hpGRCw'
37780326059081728,2011-02-16 07:48:26,b'Just Wondering \nsleep apnea cures I snore too loudly. A nurse said that\xe2\x80\x99s sleep apnea for sure.? http://bit.ly/gI0f1a'
37780173193482240,2011-02-16 07:47:49,b'I need to know Financial Aid for Completing Masters Degree \xe2\x80\x93 Religious Studies? http://bit.ly/h3YbY4'
37780171796779009,2011-02-16 07:47:49,b'Buy Sekonic L-358 Flash Master Light Meter http://bit.ly/fXFAZx'
37779824957194240,2011-02-16 07:46:26,b'Sleep Apnea? Hypersomnia? http://bit.ly/gz8gFa'
37779786503823360,2011-02-16 07:46:17,b'I need to know Is it possible to get rid if black under eyes (puffy eyes) by just sleeping more? http://bit.ly/h63QK9'
37777760642400256,2011-02-16 07:38:14,b'Steps to become a radiology technician in California? http://bit.ly/fOtgK4'
37775583312093184,2011-02-16 07:29:35,b'Will they hospitalize my son for having tonsil and adenoid surgery? http://bit.ly/f6eDoI'
37775466114846720,2011-02-16 07:29:07,b'bipolar disorder diagnosis/confidentiality? http://bit.ly/i6kzyg'
37774677921234944,2011-02-16 07:25:59,b'Just Wondering \ndo people suffering from dry eye have red eyes and itchiness every day? http://bit.ly/ge29bk'
37773302420217856,2011-02-16 07:20:31,b'Buy Nozovent Anti-Snore 2 Box http://bit.ly/i3dV3F'
37773301061259264,2011-02-16 07:20:31,b'how do I GET USED TO THE MASK FOR SLEEP APNEA? http://bit.ly/g983eh'
37772684695699456,2011-02-16 07:18:04,b'seeking information on help with prostate cancer treatments without insurance? http://bit.ly/fA343o'
37772139973050368,2011-02-16 07:15:54,b'I need to know How old do you need to be to get laser eye surgery? http://bit.ly/gJHB5F'
37772092665499648,2011-02-16 07:15:43,b'can depression be treated with weed? what about bipolar disorder or hypomania? http://bit.ly/e1jP4f'
37769455278755840,2011-02-16 07:05:14,b'What\xe2\x80\x99s the point of choosing an ESCO (Energy Service Com)? http://bit.ly/f3wnmo'
37769454653808640,2011-02-16 07:05:14,b'What\xe2\x80\x99s the deal with the electric and gas companies in new apartments? http://bit.ly/fa8zYb'
37769104194535424,2011-02-16 07:03:50,b'Just Wondering \nDoes any one have any suggestions on how to help a 13 year old cope with bipolar disorder? http://bit.ly/fdTrWJ'
37769103661858816,2011-02-16 07:03:50,b'Can you refuse medication for bipolar disorder? http://bit.ly/gvNdZ1'
37768996895850496,2011-02-16 07:03:25,b'I need to know How many times can you get the laser surgery for abnormal cell changes in your cervex? http://bit.ly/fkH8WT'
37768996216381441,2011-02-16 07:03:25,b'Understanding Eye Care \xe2\x80\x93 Everything You Need to Know to Take Care of Your Eyes http://bit.ly/hEHN99'
37768862690705408,2011-02-16 07:02:53,b'Help.. master in mental health psychology \xe2\x80\x93APA or CACREP accreditation? http://bit.ly/efB4mk'
37767004458852352,2011-02-16 06:55:30,b'Should I get Lasik vision corrective surgery prior to enlisting in the military? http://bit.ly/hIj1R5'
37767003729035264,2011-02-16 06:55:30,b'How much does laser eye surgery cost at BostonLaser.com? http://bit.ly/hfrI9J'
37764378665164800,2011-02-16 06:45:04,b'What is the cheapest method for determining protein DNA interactions? http://bit.ly/e5V96F'
37763484078841856,2011-02-16 06:41:30,b'How much does a felony criminal court case cost? http://bit.ly/dNmEdQ'
37763483357417473,2011-02-16 06:41:30,b'quick question? What does four counts of a felony class 1 mean for drug and guns chagres mean? http://bit.ly/hg2EVK'
37763326255570944,2011-02-16 06:40:53,"b'In your opinion, what is the safest form of vision correction? http://bit.ly/h1ydtP'"
37763149897662465,2011-02-16 06:40:11,b'What to look for in a lawyer.Criminal defense? http://bit.ly/e0diJ7'
37761163961835521,2011-02-16 06:32:17,b'Can I be a truck driver if I take medications for bipolar disorder? http://bit.ly/fBtL9Z'
37758401421250560,2011-02-16 06:21:19,b'Instructional Design & Technology Graduate Program at WIU http://bit.ly/eXw9TB'
37757418393837568,2011-02-16 06:17:24,b'The Alcohol & Drug Abuse?The American Scene And The Islamic Perspective ? http://bit.ly/eeQUxk'
37757417705963520,2011-02-16 06:17:24,b'Looking for a drug and alcohol treatment facility? http://bit.ly/i8MrZK'
37752693657174016,2011-02-16 05:58:38,"b'Proceedings of a Court Martial Convened for the Trial of Lt. Col. Joshua B. Brant: At St. Louis, June 15, 1839, ... http://bit.ly/dXikiu'"
37749150170742784,2011-02-16 05:44:33,b'I need to know How to cover dark under eye circles without looking cakey? http://bit.ly/gM8Jg3'
37748704173625344,2011-02-16 05:42:47,"b'Color blind, Can that X chrome lense be surgically installed? http://bit.ly/fPqHKS'"
37747807154601984,2011-02-16 05:39:13,b'sleep apnea? http://bit.ly/ecCJ8w'
37747806504493056,2011-02-16 05:39:13,b'Anyone knows how to deal with sleep apnea? http://bit.ly/hQ9PUe'
37747752356024320,2011-02-16 05:39:00,b'Corrective eye surgery with this prescription\xe2\x80\xa6? http://bit.ly/gAVMn7'
37747262553595904,2011-02-16 05:37:03,"b'I have to find addiction treatment centers in Holtsville, New York, for people with prescription drug addictio http://bit.ly/ewTsAx'"
37747260213166080,2011-02-16 05:37:02,b'Statistics on prescription drug abuse in the state of west virginia? http://bit.ly/ePMRr6'
37746104132964352,2011-02-16 05:32:27,b'I need to know how do i get rid of my mild sleep apnea? http://bit.ly/dEPZfa'
37745779619663872,2011-02-16 05:31:09,b'what are the symptoms of bipolar I and bipolar II? http://bit.ly/f6ZvWS'
37745778935988224,2011-02-16 05:31:09,"b'Living With Someone Who\xe2\x80\x99s Living With Bipolar Disorder: A Practical Guide for Family, Friends, and Coworkers Bes... http://bit.ly/gTVJ9H'"
37745290454761472,2011-02-16 05:29:13,b'I need to know Nasal Airway Surgery for Obstructive Sleep Apnea? http://bit.ly/hwU5YL'
37745169386176512,2011-02-16 05:28:44,b'I need to know online trading? http://bit.ly/fy6Voa'
37744787666771968,2011-02-16 05:27:13,b'Advice for former teacher looking into computer training.? http://bit.ly/eeXNGJ'
37744090078511104,2011-02-16 05:24:26,b'I need to know Are instant approval payday loans okay for working students? http://bit.ly/hFhBKZ'
37744089382260736,2011-02-16 05:24:26,b'If I consolidate my payday loans will it affect my credit? http://bit.ly/eLQHpI'
37743261871251458,2011-02-16 05:21:09,b'My 2week newborns test for sickle cell trait came back positive\xe2\x80\xa6is there anyway that this could be wrong.? http://bit.ly/gDz3OY'
37743094870839296,2011-02-16 05:20:29,b'ADHD and Bipolar Disorder? http://bit.ly/fMCj7w'
37742587871756288,2011-02-16 05:18:28,b'does anyone have more info on bipolar disorder? http://bit.ly/dOR0CE'
37742224674394112,2011-02-16 05:17:02,b'What are the cheapest gas prices in my area? http://bit.ly/gP4mi8'
37742182253203456,2011-02-16 05:16:52,b'have you had any luck dealing with bipolar disorder without taking medication? http://bit.ly/gCZgFC'
37741589002461184,2011-02-16 05:14:30,"b'Aren\xe2\x80\x99t there enough brainiacs out there to solve this energy crisis, or is it really all about money? http://bit.ly/eRNUc7'"
37740531324821504,2011-02-16 05:10:18,b'Wheres a good place to buy a bbq grill? online? store? http://bit.ly/hXsHIa'
37739248484360192,2011-02-16 05:05:12,b'where can i find mirrored tinted contact lenses? http://bit.ly/h00yot'
37739247825850368,2011-02-16 05:05:12,b'Just Wondering \nCan an uncomfortable toric contact lens mean an incorrect Rx? http://bit.ly/hosqsQ'
37738754282098689,2011-02-16 05:03:14,b'Glasses/Contacts help? I\xe2\x80\x99m trying to decide between purchasing contact lenses or eye glasses.? http://bit.ly/eaSuaN'
37737879652278272,2011-02-16 04:59:46,b'Has anyone has lasik surgery? Are there any side effects? http://bit.ly/gx0VvR'
37737560826445824,2011-02-16 04:58:30,b'Want to be a high school history teacher: should I get a masters in Education or History? http://bit.ly/ecyT52'
37737545349464064,2011-02-16 04:58:26,b'How much does electricity/gas cost in Paris? http://bit.ly/hbr32m'
37737334417924096,2011-02-16 04:57:36,b'What is cheaper: heating water by using electricity or gas? http://bit.ly/gA6HRg'
37735065832136705,2011-02-16 04:48:35,b'My dad has prostate cancer..? http://bit.ly/i0DrLb'
37735065169428480,2011-02-16 04:48:35,b'can playing with your shaft cause prostate problems? http://bit.ly/eDHgNb'
37734738735136769,2011-02-16 04:47:17,b'Can being overweight cause sleep apnea? http://bit.ly/gswN7F'
37734738068250625,2011-02-16 04:47:17,b'What is the homeopathy medicine for stoping snoring ? http://bit.ly/g4Uvwc'
37734420957888512,2011-02-16 04:46:01,b'Is there online help for drug/alcohol abuse? http://bit.ly/eUVkh7'
37733727140323328,2011-02-16 04:43:16,"b'Therapy,Bipolar Disorder,Anorexia Nervosa.? http://bit.ly/fGMXeM'"
37733726959964160,2011-02-16 04:43:16,b'I need to know Bipolar/Depression Symptoms? http://bit.ly/dLTsGd'
37733726527950848,2011-02-16 04:43:16,b'What are some books on BIPOLAR disorder? http://bit.ly/gYQUhH'
37732879530205184,2011-02-16 04:39:54,b'Just Wondering \nI need to know Where can I find Sharingan contact lenses for a cheap price? http://bit.ly/dWEhNf'
37729686037463040,2011-02-16 04:27:12,b'The Bipolar Teen: What You Can Do to Help Your Child and Your Family http://bit.ly/gdIaYf'
37703022788222976,2011-02-16 02:41:15,b'Dog with sleep apnea or some sleep disorder? http://bit.ly/eKlEVO'
37702509589954560,2011-02-16 02:39:13,b'Just Wondering \nwhat are the risks in laser eye surgery? http://bit.ly/fxALPt'
37701971360096256,2011-02-16 02:37:05,b'I threw a beehive at a pregnant woman. Do you think that she will be filing assault charges? http://bit.ly/hAaT6d'
37700644563329024,2011-02-16 02:31:48,b'Applying online for nursing college? http://bit.ly/hfE1bv'
37700028952743936,2011-02-16 02:29:21,b'Is anyone with bipolar disorder living \xe2\x80\x9ca normal life?\xe2\x80\x9d? http://bit.ly/ia6DsH'
37699273353068544,2011-02-16 02:26:21,b'I need to know What are the symptoms of Bipolar disorder? http://bit.ly/hBgf2W'
37699273256607744,2011-02-16 02:26:21,b'Bipolar mood disorder or something else? http://bit.ly/eJFB3L'
37699191283122176,2011-02-16 02:26:02,b'Does the United Healthcare Choice Plus insurance plan cover pre-existing sleep apnea CPAP treatments? http://bit.ly/eLrdlH'
37698495364210688,2011-02-16 02:23:16,b'Where does DNA blood test go from 1974? http://bit.ly/fuQAdw'
37696438460743680,2011-02-16 02:15:05,b'Has any guy here ever had a transrectal biopsy (to check for prostate cancer)? Did it hurt? http://bit.ly/i9KGYv'
37695639873658881,2011-02-16 02:11:55,b'Can i change power supplier if i rent my property? http://bit.ly/gtGelJ'
37695563071750144,2011-02-16 02:11:37,b'Buy PowerGard CT1688 Energy Saving Device Best Price http://bit.ly/feOYWQ'
37695372759408640,2011-02-16 02:10:51,"b'What are the signs and symptoms of depression, and being Bi polar? http://bit.ly/dY5g15'"
37693284323172352,2011-02-16 02:02:33,b'LASER EYE SURGERY INFO? http://bit.ly/gimRt7'
37692899860684800,2011-02-16 02:01:02,b'I need to know Where can I buy cheap crazy contact lenses? http://bit.ly/hmCyuO'
37692068289581056,2011-02-16 01:57:44,b'Anyone else have a toddler who is a heavy snorer? http://bit.ly/hV597j'
37690894773657600,2011-02-16 01:53:04,b'can anyone recomend a good non 12 step rehab in california? http://bit.ly/f8YV1S'
37689462435610625,2011-02-16 01:47:22,b'YuGiOh Gold Series 2 2009 Single Card Future Fusion GLD2-EN039 Gold Rare Shor\xe2\x80\xa6 http://bit.ly/fKbTox'
37687396489236480,2011-02-16 01:39:10,b'Getting What You Came For: The Smart Student\xe2\x80\x99s Guide to Earning an M.A. or a Ph.D. http://bit.ly/eA1M4S'
37687061641166848,2011-02-16 01:37:50,b'What changes in your life schedule occur after getting Lasik eye surgery? http://bit.ly/i9JGe4'
37686248780865536,2011-02-16 01:34:36,b'How do you find reviews of laser correction doctors? http://bit.ly/eCWRk7'
37684024247848961,2011-02-16 01:25:46,b'How can I stop snoring? http://bit.ly/hVWWX0'
37683219243470848,2011-02-16 01:22:34,b'genetic history? http://bit.ly/dOSi0B'
37682062332788736,2011-02-16 01:17:58,b'Can you tell me the symptoms of Bipolar disorder? http://bit.ly/eECcfA'
37681530427940864,2011-02-16 01:15:51,b'Just Wondering \nCan a mental disorder (Bipolar) blind your true feelings? http://bit.ly/e8YZZb'
37680519994941440,2011-02-16 01:11:50,b'How much does laser eye surgery cost at BostonLaser.com? http://bit.ly/g9QAVm'
