id,created_at,text36425824450125825,2011-02-12 14:06:07,b'Do I fight Regional Center or Insurance Company? http://bit.ly/enarzX'
36425150027010049,2011-02-12 14:03:27,b'whats the best way to deal with having bipolar disorder / manic depression ? http://bit.ly/g9MZCZ'
36423857308962816,2011-02-12 13:58:18,b'With the UK credit crunch and rising Energy prices will you be Christmas\xe2\x80\xa6? http://bit.ly/ggvJyu'
36423008109203457,2011-02-12 13:54:56,b'Just Wondering \nHow would you get prescribed \xe2\x80\x9cbaclofen\xe2\x80\x9d for drug addiction treatment? http://bit.ly/fsx4rT'
36422165351899136,2011-02-12 13:51:35,b'Biomedical Equipment at Texas State Technical College http://bit.ly/hgZYqg'
36422164773085184,2011-02-12 13:51:35,b'Requesting advice from anyone who knows what the process is to becoming a U.S Navy Dental Technician? http://bit.ly/fdD42r'
36421414831525888,2011-02-12 13:48:36,b'Seeds of Mortality: The Public and Private Worlds of Cancer http://bit.ly/h9MvQv'
36419712040566784,2011-02-12 13:41:50,b'How many times can you have Lasik surgery on your eyes? http://bit.ly/eVmW0Q'
36418789230772224,2011-02-12 13:38:10,b'How do tell people that my previous strange behaviour was due to undiagnosed mild bipolar disorder? http://bit.ly/hZGPgt'
36418690870153216,2011-02-12 13:37:47,"b'Where can I get alcohol addiction treatment here in Garden Valley, California? http://bit.ly/fzcE0q'"
36418051150712832,2011-02-12 13:35:14,"b'Premium High-Speed V1.4 HDMI Male to Male Cable 6Ft for Ethernet Channel, 3D HDTV 10.2Gbps 28 AWG, Gold Plated Pins http://bit.ly/hOoiFh'"
36417359581282304,2011-02-12 13:32:29,b'What is an eye pressure of 64? http://bit.ly/g3T5ix'
36414541453598720,2011-02-12 13:21:17,"b'I need to know How can I stop my dog snoring at night? I bought my dog 3 beds, but non of them are seems to stop... http://bit.ly/e6835p'"
36413829902508032,2011-02-12 13:18:28,"b'anyone know of an illness with the following- cold symptoms, migraine, eye infection, back aches? http://bit.ly/hWVErC'"
36412864126263296,2011-02-12 13:14:37,"b'husband snores badly, can\xe2\x80\x99t sleep with him. Any ways to fix this? ? http://bit.ly/glhAy0'"
36411800127807488,2011-02-12 13:10:24,b'Does it cost money to press assault and battery charges against a person? http://bit.ly/g4Ddk0'
36411431230382080,2011-02-12 13:08:56,"b'What is the Procedure to apply for a court appt. attorney, California Courts? http://bit.ly/gWNIyG'"
36410569749696512,2011-02-12 13:05:30,b'Having normal embryo chromosomes during pregnancy? http://bit.ly/gl9Ogh'
36410259593494528,2011-02-12 13:04:17,b'Buy Take Charge of Bipolar Disorder: A 4-Step Plan for You and Your Loved Ones to Manage the Illness and Create ... http://bit.ly/gKlwE5'
36409972241727488,2011-02-12 13:03:08,b'Buy Survival Strategies for Parenting Children with Bipolar Disorder: Innovative Parenting and Counseling Techni... http://bit.ly/giUo8D'
36409158622253057,2011-02-12 12:59:54,"b'Just Wondering \nFind boleo alcohol abuse treatment in Topeka, Kansas? http://bit.ly/hqU63R'"
36404810546683906,2011-02-12 12:42:37,b'Could Obama still loose the Election even with 70% of the vote? http://bit.ly/hDqxmt'
36403524493385728,2011-02-12 12:37:31,b'I need to know Do you think I could have a bipolar disorder? http://bit.ly/dOOdPU'
36400450668339201,2011-02-12 12:25:18,b'Does anyone know about Diagnostic Medical Sonography? http://bit.ly/fOPccE'
36400449900781568,2011-02-12 12:25:18,b'I need to know where\xe2\x80\x99s the best school in california to get into for ultrasound sonography school? http://bit.ly/fIjlDI'
36397438675722240,2011-02-12 12:13:20,"b'Monitor, samsung or acer? Which one do you think is better for this price? http://bit.ly/hahqCJ'"
36397247700664320,2011-02-12 12:12:34,b'True False Economic questions? http://bit.ly/igSrms'
36389828694114305,2011-02-12 11:43:05,b'What are some symptoms of depression and bipolar disorder? http://bit.ly/eJ3Zik'
36389483758755841,2011-02-12 11:41:43,b'Just Wondering \nWhat online stock brokers allow more than 3 individuals on a joint investment account? http://bit.ly/dVJM2f'
36388420594966528,2011-02-12 11:37:30,b'What not to do after Lasik eye surgery? http://bit.ly/h6RoiK'
36387535844286464,2011-02-12 11:33:59,b'molecular biology lab help please? http://bit.ly/dLNTqo'
36387425588617216,2011-02-12 11:33:32,"b'Just Wondering \nGlasses, contacts or laser surgery? http://bit.ly/hsbuPd'"
36385933624352768,2011-02-12 11:27:37,b'How do i get coloured contact lenses? http://bit.ly/dNu9ED'
36384599479160832,2011-02-12 11:22:19,b'I need help dealing with bipolar disorder\xe2\x80\x93what can I do? http://bit.ly/dTPU74'
36383455470157824,2011-02-12 11:17:46,b'How to teach an elementary class about alcohol if many of the student\xe2\x80\x99s parents drink? http://bit.ly/gZqkom'
36382676915068928,2011-02-12 11:14:40,b'I need to know Does psychotherapy make a difference in treatment of Bipolar Disorder? http://bit.ly/fMcToc'
36382430780723200,2011-02-12 11:13:42,b'Is it common for victims to not obtain an attorney in court for assault cases? http://bit.ly/dKbjKK'
36381952361635840,2011-02-12 11:11:48,b'Do you have bipolar disorder and use natural treatments? http://bit.ly/eIqVZO'
36381895524614144,2011-02-12 11:11:34,b'Unix Scripting & Variables Question? http://bit.ly/gOAg1n'
36381860720283648,2011-02-12 11:11:26,b'Where to obtain online degree in civil engineering? http://bit.ly/eGSKmK'
36381816906579970,2011-02-12 11:11:15,b'What age is safest/best to get laser eye surgery at? http://bit.ly/hgoDAg'
36378263458684929,2011-02-12 10:57:08,b'Anyone know of a place to get cheap color contacts? http://bit.ly/e50Ofj'
36378217644294144,2011-02-12 10:56:57,"b'Just Wondering \nI need to know Sleep Apnea\xe2\x80\xa6 how soon can I expect to feel better, and just what will \xe2\x80\x98feel bette... http://bit.ly/gUBIqC'"
36377547130277888,2011-02-12 10:54:17,b'Questions about the USCG?? Please HELP? http://bit.ly/fyfvTO'
36376123029856256,2011-02-12 10:48:38,b'What are the main symptoms of bipolar disorder? http://bit.ly/hFwFMB'
36375267958071296,2011-02-12 10:45:14,b'Just Wondering \nWhat is the best approach to a Phd in mathematics with a masters but no bachelors in math? http://bit.ly/gyLPPA'
36373148148436992,2011-02-12 10:36:48,b'Retinal Detachment in Right eye? http://bit.ly/dJsyod'
36373079907110912,2011-02-12 10:36:32,b'I was just wanting to know if anyone has had an eye laser treatment and if it hurts or anything? http://bit.ly/hRPGy8'
36372699785723904,2011-02-12 10:35:02,"b'Just Wondering \nWhat did you pay for your \xe2\x80\x9cCustom\xe2\x80\x9d LASIK , Where, when and why; and are you satisfied? Thanks!? http://bit.ly/ibr721'"
36372683767681024,2011-02-12 10:34:58,b'Husqvarna 350BT 50.2cc 2-Cycle X-Torq Gas Powered 180 MPH Midsize Back Pack Blower http://bit.ly/ea2KiH'
36372138495582208,2011-02-12 10:32:48,b'I need to know anybody knows why in DNA methylation real-time PCR we have to use betaactin as refrence gene ? http://bit.ly/hbHAob'
36371482602901504,2011-02-12 10:30:11,b'I need to know remedies for enlarge prostate? http://bit.ly/i9SJoF'
36370877834592256,2011-02-12 10:27:47,b'Can trauma in infancy cause post traumatic stress disorder thoughout the infants entire life? http://bit.ly/eDLeDM'
36370636179771393,2011-02-12 10:26:50,b'Just Wondering \nCan I join the Air Force after getting eye surgery? http://bit.ly/h2DEqh'
36370141771997184,2011-02-12 10:24:52,b'Drugs/Alcohol STUDY SHEET help? http://bit.ly/e6pf2X'
36370126861242368,2011-02-12 10:24:48,"b'Besides plastic surgery, what\xe2\x80\x99s another way to get rid of wrinkles under the eyes? http://bit.ly/h83V5E'"
36369075101761536,2011-02-12 10:20:37,b'Is anyone else utterly sick and tired of the symptoms of bipolar disorder (manic depression)? http://bit.ly/elm5EE'
36367292581281792,2011-02-12 10:13:32,b'wich is best to get laser eye surgery glasses or contacts? http://bit.ly/fIaXsT'
36366705932374016,2011-02-12 10:11:13,"b'Just Wondering \nneed emergency loan until march 24,2006. had theift identify & it seems like i can\xe2\x80\x99t get anything. i? http://bit.ly/i18lvO'"
36366632276197376,2011-02-12 10:10:55,b'DO you know what website has statistics for bipolar disorder in the Philippines? I need it for my research\xe2\x80\xa6? http://bit.ly/gNSM7y'
36366306122932224,2011-02-12 10:09:37,"b'What training, education, or experiences are necessary to become a Secondary School English teacher? http://bit.ly/eUw1c3'"
36365217709432832,2011-02-12 10:05:18,b'Toro 38381 18-Inch 15 Amp Electric 1800 Power Curve Snow Thrower for Sale http://bit.ly/fgHvUq'
36365146704060416,2011-02-12 10:05:01,"b'In enrolling for a post graduate degree, which is better \xe2\x80\x93 Master of Arts or Master of Science in Nursing? http://bit.ly/eK4wK1'"
36363672666251264,2011-02-12 09:59:09,b'Economy 10 Electricity!!! Does anyone know how to read an Economy 10 meter \xe2\x80\x93 (UK)? http://bit.ly/hOnYuW'
36362959332577280,2011-02-12 09:56:19,b'Does anyone have problems with the mask with CPAP for sleep apnea? http://bit.ly/dFsZtk'
36362947269754880,2011-02-12 09:56:16,b'Grayson Earl T OD Odessa TX from Youtube http://bit.ly/ewY91j'
36361262631751680,2011-02-12 09:49:35,b'What is the best way to take a CCENT or CCNA course for free? http://bit.ly/gffoma'
36359141597388800,2011-02-12 09:41:09,b'Just Wondering \nWhat is the average starting salary for criminal defense attorneys? http://bit.ly/enBF1h'
36358950236463104,2011-02-12 09:40:23,b'What\xe2\x80\x99s the best way to learn stock option trading? http://bit.ly/fxndbr'
36358487550197760,2011-02-12 09:38:33,b'prostate cancer radiation therapy is about to start. Does anyone have any good or bad to say about it .? http://bit.ly/hQO2S9'
36358278489313280,2011-02-12 09:37:43,b'bipolar disorder\xe2\x80\xa6..? http://bit.ly/fXHpTJ'
36357913974935552,2011-02-12 09:36:16,"b'In developing or developed countries, what do electricity suppliers when they damnify consumers facilities? http://bit.ly/ed2dRw'"
36357242697547776,2011-02-12 09:33:36,b'Just Wondering \nWhat are some cheap ways to reduce gas and electric bill during winter? http://bit.ly/hjMAni'
36356602525130752,2011-02-12 09:31:04,b'I need to know Has anyone found an anti-snoring method/device that really works? http://bit.ly/ik7IaK'
36355924805296128,2011-02-12 09:28:22,b'How can i get a business loans with bad credit? http://bit.ly/hpDBkn'
36355176436596736,2011-02-12 09:25:24,b'I find a mutation that disrupts the function of transcription factor Z. I hypothesize that this loss of functi? http://bit.ly/hUwI2g'
36354866582388736,2011-02-12 09:24:10,"b'My psychiatarist said i have bipolar disorder with psychosis, and a second diagnoses of schizophrenia? http://bit.ly/hNTcHo'"
36353567388344320,2011-02-12 09:19:00,b'What\xe2\x80\x99s the cheapest gas prices near you and where do you live? http://bit.ly/i6Uj7W'
36350738229624832,2011-02-12 09:07:46,"b'If you have sleep apnea, and don\xe2\x80\x99t use a breathing machine, would you die? http://bit.ly/dWEazI'"
36350419160539136,2011-02-12 09:06:29,b'Bipolar disorder? http://bit.ly/fgL28f'
36348554070990848,2011-02-12 08:59:05,b'Is ten milligrams of Topomax a negligible dosage for treating Bipolar disorder? http://bit.ly/f8qER0'
36347159741726721,2011-02-12 08:53:32,b'Laser surgery is the only way to get rid of the scars completely? Any side effects? http://bit.ly/huAiWF'
36347159091617793,2011-02-12 08:53:32,b'Will I need my birth certificate to get a new driver\xe2\x80\x99s license? http://bit.ly/eYEnHb'
36347158386974720,2011-02-12 08:53:32,b'What is the risk of laser eye surgery and is it worth doing? http://bit.ly/h3FFfx'
36342283297095680,2011-02-12 08:34:10,b'I need to know Where is a free alcohol rehab center in southern california? http://bit.ly/gUsrG0'
36340847163211776,2011-02-12 08:28:27,b'What percentage of the us population has been arrested/charged with a crime? http://bit.ly/gdOaHT'
36339608086126592,2011-02-12 08:23:32,b'Does psychotherapy make a difference in treatment of Bipolar Disorder? http://bit.ly/gEUq5H'
36339091163324416,2011-02-12 08:21:29,b'Just Wondering \nI need to know is there many job opportunitys for ultrasound technicians in minnesota? http://bit.ly/ec2lUV'
36338848854188033,2011-02-12 08:20:31,b'Can I use my father\xe2\x80\x99s old cpap breathing machine for sleep apnea? How can i find pressure setting to use? http://bit.ly/fw9mIn'
36338202444828672,2011-02-12 08:17:57,b'Does schizoaffective bipolar 1 disorder mean you have schizophrenia and bipolar disorder? please explain? http://bit.ly/h5XtnM'
36337210223501312,2011-02-12 08:14:00,b'TEDxLansing \xe2\x80\x93 Dirk Schweitzer \xe2\x80\x93 Genetic Genealogy \nCredit: Youtube http://bit.ly/g31Vjd'
36335944697118721,2011-02-12 08:08:58,b'Anyone had problems with sleep apnea during pregnancy\xe2\x80\xa6.? http://bit.ly/eIGCie'
36335857841471488,2011-02-12 08:08:38,b'Cancer Education and History Movie: You Are the Switchman DVD (1951) http://bit.ly/gaha4G'
36335681525518338,2011-02-12 08:07:56,b'being a geography teacher in uk? http://bit.ly/hXdnaP'
36332255764815872,2011-02-12 07:54:19,b'What does a \xe2\x80\x9cWorking diagnosis of Bipolar Disorder\xe2\x80\x9d mean? http://bit.ly/g08YSA'
36328492912091136,2011-02-12 07:39:22,b'where can i find and criminal/civil attorney in north carolina? http://bit.ly/eNA3YD'
36326901366661120,2011-02-12 07:33:02,b'I Heart (Love) Rehab Women\xe2\x80\x99s tee Shirt in 6 Colors Small thru XXL for Sale http://bit.ly/eleuTV'
36325556882509824,2011-02-12 07:27:42,b'Just Wondering \nWhere can I find the punishments for criminal offences in Canada? http://bit.ly/dHLJdf'
36324363821125632,2011-02-12 07:22:57,b'What is the proper color ribbon to wear in support of bipolar disorder awareness? http://bit.ly/ige33P'
36324057246859264,2011-02-12 07:21:44,"b'Just Wondering \nladies, any remedies for dark circles under my eyes? http://bit.ly/fkEYI3'"
36323619785146369,2011-02-12 07:20:00,b'can sleep apnea cause depression? http://bit.ly/gYazw3'
36323162186584064,2011-02-12 07:18:11,b'I need to know What are the symptoms of these two disorders? http://bit.ly/eO3vn3'
36322965809270784,2011-02-12 07:17:24,b'Facing Bipolar: The Young Adult\xe2\x80\x99s Guide to Dealing With Bipolar Disorder http://bit.ly/fklp3y'
36322029753860096,2011-02-12 07:13:41,b'Help with addiction and recovery? http://bit.ly/facTrX'
36321966797365248,2011-02-12 07:13:26,b'Just Wondering \nremedies for snoring? http://bit.ly/fLZNtH'
36321869439180800,2011-02-12 07:13:03,b'What is painless newborn genetic screening? Is it safe and reliable? http://bit.ly/f7jqlo'
36321529385979905,2011-02-12 07:11:42,b'I need to know I have some questions concerning seizures and bipolar disorder. http://bit.ly/dTa8j3'
36320732963151872,2011-02-12 07:08:32,b'Sleep Apnea-has anyone had their deviated septum fixed or their turbinates trimmed? http://bit.ly/fXFnlI'
36320536141242368,2011-02-12 07:07:45,b'Navy Officer Candidate School Question? http://bit.ly/fWDnuG'
36319466031677440,2011-02-12 07:03:30,b'Is there a website that tells you the cheapest gas prices around your area.? http://bit.ly/e4NNdI'
36317051068882944,2011-02-12 06:53:54,b'What is it like having bipolar (manic depression)? http://bit.ly/eMiXvM'
36316346178347008,2011-02-12 06:51:06,b'PreOp\xc2\xae Patient Education Opthamology: PRK Laser Eye Surgery from Youtube http://bit.ly/eYYMmT'
36312868500545536,2011-02-12 06:37:17,"b'Guide to Analysis of DNA Microarray Data, Second Edition http://bit.ly/gFopgr'"
36306261662240768,2011-02-12 06:11:01,b'Just Wondering \nHow do i go about getting a teaching degree? http://bit.ly/fXVXSd'
36304107111194624,2011-02-12 06:02:28,b'Would my conditions qualify for medical marijuana? http://bit.ly/hTX5Gu'
36303072724520960,2011-02-12 05:58:21,b'Is ThisThe Number #1 Bipolar Disorder Killer? http://bit.ly/f8GUSq'
36300158580822016,2011-02-12 05:46:46,b'Possession http://bit.ly/f46Brk'
36299423877177344,2011-02-12 05:43:51,b'I need to know Can anyone tell me what are you suggestions or comments? What do you think about my plan and career? http://bit.ly/f7a5s5'
36299080971849728,2011-02-12 05:42:29,b'I need to know my doctor referred me to a urologist because my psa is slightly elevated.what should i expect? http://bit.ly/fXv3Ub'
36295458443763712,2011-02-12 05:28:06,b'Can young children or babies have bipolar disorders? If so what are the symptoms and how to get them diagnosed? http://bit.ly/fBFk37'
36294382927745024,2011-02-12 05:23:49,b'What do I do if I lost the prescription sticker on my eye drops? http://bit.ly/hsiP1c'
36292966419013632,2011-02-12 05:18:12,b'I need to know are restless leg syndrome and sleep apnea related? http://bit.ly/dYgX8F'
36292965269774336,2011-02-12 05:18:11,b'How much did laser eye surgery cost you? http://bit.ly/icWqw6'
36292964607066113,2011-02-12 05:18:11,b'Can a beautician deduct the cost of Lasik eye surgery as business expense if it is business related? http://bit.ly/hhJvGQ'
36292392051019776,2011-02-12 05:15:55,b'What are the German translation for these terms? Help!? http://bit.ly/elcD3a'
36291847101878272,2011-02-12 05:13:45,"b'who r the pretty good online commodity brokers that allow me to trade oats,corn,oil,gold,cotton etc http://bit.ly/fkMdQJ'"
36289645364903938,2011-02-12 05:05:00,b'Do court appointed lawyers defend sexual assault cases and win? http://bit.ly/eba8GL'
36289110956052480,2011-02-12 05:02:52,b'I need to know Could bipolar symptoms be a sugar problem? http://bit.ly/g8QETP'
36288308443086849,2011-02-12 04:59:41,b'genetic history? http://bit.ly/h3lNRV'
36287600398438400,2011-02-12 04:56:52,b'Take Charge of Bipolar Disorder: A 4-Step Plan for You and Your Loved Ones to Manage the Illness and Create Last... http://bit.ly/hTs6TH'
36286494226255872,2011-02-12 04:52:29,b'When is the best time to invest in electric utilities? Are they a good investment? http://bit.ly/eO2VEL'
36285603016343552,2011-02-12 04:48:56,b'Does a cataract grow back after removed by Lasik? http://bit.ly/fdbnZb'
36285510414508032,2011-02-12 04:48:34,"b'What is cheaper for heating a room, Gas or Electric Heaters? http://bit.ly/gd7pgk'"
36285416885723136,2011-02-12 04:48:12,b'where can I find free alcohol and drug rehabilitation in Sacramento California? http://bit.ly/fxFMkp'
36284373179305984,2011-02-12 04:44:03,b'Just Wondering \nMasters degree in social work or school psychology? http://bit.ly/g3mGaT'
36280706594246656,2011-02-12 04:29:29,b'What are some signs of bipolar disorder? http://bit.ly/fTE1fF'
36278748319842304,2011-02-12 04:21:42,b'Buy The Eye Laser Miracle: The Complete Guide to Better Vision http://bit.ly/dLnWOn'
36277655212916737,2011-02-12 04:17:21,b'how is central sleep apnea treated? http://bit.ly/f3FmI0'
36277074595422208,2011-02-12 04:15:03,b'I need to know How does Toric Lenses corrects eye with Astigmatism? http://bit.ly/glcrBh'
36276472800878593,2011-02-12 04:12:39,b'Just Wondering \nHow to explain do those one-way Anova? ? http://bit.ly/eyT6hh'
36276283025391616,2011-02-12 04:11:54,"b'I,m a diabetic does it means that this is the cause why I\xe2\x80\x99m suffering of an eye cataract? http://bit.ly/gyrKMb'"
36276150099517441,2011-02-12 04:11:22,b'How to stop my boyfriend\xe2\x80\x99s snoring? http://bit.ly/fM9s2m'
36275904099393536,2011-02-12 04:10:24,b'Rate my rap verse 1-10? http://bit.ly/hGFw1q'
36275642190266368,2011-02-12 04:09:21,b'Snoring Problem? http://bit.ly/eRmWoL'
36273848814936064,2011-02-12 04:02:14,"b'Sleep Apnea is a pause of sleep during sleeping, does it have any effects or connection to Stroke? http://bit.ly/dLDWGa'"
36272709771988993,2011-02-12 03:57:42,b'How easy is it to identify bipolar disorder? http://bit.ly/dZSQpq'
36272548798795776,2011-02-12 03:57:04,"b'Buy Kids in the Syndrome Mix of ADHD, LD, Asperger\xe2\x80\x99s, Tourette\xe2\x80\x99s, Bipolar and More!: The One Stop Guide for Pare... http://bit.ly/dYooOF'"
36271869476737024,2011-02-12 03:54:22,b'What rate of the pump supply energy to the building as a heat? http://bit.ly/ig3Wyc'
36271414809993216,2011-02-12 03:52:33,b'SynergEyes\xc2\xae A Hybrid Contact Lenses for Astigmatism \nCredit: Youtube http://bit.ly/hYDiFK'
36271406983421953,2011-02-12 03:52:31,b'Alcohol and Drug Abuse Problems: Oxford Bibliographies Online Research Guide Best Price http://bit.ly/f3VLH1'
36271228486422528,2011-02-12 03:51:49,"b'Just Wondering \nBenefit of hydrogen-oxygen fuel cells compared to natural gas, batteries, and gasoline? http://bit.ly/f4dC9O'"
36271096542003200,2011-02-12 03:51:17,b'I was just wanting to know if anyone has had an eye laser treatment and if it hurts or anything? http://bit.ly/euCBzR'
36270225678671872,2011-02-12 03:47:50,b'I need to know Why would the working American vote for someone that will take more money from their paycheck in ... http://bit.ly/eYbHSi'
36269136715710465,2011-02-12 03:43:30,b'I need to know any nursing schools online for RN or BSN? http://bit.ly/eWADKp'
36266871917387777,2011-02-12 03:34:30,"b'can i use my philhealth if i undergo LASIK eye surgery, how much and which one is the best clinic here in Cebu? http://bit.ly/fo9egb'"
36266442122858496,2011-02-12 03:32:48,b'Many people said that hot peppers can prevent or cure prostate cancer? http://bit.ly/ejb9QN'
36265339129954304,2011-02-12 03:28:25,"b'Clinical Supervision in Alcohol and Drug  Abuse Counseling: Principles, Models, Methods http://bit.ly/idQ4u2'"
36265252966375424,2011-02-12 03:28:04,b'I would like to hear from people who had lasik eye surgery in the last couple of years. Pro and con.? http://bit.ly/fZma3c'
36264764237684736,2011-02-12 03:26:08,b'Can surgery cure sleep apnea? http://bit.ly/e3ymKc'
36264634050678784,2011-02-12 03:25:37,b'What is an online Bachelors degree program in California that will accept ALL of my 60 college credits? http://bit.ly/egjBqt'
36263645352562688,2011-02-12 03:21:41,b'Should I ask my doctor about sleep apnea during my pregnancy? http://bit.ly/gMaITk'
36262930659942400,2011-02-12 03:18:51,b'Do you know much about Concord Online Law School? http://bit.ly/e7AOEU'
36262435685928960,2011-02-12 03:16:53,"b'Why is drug consumption, drug demand, drug addiction, and drug abuse, a huge problem in America? http://bit.ly/g3wsGP'"
36261617578549248,2011-02-12 03:13:37,b'What are some of the alternative treatments for Bipolar Disorder? http://bit.ly/h4XMPD'
36261031646859264,2011-02-12 03:11:18,b'Floaters \xe2\x80\x93 What are they? How do they happen? http://bit.ly/e7nlOb'
36260440933670912,2011-02-12 03:08:57,b'I need to know Is it safe to wear ear plugs every night? http://bit.ly/hR9a8P'
36259467246964736,2011-02-12 03:05:05,"b'What loan company will make a property loan, W/O a down payment or collateral at; a reasonable interest rate? http://bit.ly/h2PkRK'"
36258596094214144,2011-02-12 03:01:37,b'What does sleep apnea have to do with someone who just wont wake up in the morning.? http://bit.ly/fLkSla'
36257461799223297,2011-02-12 02:57:07,b'How long does a manic/depressive episode last? (Bipolar Disorder)? http://bit.ly/i9e087'
36256226157268993,2011-02-12 02:52:12,b'Questions about coloured contact lenses? http://bit.ly/g5grgO'
36254492269744128,2011-02-12 02:45:19,b'Are assault and street terrorism misdemeanors or felonies? http://bit.ly/gUavmp'
36253219768242177,2011-02-12 02:40:15,b'I need to know Quality Online Masters Degree Programs? http://bit.ly/gzTFOO'
36251969211334656,2011-02-12 02:35:17,b'Can I become a RN if I have a felony for theft of property expunged? http://bit.ly/dQl8Us'
36251099497238529,2011-02-12 02:31:50,b'How can I treat Bipolar II disorder w/o meds? http://bit.ly/hHMTC9'
36249964623429633,2011-02-12 02:27:19,b'Contact Lenses and Laser eye surgery? http://bit.ly/hAIS4Q'
36248796862087168,2011-02-12 02:22:41,b'where can i get cool contact lenses? http://bit.ly/fxp0EO'
36248681313206272,2011-02-12 02:22:13,b'How Does PERSONAL LOAN | ACCOMMODATIVE FINANCIAL SOLUTIONS know the correct banks to get loans from? http://bit.ly/eMQsTx'
36248194031554560,2011-02-12 02:20:17,b'Anyone have LASIK at Kremer Eye Center in PA? http://bit.ly/epm5r4'
36247779479134208,2011-02-12 02:18:38,"b'I was diagnosed with sleep apnea and have a sleep aid. I was doing fine then got depressed, now I am on Escal http://bit.ly/ePYmB0'"
36247198496722944,2011-02-12 02:16:20,b'Just Wondering \nI need to know Can a mental disorder (Bipolar) blind your true feelings? http://bit.ly/hDjOwz'
36246657364402176,2011-02-12 02:14:11,b'I urgently need Bipolar Disorder support.? http://bit.ly/gsxSPP'
36245849881182208,2011-02-12 02:10:58,b'Just Wondering \nPlease compare Gore (House #1) vs Bush (House #2)? http://bit.ly/glWppn'
36245571337453568,2011-02-12 02:09:52,b'Anyone tried dental device for snoring/apnea? http://bit.ly/hTcrJT'
36245569018007552,2011-02-12 02:09:51,b'How many people are in drug and alcohol treatment each year in the US? http://bit.ly/fHpOUw'
36245132986548224,2011-02-12 02:08:07,b'What is the most severe \xe2\x80\x98type\xe2\x80\x99 of Bipolar Disorder? http://bit.ly/g6H6lg'
36244737161699329,2011-02-12 02:06:33,b'How\xe2\x80\x99s my story intro? http://bit.ly/hCk8tH'
36244408294711296,2011-02-12 02:05:14,b'Utility Bills? Answers from England only please.? http://bit.ly/fNusff'
36244097131880448,2011-02-12 02:04:00,b'Find out what Lasik Eye Surgery is all about http://bit.ly/egfSSK'
36243611213365249,2011-02-12 02:02:04,b'My overweight 4yo son just had his adenoids and tonsils removed. He had sleep apnea. Will he lose weight? http://bit.ly/frs6Pg'
