id,created_at,text1049342290022424576,2018-10-08 16:54:32,b'I make sense. Similar to my thoughts.'
1049334734898126850,2018-10-08 16:24:31,b'repeated malicious'
1049327197213741056,2018-10-08 15:54:34,b'Consider the meaning of the words. Who will do what is common sense?'
1049319635798044673,2018-10-08 15:24:31,b'You are dignified to unreasonable?'
1049312100743491584,2018-10-08 14:54:34,b'Scared'
1049304550207680512,2018-10-08 14:24:34,b'Fear'
1049297002083713024,2018-10-08 13:54:34,b'Worried'
1049289454362406912,2018-10-08 13:24:35,b'Who is it for?'
1049281897023471617,2018-10-08 12:54:33,b'People grow up sorrow repeatedly.'
1049274355396440064,2018-10-08 12:24:35,b'It is egoism. Maybe it can not be helped but as a human being. Now all the water in the soil. I think that should g\xe2\x80\xa6 https://t.co/O3FnnZ9ob6'
1049266809017315328,2018-10-08 11:54:36,"b'Meaningless life will stop, because it will not come back to the earth even die.'"
1049259259525967873,2018-10-08 11:24:36,b'Between dream and reality is drawn to hurt the love.'
1049251698936434688,2018-10-08 10:54:33,b'If something scared to reach out to anyone without'
1049244150275567616,2018-10-08 10:24:34,b'I believe the only pure love.'
1049236600297672704,2018-10-08 09:54:34,b'I want to keep at least a confirmation.'
1049229056267304960,2018-10-08 09:24:35,b'I wonder if it is correct as an educator.'
1049221507820347392,2018-10-08 08:54:35,b'It seems like a contradiction hate to commit a contradiction.'
1049213954394796032,2018-10-08 08:24:34,"b'What is a crime? Seems to be made \xe2\x80\x8b\xe2\x80\x8bof human egoism, such  ""sin"" to me.'"
1049206401996709888,2018-10-08 07:54:34,"b'But people will die, or that it can become meaningful in the soil through the fusion with the desire that we live?'"
1049198860298420224,2018-10-08 07:24:36,"b'""My answer is"" all would backfire somehow. What it will do this world?'"
1049191296412176384,2018-10-08 06:54:32,b'What I did we change? Is it pointless?'
1049183753841438720,2018-10-08 06:24:34,b'Pointless time flows.'
1049176210989768704,2018-10-08 05:54:36,b'Am I abnormal? I do not realize is everyone else?'
1049168664618885120,2018-10-08 05:24:36,"b'I could not sleep, he does not disappear from, I will not rest.'"
1049161099466002433,2018-10-08 04:54:33,b'I want to make sure you.'
1049153553334382592,2018-10-08 04:24:34,b'What do we love? What is a lie?'
1049146005378101254,2018-10-08 03:54:34,"b""I wonder why I'm here?"""
1049138463939780610,2018-10-08 03:24:36,"b'I will not cry, because I just get tired.'"
1049130902633082880,2018-10-08 02:54:33,b'I have people I want to give a thought as tethered with chains in the depths of the sea.'
1049123362948050945,2018-10-08 02:24:36,b'Every day I listen to my heart.'
1049115808142516224,2018-10-08 01:54:34,b'Feel uncomfortable gaze of anyone nor.'
1049108259871719424,2018-10-08 01:24:35,"b""It feels like it's impurities as salvation."""
1049100701190643712,2018-10-08 00:54:33,b'Salvation is not correct.'
1049093158095605760,2018-10-08 00:24:34,"b'But you will have to do something terrible to me, what should I have for you is better?'"
1049085611263451136,2018-10-07 23:54:35,"b""Now, I'm sad. Now, I'm suffering. Although I do not even know myself."""
1049078067493097472,2018-10-07 23:24:36,b'Now I want to live without knowing anything. From now on I want to continue to live without feeling anything.'
1049070503107813376,2018-10-07 22:54:33,b'Incident that happened in my head all.'
1049062941176164352,2018-10-07 22:24:30,"b'I do not know, I can around the.'"
1049055401373663232,2018-10-07 21:54:32,b'I am what I am. That much.'
1049047843959267329,2018-10-07 21:24:31,b'Nor should I move from.'
1049040301921206273,2018-10-07 20:54:32,b'I want to confine your.'
1049032740438335488,2018-10-07 20:24:30,b'I was always asking too.'
1049025202368086018,2018-10-07 19:54:32,b'What you got?'
1049017643024375808,2018-10-07 19:24:30,b'Seeking to convince all my remarks.'
1049010101145591808,2018-10-07 18:54:32,"b'Therefore, painful.'"
1049002543391506432,2018-10-07 18:24:30,b'Do not change the shape of love I was looking for.'
1048995013382664192,2018-10-07 17:54:35,b'I feel that I could be free I had to.'
1048987442152271872,2018-10-07 17:24:30,b'If I do not the proof of the existence.'
1048979901649321985,2018-10-07 16:54:32,b'I was created in this corrupt world.'
1048972351570731008,2018-10-07 16:24:32,b'Bad feeling.'
1048964812103774208,2018-10-07 15:54:34,b'Exists I want to ensure that it is not whether public.'
1048957244564365313,2018-10-07 15:24:30,b'I killed myself so to protect the common sense.'
1048949711892140032,2018-10-07 14:54:34,b'Those nasty things that come from outside.'
1048942162820263936,2018-10-07 14:24:34,b'It seems rather confusing to me what is the meaning.'
1048934610258735110,2018-10-07 13:54:34,b'Can not escape.'
1048927068824555520,2018-10-07 13:24:35,b'I want know a little bit inside of me.'
1048919512727269376,2018-10-07 12:54:34,b'so.'
1048911961256124419,2018-10-07 12:24:34,b'It is incomplete.'
1048904419822067712,2018-10-07 11:54:36,b'Do not know.'
1048896875271663616,2018-10-07 11:24:37,b'I also do not care what you think.'
1048889308667568128,2018-10-07 10:54:33,b'All of the world is self-satisfaction.'
1048881766168059904,2018-10-07 10:24:34,b'How do i live on such a field?'
1048874212566298624,2018-10-07 09:54:34,"b""I can't hang out this world."""
1048866665239207936,2018-10-07 09:24:34,b'This word is a flesh-and-blood human beings like me.'
1048859113508069376,2018-10-07 08:54:34,b'I hate.'
1048851565862240257,2018-10-07 08:24:34,b'I hate the world that there is a family of.'
1048844021634715650,2018-10-07 07:54:35,"b""I know I've let you down."""
1048836469995888640,2018-10-07 07:24:35,b'I do not feel is a good one but.'
1048828910819991552,2018-10-07 06:54:33,"b""You can't forget love \xef\xbc\x86 pride."""
1048821367628390400,2018-10-07 06:24:34,"b""what's done. is done it feels so bad."""
1048813819013689344,2018-10-07 05:54:35,b'I seem to be one of the relief is the end of you and me.'
1048806278720417796,2018-10-07 05:24:37,b'But it does not achieve.'
1048798711050993664,2018-10-07 04:54:33,"b'Also,because i love you because.'"
1048791167553290240,2018-10-07 04:24:34,b'I do not have place anywhere'
1048783618615595009,2018-10-07 03:54:34,b'But I also do not know the consequences of love\nDaughter and I have seen in a dream that even far future\n say I hat\xe2\x80\xa6 https://t.co/I5AzcBP426'
1048776077521248256,2018-10-07 03:24:36,b'This is the night I fled and I do not want to be bound by anyone\nI feel that I could be free I'
1048768518999535616,2018-10-07 02:54:34,b'We tremble not understand it or even what their presence'
1048760969462132736,2018-10-07 02:24:34,b'Adults who can not see eye to know even one of the heart'
1048753417068339200,2018-10-07 01:54:34,b'If it finds no escape'
1048745874426290177,2018-10-07 01:24:35,b'I wanted to break the door without feeling unfocused'
1048738309185236992,2018-10-07 00:54:32,b'I have a dream that does not reach.'
1048730772528492544,2018-10-07 00:24:35,"b""I see that I'm just outside of textbooks and graffiti"""
1048723222621904896,2018-10-06 23:54:35,"b'The cry of the heart of a frightened boy that sin and its meaning-seeking love and dreams, and to live the truth, t\xe2\x80\xa6 https://t.co/eYwYqy5DdL'"
1048715682508984322,2018-10-06 23:24:37,b'i was born to love you.'
1048708112973090817,2018-10-06 22:54:32,b'The kindness of the people. Love it. But sometimes become hate. Maybe I do not want to be so in love. Understand the cowardice.'
1048700550668201984,2018-10-06 22:24:29,"b'That make you feel uncomfortable I can not understand, how the people are pleasant to you?'"
1048693015542259713,2018-10-06 21:54:33,b'Not only you in my time'
1048685455430959106,2018-10-06 21:24:30,b'For you it is not for honor'
1048677915360018432,2018-10-06 20:54:33,b'Is there back. I do not know much.'
1048670353466089472,2018-10-06 20:24:30,"b""I'm not sure you've been taught in the classroom but have found over many things little by little"""
1048662815324565504,2018-10-06 19:54:33,b'There is a body of two mutually seek'
1048655253875253249,2018-10-06 19:24:30,"b""You're a precious and love regrettable"""
1048647711841374208,2018-10-06 18:54:32,b'Are you tempted me in general terms?'
1048640154775085056,2018-10-06 18:24:30,b'Do you say to act judging from the moment you cut the umbilical cord to me?'
1048632623440920576,2018-10-06 17:54:34,b'Responsibility.'
1048625054949367809,2018-10-06 17:24:30,"b""I think it's very important because often"""
1048617517277532160,2018-10-06 16:54:33,b'So I do not I wanted? So I do not feel it? Are you good to believe? Even me?'
1048609960483942401,2018-10-06 16:24:31,b'Temptation'
1048602418856910848,2018-10-06 15:54:33,"b""Even if you tell a joke, I would believe. You're a femme fatale."""
1048594859072794625,2018-10-06 15:24:31,"b'I like you, I might have become a little brisk walking.'"
1048587327650422784,2018-10-06 14:54:35,b'Do not wake up if a dream. I gently erase.'
1048579775328018432,2018-10-06 14:24:34,"b'I have in me that you died, what do I have in you?'"
1048572224951615488,2018-10-06 13:54:34,b'Yuku know what I feel like something that has touched you I will.'
1048564680132722688,2018-10-06 13:24:35,b'Not only shed tears worthless'
1048557120830885888,2018-10-06 12:54:33,b'Because I become anxious to hear the voice of his father. I ears with earphones. Endured.'
1048549574745309185,2018-10-06 12:24:34,b'I could not care less or respectability or face or life. I love you. And stay there.'
1048542031096627200,2018-10-06 11:54:35,b'I will give you all my love.'
1048534487095627776,2018-10-06 11:24:37,b'I want to go back to the appearance of the soil'
1048526920978128896,2018-10-06 10:54:33,"b'Therefore, painful.'"
1048519374691164160,2018-10-06 10:24:34,"b'If I evaluate and you, and you will say ""bad example"".'"
1048511824356765697,2018-10-06 09:54:33,"b'I simply tell the love, you and I would have times of confession of what you love.'"
1048504277428305920,2018-10-06 09:24:34,"b'Father, trauma, pressure, violence, prejudice, violence, trauma, pressure, pressure.'"
1048496726410125312,2018-10-06 08:54:34,b'Horrible hysterical crazy guy anyway. I was born from that kind of guy.'
1048489176549584897,2018-10-06 08:24:34,b'My mother ran away from home when I was much in elementary school. Because of the violence and the sexual desire of\xe2\x80\xa6 https://t.co/aX5O5H6RpB'
1048481625523159040,2018-10-06 07:54:34,b'My mother had an affair with another man. Do not mind me okay since. Do not be gentle.'
1048474082142957569,2018-10-06 07:24:35,b'Common sense with my brother was the same thing as prejudice. Prejudice to exist or will I have to recognize it?'
1048466528574701568,2018-10-06 06:54:34,b'The wrist of the elder sister still has a lot after the cut wrists.'
1048458978118627328,2018-10-06 06:24:34,b'Why I do not I mean? Would die of'
1048451435325575168,2018-10-06 05:54:36,"b""You may laugh with me the difference between the values. I do not want to think of you stupid. What's this?"""
1048443889890160640,2018-10-06 05:24:37,b'I can not understand people who you let yourself go. Even though it is the same person. I am aware that it is not emotional.'
1048436324095602688,2018-10-06 04:54:33,b'Love and wonder that libido? Love and wonder of living things? What about you?'
1048428779163463681,2018-10-06 04:24:34,"b'I do not want to end with the words ""convenient.""'"
1048421225096044544,2018-10-06 03:54:33,b'The force of public opinion cannot be resisted when permitted freely to be expressed. The agitation it produces must be submitted to.'
1048413690104401921,2018-10-06 03:24:36,b'I want to tell.'
1048406131347845120,2018-10-06 02:54:34,"b""I was a happy dream. I want to hold you here if that is allowed. The dirty, so I'm real though."""
1048398584268247040,2018-10-06 02:24:35,b'Defeated. Healthy instinct.'
1048391028422500352,2018-10-06 01:54:33,b'I want to dance wearing thy whole body.'
1048383486384427009,2018-10-06 01:24:35,"b""That 's not true."""
1048375925782409217,2018-10-06 00:54:33,"b'Fake, I have seen have a peek trembling Maybe I will. I can not see myself.'"
1048368383270432768,2018-10-06 00:24:34,b'May have been confined to common sense made the mind.'
1048360835972616192,2018-10-05 23:54:35,b'If you do not love whim! Because I become serious.'
1048353292659568641,2018-10-05 23:24:37,"b""I'm still. I want to leave. Shape because I had changed."""
1048345724163829762,2018-10-05 22:54:32,b'Exposed to a cold heart'
1048338166606745600,2018-10-05 22:24:30,b'Mistake that has been bonded to the complexity.'
1048330625822801920,2018-10-05 21:54:32,b'I make sense. Similar to my thoughts.'
1048323064415436800,2018-10-05 21:24:30,b'repeated malicious'
1048315529339887616,2018-10-05 20:54:33,b'Consider the meaning of the words. Who will do what is common sense?'
1048307967492333569,2018-10-05 20:24:30,b'You are dignified to unreasonable?'
1048300430311079936,2018-10-05 19:54:33,b'Scared'
1048292866311610368,2018-10-05 19:24:30,b'Fear'
1048285324411990016,2018-10-05 18:54:32,b'Worried'
1048277770147491845,2018-10-05 18:24:31,b'Who is it for?'
1048270232991674369,2018-10-05 17:54:34,b'People grow up sorrow repeatedly.'
1048262671550701568,2018-10-05 17:24:31,b'It is egoism. Maybe it can not be helped but as a human being. Now all the water in the soil. I think that should g\xe2\x80\xa6 https://t.co/P3uSYNHUJf'
1048255127230996480,2018-10-05 16:54:32,"b'Meaningless life will stop, because it will not come back to the earth even die.'"
1048247568394670082,2018-10-05 16:24:30,b'Between dream and reality is drawn to hurt the love.'
1048240038578806784,2018-10-05 15:54:35,b'If something scared to reach out to anyone without'
1048232469248364544,2018-10-05 15:24:30,b'I believe the only pure love.'
1048224936014180352,2018-10-05 14:54:34,b'I want to keep at least a confirmation.'
1048217389043572742,2018-10-05 14:24:35,b'I wonder if it is correct as an educator.'
1048209837987835906,2018-10-05 13:54:34,b'It seems like a contradiction hate to commit a contradiction.'
1048202293881921536,2018-10-05 13:24:36,"b'What is a crime? Seems to be made \xe2\x80\x8b\xe2\x80\x8bof human egoism, such  ""sin"" to me.'"
1048194734076751873,2018-10-05 12:54:33,"b'But people will die, or that it can become meaningful in the soil through the fusion with the desire that we live?'"
1048187188595253254,2018-10-05 12:24:34,"b'""My answer is"" all would backfire somehow. What it will do this world?'"
1048179642668969985,2018-10-05 11:54:35,b'What I did we change? Is it pointless?'
1048172099385212933,2018-10-05 11:24:37,b'Pointless time flows.'
1048164537487093760,2018-10-05 10:54:34,b'Am I abnormal? I do not realize is everyone else?'
1048156987257573376,2018-10-05 10:24:34,"b'I could not sleep, he does not disappear from, I will not rest.'"
1048149439372701696,2018-10-05 09:54:34,b'I want to make sure you.'
1048141894021070849,2018-10-05 09:24:35,b'What do we love? What is a lie?'
1048134335595835393,2018-10-05 08:54:33,"b""I wonder why I'm here?"""
1048126791817158656,2018-10-05 08:24:35,"b'I will not cry, because I just get tired.'"
1048119237263282178,2018-10-05 07:54:33,b'I have people I want to give a thought as tethered with chains in the depths of the sea.'
1048111693291651072,2018-10-05 07:24:35,b'Every day I listen to my heart.'
1048104134350581760,2018-10-05 06:54:33,b'Feel uncomfortable gaze of anyone nor.'
1048096591863734277,2018-10-05 06:24:34,"b""It feels like it's impurities as salvation."""
1048089042628141056,2018-10-05 05:54:34,b'Salvation is not correct.'
1048081498757185536,2018-10-05 05:24:36,"b'But you will have to do something terrible to me, what should I have for you is better?'"
1048073936649342976,2018-10-05 04:54:33,"b""Now, I'm sad. Now, I'm suffering. Although I do not even know myself."""
1048066391197114370,2018-10-05 04:24:34,b'Now I want to live without knowing anything. From now on I want to continue to live without feeling anything.'
1048058843366797312,2018-10-05 03:54:34,b'Incident that happened in my head all.'
1048051297591549953,2018-10-05 03:24:35,"b'I do not know, I can around the.'"
1048043737505443840,2018-10-05 02:54:33,b'I am what I am. That much.'
1048036195555401728,2018-10-05 02:24:35,b'Nor should I move from.'
1048028639470661632,2018-10-05 01:54:33,b'I want to confine your.'
1048021095490584576,2018-10-05 01:24:35,b'I was always asking too.'
1048013540282392576,2018-10-05 00:54:33,b'What you got?'
1048005990015152129,2018-10-05 00:24:33,b'Seeking to convince all my remarks.'
1047998446584528901,2018-10-04 23:54:35,"b'Therefore, painful.'"
1047990907583131649,2018-10-04 23:24:37,b'Do not change the shape of love I was looking for.'
1047983336424005633,2018-10-04 22:54:32,b'I feel that I could be free I had to.'
1047975780100132864,2018-10-04 22:24:31,b'If I do not the proof of the existence.'
1047968238284365824,2018-10-04 21:54:32,b'I was created in this corrupt world.'
1047960679418757120,2018-10-04 21:24:30,b'Bad feeling.'
1047953140937412608,2018-10-04 20:54:33,b'Exists I want to ensure that it is not whether public.'
1047945581908258817,2018-10-04 20:24:31,b'I killed myself so to protect the common sense.'
1047938041543716864,2018-10-04 19:54:33,b'Those nasty things that come from outside.'
1047930479469445120,2018-10-04 19:24:30,b'It seems rather confusing to me what is the meaning.'
1047922941243998208,2018-10-04 18:54:33,b'Can not escape.'
1047915377986945024,2018-10-04 18:24:30,b'I want know a little bit inside of me.'
1047907845969072128,2018-10-04 17:54:34,b'so.'
1047900278656126977,2018-10-04 17:24:30,b'It is incomplete.'
1047892741798031361,2018-10-04 16:54:33,b'Do not know.'
1047885181804113920,2018-10-04 16:24:30,b'I also do not care what you think.'
1047877647101964293,2018-10-04 15:54:34,b'All of the world is self-satisfaction.'
1047870087003176961,2018-10-04 15:24:31,b'How do i live on such a field?'
1047862550618984449,2018-10-04 14:54:35,"b""I can't hang out this world."""
1047855001165418497,2018-10-04 14:24:35,b'This word is a flesh-and-blood human beings like me.'
1047847451938369536,2018-10-04 13:54:35,b'I hate.'
1047839907522048001,2018-10-04 13:24:36,b'I hate the world that there is a family of.'
1047832347230367744,2018-10-04 12:54:34,"b""I know I've let you down."""
1047824801211924480,2018-10-04 12:24:34,b'I do not feel is a good one but.'
1047817253079605248,2018-10-04 11:54:35,"b""You can't forget love \xef\xbc\x86 pride."""
1047809712639508480,2018-10-04 11:24:37,"b""what's done. is done it feels so bad."""
1047802146052132864,2018-10-04 10:54:33,b'I seem to be one of the relief is the end of you and me.'
1047794601770147840,2018-10-04 10:24:34,b'But it does not achieve.'
1047787047870582785,2018-10-04 09:54:33,"b'Also,because i love you because.'"
1047779504154787840,2018-10-04 09:24:35,b'I do not have place anywhere'
1047771951664484353,2018-10-04 08:54:34,b'But I also do not know the consequences of love\nDaughter and I have seen in a dream that even far future\n say I hat\xe2\x80\xa6 https://t.co/JP0OS204mT'
1047764400289923072,2018-10-04 08:24:34,b'This is the night I fled and I do not want to be bound by anyone\nI feel that I could be free I'
1047756853201883136,2018-10-04 07:54:34,b'We tremble not understand it or even what their presence'
1047749306139045888,2018-10-04 07:24:35,b'Adults who can not see eye to know even one of the heart'
1047741745973215233,2018-10-04 06:54:32,b'If it finds no escape'
1047734205654884352,2018-10-04 06:24:35,b'I wanted to break the door without feeling unfocused'
1047726655517548544,2018-10-04 05:54:35,b'I have a dream that does not reach.'
1047719111944355840,2018-10-04 05:24:36,"b""I see that I'm just outside of textbooks and graffiti"""
1047711547600994304,2018-10-04 04:54:33,"b'The cry of the heart of a frightened boy that sin and its meaning-seeking love and dreams, and to live the truth, t\xe2\x80\xa6 https://t.co/FxOAyPDlrL'"
1047704004459819008,2018-10-04 04:24:34,b'i was born to love you.'
1047696455035568128,2018-10-04 03:54:34,b'The kindness of the people. Love it. But sometimes become hate. Maybe I do not want to be so in love. Understand the cowardice.'
1047688911969898496,2018-10-04 03:24:36,"b'That make you feel uncomfortable I can not understand, how the people are pleasant to you?'"
1047681353171386368,2018-10-04 02:54:34,b'Not only you in my time'
1047673804514717696,2018-10-04 02:24:34,b'For you it is not for honor'
1047666256373899264,2018-10-04 01:54:34,b'Is there back. I do not know much.'
1047658705796222977,2018-10-04 01:24:34,"b""I'm not sure you've been taught in the classroom but have found over many things little by little"""
1047651149505941504,2018-10-04 00:54:33,b'There is a body of two mutually seek'
1047643605760786432,2018-10-04 00:24:34,"b""You're a precious and love regrettable"""
1047636062061752320,2018-10-03 23:54:35,b'Are you tempted me in general terms?'
1047628517591212033,2018-10-03 23:24:37,b'Do you say to act judging from the moment you cut the umbilical cord to me?'
1047620948738727947,2018-10-03 22:54:32,b'Responsibility.'
1047613388589690880,2018-10-03 22:24:30,"b""I think it's very important because often"""
1047605848627798016,2018-10-03 21:54:32,b'So I do not I wanted? So I do not feel it? Are you good to believe? Even me?'
1047598291293065216,2018-10-03 21:24:30,b'Temptation'
1047590752052604928,2018-10-03 20:54:33,"b""Even if you tell a joke, I would believe. You're a femme fatale."""
1047583193845514240,2018-10-03 20:24:31,"b'I like you, I might have become a little brisk walking.'"
1047575652268830720,2018-10-03 19:54:33,b'Do not wake up if a dream. I gently erase.'
1047568092572745728,2018-10-03 19:24:30,"b'I have in me that you died, what do I have in you?'"
1047560552111693825,2018-10-03 18:54:33,b'Yuku know what I feel like something that has touched you I will.'
1047552991710998528,2018-10-03 18:24:30,b'Not only shed tears worthless'
1047545456866222080,2018-10-03 17:54:34,b'Because I become anxious to hear the voice of his father. I ears with earphones. Endured.'
1047537897132314624,2018-10-03 17:24:31,b'I could not care less or respectability or face or life. I love you. And stay there.'
1047530351814369281,2018-10-03 16:54:32,b'I will give you all my love.'
1047522798485139456,2018-10-03 16:24:31,b'I want to go back to the appearance of the soil'
1047515255859859457,2018-10-03 15:54:33,"b'Therefore, painful.'"
1047507694624493569,2018-10-03 15:24:30,"b'If I evaluate and you, and you will say ""bad example"".'"
1047500157850333184,2018-10-03 14:54:33,"b'I simply tell the love, you and I would have times of confession of what you love.'"
1047492616202244101,2018-10-03 14:24:35,"b'Father, trauma, pressure, violence, prejudice, violence, trauma, pressure, pressure.'"
1047485062525071361,2018-10-03 13:54:34,b'Horrible hysterical crazy guy anyway. I was born from that kind of guy.'
1047477515650924549,2018-10-03 13:24:35,b'My mother ran away from home when I was much in elementary school. Because of the violence and the sexual desire of\xe2\x80\xa6 https://t.co/vQWUKZsKVu'
1047469958844768256,2018-10-03 12:54:33,b'My mother had an affair with another man. Do not mind me okay since. Do not be gentle.'
1047462416366284801,2018-10-03 12:24:35,b'Common sense with my brother was the same thing as prejudice. Prejudice to exist or will I have to recognize it?'
1047454864047976448,2018-10-03 11:54:35,b'The wrist of the elder sister still has a lot after the cut wrists.'
1047447325373657089,2018-10-03 11:24:37,b'Why I do not I mean? Would die of'
1047439757947502592,2018-10-03 10:54:33,"b""You may laugh with me the difference between the values. I do not want to think of you stupid. What's this?"""
1047432213501865985,2018-10-03 10:24:34,b'I can not understand people who you let yourself go. Even though it is the same person. I am aware that it is not emotional.'
1047424661242314752,2018-10-03 09:54:34,b'Love and wonder that libido? Love and wonder of living things? What about you?'
1047417112547930113,2018-10-03 09:24:34,"b'I do not want to end with the words ""convenient.""'"
1047409565535326208,2018-10-03 08:54:35,b'The force of public opinion cannot be resisted when permitted freely to be expressed. The agitation it produces must be submitted to.'
1047402012042616832,2018-10-03 08:24:34,b'I want to tell.'
1047394462962343936,2018-10-03 07:54:34,"b""I was a happy dream. I want to hold you here if that is allowed. The dirty, so I'm real though."""
1047386917757571072,2018-10-03 07:24:35,b'Defeated. Healthy instinct.'
1047379360926158848,2018-10-03 06:54:33,b'I want to dance wearing thy whole body.'
1047371812399501313,2018-10-03 06:24:33,"b""That 's not true."""
1047364263507968000,2018-10-03 05:54:34,"b'Fake, I have seen have a peek trembling Maybe I will. I can not see myself.'"
1047356723160211456,2018-10-03 05:24:36,b'May have been confined to common sense made the mind.'
1047349162272935936,2018-10-03 04:54:33,b'If you do not love whim! Because I become serious.'
1047341615986012160,2018-10-03 04:24:34,"b""I'm still. I want to leave. Shape because I had changed."""
1047334068612788224,2018-10-03 03:54:35,b'Exposed to a cold heart'
1047326527782707206,2018-10-03 03:24:37,b'Mistake that has been bonded to the complexity.'
