id,created_at,text1055412292408434688,2018-10-25 10:54:33,b'I make sense. Similar to my thoughts.'
1055404745601372161,2018-10-25 10:24:34,b'repeated malicious'
1055397190636457985,2018-10-25 09:54:33,b'Consider the meaning of the words. Who will do what is common sense?'
1055389647180726272,2018-10-25 09:24:34,b'You are dignified to unreasonable?'
1055382094954737665,2018-10-25 08:54:34,b'Scared'
1055374546608345089,2018-10-25 08:24:34,b'Fear'
1055366993937760256,2018-10-25 07:54:33,b'Worried'
1055359452499501056,2018-10-25 07:24:35,b'Who is it for?'
1055351890626506752,2018-10-25 06:54:32,b'People grow up sorrow repeatedly.'
1055344348223561729,2018-10-25 06:24:34,b'It is egoism. Maybe it can not be helped but as a human being. Now all the water in the soil. I think that should g\xe2\x80\xa6 https://t.co/JOGNqvTZVQ'
1055336800099557378,2018-10-25 05:54:35,"b'Meaningless life will stop, because it will not come back to the earth even die.'"
1055329257184882688,2018-10-25 05:24:36,b'Between dream and reality is drawn to hurt the love.'
1055321689280536576,2018-10-25 04:54:32,b'If something scared to reach out to anyone without'
1055314147380932608,2018-10-25 04:24:34,b'I believe the only pure love.'
1055306594957705216,2018-10-25 03:54:33,b'I want to keep at least a confirmation.'
1055299054551232512,2018-10-25 03:24:35,b'I wonder if it is correct as an educator.'
1055291498177060866,2018-10-25 02:54:34,b'It seems like a contradiction hate to commit a contradiction.'
1055283953437827072,2018-10-25 02:24:35,"b'What is a crime? Seems to be made \xe2\x80\x8b\xe2\x80\x8bof human egoism, such  ""sin"" to me.'"
1055276395855638528,2018-10-25 01:54:33,"b'But people will die, or that it can become meaningful in the soil through the fusion with the desire that we live?'"
1055268850910998528,2018-10-25 01:24:34,"b'""My answer is"" all would backfire somehow. What it will do this world?'"
1055261293991538689,2018-10-25 00:54:32,b'What I did we change? Is it pointless?'
1055253747436216320,2018-10-25 00:24:33,b'Pointless time flows.'
1055246202302681088,2018-10-24 23:54:34,b'Am I abnormal? I do not realize is everyone else?'
1055238660025593857,2018-10-24 23:24:36,"b'I could not sleep, he does not disappear from, I will not rest.'"
1055231094784581632,2018-10-24 22:54:32,b'I want to make sure you.'
1055223534727753728,2018-10-24 22:24:30,b'What do we love? What is a lie?'
1055215995533484032,2018-10-24 21:54:32,"b""I wonder why I'm here?"""
1055208433564012544,2018-10-24 21:24:30,"b'I will not cry, because I just get tired.'"
1055200897905516544,2018-10-24 20:54:33,b'I have people I want to give a thought as tethered with chains in the depths of the sea.'
1055193334375841793,2018-10-24 20:24:30,b'Every day I listen to my heart.'
1055185797266042881,2018-10-24 19:54:33,b'Feel uncomfortable gaze of anyone nor.'
1055178237817511936,2018-10-24 19:24:30,"b""It feels like it's impurities as salvation."""
1055170695200555008,2018-10-24 18:54:32,b'Salvation is not correct.'
1055163138767613952,2018-10-24 18:24:30,"b'But you will have to do something terrible to me, what should I have for you is better?'"
1055155604354822144,2018-10-24 17:54:34,"b""Now, I'm sad. Now, I'm suffering. Although I do not even know myself."""
1055148038149160960,2018-10-24 17:24:30,b'Now I want to live without knowing anything. From now on I want to continue to live without feeling anything.'
1055140495981039616,2018-10-24 16:54:32,b'Incident that happened in my head all.'
1055132937753001984,2018-10-24 16:24:30,"b'I do not know, I can around the.'"
1055125402128011264,2018-10-24 15:54:33,b'I am what I am. That much.'
1055117837625253889,2018-10-24 15:24:30,b'Nor should I move from.'
1055110304487563265,2018-10-24 14:54:34,b'I want to confine your.'
1055102759962198016,2018-10-24 14:24:35,b'I was always asking too.'
1055095205236363265,2018-10-24 13:54:34,b'What you got?'
1055087660656558080,2018-10-24 13:24:35,b'Seeking to convince all my remarks.'
1055080103774834688,2018-10-24 12:54:33,"b'Therefore, painful.'"
1055072554933579776,2018-10-24 12:24:34,b'Do not change the shape of love I was looking for.'
1055065009242263552,2018-10-24 11:54:35,b'I feel that I could be free I had to.'
1055057467850145792,2018-10-24 11:24:37,b'If I do not the proof of the existence.'
1055049901069881349,2018-10-24 10:54:32,b'I was created in this corrupt world.'
1055042359270899712,2018-10-24 10:24:34,b'Bad feeling.'
1055034807929864192,2018-10-24 09:54:34,b'Exists I want to ensure that it is not whether public.'
1055027259415785472,2018-10-24 09:24:34,b'I killed myself so to protect the common sense.'
1055019719814733824,2018-10-24 08:54:37,b'Those nasty things that come from outside.'
1055012173326487552,2018-10-24 08:24:37,b'It seems rather confusing to me what is the meaning.'
1055004623151476736,2018-10-24 07:54:37,b'Can not escape.'
1054997078433251328,2018-10-24 07:24:39,b'I want know a little bit inside of me.'
1054989514974879745,2018-10-24 06:54:35,b'so.'
1054981971837927424,2018-10-24 06:24:37,b'It is incomplete.'
1054974422677942277,2018-10-24 05:54:37,b'Do not know.'
1054966884729266178,2018-10-24 05:24:40,b'I also do not care what you think.'
1054959328120238080,2018-10-24 04:54:38,b'All of the world is self-satisfaction.'
1054951774665302016,2018-10-24 04:24:37,b'How do i live on such a field?'
1054944222380523520,2018-10-24 03:54:37,"b""I can't hang out this world."""
1054936666622717952,2018-10-24 03:24:35,b'This word is a flesh-and-blood human beings like me.'
1054929108537270272,2018-10-24 02:54:33,b'I hate.'
1054921563684782081,2018-10-24 02:24:34,b'I hate the world that there is a family of.'
1054914013199384576,2018-10-24 01:54:34,"b""I know I've let you down."""
1054906463368298496,2018-10-24 01:24:34,b'I do not feel is a good one but.'
1054898908453728257,2018-10-24 00:54:33,"b""You can't forget love \xef\xbc\x86 pride."""
1054891361592201216,2018-10-24 00:24:34,"b""what's done. is done it feels so bad."""
1054883819554099200,2018-10-23 23:54:36,b'I seem to be one of the relief is the end of you and me.'
1054876270951989249,2018-10-23 23:24:36,b'But it does not achieve.'
1054868703991390208,2018-10-23 22:54:32,"b'Also,because i love you because.'"
1054861150096023552,2018-10-23 22:24:31,b'I do not have place anywhere'
1054853606384398336,2018-10-23 21:54:32,b'But I also do not know the consequences of love\nDaughter and I have seen in a dream that even far future\n say I hat\xe2\x80\xa6 https://t.co/oRH7LMogE0'
1054846046948405248,2018-10-23 21:24:30,b'This is the night I fled and I do not want to be bound by anyone\nI feel that I could be free I'
1054838508089556993,2018-10-23 20:54:32,b'We tremble not understand it or even what their presence'
1054830950104743936,2018-10-23 20:24:30,b'Adults who can not see eye to know even one of the heart'
1054823409748594688,2018-10-23 19:54:33,b'If it finds no escape'
1054815848932601856,2018-10-23 19:24:30,b'I wanted to break the door without feeling unfocused'
1054808307087491073,2018-10-23 18:54:32,b'I have a dream that does not reach.'
1054800751162142720,2018-10-23 18:24:30,"b""I see that I'm just outside of textbooks and graffiti"""
1054793215033860096,2018-10-23 17:54:34,"b'The cry of the heart of a frightened boy that sin and its meaning-seeking love and dreams, and to live the truth, t\xe2\x80\xa6 https://t.co/XwYu7rptFy'"
1054785648878510080,2018-10-23 17:24:30,b'i was born to love you.'
1054778108308414464,2018-10-23 16:54:32,b'The kindness of the people. Love it. But sometimes become hate. Maybe I do not want to be so in love. Understand the cowardice.'
1054770553179930624,2018-10-23 16:24:31,"b'That make you feel uncomfortable I can not understand, how the people are pleasant to you?'"
1054763012093956097,2018-10-23 15:54:33,b'Not only you in my time'
1054755453152837632,2018-10-23 15:24:31,b'For you it is not for honor'
1054747916475088897,2018-10-23 14:54:34,b'Is there back. I do not know much.'
1054740374072086528,2018-10-23 14:24:35,"b""I'm not sure you've been taught in the classroom but have found over many things little by little"""
1054732841593069570,2018-10-23 13:54:40,b'There is a body of two mutually seek'
1054725280038899712,2018-10-23 13:24:37,"b""You're a precious and love regrettable"""
1054717725115699200,2018-10-23 12:54:36,b'Are you tempted me in general terms?'
1054710164882747392,2018-10-23 12:24:33,b'Do you say to act judging from the moment you cut the umbilical cord to me?'
1054702618381975554,2018-10-23 11:54:34,b'Responsibility.'
1054695079170912256,2018-10-23 11:24:36,"b""I think it's very important because often"""
1054687513464303617,2018-10-23 10:54:33,b'So I do not I wanted? So I do not feel it? Are you good to believe? Even me?'
1054679967735308288,2018-10-23 10:24:33,b'Temptation'
1054672413248507904,2018-10-23 09:54:32,"b""Even if you tell a joke, I would believe. You're a femme fatale."""
1054664871470542849,2018-10-23 09:24:34,"b'I like you, I might have become a little brisk walking.'"
1054657321584930817,2018-10-23 08:54:34,b'Do not wake up if a dream. I gently erase.'
1054649769056858112,2018-10-23 08:24:34,"b'I have in me that you died, what do I have in you?'"
1054642219880079360,2018-10-23 07:54:34,b'Yuku know what I feel like something that has touched you I will.'
1054634674641788933,2018-10-23 07:24:35,b'Not only shed tears worthless'
1054627112886255616,2018-10-23 06:54:32,b'Because I become anxious to hear the voice of his father. I ears with earphones. Endured.'
1054619571879989248,2018-10-23 06:24:34,b'I could not care less or respectability or face or life. I love you. And stay there.'
1054612027446976512,2018-10-23 05:54:35,b'I will give you all my love.'
1054604479016841216,2018-10-23 05:24:36,b'I want to go back to the appearance of the soil'
1054596915625521152,2018-10-23 04:54:32,"b'Therefore, painful.'"
1054589372547264514,2018-10-23 04:24:34,"b'If I evaluate and you, and you will say ""bad example"".'"
1054581826491039744,2018-10-23 03:54:35,"b'I simply tell the love, you and I would have times of confession of what you love.'"
1054574282645229570,2018-10-23 03:24:36,"b'Father, trauma, pressure, violence, prejudice, violence, trauma, pressure, pressure.'"
1054566724031283200,2018-10-23 02:54:34,b'Horrible hysterical crazy guy anyway. I was born from that kind of guy.'
1054559174925807616,2018-10-23 02:24:34,b'My mother ran away from home when I was much in elementary school. Because of the violence and the sexual desire of\xe2\x80\xa6 https://t.co/zNYT3KYKKc'
1054551620770361345,2018-10-23 01:54:33,b'My mother had an affair with another man. Do not mind me okay since. Do not be gentle.'
1054544080309350400,2018-10-23 01:24:35,b'Common sense with my brother was the same thing as prejudice. Prejudice to exist or will I have to recognize it?'
1054536520021925888,2018-10-23 00:54:33,b'The wrist of the elder sister still has a lot after the cut wrists.'
1054528974326353920,2018-10-23 00:24:34,b'Why I do not I mean? Would die of'
1054521431520768000,2018-10-22 23:54:35,"b""You may laugh with me the difference between the values. I do not want to think of you stupid. What's this?"""
1054513886861258752,2018-10-22 23:24:37,b'I can not understand people who you let yourself go. Even though it is the same person. I am aware that it is not emotional.'
1054506323633569792,2018-10-22 22:54:33,b'Love and wonder that libido? Love and wonder of living things? What about you?'
1054498760368152577,2018-10-22 22:24:30,"b'I do not want to end with the words ""convenient.""'"
1054491221698084864,2018-10-22 21:54:33,b'The force of public opinion cannot be resisted when permitted freely to be expressed. The agitation it produces must be submitted to.'
1054483656968876032,2018-10-22 21:24:29,b'I want to tell.'
1054476122245611520,2018-10-22 20:54:33,"b""I was a happy dream. I want to hold you here if that is allowed. The dirty, so I'm real though."""
1054468559152107520,2018-10-22 20:24:30,b'Defeated. Healthy instinct.'
1054461020113002496,2018-10-22 19:54:32,b'I want to dance wearing thy whole body.'
1054453459255062528,2018-10-22 19:24:30,"b""That 's not true."""
1054445914989912065,2018-10-22 18:54:31,"b'Fake, I have seen have a peek trembling Maybe I will. I can not see myself.'"
1054438360436006912,2018-10-22 18:24:30,b'May have been confined to common sense made the mind.'
1054430828057382917,2018-10-22 17:54:34,b'If you do not love whim! Because I become serious.'
1054423260165623815,2018-10-22 17:24:30,"b""I'm still. I want to leave. Shape because I had changed."""
1054415718907662337,2018-10-22 16:54:32,b'Exposed to a cold heart'
1054408162789343232,2018-10-22 16:24:30,b'Mistake that has been bonded to the complexity.'
1054400630024851456,2018-10-22 15:54:34,b'I make sense. Similar to my thoughts.'
1054393062053433345,2018-10-22 15:24:30,b'repeated malicious'
1054385529528012800,2018-10-22 14:54:34,b'Consider the meaning of the words. Who will do what is common sense?'
1054377980049350656,2018-10-22 14:24:34,b'You are dignified to unreasonable?'
1054370427789660161,2018-10-22 13:54:33,b'Scared'
1054362884547866629,2018-10-22 13:24:35,b'Fear'
1054355334913912835,2018-10-22 12:54:35,b'Worried'
1054347779718340608,2018-10-22 12:24:34,b'Who is it for?'
1054340238192009221,2018-10-22 11:54:36,b'People grow up sorrow repeatedly.'
1054332714713825286,2018-10-22 11:24:42,b'It is egoism. Maybe it can not be helped but as a human being. Now all the water in the soil. I think that should g\xe2\x80\xa6 https://t.co/ZNbU8Uk91R'
1054325129142984704,2018-10-22 10:54:33,"b'Meaningless life will stop, because it will not come back to the earth even die.'"
1054317582352711681,2018-10-22 10:24:34,b'Between dream and reality is drawn to hurt the love.'
1054310027874291717,2018-10-22 09:54:33,b'If something scared to reach out to anyone without'
1054302485211308032,2018-10-22 09:24:35,b'I believe the only pure love.'
1054294931404025856,2018-10-22 08:54:34,b'I want to keep at least a confirmation.'
1054287385544904704,2018-10-22 08:24:35,b'I wonder if it is correct as an educator.'
1054279834552086529,2018-10-22 07:54:34,b'It seems like a contradiction hate to commit a contradiction.'
1054272285148758016,2018-10-22 07:24:34,"b'What is a crime? Seems to be made \xe2\x80\x8b\xe2\x80\x8bof human egoism, such  ""sin"" to me.'"
1054264726983606272,2018-10-22 06:54:32,"b'But people will die, or that it can become meaningful in the soil through the fusion with the desire that we live?'"
1054257186170265611,2018-10-22 06:24:34,"b'""My answer is"" all would backfire somehow. What it will do this world?'"
1054249632199467008,2018-10-22 05:54:33,b'What I did we change? Is it pointless?'
1054242093629984771,2018-10-22 05:24:36,b'Pointless time flows.'
1054234527579570176,2018-10-22 04:54:32,b'Am I abnormal? I do not realize is everyone else?'
1054226983977082880,2018-10-22 04:24:34,"b'I could not sleep, he does not disappear from, I will not rest.'"
1054219433537720321,2018-10-22 03:54:34,b'I want to make sure you.'
1054211889536753664,2018-10-22 03:24:35,b'What do we love? What is a lie?'
1054204337725919232,2018-10-22 02:54:34,"b""I wonder why I'm here?"""
1054196787689357312,2018-10-22 02:24:34,"b'I will not cry, because I just get tired.'"
1054189235064889344,2018-10-22 01:54:34,b'I have people I want to give a thought as tethered with chains in the depths of the sea.'
1054181686441795585,2018-10-22 01:24:34,b'Every day I listen to my heart.'
1054174134786093058,2018-10-22 00:54:33,b'Feel uncomfortable gaze of anyone nor.'
1054166585328381954,2018-10-22 00:24:34,"b""It feels like it's impurities as salvation."""
1054159039607656448,2018-10-21 23:54:35,b'Salvation is not correct.'
1054151495841538048,2018-10-21 23:24:36,"b'But you will have to do something terrible to me, what should I have for you is better?'"
1054143929019326464,2018-10-21 22:54:32,"b""Now, I'm sad. Now, I'm suffering. Although I do not even know myself."""
1054136373194633216,2018-10-21 22:24:30,b'Now I want to live without knowing anything. From now on I want to continue to live without feeling anything.'
1054128831215230976,2018-10-21 21:54:32,b'Incident that happened in my head all.'
1054121271896694785,2018-10-21 21:24:30,"b'I do not know, I can around the.'"
1054113731200745472,2018-10-21 20:54:32,b'I am what I am. That much.'
1054106173027172352,2018-10-21 20:24:30,b'Nor should I move from.'
1054098634394882048,2018-10-21 19:54:33,b'I want to confine your.'
1054091070181597184,2018-10-21 19:24:29,b'I was always asking too.'
1054083532186836992,2018-10-21 18:54:32,b'What you got?'
1054075973782528000,2018-10-21 18:24:30,b'Seeking to convince all my remarks.'
1054068436068777984,2018-10-21 17:54:33,"b'Therefore, painful.'"
1054060874107777024,2018-10-21 17:24:30,b'Do not change the shape of love I was looking for.'
1054053335957827585,2018-10-21 16:54:33,b'I feel that I could be free I had to.'
1054045773908729857,2018-10-21 16:24:30,b'If I do not the proof of the existence.'
1054038237637820416,2018-10-21 15:54:33,b'I was created in this corrupt world.'
1054030678247923713,2018-10-21 15:24:31,b'Bad feeling.'
1054023142774005760,2018-10-21 14:54:34,b'Exists I want to ensure that it is not whether public.'
1054015595295989760,2018-10-21 14:24:35,b'I killed myself so to protect the common sense.'
1054008036866482176,2018-10-21 13:54:33,b'Those nasty things that come from outside.'
1054000494857736194,2018-10-21 13:24:35,b'It seems rather confusing to me what is the meaning.'
1053992941117595650,2018-10-21 12:54:34,b'Can not escape.'
1053985390888083458,2018-10-21 12:24:33,b'I want know a little bit inside of me.'
1053977851567849472,2018-10-21 11:54:36,b'so.'
1053970303309606912,2018-10-21 11:24:36,b'It is incomplete.'
1053962736554565632,2018-10-21 10:54:32,b'Do not know.'
1053955193249779713,2018-10-21 10:24:34,b'I also do not care what you think.'
1053947639031418880,2018-10-21 09:54:33,b'All of the world is self-satisfaction.'
1053940097475702785,2018-10-21 09:24:35,b'How do i live on such a field?'
1053932543416819712,2018-10-21 08:54:34,"b""I can't hang out this world."""
1053924992071622656,2018-10-21 08:24:33,b'This word is a flesh-and-blood human beings like me.'
1053917443297439746,2018-10-21 07:54:33,b'I hate.'
1053909899363532800,2018-10-21 07:24:35,b'I hate the world that there is a family of.'
1053902342850891776,2018-10-21 06:54:33,"b""I know I've let you down."""
1053894795960102914,2018-10-21 06:24:34,b'I do not feel is a good one but.'
1053887248314249216,2018-10-21 05:54:34,"b""You can't forget love \xef\xbc\x86 pride."""
1053879704543879175,2018-10-21 05:24:36,"b""what's done. is done it feels so bad."""
1053872143493038080,2018-10-21 04:54:33,b'I seem to be one of the relief is the end of you and me.'
1053864594957979649,2018-10-21 04:24:33,b'But it does not achieve.'
1053857041742090240,2018-10-21 03:54:33,"b'Also,because i love you because.'"
1053849504284176384,2018-10-21 03:24:36,b'I do not have place anywhere'
1053841943334084608,2018-10-21 02:54:33,b'But I also do not know the consequences of love\nDaughter and I have seen in a dream that even far future\n say I hat\xe2\x80\xa6 https://t.co/tUQ0ekMzi4'
1053834399647559680,2018-10-21 02:24:34,b'This is the night I fled and I do not want to be bound by anyone\nI feel that I could be free I'
1053826847459274752,2018-10-21 01:54:34,b'We tremble not understand it or even what their presence'
1053819300522258432,2018-10-21 01:24:34,b'Adults who can not see eye to know even one of the heart'
1053811745406431232,2018-10-21 00:54:33,b'If it finds no escape'
1053804194409271297,2018-10-21 00:24:33,b'I wanted to break the door without feeling unfocused'
1053796650798407680,2018-10-20 23:54:34,b'I have a dream that does not reach.'
1053789110291259392,2018-10-20 23:24:37,"b""I see that I'm just outside of textbooks and graffiti"""
1053781542449737728,2018-10-20 22:54:32,"b'The cry of the heart of a frightened boy that sin and its meaning-seeking love and dreams, and to live the truth, t\xe2\x80\xa6 https://t.co/jlw71FUHvA'"
1053773982204231680,2018-10-20 22:24:30,b'i was born to love you.'
1053766442330378240,2018-10-20 21:54:32,b'The kindness of the people. Love it. But sometimes become hate. Maybe I do not want to be so in love. Understand the cowardice.'
1053758883963916289,2018-10-20 21:24:30,"b'That make you feel uncomfortable I can not understand, how the people are pleasant to you?'"
1053751347311337472,2018-10-20 20:54:33,b'Not only you in my time'
1053743783307702272,2018-10-20 20:24:30,b'For you it is not for honor'
1053736245820444672,2018-10-20 19:54:33,b'Is there back. I do not know much.'
1053728686417956864,2018-10-20 19:24:30,"b""I'm not sure you've been taught in the classroom but have found over many things little by little"""
1053721140747628544,2018-10-20 18:54:31,b'There is a body of two mutually seek'
1053713584604073984,2018-10-20 18:24:30,"b""You're a precious and love regrettable"""
1053706050690408449,2018-10-20 17:54:34,b'Are you tempted me in general terms?'
1053698488020557825,2018-10-20 17:24:30,b'Do you say to act judging from the moment you cut the umbilical cord to me?'
1053690946653630464,2018-10-20 16:54:32,b'Responsibility.'
1053683387314057216,2018-10-20 16:24:30,"b""I think it's very important because often"""
1053675853479964677,2018-10-20 15:54:34,b'So I do not I wanted? So I do not feel it? Are you good to believe? Even me?'
1053668290424258560,2018-10-20 15:24:31,b'Temptation'
1053660751041200129,2018-10-20 14:54:33,"b""Even if you tell a joke, I would believe. You're a femme fatale."""
1053653205333114880,2018-10-20 14:24:34,"b'I like you, I might have become a little brisk walking.'"
1053645653589450758,2018-10-20 13:54:34,b'Do not wake up if a dream. I gently erase.'
1053638106895679489,2018-10-20 13:24:34,"b'I have in me that you died, what do I have in you?'"
1053630553105162240,2018-10-20 12:54:34,b'Yuku know what I feel like something that has touched you I will.'
1053623006738636800,2018-10-20 12:24:34,b'Not only shed tears worthless'
1053615457142329344,2018-10-20 11:54:34,b'Because I become anxious to hear the voice of his father. I ears with earphones. Endured.'
1053607913669816321,2018-10-20 11:24:36,b'I could not care less or respectability or face or life. I love you. And stay there.'
1053600349699731456,2018-10-20 10:54:32,b'I will give you all my love.'
1053592805115719682,2018-10-20 10:24:34,b'I want to go back to the appearance of the soil'
1053585256844947456,2018-10-20 09:54:34,"b'Therefore, painful.'"
1053577708033081344,2018-10-20 09:24:34,"b'If I evaluate and you, and you will say ""bad example"".'"
1053570154737496064,2018-10-20 08:54:33,"b'I simply tell the love, you and I would have times of confession of what you love.'"
1053562605153861632,2018-10-20 08:24:33,"b'Father, trauma, pressure, violence, prejudice, violence, trauma, pressure, pressure.'"
1053555058120384512,2018-10-20 07:54:34,b'Horrible hysterical crazy guy anyway. I was born from that kind of guy.'
1053547510348673024,2018-10-20 07:24:35,b'My mother ran away from home when I was much in elementary school. Because of the violence and the sexual desire of\xe2\x80\xa6 https://t.co/f4KCTomZoP'
1053539951671832577,2018-10-20 06:54:32,b'My mother had an affair with another man. Do not mind me okay since. Do not be gentle.'
1053532407670820864,2018-10-20 06:24:34,b'Common sense with my brother was the same thing as prejudice. Prejudice to exist or will I have to recognize it?'
1053524861941760000,2018-10-20 05:54:35,b'The wrist of the elder sister still has a lot after the cut wrists.'
1053517314841169920,2018-10-20 05:24:35,b'Why I do not I mean? Would die of'
1053509753735806976,2018-10-20 04:54:33,"b""You may laugh with me the difference between the values. I do not want to think of you stupid. What's this?"""
1053502207616724993,2018-10-20 04:24:34,b'I can not understand people who you let yourself go. Even though it is the same person. I am aware that it is not emotional.'
1053494655776567296,2018-10-20 03:54:33,b'Love and wonder that libido? Love and wonder of living things? What about you?'
1053487112790528000,2018-10-20 03:24:35,"b'I do not want to end with the words ""convenient.""'"
1053479559989944321,2018-10-20 02:54:34,b'The force of public opinion cannot be resisted when permitted freely to be expressed. The agitation it produces must be submitted to.'
1053472012922830848,2018-10-20 02:24:35,b'I want to tell.'
1053464458490634240,2018-10-20 01:54:33,"b""I was a happy dream. I want to hold you here if that is allowed. The dirty, so I'm real though."""
1053456911704612864,2018-10-20 01:24:34,b'Defeated. Healthy instinct.'
1053449358178283520,2018-10-20 00:54:33,b'I want to dance wearing thy whole body.'
1053441809823592448,2018-10-20 00:24:34,"b""That 's not true."""
1053434265986191360,2018-10-19 23:54:35,"b'Fake, I have seen have a peek trembling Maybe I will. I can not see myself.'"
1053426721758707712,2018-10-19 23:24:36,b'May have been confined to common sense made the mind.'
1053419154315739138,2018-10-19 22:54:32,b'If you do not love whim! Because I become serious.'
1053411594309259264,2018-10-19 22:24:30,"b""I'm still. I want to leave. Shape because I had changed."""
1053404055983185920,2018-10-19 21:54:32,b'Exposed to a cold heart'
1053396494273806336,2018-10-19 21:24:30,b'Mistake that has been bonded to the complexity.'
