id,created_at,text
1066556424434737153,2018-11-25 04:57:21,b'Also it\xe2\x80\x99s like nothing I do makes me feel attractive any more. I don\xe2\x80\x99t know why.... I just don\xe2\x80\x99t feel like myself.\xe2\x80\xa6 https://t.co/ebWBiN5fdC'
1066554919799406592,2018-11-25 04:51:23,b'My own shelf shittiness is making me messed up again. Why can\xe2\x80\x99t my brain just work normal and not overreact to ever little thing ever \xf0\x9f\x98\x9e'
1064969793835593730,2018-11-20 19:52:39,b'Also why do men try to lie to women all the time?! Like have you ever lied to a woman and gotten away with it forev\xe2\x80\xa6 https://t.co/lgbsgIkcQE'
1064968761910939650,2018-11-20 19:48:33,"b'Something I will never understand about some men is, they could have the best chick out here, who does everything f\xe2\x80\xa6 https://t.co/FQMRCvz62A'"
1064868921545768960,2018-11-20 13:11:49,b'If you ever feel like you don\xe2\x80\x99t have enough stress in your life and you want to be constantly stressed out all the\xe2\x80\xa6 https://t.co/MY8IAQWNwm'
1064666962008178688,2018-11-19 23:49:18,b'Whoever is putting hexes on me will you please stop?! I am like already emotionally exhausted and crying and it\xe2\x80\x99s o\xe2\x80\xa6 https://t.co/NrGQp1kD4n'
1064185575597592581,2018-11-18 15:56:27,b'Down side of having a really fun girls night downtown is waking up the next day and having to continue moving when\xe2\x80\xa6 https://t.co/oClRJZLflG'
1063650956334764032,2018-11-17 04:32:04,b'I swear to you if one more person gets engaged this week im going to lose it..... \xf0\x9f\x98\x82\xf0\x9f\x99\x8f\xf0\x9f\x8f\xbb'
1062911852047491072,2018-11-15 03:35:08,b'Well it\xe2\x80\x99s safe to say my self esteem has hit rock bottom for now. \xf0\x9f\x98\xa5 #thisisgonnahurtawhile #beingagirlsucks #youreneverenough'
1062540025974415360,2018-11-14 02:57:37,b'So sick of packing all my shit into my car just so I can unpack it again after a 15min drive. Why is moving so damn\xe2\x80\xa6 https://t.co/tYxydsKM1s'
1059274680954220544,2018-11-05 02:42:18,b'So close to being done painting at our house.... I will be happy to never pick up a paint brush again in my life \xf0\x9f\x8f\xa1\xf0\x9f\x98\xa9'
1057090611910795266,2018-10-30 02:03:36,b'I\xe2\x80\x99m so stressed about getting our house done it legit keeps me up at night. I can\xe2\x80\x99t even be stressed about work any\xe2\x80\xa6 https://t.co/IrPDjYvTri'
1056340758553415680,2018-10-28 00:23:57,b'Well after years of random people calling me \xe2\x80\x9cgothic\xe2\x80\x9d just because I have black hair I\xe2\x80\x99m finally gonna make all the\xe2\x80\xa6 https://t.co/t2qknaFSoq'
1055550973467394048,2018-10-25 20:05:37,b'Can\xe2\x80\x99t wait to get off work so I can go do more work at my own house \xf0\x9f\x99\x83\xf0\x9f\x99\x83 it never ends for real. Don\xe2\x80\x99t think I\xe2\x80\x99ve sat\xe2\x80\xa6 https://t.co/Guzum9nEc4'
1054149040546430976,2018-10-21 23:14:51,"b'And to top off one of the worst weeks I\xe2\x80\x99ve ever had, I went to take a nice relaxing bath and caught a pretty large\xe2\x80\xa6 https://t.co/nOd2fzEGSF'"
1053841411320266752,2018-10-21 02:52:26,b'@brittmorgannnnn My arms feel like they\xe2\x80\x99re ready to snap off \xf0\x9f\x99\x83\xf0\x9f\x99\x83'
1053814287154724864,2018-10-21 01:04:39,"b'Buy a house they said, it\xe2\x80\x99ll be fun they said..... spends from 8am to 8pm there working on it and looks like I didn\xe2\x80\xa6 https://t.co/Eflc7kMSAd'"
1052693374715777025,2018-10-17 22:50:33,"b'Physically, mentally, emotionally I am just tapped out right now. I am taking a break from life pretty much. Maybe\xe2\x80\xa6 https://t.co/2k7lUjAb23'"
1052396005671489536,2018-10-17 03:08:54,"b'I am really struggling right now with many things in my life...... I have not felt this way in a long time, but I a\xe2\x80\xa6 https://t.co/EgLRNYn5ne'"
1051922473317470208,2018-10-15 19:47:16,b'Historically having the worst two days of my life. My heart is rubbed raw..... \xf0\x9f\x92\x94'
1051847260609437705,2018-10-15 14:48:23,"b'It\xe2\x80\x99s cold outside, I am sad today, I am not getting out of bed. I just don\xe2\x80\x99t feel like being a part of the world today \xf0\x9f\x98\x9e'"
1051670896572817408,2018-10-15 03:07:35,b'Today we lost my meme (grandma) to dementia. The last 10+ years have been so hard for you and I\xe2\x80\x99m sad but at peace\xe2\x80\xa6 https://t.co/w9nvKM8ik1'
1049836541349113856,2018-10-10 01:38:31,"b'I love cooking dinner with you every night, I love cuddling and watching our shows together, I love that you\xe2\x80\x99re my\xe2\x80\xa6 https://t.co/7UYI2YPK4S'"
1045821446080135173,2018-09-28 23:43:57,b'Today was a perfect fall day. Sunny but cool. Love this time of year \xf0\x9f\x8d\x82\xe2\x98\x80\xef\xb8\x8f\xe2\x9d\xa4\xef\xb8\x8f'
1045357383772491776,2018-09-27 16:59:56,b'I\xe2\x80\x99m stressed about packing when I haven\xe2\x80\x99t even started packing yet..... #beginingoftheend #2moreweeks #herewego \xf0\x9f\x99\x8f\xf0\x9f\x8f\xbb\xe2\x9d\xa4\xef\xb8\x8f'
1043702973048729600,2018-09-23 03:25:54,b'At the end of the day my brother and his new wife Katie had a wonderful wedding. So happy for them both. Loved bein\xe2\x80\xa6 https://t.co/XARYmiT1MC'
1037527044639338496,2018-09-06 02:24:58,b'And just like that everything is ruined again.... such is my life I guess \xf0\x9f\xa4\xb7\xf0\x9f\x8f\xbb\xe2\x80\x8d\xe2\x99\x80\xef\xb8\x8f\xf0\x9f\x98\x9e'
1037159310533558277,2018-09-05 02:03:43,b'It may be lame but.....\nAdd me on Pok\xc3\xa9mon GO! #pokemongo #friendcode #addme https://t.co/5PGRqhMlKy'
1035725964376981505,2018-09-01 03:08:07,b'All I can say is AHHHHHHHH! We did it \xf0\x9f\x98\x81\xe2\x9d\xa4\xef\xb8\x8f #soexcited #cantevenbelieveit #loveyou #cantwait #newadventures'
1034891282932555777,2018-08-29 19:51:23,b'BIG things happening in my life today! Fingers crossed for the future \xe2\x9d\xa4\xef\xb8\x8f\xf0\x9f\x8f\xa1 #excited #youandme'
1034263353995284481,2018-08-28 02:16:13,b'I need to just take a break from life atm. Like I am about at my breaking point currently. Everything is stressing\xe2\x80\xa6 https://t.co/tKJuvBmoNQ'
1033175084394000384,2018-08-25 02:11:50,b'Honestly can\xe2\x80\x99t wait for my boyfriend to be back from his business trip. It\xe2\x80\x99s been lonely here and this is the longe\xe2\x80\xa6 https://t.co/tb1bqU8AYN'
1032100430195707904,2018-08-22 03:01:32,b'The fact that you still call me to say goodnight and I love you when your away \xe2\x9d\xa4\xef\xb8\x8f #mywholeheart #iloveyoubabe #happytweet #goodnightworld'
1030859632166748165,2018-08-18 16:51:03,b'It\xe2\x80\x99s a curl up on the couch and watch murder shows type of Saturday \xf0\x9f\x91\x8c\xf0\x9f\x8f\xbb\xf0\x9f\x94\xaa\xe2\x9d\xa4\xef\xb8\x8f'
1029197676884066305,2018-08-14 02:47:02,b'Really you\xe2\x80\x99re starting to irritate the piss out of me. Grow up for once in your life and make a decision about something on your own.......'
1028459222772736000,2018-08-12 01:52:41,b'Why is it every time I about to go out for drinks and girls night I end up in a terrible ass mood? Hope I can get over this \xf0\x9f\xa4\x94\xf0\x9f\x99\x84'
1023563182667952128,2018-07-29 13:37:34,b'Yesterday was really good. Went to my big brothers wedding shower. My boyfriend drove 3 hours there to surprise me\xe2\x80\xa6 https://t.co/rNyrb9BeDV'
1015567121294745600,2018-07-07 12:04:04,b'RT @zachbraff: Arrested Development Narrator: \n\xe2\x80\x9cIt wasn\xe2\x80\x99t.\xe2\x80\x9d https://t.co/Dq0FPtiELF'
1015566581928259584,2018-07-07 12:01:56,b'@SammiSweetheart @KylieMarie did Sammy sweetheart get married to Gil \xf0\x9f\x98\x82\xf0\x9f\x98\x82\xf0\x9f\x98\x82 #realtalk'
1015565733475086336,2018-07-07 11:58:33,b'Taking my beeb sister to the zoo today. It has been such a fun weekend already having her here. Makes me wish we we\xe2\x80\xa6 https://t.co/Y7XghtIlVw'
1012881835028819969,2018-06-30 02:13:42,b'I really feel like I will never be 100% happy. And it makes me feel like what is even the point then?'
1008897582154878978,2018-06-19 02:21:42,"b'Words do not even adequately describe how terrible this day was. So went to trade my car in, popped my tire within\xe2\x80\xa6 https://t.co/dfO775Aamu'"
1008800264797728771,2018-06-18 19:55:00,b'Can\xe2\x80\x99t wait to go pick up my brand new car after work. Loved my old Mazda it was just so unlucky....'
1008321765716656128,2018-06-17 12:13:37,b'Do to a series of unfortunate events I traded in Miguel the Cx-5 Mazda yesterday to get a brand new CX-5 which I wi\xe2\x80\xa6 https://t.co/6bqJ8Yd1qX'
1006513653812813824,2018-06-12 12:28:49,b'FML.... second time in less then a year someone hit my PARKED CAR! Drunk driver hit the car behind me slammed it in\xe2\x80\xa6 https://t.co/68yANhRMhi'
1004561437308653569,2018-06-07 03:11:25,b'Much needed girls shopping trip with my fav girlfriend. What a good hump day \xf0\x9f\x92\x95\xf0\x9f\x9b\x8d'
995850637438046208,2018-05-14 02:17:48,b'My heart is heavy and my head is racing. I don\xe2\x80\x99t even know what I want anymore. Just feels like no matter what I do I lose \xf0\x9f\x98\x9e\xf0\x9f\x92\x94'
989319992175923201,2018-04-26 01:47:21,b'Cavs finish was insane tonight! \xf0\x9f\x8f\x86\xf0\x9f\x8f\x80'
988918990767575041,2018-04-24 23:13:55,b'Am I really this unhappy right now or is my mental health really that shitty? #theplotthickens'
986409993120440325,2018-04-18 01:04:03,b'Well that kind of ruined my day. Sometimes it\xe2\x80\x99s like you take 1 step forward and 3 steps back. It\xe2\x80\x99s really frustrating honestly....'
985644613913505792,2018-04-15 22:22:43,b'Went to see A Quiet Place last night and I have to say I was truly impressed. Sometimes it was so suspenseful I was\xe2\x80\xa6 https://t.co/BRGQz9IfSG'
983898446720577536,2018-04-11 02:44:04,b'Been feeling really bad about myself and wish I could snap out of it. Gaining 10 pounds isn\xe2\x80\x99t a huge deal but my br\xe2\x80\xa6 https://t.co/QxbHfCZp0e'
983101260189618176,2018-04-08 21:56:20,b'Legit Marcus is the best boyfriend ever. Knows I love taking baths and haven\xe2\x80\x99t been able to do it for a while cause\xe2\x80\xa6 https://t.co/GqJ24dpC79'
982682892542332928,2018-04-07 18:13:53,b'Can\xe2\x80\x99t wait to go out with my girls tonight. Haven\xe2\x80\x99t had a girls night in so long \xf0\x9f\x91\xaf\xe2\x80\x8d\xe2\x99\x80\xef\xb8\x8f\xf0\x9f\x92\x95\xf0\x9f\x8d\xb9'
981504019293179904,2018-04-04 12:09:28,b'Feeling sluggish and blah. Really thankful my babe has been cuddling me and spoiling me cause he\xe2\x80\x99s the best when I\xe2\x80\xa6 https://t.co/dsiS5pW0Zq'
980467220487655424,2018-04-01 15:29:36,b'Fucking pissed. While Home trying to have a nice Easter dinner with my family someone hit my goddam car and drove o\xe2\x80\xa6 https://t.co/JUdTorDkRu'
979205318667272192,2018-03-29 03:55:15,b'What a good girls night. So good to catch up with friends. Also the movie we saw was decent. #girlsnight #goodfriends'
977693323090649088,2018-03-24 23:47:07,"b'Relaxing Saturday, Netflix and chill with the babe. I\xe2\x80\x99m content #happytweet'"
975705074591727616,2018-03-19 12:06:32,b'Literally wish I could not wear pants to work my hip hurts so bad and my other hip is gross and dry cause of my tattoo.... kill me.'
975574724439937025,2018-03-19 03:28:34,b'I tell ya what I must be getting old because this is the most pain I\xe2\x80\x99ve ever been in from a healing tattoo \xf0\x9f\x98\x86\xf0\x9f\x98\x86\xe2\x80\xa6 https://t.co/wqMtQmebHm'
974639442723033088,2018-03-16 13:32:05,b'FINALLY GETTING MY TATTOO TODAY!! (What\xe2\x80\x99s funny is exactly 2 years ago to the the day I got my last tattoo and I di\xe2\x80\xa6 https://t.co/bCx6JeG5iu'
973731930473672704,2018-03-14 01:25:57,b'I\xe2\x80\x99m so old I\xe2\x80\x99m sitting on my couch with a heating pad on my hip watching golden girls..... #thebeginingoftheend'
973616071553966080,2018-03-13 17:45:35,b'3 more days till I get my tattoo and I have never been so hyped vneosueheuswbhiddjrbnrjrrjnrdiiwbwbebe!! \xf0\x9f\x91\x8c\xf0\x9f\x8f\xbb\xf0\x9f\x98\x8e'
972580853984514053,2018-03-10 21:11:59,b'Things are not going well \xf0\x9f\x98\x9e'
971945805442637824,2018-03-09 03:08:32,b'When you spent all day thinking it was Friday and then you realize it was Thursday... so now you have to live through Friday again \xf0\x9f\x92\x94\xf0\x9f\x98\x9e'
971523165448015873,2018-03-07 23:09:07,"b'Legit just want to lay in a ball all day, everything hurts and I\xe2\x80\x99m dying. #killme #iwannadie'"
971212750016958464,2018-03-07 02:35:38,b'10 more days till my tattoo and that\xe2\x80\x99s about the only good thing happening right now \xf0\x9f\x98\x9e\xf0\x9f\x91\x8c\xf0\x9f\x8f\xbb'
968689889406541824,2018-02-28 03:30:41,"b'Crazy,Stupid,Love is still one of my all time favorite chick flicks. I love it. Really brightened my day'"
968302461273497603,2018-02-27 01:51:11,b'But sometimes it feels like I give it all and it\xe2\x80\x99s still not enough. Emotionally very drained lately....'
968111419949568001,2018-02-26 13:12:03,b'I just know I\xe2\x80\x99m about to have a really bad day. My anxiety is really winning right now. I feel like it\xe2\x80\x99s 1 step for\xe2\x80\xa6 https://t.co/7oMLqE4Equ'
967622456965025792,2018-02-25 04:49:05,b'Depression/ Anxiety is a fight that never ends. You can have months of happiness but it seems this demon always fin\xe2\x80\xa6 https://t.co/UqsBO74n5N'
965404292558487552,2018-02-19 01:54:54,b'Sometimes you just need a weekend back home getting drunk with your besties blasting old jams and dancing in your l\xe2\x80\xa6 https://t.co/y5O83Xbjlm'
963972303976583169,2018-02-15 03:04:41,b'Just spent the 3rd Valentines in a row with my babe. Honestly can\xe2\x80\x99t imagine my life with anyone else. You are my wh\xe2\x80\xa6 https://t.co/RO8vskbktI'
963247074627211266,2018-02-13 03:02:53,b'If \xe2\x80\x9cI Fall Apart\xe2\x80\x9d by Post Malone don\xe2\x80\x99t put you in your feels you ain\xe2\x80\x99t never had your life fucked up by someone you\xe2\x80\xa6 https://t.co/QbFMuzXzGF'
963245835667386368,2018-02-13 02:57:58,"b'Week 3 of going to the gym: I hate this shit, my whole body hurts, and I don\xe2\x80\x99t look any hotter \xf0\x9f\x91\x8c\xf0\x9f\x8f\xbb\xf0\x9f\x98\xad'"
962171835667410944,2018-02-10 03:50:16,b'It was super nice to have a totally unplanned but amazing girls night with Sam! Love when life just puts amazing pe\xe2\x80\xa6 https://t.co/SI0jzQXW1D'
961440356557615104,2018-02-08 03:23:38,b'I hate the new snap chat update. The fuck did they make all the stories and my snaps on the same damn page. I don\xe2\x80\x99t\xe2\x80\xa6 https://t.co/lmLvZPDj7V'
960725581401919488,2018-02-06 04:03:22,b'I secretly only go to the gym and do squats so my boyfriend will rub my sore leg mussels till I fall asleep \xf0\x9f\xa4\xab#itfeelssogood #hesthebest'
960010456588005376,2018-02-04 04:41:43,b'What a fun but painful day learning to snowboard for the first time with my babe and Sylvia. I appreciate them savi\xe2\x80\xa6 https://t.co/8sRBGoUcQr'
959790938058051586,2018-02-03 14:09:26,b'Legitimately hate the fuckers who live above me..... it\xe2\x80\x99s 9am on a Saturday I would like to sleep in my bed without\xe2\x80\xa6 https://t.co/8mv5tkx4RT'
958883189870747649,2018-02-01 02:02:22,b'It\xe2\x80\x99s week 2 and I\xe2\x80\x99m already sick of going to the gym \xf0\x9f\x98\xad\xf0\x9f\xa4\xa6\xf0\x9f\x8f\xbb\xe2\x80\x8d\xe2\x99\x80\xef\xb8\x8f #nomotivation #hateit'
956001233692741632,2018-01-24 03:10:30,"b'Great gym, Piada, laundry night with my babe followed by lethal weapon,cuddles, and leg massages for my sore legs.\xe2\x80\xa6 https://t.co/8rbMsMW4LL'"
953823573294100482,2018-01-18 02:57:15,b'When you don\xe2\x80\x99t go to the gym for a super long time then you go and go way to fuckin ham so now your whole body hurt\xe2\x80\xa6 https://t.co/EUU0hjLStc'
953115966501801984,2018-01-16 04:05:29,b'My favorite part of going to bed every night is sleeping next to you \xe2\x9d\xa4\xef\xb8\x8f I\xe2\x80\x99ve seriously never slept better in my lif\xe2\x80\xa6 https://t.co/5oMDtoVImA'
952372369439576064,2018-01-14 02:50:41,b'Having a super fun night kicking it with my sister \xf0\x9f\x91\xaf\xe2\x80\x8d\xe2\x99\x80\xef\xb8\x8f\xf0\x9f\x92\x95 #missedthis'
951676192318545922,2018-01-12 04:44:20,b'It was a make bacon burgers and cuddle till we fall asleep watching the Cavs game type of night and I couldn\xe2\x80\x99t be h\xe2\x80\xa6 https://t.co/F9IqKPb8Zf'
950922604180922368,2018-01-10 02:49:50,"b'When you snap your boyfriend a picture while he\xe2\x80\x99s home sick from work and he screenshots it, then when you come hom\xe2\x80\xa6 https://t.co/5Arhy0aNdB'"
949668969715322880,2018-01-06 15:48:21,b'Going out to celebrate the most amazing day ever today!!!...... The day my wonderful self graced this earth with he\xe2\x80\xa6 https://t.co/IHP6NRZghY'
948740272237830144,2018-01-04 02:18:02,b'I WOULD GIVE ANYTHING JUST TO HAVE MY FEET NOT BE COLD RIGHT NOW \xf0\x9f\x98\xad\xf0\x9f\x91\xa3\xf0\x9f\xa7\xa6'
947896871363710976,2018-01-01 18:26:39,b'Rung in yet another new year with you and I couldn\xe2\x80\x99t be happier. Here\xe2\x80\x99s to all that 2018 will bring us! \xf0\x9f\x92\x95 #happynewyear #tous'
947298872023486464,2017-12-31 02:50:25,b'I lied I spent all day watching black mirror then cuddling with my babe and ordering pizza. Really perfect Saturday\xe2\x80\xa6 https://t.co/CPVdoeZEVd'
947156619951042560,2017-12-30 17:25:10,"b'Lazy Saturday, gonna spend all day watching black mirror \xf0\x9f\xa4\xb7\xf0\x9f\x8f\xbb\xe2\x80\x8d\xe2\x99\x80\xef\xb8\x8f\xf0\x9f\x98\x8a'"
946574004298616832,2017-12-29 02:50:03,b'Went and had the consult for my tattoo and I could not be more psyched right now. This two month wait is yo by to b\xe2\x80\xa6 https://t.co/q99aAd462g'
944948313048088576,2017-12-24 15:10:08,b'Really feeling the most un-Christmas I\xe2\x80\x99ve ever felt in my life. Wish I wasn\xe2\x80\x99t feeling so shitty \xf0\x9f\x8e\x84\xf0\x9f\x98\x95'
944578880261804034,2017-12-23 14:42:09,b'On the plus side yesterday I booked and paid for tattoo number #4. And I couldn\xe2\x80\x99t be more psyched about it! 2 more months \xf0\x9f\x98\x9c\xf0\x9f\xa4\x97'
944451303958335488,2017-12-23 06:15:12,b'I\xe2\x80\x99m really 1000% over your shit right now.... I\xe2\x80\x99m sick but I swear to you I\xe2\x80\x99ll still loose my shit in about 5 minuets \xf0\x9f\xa4\xac\xf0\x9f\x98\xa1'
943665248950726656,2017-12-21 02:11:42,b'I thought for once in my I wasn\xe2\x80\x99t going to get sick right before Christmas.... well ladies and gentleman I was wron\xe2\x80\xa6 https://t.co/ps8owGR7fH'
942267719596036096,2017-12-17 05:38:25,"b'Well it\xe2\x80\x99s done, lopped all my bangs off. Not sure how to feel right now \xf0\x9f\xa4\xb7\xf0\x9f\x8f\xbb\xe2\x80\x8d\xe2\x99\x80\xef\xb8\x8f\xf0\x9f\x99\x88'"
941802538319441920,2017-12-15 22:49:57,b'Well at 5:45 tomorrow my hairs getting chopped. I\xe2\x80\x99m terrified hopefully it doesn\xe2\x80\x99t look awful \xf0\x9f\xa4\xb7\xf0\x9f\x8f\xbb\xe2\x80\x8d\xe2\x99\x80\xef\xb8\x8f\xf0\x9f\x92\x87\xf0\x9f\x8f\xbb\xe2\x80\x8d\xe2\x99\x80\xef\xb8\x8f'
941484069963161600,2017-12-15 01:44:28,"b'Today I had to drive almost 120 miles for work, I broke my favorite knife that I\xe2\x80\x99ve had for 10 years and it was jus\xe2\x80\xa6 https://t.co/OYtYnsMICw'"
940773859640467456,2017-12-13 02:42:21,b'I\xe2\x80\x99m so prepared for Christmas this year..... like I only have one more gift to wrap and it\xe2\x80\x99ll be here tomorrow. I\xe2\x80\x99m\xe2\x80\xa6 https://t.co/HmFe8DLCCe'
940379966373588994,2017-12-12 00:37:10,b'Just had the best spaghetti dinner with my baby \xe2\x9d\xa4\xef\xb8\x8f\xf0\x9f\x8d\x9d #thisisthelife #happymonday'
939331443108564992,2017-12-09 03:10:42,b'My babe went and bought me chicken wings because this ear infection is kicking my booty \xf0\x9f\x98\x93\xf0\x9f\x98\xa9 thanks babe'
938242737673031680,2017-12-06 03:04:35,b'Tonight \xf0\x9f\x92\x94.....'
938198686601015297,2017-12-06 00:09:32,b'Qtips can hurt you guys......  accidentally stuck one to far in my ear and perforated my ear drum. Nothing can be d\xe2\x80\xa6 https://t.co/TKBzBRxEcK'
938031475760549890,2017-12-05 13:05:06,b'I haven\xe2\x80\x99t felt this shitty in a really long time.... feels like nothing is east anymore \xf0\x9f\x98\xa2\xf0\x9f\x99\x81'
937885486030483461,2017-12-05 03:24:59,b'Other than seeing my sister this has been a really terrible couple of days.... feeling at a loss right now. Just out of things to say \xf0\x9f\x98\x93'
937500830969815040,2017-12-04 01:56:30,"b'What a shitty night this turned out to be, im so disappointed \xf0\x9f\x98\xa2'"
936757081604083712,2017-12-02 00:41:07,"b'Feeling so relaxed. Got off work, threw a bath bomb in the tub, put on  a hydrating face mask, and read some of my\xe2\x80\xa6 https://t.co/KtaiePAzl2'"
935664690381905922,2017-11-29 00:20:20,b'Signed my first lease at my new job and got myself a shiny $150 dollar bonus on my check for t \xf0\x9f\x91\x8c\xf0\x9f\x8f\xbb\xf0\x9f\x92\xb8 #lovingthis #proudofmyself'
933780604503707650,2017-11-23 19:33:39,"b'Today I\xe2\x80\x99m thankful for my family, my amazing boyfriend, mashed Potatos, and naps when you\xe2\x80\x99re to full, oh and my new\xe2\x80\xa6 https://t.co/ApMFTAzUd0'"
933528933190062081,2017-11-23 02:53:36,b'Think my babes gonna pay for my 4th tattoo for christmas/my Birthday \xe2\x9d\xa4\xef\xb8\x8f\xf0\x9f\x98\xac\xf0\x9f\x92\x89#hesthebest #itsgonnabesickkk'
933472895296303104,2017-11-22 23:10:55,b'Really loving my new job. It\xe2\x80\x99s been such a good move for me. First time I\xe2\x80\x99ve had Black Friday off in 6 years \xf0\x9f\x98\xb1\xe2\x9d\xa4\xef\xb8\x8f'
932350945178071040,2017-11-19 20:52:42,b'Had a great night out celebrating with all my Lowes family unfortunately I am paying for it today as I am hungover\xe2\x80\xa6 https://t.co/PJYCPsBdFz'
931316360574988288,2017-11-17 00:21:38,b'Last few hours as a Lowes employee! It\xe2\x80\x99s been real you guys. Going to miss my Lowes family for sure! \xf0\x9f\x98\xad\xe2\x9d\xa4\xef\xb8\x8f'
931217852639666176,2017-11-16 17:50:11,b'Today is my last day as a Lowes 1175 employee. Tomorrow I start my big girl job. Doesn\xe2\x80\x99t even feel real honestly \xf0\x9f\x98\xac\xf0\x9f\x98\xac'
929917939721166848,2017-11-13 03:44:48,b'Today\xe2\x80\x99s definitely one of those nights my demons are just getting the best of me. Your own head is sometimes the wo\xe2\x80\xa6 https://t.co/udyuYltqAu'
929384270577258497,2017-11-11 16:24:11,b'This day just keeps getting better and better \xf0\x9f\x98\x91\xf0\x9f\xa4\xa6\xf0\x9f\x8f\xbb\xe2\x80\x8d\xe2\x99\x80\xef\xb8\x8f'
929361321761615873,2017-11-11 14:53:00,b'I\xe2\x80\x99m in one of those moods where just everything is pissing me off lately.... \xf0\x9f\x98\xa1'
928787244114108417,2017-11-10 00:51:49,b'When you have a terribly shitty day at work but when you come home your boyfriend makes it all better cause he\xe2\x80\x99s th\xe2\x80\xa6 https://t.co/7JD0nChD1h'
928444244578242560,2017-11-09 02:08:52,b'On the up side I only have 8 more days in this hell hole till I start my new job \xf0\x9f\xa4\x97'
927330462627975173,2017-11-06 00:23:05,b'Okay random storm out of no where thanks for scaring the shit out of me \xe2\x9b\x88\xf0\x9f\x98\xad'
926274855753994240,2017-11-03 02:28:29,"b'My last day at Lowes is November 16th, can\xe2\x80\x99t believe I finally got a new job.'"
925889794525286400,2017-11-02 00:58:23,b'Got some great news today..... wish it wasn\xe2\x80\x99t so bitter sweet. This is going to be harder than I thought'
924497662266798085,2017-10-29 04:46:33,b'So much fun back home in PA doing Halloween things with @KylieMarie ! #frightnights #hundredacremanor #JigsawMovie #halloweenfun \xf0\x9f\x8e\x83\xf0\x9f\x91\xbb'
923024225971171329,2017-10-25 03:11:39,"b'Wish me luck, have a big girl interview tomorrow, hopefully all goes well \xf0\x9f\x91\x8c\xf0\x9f\x8f\xbb\xe2\x9d\xa4\xef\xb8\x8f'"
922610199378227200,2017-10-23 23:46:27,b'@KylieMarie shut up you love me!! \xe2\x9d\xa4\xef\xb8\x8f\xf0\x9f\x92\x9c\xf0\x9f\x92\x99'
922610019367112704,2017-10-23 23:45:44,"b'My heart is just hurting right now, just wanna be there for you. Can\xe2\x80\x99t believe this is how our family is \xf0\x9f\x98\x9e\xf0\x9f\x92\x94'"
922292373937446912,2017-10-23 02:43:31,b'Finally went to a haunted house last night! Now in two days I get to go home and do Halloween stuff with my best friend \xf0\x9f\x98\x81\xf0\x9f\x91\xbb\xf0\x9f\x8e\x83 #spooooopy'
921559682845761537,2017-10-21 02:12:04,b'Feels like our whole lives are about to be so different. Really wish you two weren\xe2\x80\x99t being so shitty \xf0\x9f\x98\x9e'
920339789693546496,2017-10-17 17:24:39,b'I really need the strength not to loose it on someone in my family today.... y\xe2\x80\x99all got me fucked up and it\xe2\x80\x99s not right.... #yourewrong'
920088881609003009,2017-10-17 00:47:38,b'I am SOOO salty that someone broke into Marcus car and stole the limited edition Ohio state hoodie I got him for his BD last year \xf0\x9f\x98\x94\xf0\x9f\x98\xa9\xf0\x9f\x98\xa1#fucker'
919759043081666560,2017-10-16 02:56:58,b'@KylieMarie You right \xf0\x9f\xa4\xb7\xf0\x9f\x8f\xbb\xe2\x80\x8d\xe2\x99\x80\xef\xb8\x8f'
918936964929290245,2017-10-13 20:30:20,"b""I usually have a good Friday the 13th, but this day has been disastrous. Can't wait to go home and cuddle with babe \xf0\x9f\x98\xa9\xf0\x9f\x98\xa9"""
917941443813101568,2017-10-11 02:34:29,"b'What a fun date night seeing the kingsman, then stuffing our faces as full as we could with Taco Bell! Love you \xf0\x9f\x8c\xae\xe2\x9d\xa4\xef\xb8\x8f'"
