id,created_at,text1019539958669848578,2018-07-18 11:10:42,"b""He's woke? I beg to disagree. Sobrang generalized nang natutunang concept ng bata. How about those police na maayos\xe2\x80\xa6 https://t.co/5x9ZBucNIS"""
1019529176083202049,2018-07-18 10:27:52,"b""Yo! Let's! https://t.co/HZu0dPhOxB"""
1019529025071566850,2018-07-18 10:27:16,"b""I like my friend's friend but I think my friend likes me. Idk what to do. Send help! =( \xe2\x80\x94 Ganda mo naman cyst pakur\xe2\x80\xa6 https://t.co/y727ZFTLUP"""
1019429864510709760,2018-07-18 03:53:14,b'It sucks to feel alone and insignificant.'
1019417518790725632,2018-07-18 03:04:10,"b'Oh reminder lang today ha, maligo po tayo nga kapuso. Wag ugaliin maglangis at mangamoy kubre kama tuwing tag ulan.\xe2\x80\xa6 https://t.co/FFpFPqRoCW'"
1019239905547902976,2018-07-17 15:18:24,b'I aspire to be mabangis like princess thea. Oh gosh goals.'
1019225674144407552,2018-07-17 14:21:51,b'So alam mo na JC sa ka ppwesto ha. Alam mo na ha. Wag mo na bolahin sarili mo.'
1019203697933336576,2018-07-17 12:54:32,b'Jusq 3rd day pa lang ng pasukan praying for suspension na din ako. Hanu na life!? Pagod agad kakasimula pa lang?'
1019200417618542592,2018-07-17 12:41:30,b'Single po siya. And hindi po sya crush ng crush nya. Sedt. https://t.co/m8s39y1n6J'
1018993583041310720,2018-07-16 22:59:36,b'@PresidentErap mayor nasa ccp na ako nung nag suspend ka. I hate you today!'
1018886437792464896,2018-07-16 15:53:51,"b""On Kyle Viray:No matter who you are in someone's life, YOU DON'T HAVE ANY GIVEN RIGHT TO PHYSICALLY ABUSE THAT PERS\xe2\x80\xa6 https://t.co/2qYRCIyjQ4"""
1018719430321115139,2018-07-16 04:50:13,b'@jerichozeta Pm me'
1018595458497691649,2018-07-15 20:37:36,b'@PresidentErap mayorrrr baha na sa kanto ng subdivision namin huhu! Wake up na poooooo!'
1018595196068511744,2018-07-15 20:36:33,"b'Ugh dapat ""where"" hindi ""that"" ugh kaines'"
1018594062935326720,2018-07-15 20:32:03,b'Ui gags di biro ang ulan ha baka magsuspend habang nasa byahe ako. Huhu Mayor @PresidentErap gising kana! Lakas ng rain oh!!!'
1018494508315467776,2018-07-15 13:56:28,b'Praying that you guys will never live a life that resting/taking a break makes you feel guilty.'
1018465541600628737,2018-07-15 12:01:21,b'Ang hirap pag di ka magaling mag verbalize ng thoughts na kumakain sayo.'
1018429849776427008,2018-07-15 09:39:32,"b""RT @LetranSHSSC: SHS Squires, It's back to school tomorrow!\n\nWe are so excited to meet you all! Dont forget to wear your IDs, Complete unif\xe2\x80\xa6"""
1018389828117807104,2018-07-15 07:00:30,b'Hahahaha! Ayannnnnnnn saglet kukuha ako tubig nauhaw ako! https://t.co/IVAAEAHm6J'
1018332683003285504,2018-07-15 03:13:25,"b""Hosted @rgmnovales 18th Bday Party at Marina Baytown Clubhouse last night. T'was a crazy crowd! \xf0\x9f\x98\x8d\n\nHope you enjoyed\xe2\x80\xa6 https://t.co/NFtTNXPYha"""
1018322083321806848,2018-07-15 02:31:18,"b'""We may not be perfect, But we will surely bring out the best in you!""\n\nFinest, Greatest, A force to reckon with, T\xe2\x80\xa6 https://t.co/WKBKDQ6AiK'"
1018319211393835008,2018-07-15 02:19:54,b'RT @keno_langot18: A tiring yet fun and successful day for us\xf0\x9f\x92\x95 Congrats to us SC Fam. One down many more to go\xf0\x9f\x92\x95\xf0\x9f\x98\x82\xf0\x9f\x98\x98\xf0\x9f\x91\x8f\n\n#SHSBinyagArriba2018 #J\xe2\x80\xa6'
1018318966115037185,2018-07-15 02:18:55,"b""Binyag Arriba --&gt; PTC --&gt; Hosting Raina's 18th Bday Party\n\nBuhay pa ka cyst?"""
1018317523060600832,2018-07-15 02:13:11,b'RT @LetranSHSSC: Thank you for attending the first Parent-Teacher Conference of the academic year 2018-2019! \n\nWelcome to Colegio de San Ju\xe2\x80\xa6'
1017829267655180288,2018-07-13 17:53:02,"b'RT @LetranSHSSC: Here are some highlights of our #SHSBinyagArriba2018 !\nSee you on monday, Letranites!\n\nSIEMPRE ARRIBA, \nSIEMPRE LETRAN!\n\n#\xe2\x80\xa6'"
1016713058662559744,2018-07-10 15:57:37,"b'Please allow me to just release this frustration through a tweet:\n\nMan, pagod na pagod na ang puso at isip ko.\n\nSagad.\n\nThere. Salamat po.'"
1016705900189384704,2018-07-10 15:29:10,b'Alone in everything. Always.'
1014751836631265282,2018-07-05 06:04:25,b'&lt;-- helpless'
1014655084289036288,2018-07-04 23:39:58,b'Greatest fear:\n\nMakaapak ng jebs ng di ko alam then pagsakay ko ng FX nag smell tapos syempre lahat nakatitig sakin\xe2\x80\xa6 https://t.co/mmOf1vuWLK'
1014373363861471232,2018-07-04 05:00:30,"b""You don't have to be the best, just be better than your old self one day at time. That's more than enough."""
1014295797309923329,2018-07-03 23:52:17,"b'Was hoping this year will be better than the previous one. But nah, half year done na eh bat wala naman pinagkaiba\xe2\x80\xa6 https://t.co/pYrNGta7uF'"
1014181083980746753,2018-07-03 16:16:27,b'Sir kabayo ka na ba ngayon kasi sabi mo bago mong trabaho takbo ka ng takbo e \xe2\x80\x94 Wow pre nakakamatay ka kornihan mo. https://t.co/nhPbymLLTL'
1014180224135716864,2018-07-03 16:13:02,"b'I am slowly realizing na, parang I\'m not  ""woke"" enough to use  twitter. Ewan ko.'"
1014006260084043776,2018-07-03 04:41:46,"b'RT @DrBabyFaceDO: As a physician, I preach to my patients to eat a healthy diet of fruits and vegetables.\n\nAs a person, I believe in the he\xe2\x80\xa6'"
1013773778747133953,2018-07-02 13:17:58,b'Ang lungkot ng school pag walang studyante. Seryoso.'
1013364829573115905,2018-07-01 10:12:57,"b""At this point , I'm not clamoring for success anymore, I just want inner peace."""
1013358910168707072,2018-07-01 09:49:26,"b""RT @inspirestagram: Believe in yourself, even when everyone else doesn't."""
1012998336637308928,2018-06-30 09:56:38,b'Naps get better if you have a pile of papers to do. Hahahahuhuhu'
1012997823418327040,2018-06-30 09:54:36,b'Tara la akong magawa ( kahit tambak na ng trabaho.  ) https://t.co/HZu0dPhOxB'
1012997636570402817,2018-06-30 09:53:51,b'Alam niyo sir minsan napapa isip ako kung di niyo ako dinampot sa katarantaduhan ko ano kaya ako ngayon \xe2\x80\x94 Haha grab\xe2\x80\xa6 https://t.co/9cymnzfN6q'
1012665206390943744,2018-06-29 11:52:54,"b'RT @LetranSHSSC: UPDATE:\nThe scheduled Senior High School Parent-Teacher Conference on July 10, 2018 was moved to July 9, 2018, 8am-12nn fo\xe2\x80\xa6'"
1012320595864743936,2018-06-28 13:03:32,b'@notkennyaranas Peymus'
1012262718588370945,2018-06-28 09:13:33,b'Papayat ako dito sa bago kong trabaho kakatakbo. Shet.'
1012262103950823424,2018-06-28 09:11:07,b'Please https://t.co/DU4IrdDM6Q'
1012199969653129216,2018-06-28 05:04:13,b'Sir. Miss na po kita ;( miss ko na yung tinuturuan niyo pa ako mag folk dance hayst :( \xe2\x80\x94 Wala na bang nagtuturo na\xe2\x80\xa6 https://t.co/YLyhHxrU3E'
1012199851814244352,2018-06-28 05:03:45,b'Sir bakit lagi mong inaaway si ryan? \xf0\x9f\x98\x82 \xe2\x80\x94 Sinong ryan yan? https://t.co/UdOgzBbMj5'
1012199815638286336,2018-06-28 05:03:36,"b'If you would be given a chance to work abroad, where would it be? \xe2\x80\x94 Bhutan. As innnn... dream place. https://t.co/kh1UZB1KPJ'"
1012199700504686597,2018-06-28 05:03:09,b'Why did some1 screenshot your thread about your popular unpopular opinion to that school? Is it still a big deal da\xe2\x80\xa6 https://t.co/QkGTLrWUiP'
1011774882814705664,2018-06-27 00:55:04,b'Be JOWABLE? no b*tch be VALUABLE.'
1011587799009521664,2018-06-26 12:31:40,b'@juliannequinano Samgyups tayo bibi pls'
1011587625457614853,2018-06-26 12:30:58,"b""Be so much immersed into improving yourself and reaching your goals that you don't have enough time to compare your\xe2\x80\xa6 https://t.co/pl9x6kZark"""
1011585232137539584,2018-06-26 12:21:28,b'Hey u curious?  https://t.co/HZu0dPhOxB'
1011568739441995782,2018-06-26 11:15:56,b'Ang disappointing lang na yung amount ng pagod ko eh hindi equal sa amount ng outputs na naproduce ko. I feel like\xe2\x80\xa6 https://t.co/8juSaadU5v'
1011352287984304128,2018-06-25 20:55:50,b'I badly want to go back  dancing again \xf0\x9f\x98\xa2 ugh. Antaba2 ko na.'
1011251594187321344,2018-06-25 14:15:42,b'Naway natanggal ng paghihilod ko kanina di lang libag ng katawan pati na din sana mga kamalasan at kabwisitan na da\xe2\x80\xa6 https://t.co/0qbPUVWcG2'
1011250929276891139,2018-06-25 14:13:04,b'Nakakaiyak na hindi maubos ang trabaho. \xf0\x9f\x98\xa2'
1011004977945325568,2018-06-24 21:55:44,b'Hindi ka naman tatanungin ng mundo kung gusto mo? o handa ka na ba? O kaya mo ba? Basta isasampal nya sayo kung ano\xe2\x80\xa6 https://t.co/WetyuGJ2PN'
1010902562277609472,2018-06-24 15:08:47,b'Sir jan jan Penge kaputian \xf0\x9f\x98\xad \xe2\x80\x94 Hahaha wow sana nga maputi ako \xf0\x9f\x98\xa2 https://t.co/wqcl6mPrni'
1010902355661991936,2018-06-24 15:07:57,b'best ramen place? \xe2\x80\x94 Potek mahal yan lucky me chicken na may itlog solve na ako. https://t.co/2DmmhMI2Ph'
1010901584966893568,2018-06-24 15:04:54,"b'nak ng putspa naman bat kahit anong paniniwala ko na "" I HAVE MY OWN TIMELINE TO FOLLOW"" eh parang nagmamadali ang\xe2\x80\xa6 https://t.co/EgEnhe8Iw2'"
1010827515789651968,2018-06-24 10:10:34,"b""So instead of making my submittals, I've decided to binge watch kdramas and shows. I just hate myself sometimes ( w\xe2\x80\xa6 https://t.co/LbONRU0nUL"""
1010821347008811008,2018-06-24 09:46:03,b'G! https://t.co/HZu0dPhOxB'
1010808150901968897,2018-06-24 08:53:37,"b'Slept for almost 2 days. Wow, productive weekend tayo cyst. Huhu.'"
1010723668312449024,2018-06-24 03:17:55,"b""Do you miss me? 'Cause I do! See you soon kaybigan. HAHAHAHAHA \xe2\x80\x94 Huy edjoanna magpakita kana https://t.co/1kFJmWgeQc"""
1010477389007032320,2018-06-23 10:59:17,"b""RT @itsmeaidil: If you're dating someone, try find out how that person was raised. Lot of people were not raised on love but were raised on\xe2\x80\xa6"""
1010422386364174336,2018-06-23 07:20:44,b'love is always happiness. agree? \xe2\x80\x94 Ambabaw nyan! Pano pag di na happy?di na yun love ganern? https://t.co/gXf7L7pnyJ'
1010421875418095616,2018-06-23 07:18:42,"b'Imagine this:\n\nYou just woke up from your ""forced siesta"" and you smell the freshly baked &amp; warm pan de coco and sp\xe2\x80\xa6 https://t.co/HDgKNnklBZ'"
1010356174959595521,2018-06-23 02:57:38,"b'How do you overcome those temptations na makakasira sa relationship? \xe2\x80\x94 Pag nakati, kamutin magisa wag ipakamot sa i\xe2\x80\xa6 https://t.co/P8am5pAf23'"
1010355874513158145,2018-06-23 02:56:26,"b""Food that you hate? \xe2\x80\x94 Atay/ Liver. Lasang bakal.  I don't understand why people love it. https://t.co/90aeea6duH"""
1010354718512578561,2018-06-23 02:51:51,"b""Will never get tired of watching Naruto's 4th great ninja war over and over again \xf0\x9f\x98\x8a"""
1010323226327543808,2018-06-23 00:46:42,b'Blackpink sa umagaaaaa!'
1010319701543616513,2018-06-23 00:32:42,"b'full name? \xe2\x80\x94 John Christopher Baclayon Mesana. Okey kana, Happy? https://t.co/LyxEQb5yIe'"
1010319359674220544,2018-06-23 00:31:20,b'@jerichozeta Nope nope. Dapat yan ma celebrate'
1010318597242015744,2018-06-23 00:28:19,b'@jerichozeta We should celebrate debut mo yan eh'
1010317252141277187,2018-06-23 00:22:58,b'@jensaavedra_ Labyu'
1010122063770628096,2018-06-22 11:27:21,b'A fan won a coffee date with me. Congrats @jensaavedra_ \xe2\x9d\xa4\xf0\x9f\x98\x89 https://t.co/8uOywUcPRh'
1009976480934158336,2018-06-22 01:48:52,b'Di na rin nakakapagtaka bakit madaming tao na ang insecure at mababa ang selfsteem. \nSilip ka na lang sa social med\xe2\x80\xa6 https://t.co/7bHuk2xE96'
1009767452681605120,2018-06-21 11:58:15,b'Ask and you will receive.  https://t.co/HZu0dPhOxB'
1009764579109269504,2018-06-21 11:46:50,"b""Hey self, unti-unti mong sanayin ang sarili mo na :\n\n1. You will face life's sh*t alone\n2. And no one actually effi\xe2\x80\xa6 https://t.co/bYxOVNGEDg"""
1009476946709839873,2018-06-20 16:43:53,"b'Sir in a scale of 1-10, 10 being the highest gaano ka kagaling sa research? And why? \xe2\x80\x94 1- still learning. No publis\xe2\x80\xa6 https://t.co/S8qfHZOHWA'"
1009424131463368704,2018-06-20 13:14:01,b'Kanina dahil super na saturate na ako sa 2 araw na pag SPSS and \nuderstanding statistics and sh*t. ( more to come \xf0\x9f\x98\xa2\xe2\x80\xa6 https://t.co/8nPeOCHVpn'
1009420890356965376,2018-06-20 13:01:09,b'hi sir!! ano po gagawin mo kapag yung taong mahal na mahal mo is nagiging toxic na para sayo? imbis na sumaya ka sa\xe2\x80\xa6 https://t.co/zcaAufAUzN'
1009420737965363202,2018-06-20 13:00:32,"b""Anong ginagawa mo kapag nakakaramdam ka ng insecurity dahil alam mong may ibang tao na mas better sa'yo like magali\xe2\x80\xa6 https://t.co/xx5e0YqcuQ"""
1009418200117723136,2018-06-20 12:50:27,"b'RT @LetranSHSSC: Upcoming SHS Letranites, are you ready? We know you are!\n\nThe Letran community and  SHS student council is estatic for the\xe2\x80\xa6'"
1009418131024953344,2018-06-20 12:50:11,"b'RT @LetranSHSSC: Future SHS Letranites! Mark your calendars! \n\n07-12-18  #BinyagArriba2018\n\nFor further updates, Like us on facebook and fo\xe2\x80\xa6'"
1009271618353238018,2018-06-20 03:07:59,"b""Let's make this years' Binyag Arriba a BLAST! \n\nSAVE THE DATE.\n 7.12.18\n\nRT MO CYST PARA MABLESS NI LORD NG LOVELIF\xe2\x80\xa6 https://t.co/dKTDm550Ro"""
1009254004981841921,2018-06-20 01:58:00,b'May papatol kaya? https://t.co/O2ViN6NUGt'
1009253677633335300,2018-06-20 01:56:42,"b'Greatest regret of your life? \xe2\x80\x94 Wala, bad decisions are necessary parts of my life story. They give color to it. https://t.co/ZrTJlJL7Jx'"
1009252879754903552,2018-06-20 01:53:32,b'@primadude Friend pasalubongggggg!!! \xe2\x9d\xa4'
1009235020970536960,2018-06-20 00:42:34,"b'""Binabasura ng iba ang siyang pinapangarap ko.""\n\nLECHENG BUHAY TO.'"
1009234380143939585,2018-06-20 00:40:01,b'Pano magkajowa? \xe2\x80\x94 Maging JOWABLE. Haha https://t.co/GZic2jy1q2'
1009234134873624578,2018-06-20 00:39:03,b'Sir pwede nyo po ba sabihan si sir ipe na wag tawaging bobo at tanga mga studyante nya *insert sarcastic haha* \xe2\x80\x94 Hm\xe2\x80\xa6 https://t.co/lZDog1l9eY'
1009233953977446402,2018-06-20 00:38:19,b'SERRRR MAPUTI PU BA KILI KILI NYO????? ALAM NYO PO BA CRUSH NA CRUSH KA NAMIN NG BOYPREN KO!!! IMAGINE PO MAPABABAE\xe2\x80\xa6 https://t.co/TCa6dDLy7q'
1009233800428220416,2018-06-20 00:37:43,b'Sir im happy na nababasa mo yung mga questions ko dito huhu imy lang po talaga \xe2\x80\x94 No problem! https://t.co/zgBXn9UvVR'
1009233737421377536,2018-06-20 00:37:28,b'Pwede ka po bang ninong sa confirmation? \xe2\x80\x94 Sino ka? Hahah https://t.co/tuCsqAbdQD'
1009233695885156353,2018-06-20 00:37:18,b'Hi janjan \xf0\x9f\x98\x80 \xe2\x80\x94 Hi po! \xf0\x9f\x98\x89 https://t.co/h6UORLB42N'
1009233622958837760,2018-06-20 00:37:01,b'Sir would you rather choose yung taong bumuo sayo or yung taong bubuo sayo? \xe2\x80\x94 Wala. Ako bubuo sa sarili ko. Malay n\xe2\x80\xa6 https://t.co/aUZd16opdW'
1009070558519021569,2018-06-19 13:49:03,b'Friend from Roxas City:\nMaganda mga malls nyo. Malaki mga sahod. Maganda edukasyon at porma.\n\nPero ...wala kayong m\xe2\x80\xa6 https://t.co/0tRiciqVUG'
1009069118681542656,2018-06-19 13:43:20,b'@ypreshi Hahahaa che! Umuwi ka dito sa reyes'
1009067413353086976,2018-06-19 13:36:33,b'@ypreshi Walang big scoop jan mamshie'
1009067307270852608,2018-06-19 13:36:08,"b""Utuin natin ang isa't isa dali! https://t.co/HZu0dPhOxB"""
1009067067872563200,2018-06-19 13:35:11,"b'Sir, bakit po yung ibang tao they only see what you did wrong? \xe2\x80\x94 dahil ayaw nila sayo? Ganun naman ata talaga. Pag\xe2\x80\xa6 https://t.co/WxS9qRm96E'"
1009066871956615168,2018-06-19 13:34:24,b'Sir alam mo po ba magneu-neurosurgeon po ako someday because of you! Sobrang ang dami ko pong natutunan from your s\xe2\x80\xa6 https://t.co/9HD6IuAnwp'
1009066827668951040,2018-06-19 13:34:13,b'Sir pag yumaman ako ililibre kita ng trip to Europe hehe kasi super grateful ako to meet someone like sir Mesana \xe2\x80\x94\xe2\x80\xa6 https://t.co/Dg6lhF0NhC'
1009066732022099968,2018-06-19 13:33:51,b'Bakit ang lupet ng fashion sense mo? \xe2\x80\x94 Sa sobrang baduy ang lupet ano? Haha https://t.co/Z6UMVSaUF7'
1009066681182969857,2018-06-19 13:33:39,b'Pahingi po ng fashion advice? \xe2\x80\x94 Just f**** wear anything u want as long as it will make you feel on point. Dun na s\xe2\x80\xa6 https://t.co/CmpnzBJvHn'
1009066338143350785,2018-06-19 13:32:17,"b'Sir, dati gusto kong magaudition sa PDT nung ikaw pa naghahandle pero natakot po ako majudge. Ngayon na wala ka na\xe2\x80\xa6 https://t.co/EOuGQiEkLK'"
1009066213316624385,2018-06-19 13:31:47,b'Kailan po kasal sir? \xe2\x80\x94 Abutin muna ang mga pangarap para sa sarili at sa pamilya. If sya talaga mahihintay nya ako.\xe2\x80\xa6 https://t.co/zqsTre3BUo'
1008740707350151168,2018-06-18 15:58:20,b'first time ko magsulat ng article for a newsletter ewan ko gudlak sakin jusko pinasa ko na lang!'
1008696343731187712,2018-06-18 13:02:03,"b'New SHS Letranites, are you ready???\n\n07.12.18\n\xf0\x9f\x92\xa7\xf0\x9f\x92\xa7\xf0\x9f\x92\xa7\xf0\x9f\x92\xa7\xf0\x9f\x92\xa7\xf0\x9f\x92\xa7\xf0\x9f\x92\xa7\xf0\x9f\x92\xa7\xf0\x9f\x92\xa7\xf0\x9f\x92\xa7\xf0\x9f\x92\xa7\xf0\x9f\x92\xa7\xf0\x9f\x92\xa7\n\n#BinyagArriba2018 \n\nRT RT RT RT RT RT\n\n(c) Ricci Sang\xe2\x80\xa6 https://t.co/93PsMsYof0'"
1008684431043911681,2018-06-18 12:14:43,b'Any advices on how to overcome jealousy inside a relationship? \xe2\x80\x94 Bakla TIWALA. Yun lang https://t.co/ep0DS8jpNl'
1008684348625825792,2018-06-18 12:14:23,b'Thoughts on Frank Pararuan po? \xe2\x80\x94 Okey naman si Frank :) Hello Frank! Wow. Haha https://t.co/Sw9iKNzDlc'
1008683948480909312,2018-06-18 12:12:48,b'Sir miss na po kita :(( ang boring ng science class kapag wala yung sir janjan vibes but i hope you are better now\xe2\x80\xa6 https://t.co/1EP2BGLATG'
1008683698890395648,2018-06-18 12:11:48,b'SINONG BIAS MO SA BLACKPINK?? \xe2\x80\x94 LISAAAAAA! OMG! https://t.co/8hrZmrVQSW'
1008683650454605825,2018-06-18 12:11:37,b'Ibang iba na yung PDT sir :(( kamiss nung ikaw pa naghahandle :( \xe2\x80\x94 Ganun talaga. Lahat ng bagay may katapusan. Chau\xe2\x80\xa6 https://t.co/0otUXP6EQi'
1008683520892563456,2018-06-18 12:11:06,b'Sir!!! Lahat po ng words of wisdom mo naalala ko pa and nagagamit ko. You have been one of my greatest teachers at\xe2\x80\xa6 https://t.co/CgYYk4zm5Q'
1008681767132266497,2018-06-18 12:04:08,b'Ngayon ko higit na pinapahalagahan ang edukasyon dahil bwaka ng kabayo lahat na ng raket pinapatos ko makaipon lang\xe2\x80\xa6 https://t.co/Ac7KbotPXU'
1008356428417908738,2018-06-17 14:31:21,b'Bakit di ako masaya?'
1008332596856516608,2018-06-17 12:56:39,b'Anong masasabi niyo sa blackpink?!?!? HAHHAAHHAHAHAHAHAHAHA \xe2\x80\x94 They snatch weaves! https://t.co/Bz6l9pD4av'
1008332508931510273,2018-06-17 12:56:18,"b'Masasabi mo na ba sir na contented ka na sa meron ka ngayon? \xe2\x80\x94 As of now, hindi pa. Madami pa akong gustong ma achi\xe2\x80\xa6 https://t.co/0GcVTfXFpa'"
1008301676757803008,2018-06-17 10:53:47,"b""Sorry pero let me just say this:\n\nPuta***** grabe ang DDU-DU DDU-DU ng Blackpink I'm literally screaming!!!"""
1008280028398923776,2018-06-17 09:27:46,b'Tara na! https://t.co/HZu0dPhOxB'
1008279608960208897,2018-06-17 09:26:06,"b""sir diba pag magaling po ang studyante kahit anong school sya galing, it doesn't matter? \xe2\x80\x94 Oo naman! https://t.co/GjgRAwRGsE"""
1008278714231107584,2018-06-17 09:22:33,"b'Ang swerte nyo, naggreet nyo dads nyo ng ""Happy Fathers\' Day!"" and naririnig nila ito ng personal. \n\nKids, pls make\xe2\x80\xa6 https://t.co/bby94zB1ox'"
1007728398741803008,2018-06-15 20:55:47,"b'3 experts in the field of folk dances ( Kuratsa, Pangalay and Binanog+ Suguidanon ) + 1 big shitty fan boy *screami\xe2\x80\xa6 https://t.co/Q6wo8sRreo'"
1007727226500964353,2018-06-15 20:51:08,b'Maraming salamat Roxas City sa umaapaw na pagkaing dagat \xf0\x9f\x90\x99\xf0\x9f\x90\x9f\xf0\x9f\x8d\xa4 at mainit na pagtanggap! Uuwi akong masaya ang puso at\xe2\x80\xa6 https://t.co/ihjdJATO0t'
1007726135105318912,2018-06-15 20:46:47,b'Never take wet wipes for granted specially in times of LBM. \xf0\x9f\x98\x84'
1007251013252755461,2018-06-14 13:18:50,b'Overflowing seafood + cold beer + seashore ahhhhh ROXAS is the fu**** place to be!!!!'
1007100445708259328,2018-06-14 03:20:31,b'Anu na bhe lapot sa kilikili ang init at tirik ng araw dito sa Roxas City.\n\nManila rain what? Habagat what? Suspended what?'
1006993131328364544,2018-06-13 20:14:06,"b""Eh I saw a belgian waffle stall sa airport, wala din. Ugh, you can't just say no to waffles bro, never, ever. Hahah"""
1006987635095625728,2018-06-13 19:52:15,"b'RT @desire_lnspire: Successful people are not gifted; they just work hard, then succeed on purpose. - G.K. Nielson'"
1006979673073508353,2018-06-13 19:20:37,"b'Putspa, di ata maganda ang mensahe ng praise songs dito sa ministop tas ganito panahon then may flight ka. Saglit Lord ha, di pa ako ready.'"
1006979005600260098,2018-06-13 19:17:58,b'Ang aga ko naman masyado for my flight and since shala ang food sa airport ittry ko mag cup noodles and bread sa mi\xe2\x80\xa6 https://t.co/sTalw6BYlx'
1006683696299233281,2018-06-12 23:44:31,b'Super hassle mag commute ngayon grabeeeee!'
1006589097916358656,2018-06-12 17:28:37,b'Patulugin nawa ako ng nilagok kong dark mocha langya.'
1006396058337886210,2018-06-12 04:41:32,"b'RT @AmbulaArt: Adulting Stage: Hindi ka na masyadong nag-post ng picture mo online, at hindi ka na nagpapalit ng profile photo. Dahil Mas m\xe2\x80\xa6'"
1006395049708417024,2018-06-12 04:37:32,b'@meijiueda @juliannequinano Sana lahat'
1006085036850810880,2018-06-11 08:05:39,b'Putspa lahat ata ng grab drivers naka hibernate din ngayong momol weather. Guys I need you gising na muna raket2 tayo. Hahah'
1006059234981752832,2018-06-11 06:23:07,b'would you start up a business soon? franchise etc \xe2\x80\x94 Opo. Bet ko ng potato corner sa tapat ng bahay namin https://t.co/m1D4XXF4SV'
1006059160977465344,2018-06-11 06:22:50,b'Sir pwede po ba ibalik pa yung pas des tous ? I mean maibabalik pa po ba ? \xe2\x80\x94 Andun naman PDT wala naman kumuha. https://t.co/H9K6Tyw8D1'
1006045346777088007,2018-06-11 05:27:56,b'RT @GeeMarie_: Woke Twitter is becoming cancer af. Too many people joining the bandwagon just so they could step on other people to feed th\xe2\x80\xa6'
1005702727387832320,2018-06-10 06:46:29,b'Painitin nyo ang malamig na Sunday by asking me. Haha relate? https://t.co/HZu0dPhOxB'
1005702568700469248,2018-06-10 06:45:52,b'what about thoughts on ate chuy? \xe2\x80\x94 My best main bissssh samgyup buddy. Love yu! https://t.co/VuMoJ5tNu7'
1005702387569487872,2018-06-10 06:45:08,b'chicken ni mang george o sisig ni marg george \xe2\x80\x94 Brown rice with adobo ni do\xc3\xb1a maria. Sorry. https://t.co/voXAAt7SiC'
1005702144006279169,2018-06-10 06:44:10,b'SIRRRRRR AHSHSHHSSHSHHS I MISS PAS DES TOUS PAG NAGPEPERFORM SILA NAALALA KITA PERO WALA ka na pala sa school. \xe2\x80\x94 Di\xe2\x80\xa6 https://t.co/93C6E0jwbC'
1005701900350644225,2018-06-10 06:43:12,b'Nasasayang buhay ko sa ulan na to\nPutspa wala akong nagagawang trabaho kakatulog hanu naaaa!'
1005653014835679234,2018-06-10 03:28:57,b'Ughhhhh. The smell of tuyo and lucky me beef noodles is so nostalgic. Huhu.'
1005629296730300416,2018-06-10 01:54:42,b'Champorado with dilis/tuyo would be perfect breakfast for this kind of weather \xf0\x9f\x98\xa2\xf0\x9f\x98\xa2'
1005475038894493696,2018-06-09 15:41:44,"b'God, thank you for the sound of the falling rain. Iba ang healing powers nya grabe.'"
1005392438507143175,2018-06-09 10:13:31,"b""Wag kayong magpplay ng break-up songs sa ganitong uri ng panahon! I'm warning ya'll di nakakatuwa ang epekto! Fck."""
1005342221497860097,2018-06-09 06:53:58,"b'May all of us find someone whose mere presence makes us feel home and at peace. Yeah, face and looks matter, pero i\xe2\x80\xa6 https://t.co/X8jzzUHj99'"
1005341100926619649,2018-06-09 06:49:31,b'@juliannequinano Thursday morning bhe'
1005341075022548998,2018-06-09 06:49:25,b'@joanvoan @juliannequinano Awehhh?'
1005274375308783616,2018-06-09 02:24:22,"b'I was born in summer but man, this is my kind of weather. \xe2\x98\x94'"
1005147282243588096,2018-06-08 17:59:21,"b'Plus,I got to see big names and co-speak with the big people in the field of culture. Tagging madam Ligaya Amilbang\xe2\x80\xa6 https://t.co/ewEXb2k7Sq'"
1005146331768188928,2018-06-08 17:55:34,b'Shookt the NCCA-intangible heritage sector by presenting a paper studying ICH with statistics. \n\nBecame an instant\xe2\x80\xa6 https://t.co/xOM4MS5KNt'
1004969870264393728,2018-06-08 06:14:23,b'@juliannequinano Saturday nasa pque na ako ulit. Next week roxas city naman ako. Natuwa NCCA sakin sinama ako pati sa visayas workshop'
1004965045128663040,2018-06-08 05:55:12,b'Gloomy Bataan. \xf0\x9f\x98\xa2 us2 qu na umuwi.'
1004463173439635456,2018-06-06 20:40:57,"b""Totoo nga ang chika, Mcdo's Longgadesal with egg is a BOMMMBBB! \xf0\x9f\x92\xa3\xf0\x9f\x92\xa3"""
1004309797532061696,2018-06-06 10:31:29,b'Thoughts on kuya denz? \xe2\x80\x94 I admire his ka-kuriputan. https://t.co/SEYM06MNVp'
1004290491108679681,2018-06-06 09:14:46,b'Parating na yan. Tiwala lang. https://t.co/bGnkNdOo7h'
1004127651961819136,2018-06-05 22:27:42,"b'Why do I feel so paranoid, uneasy and worried these days. Anooo toooo buiiiii??? Haha \xf0\x9f\x98\xac\xf0\x9f\x98\xac'"
1004040241932570624,2018-06-05 16:40:22,b'did you ever fancy men? \xe2\x80\x94 UHMMMMM. HAHAHA https://t.co/Ka26I1a0XF'
1004040166179328001,2018-06-05 16:40:04,b'Sir pano kayo naging close ni jensaavedra? \xe2\x80\x94 FC kasi siya. Naawa naman ako \xf0\x9f\x98\xa2 huehue https://t.co/kxph9oAs3J'
