id,created_at,text910112346617425920,2017-09-19 12:04:27,"b'Surprisingly, kaya ko pa pala nag forward and backward roll sa bangko sa edad kong to. Gudness! Salamat UP Manila Indayog sa imbitasyon! \xe2\x9d\xa4'"
910063025402519552,2017-09-19 08:48:28,b'RT @DavidRoads: If you think education is expensive try ignorance. - Derek Bok'
909921295155978240,2017-09-18 23:25:16,"b""RT @kelsmerritt: I'm so bad at replying to people.. I have a habit of viewing a message and just replying in my head \xf0\x9f\xa4\xb7\xf0\x9f\x8f\xbc\xe2\x80\x8d\xe2\x99\x80\xef\xb8\x8f"""
909917686418644992,2017-09-18 23:10:56,b'Pano isusurvive ang araw na to?'
909876011998756864,2017-09-18 20:25:20,"b'RT @DavidRoads: You may have not gone where you intended to go, but you will end up where you need to be.'"
909771371357413378,2017-09-18 13:29:32,b'Getting used to it.'
909756780980330496,2017-09-18 12:31:33,"b'Okey way to ni Lord para sabihin "" My son, mag rest ka muna \xf0\x9f\x98\xa2. "" chars'"
909756089230491648,2017-09-18 12:28:48,b'Nagmadali ako umuwi kasi nga gagawa dapat ako ppt for the class observation sa Wed. Tas iniwan ko pala book ko sa school. Napakahusay.'
909753161509888001,2017-09-18 12:17:10,b'Huhuhu ampretty nya.. \xf0\x9f\x92\x94\xf0\x9f\x92\x94 https://t.co/oUOasVSE59'
909749590542344192,2017-09-18 12:02:59,b'Wow ngayon na lang ulit me nakauwi ng mas maaga sa 12 midnight hahahaha. So proud'
909709401753231360,2017-09-18 09:23:17,b'Yaaaaasss. Laban pa bezzyweps https://t.co/8Z90MrnCog'
909709329556676608,2017-09-18 09:23:00,b'Tutorial sesh ulit with dean. Napaka swerte ng mga studyante ko talaga jusq.'
909704667034087425,2017-09-18 09:04:28,"b'Lakas maka drain ng creativity pag pagod ka, eto pala feels talaga pag working student ka. Saludo po ako senyo!'"
909699682242146305,2017-09-18 08:44:40,b'Makakasanayan ko din maging ganito ka busy.'
909635411328118784,2017-09-18 04:29:16,b'RT @DavidRoads: Prove yourself to yourself not others.'
909621345280974848,2017-09-18 03:33:23,"b'RT @AlecRocelRamos: Magandang umaga, UST! \xf0\x9f\x92\x9b https://t.co/4IScg0sLJW'"
909620976756842496,2017-09-18 03:31:55,b'RT @DavidRoads: There are no shortcuts to any place worth going.'
909552079877709824,2017-09-17 22:58:09,b'RT @DavidRoads: Success is peace of mind which is a direct result of knowing u did your best to become the best that u are capable of being\xe2\x80\xa6'
909408241494265857,2017-09-17 13:26:35,"b'Me, I just want a good life and a big comfy house for my mom and sibs \xf0\x9f\x98\xaf https://t.co/GQX44QoSes'"
909374465917595650,2017-09-17 11:12:22,"b""Hard times create strong men, strong men create good times. Let that sink in Jc. Let's enjoy the hard times."""
909366935690780673,2017-09-17 10:42:27,b'RT @jensaavedra_: Sunday well spent with my bae \xe2\x9d\xa4\xef\xb8\x8f @hyperbulalo https://t.co/6EMp5iSiVT'
909337094203482112,2017-09-17 08:43:52,b'So research naman kinacarreer namin ngayon \xf0\x9f\x98\xa2 di na naka rest. \xf0\x9f\x98\xb5\xf0\x9f\x98\xb5 @jensaavedra_ https://t.co/bYuf7Gyql1'
909314423809990656,2017-09-17 07:13:47,b'Paotsin Sunday with my forevz @jensaavedra_  \xe2\x9d\xa4 https://t.co/dvAT7Wk2BE'
909296741878349824,2017-09-17 06:03:31,b'Ipapa topic ko nga to sa ABM students ko next year for their research.'
909290759852933120,2017-09-17 05:39:45,b'2017 na. Andami ng deoderant/anti-perspirant products sa market bat amoy pu*ok pa din sa FX na to. My gudness.'
909290423037829120,2017-09-17 05:38:25,b'@joanvoan Hahahahah tara coffe libre ko na. Hahah. Ambaho sa fx ngayon mam amoy dyablo'
909289776578039808,2017-09-17 05:35:51,b'@joanvoan Pm mo ko sis. Hahaha'
909289326264979456,2017-09-17 05:34:03,b'@joanvoan May kilala ka ba nabebentahan ng kidneys? Benta ko yung sa right side ko pambili nyan haha'
909287380233764864,2017-09-17 05:26:19,b'Bayad bills Sunday. Ke saya maging adult. Yaw qu nah'
909263310511468546,2017-09-17 03:50:41,b'Hirap ng walang wifi wuuuuuuu!'
909213361639849984,2017-09-17 00:32:12,"b'Sagrado Sarado Dominicano! \xf0\x9f\x91\x8a\nIndeed, pag may nawalang isa, may 2 bonggang kapalit. Mas bongga.\xf0\x9f\x98\x84 https://t.co/Y05AY5EXUd'"
909207550515593216,2017-09-17 00:09:06,b'Pero syempre hanggang dun lang yun kasi aral muna more than anything else. Awow! Huehue'
909206511024463877,2017-09-17 00:04:59,b'Nasa point ako ng buhay na I have to choose between enrolling for the 2nd term or buying IphoneX hahahahahaha. \xf0\x9f\x98\xa2\xf0\x9f\x98\xa2\xf0\x9f\x98\xa2\xf0\x9f\x98\xa2\xf0\x9f\x98\xa2\xf0\x9f\x98\xa2\xf0\x9f\x98\xa2\xf0\x9f\x98\xa2\xf0\x9f\x98\xa2\xf0\x9f\x98\xa2\xf0\x9f\x98\xa2\xf0\x9f\x98\xa2\xf0\x9f\x98\xa2\xf0\x9f\x98\xa2\xf0\x9f\x98\xa2'
909204317713817600,2017-09-16 23:56:16,b'RT @DavidRoads: Allow yourself to be a beginner. No one starts off being excellent.'
909204018244632576,2017-09-16 23:55:04,"b""RT @DavidRoads: Don't look back when you know you shouldn't.\nDon't stress over things that don't matter.\nDon't worry about thinks you can't\xe2\x80\xa6"""
909024903952609280,2017-09-16 12:03:20,b'30 IMRAD papers 4 ABM to finish. 2 group advisees 4 STEM. 2 term papers and 2 research output for gradschool.Fertile pa ba ako after this?'
909010795522015233,2017-09-16 11:07:16,b'Survived this week yahuu! \xe2\x9d\xa4\xf0\x9f\x91\x8a https://t.co/0bGOTKiwFF'
908980737042350080,2017-09-16 09:07:50,b'Is that sooo... hmmm https://t.co/xCAXfgqJgP'
908980583266639872,2017-09-16 09:07:13,"b'RT @DavidRoads: Be happy not because everything is good, but because you can see the good side of everything. #optimism'"
908697327120007168,2017-09-15 14:21:40,b'@RaffyFHuet Awieee! Noted sir! \xe2\x9d\xa4\xe2\x9d\xa4\xe2\x9d\xa4 at bat di kita nakikita sa Uste!'
908675776404373504,2017-09-15 12:56:02,b'Okey lang sana if bagets age pa eh \xf0\x9f\x98\xa2 pero thank you Jesus wala pong sakit na nadapo.'
908672354863112192,2017-09-15 12:42:26,"b'Ngayon ko lang na realize na halos everynight pala ako sa gradschool at everyday, halos 3  hrs lang sleep ko. \xf0\x9f\x98\x82'"
908609820906754048,2017-09-15 08:33:57,b'@juliannequinano I love you and you are not any of those mentioned \xf0\x9f\x98\x84\xf0\x9f\x98\x8d'
908541204387655680,2017-09-15 04:01:17,b'RT @DavidRoads: You are not what you have done - you are what you have overcome.'
908536568716988417,2017-09-15 03:42:52,"b""@SamColoso Cheer up bebe loves! U pretty like me so don't fret. Labyu! \xe2\x9d\xa4"""
908488468895895552,2017-09-15 00:31:44,b'Jusq najejebs na naman me mga ka DDS. \xf0\x9f\x92\xa9'
908482876802424832,2017-09-15 00:09:31,b'Ibomba natin tong araw na to kahit walang sleep masyado!\xf0\x9f\x92\xa3 Halukaaaaaaaaaayyy! \nMiss ko na sexbomb girls \xf0\x9f\x98\xaf'
908481927757352960,2017-09-15 00:05:45,b'@angeliaj_ U r not alone babe \xf0\x9f\x98\x84 samedt here. Lavyu!'
908481512181448704,2017-09-15 00:04:05,b'@jerichozeta Goodmorning nak! Labyu! U got tis dey! \xf0\x9f\x91\x8a'
908481386478059520,2017-09-15 00:03:35,b'@superesmana_ Omg san yang shirt nabibili! I want!'
908332325179555840,2017-09-14 14:11:16,b'so much truth https://t.co/2B2XcXh48i'
908324077210701825,2017-09-14 13:38:30,b'@joanvoan Tingin mo after this fertile pa us? Hahahah'
908322107972403206,2017-09-14 13:30:41,b'@joanvoan Katatapos lang ng class ko momshiecake. Hahahaha may pasok pa ako tom need to wake up at 4am. Rak na dis!'
908269600831283201,2017-09-14 10:02:02,b'Aral-work cycle. Kayanin mo pa @self all of these will be worth it.'
908217273533341696,2017-09-14 06:34:06,b'Kuracha ng todo ngayon mga kapuso..may gradschool pa laturzx. Love itttttr! \xf0\x9f\x98\xa2'
908215505864900608,2017-09-14 06:27:05,"b'RT @DavidRoads: Whatever you want to do, do it now. There are only so many tomorrows.'"
908124654442659841,2017-09-14 00:26:04,b'Bawat umaga na lang najejebs ako sa school mga kapuso ano baaaa'
908109625005707264,2017-09-13 23:26:21,"b'RT @DavidRoads: When you truly believe in what you are doing, it shows. And it pays. Winners in life are those who are excited about where\xe2\x80\xa6'"
907945061182083074,2017-09-13 12:32:26,b'Wala pa din akong bill na natatanggap for 2 months na @PLDT tapos mawawalan ako ng net? Bat kayo ganyan! Ang hilig nyo mangiwan sa ere.'
907937311937015809,2017-09-13 12:01:38,b'Was craving for https://t.co/J4kU4RPwc3 donuts ended up buying turon with langka. Was not disappointed. \xf0\x9f\x98\x84'
907880143946788864,2017-09-13 08:14:28,b'Noted. https://t.co/n1xgtYJZmB'
907823869758722054,2017-09-13 04:30:51,b'Oh iphone X pangarap ka na lang.  Masters muna. Iyak na lang us.'
907823024958836737,2017-09-13 04:27:30,b'Ang pure ko tignan. Untouched. Unspoiled.Labang Ariel antibac fortified with B- vitamins and lacto-bacillus protect\xe2\x80\xa6 https://t.co/nzv6pdOnB8'
907819442960203776,2017-09-13 04:13:16,"b'No, no, no, bawal ka pumasok sa sistema ko. Di kita hahayaan bessy, wag mo na itry. @stress'"
907817300161576960,2017-09-13 04:04:45,b'@KoyaAnton you gonna love this! \xf0\x9f\x98\xa2\xf0\x9f\x98\xa2 https://t.co/5qrqIBX22h'
907786376438980608,2017-09-13 02:01:52,"b""RT @DavidRoads: I'd rather have a life of 'OH WELLS' than a life of 'WHAT IFS.'"""
907741706912591872,2017-09-12 23:04:22,b'Awow blue skies and the sun is making silip na through the clouds. Saya nemen'
907716777852887040,2017-09-12 21:25:19,"b'Lowkey hoping na suspended din kami pero no, so iyak, ligo, bihis and pasok.'"
907597715449667584,2017-09-12 13:32:12,b'Hirap kaya! https://t.co/FpzDuQSlXK'
907591697210654720,2017-09-12 13:08:17,"b'May pasok na tom, hay makaka ligo na din ulit salamat naman.'"
907562488518000641,2017-09-12 11:12:13,b'RT @AngeliqueManto: Never forget those who are with you during your lowest. They are the ones who truly matter the most.'
907543720219643905,2017-09-12 09:57:38,b'Pero parang trip ko mag razons \xf0\x9f\x98\xa2'
907543204253204480,2017-09-12 09:55:35,b'Dadaan ata latur yung bagyo sa NCR guys please be safe! \xf0\x9f\x98\xa2'
907542479129292800,2017-09-12 09:52:43,b'@juliannequinano Hahahha. Meron sa smj diba may ramyun sa kimbob'
907541562166411264,2017-09-12 09:49:04,b'Parang ang sarap ng spicy korean noodle ngayon...'
907516591239192577,2017-09-12 08:09:50,b'RT @DavidRoads: Sometimes the wrong choices bring us to the right places.'
907424458306027520,2017-09-12 02:03:44,b'May tao kayang willing sumugod sa baha at ulan para lang samahan ka mag coffee somewhere. Hahaha asa'
907423756447924225,2017-09-12 02:00:57,b'RT @DavidRoads: A pessimist sees the difficulty in every opportunity; an optimist sees the opportunity in every difficulty.'
907407332929187842,2017-09-12 00:55:41,"b'Goodmorning! Stay dry and safe. Yes I know masarap may ka cuddle ngayon, eh wala, inom na na lang us coffee \xf0\x9f\x98\xa2'"
907246510852661249,2017-09-11 14:16:38,"b""Now that I'm the one paying for my own tuition fee, suspensions are not that fun anymore. \xf0\x9f\x98\xb5 paradigm shift real quick."""
907238791106240512,2017-09-11 13:45:58,b'@jo1namangayao Kayang kaya mo yan j1 \xf0\x9f\x92\xaa\xf0\x9f\x91\x8a\xf0\x9f\x98\x84'
907235306855739392,2017-09-11 13:32:07,"b'Saglet ha mga sis, sana sa kabila ng pageenjoy natin na walang pasok eh prayers sa mga tatamaan ng bagyo. Wala sanang casualties.'"
907218485134151681,2017-09-11 12:25:16,b'Sorry LORD pero is it okey to SHIP them? Hahahahahahahahahahahahahahahaha. Cute kaya nila together. Ay nako ha.'
907218279734829056,2017-09-11 12:24:27,"b""We call him BROTHER, cute naman sya, and they look good together, they jog pa nga around UST to relieve girl's down emotions."""
907217898132746240,2017-09-11 12:22:56,"b'Ang funny ng iniisip ko, ganito kc, we have a classmate na seminarista, and sinasamahan daw nya si girl magsimba and counseling her. Tapos..'"
907215049034305536,2017-09-11 12:11:37,"b'Ang hirap siguro sa part nung iniwan na isipin san ba sya nagkulang? Or ano bang mali sa kanya? Sa huli, sarili mo pa din sisisihin mo. \xf0\x9f\x92\x94'"
907210922644537344,2017-09-11 11:55:13,b'Maiba ako: Bat kasi ganun na lang kadali para sa iba na bumitaw? Nahirapan ka man lang ba? O sadyang hindi ka naman kumapit kahit kelan?  \xf0\x9f\x98\xa1'
907210271948644354,2017-09-11 11:52:38,b'Moral:DREAM for YOURSELF. Do it for yourself. MOTIVATE yourself. ACHIEVE it for yourself. Wag mo iasa mga pangarap mo sa mga taong temporary'
907209824252846080,2017-09-11 11:50:51,"b""According kasi sa kanya, when she's planning to start her gradschool, in full support si GF, eh pano now,wala na yung drive to push through?"""
907209501467541504,2017-09-11 11:49:34,"b""Ayun tapos na ang class, ang galing din nya ha,nakaka focus sya sa studies despite the pain she's going through.  Iba din endurance sis."""
907182609242787840,2017-09-11 10:02:43,"b""And ikaw u were left there hanging, clinging to those mem'ries and plans na binuo, pero hanggang dun ka na lang,omg nafefeel ko yung pain \xf0\x9f\x98\xa2"""
907181777239732225,2017-09-11 09:59:24,"b""Just can't imagine how it feels na yung taong for how many years nakasama mo thru thick and thin eh nagdecide na to live without you."""
907179915899838464,2017-09-11 09:52:01,"b'I asked her "" hoping ka pa na babalik sya? "" and w/o hesitation she nodded her head and said yes. So nasa bargaining stage pa sya? Tama?'"
907179145414590465,2017-09-11 09:48:57,b'Ang sad lang ng thought na ikaw willing ka mag compromise at gagawin mo lahat tumagal lang kayo pero yung partner mo hindi yun ang GOAL.'
907178829168308225,2017-09-11 09:47:42,b'Kunsabagay wala namang pinipiling edad and pagiging faithful at wala ding perpektong timpla for a longterm relationship. Nasa tao pa din yan'
907178553623506944,2017-09-11 09:46:36,b'Ang scary and funny lang isipin na you will hear stories of break up and infidelity kahit pa ages 33 and 40 na sila. \xf0\x9f\x98\xa2\xf0\x9f\x98\xa2\xf0\x9f\x98\xa2'
907178072566149121,2017-09-11 09:44:41,"b""So eto, 2 lang kami andito ngayon ni girl classmate. She's making kwento about her GF, yes, GF, na iniwan sya. Oh diba close na kami agad."""
907171398212239360,2017-09-11 09:18:10,b'@juliannequinano Hahahah lasang yogurt \xf0\x9f\x98\x89 babuy mo nak'
907171066669187072,2017-09-11 09:16:51,"b'I hope more than my strict and stiff attitude sa klase, sana my students can see how they became better because of what Im doing. \xf0\x9f\x98\x82'"
907170554347642881,2017-09-11 09:14:49,b'@juliannequinano Amoy fresh milk. Hahaha'
907170399053418496,2017-09-11 09:14:12,b'To add more pain til 7:30 lang daw kami. Ang saya2 ano bessy.'
907169560419213312,2017-09-11 09:10:52,b'Okey mukhang madaming absent today sige classmates ganyan kayo. Ipahid ko sa inyo wet socks ko.'
907161953444945921,2017-09-11 08:40:38,b'Napproud is me sa sarili ko dahil kahit soaking wet na socks ko pumasok pa din ako grad school! Wwwuu go USTee! Nyemas'
907141448469848064,2017-09-11 07:19:09,b'Most important phrases for self-talk:\n\n1. Papasok ako today\n2. Papasok ako today\n3. Papasok ako today\n\nJusqqqqq..'
907139248188358657,2017-09-11 07:10:25,b'@KoyaAnton Ay nako baka bulaga pag ulan mamayang gabiiiiii.'
907124004720226304,2017-09-11 06:09:50,b'Espa\xc3\xb1a people di ba naulan jan now? Nakaka doubt pumasok na ganito langit hanu ba.'
907115487829516288,2017-09-11 05:36:00,b'Mga 90% puro struggle ano bezzy? Tapos 8% breakdown and tulog tas 2% real happiness. Hahaha. https://t.co/oBLzuMo41d'
907100703037915136,2017-09-11 04:37:15,b'Yassssss Lord eymen! https://t.co/pYnBcvsUUw'
907099766588293120,2017-09-11 04:33:32,b'Kasumpa sumpa yung mga taong ang ganda/gwapo pa din habang natutulog samantalang ako parang sinaniban ni satanas ang itsura ayoqu nuah!'
907093829781676033,2017-09-11 04:09:56,b'@LanceDLA @YakultUSA Isang bote ng weak \xf0\x9f\x92\xa9 para sayo! Mcdo! https://t.co/gSibzZVLbt'
907091126523273216,2017-09-11 03:59:12,b'Praying na maka jackpot kayo ng yummy na brainy pa. Ewan ko na lang.'
907089886812844033,2017-09-11 03:54:16,"b'Hello kids, baka naman pwedeng pili kayo ng jowang nag aaral at may pangarap. Ano to, basta yummy, keri?'"
907089345550544896,2017-09-11 03:52:07,b'@AngelPallersss Omggg yasssssss hahaha! Mis u bigtime!'
907088921032515584,2017-09-11 03:50:26,"b'If mag suspend wala ako gradschool mamaya. Okey sana kasi more sleep, as if nag ssleep ako agad paguwi.'"
907081421260447744,2017-09-11 03:20:38,b'Open for a bwisit-free Monday. Chozst! \xf0\x9f\x98\xb5\xf0\x9f\x98\xb5 https://t.co/K7wTsjzwMa'
907079901710135298,2017-09-11 03:14:35,b'Lalaklak na naman me 1 gallon ng @YakultUSA  neto. Hay. Okey ka ba tyan!'
907078651597877248,2017-09-11 03:09:37,b'#NewProfilePic https://t.co/oyzRYlnPr9'
907076925943713792,2017-09-11 03:02:46,b'Puro pagkain nasa utak ko ano ba to pa check up na ako tis not healthy. Ugh'
907076494307901440,2017-09-11 03:01:03,b'I want isawwwwww now!'
907075876319199232,2017-09-11 02:58:36,b'Oreo minis! \xf0\x9f\x98\xb2'
907042637009399809,2017-09-11 00:46:31,b'Bat lahat na lang ng gawin ko lagi na lang kulang. Pagod na ako.'
907041836597886978,2017-09-11 00:43:20,b'Jumebs na ko kanina sa haus di pa din sapat. Kaazar'
907031886613979136,2017-09-11 00:03:48,b'Sama ng tyan ko bessy jusq happy Monday!'
907019802555719680,2017-09-10 23:15:47,b'Tawang tawa ako dito! Hahhahah @AngelPallersss ! https://t.co/uLsKElx519'
907019666773573632,2017-09-10 23:15:14,b'RT @DavidRoads: The moment you give up is the moment you let someone else win.'
906903921838366722,2017-09-10 15:35:19,b'Weak \xf0\x9f\x92\xa9 @LanceDLA https://t.co/qYUOsN6iIi'
906903553788198912,2017-09-10 15:33:51,b'Seryosong ang scary ng future diba?'
906903060441473025,2017-09-10 15:31:53,b'@LanceDLA Nakaka nyemas bwisit kayong 2'
906806532842459136,2017-09-10 09:08:19,b'Jusq bawat episode naiyak ako anu naaa!'
906763616375922688,2017-09-10 06:17:47,b'Bat ako napapaiyak ng Naruto \xf0\x9f\x98\xa2\xf0\x9f\x98\xa2'
906677805634641920,2017-09-10 00:36:48,b'Happy 18th @Nagamariaaa i love you!'
906677417866969088,2017-09-10 00:35:16,"b'Umuwing bogsa, and ngayon ko lang narealize I slept without removing my contact lenses. Huhuhuh. Pero I enjoyed the night!'"
906420632308531200,2017-09-09 07:34:53,b'Whudaaa! This is a megalodon shark toothhhh! Im cryyyyyiinggg! https://t.co/M9eREg00Te'
906416856361197568,2017-09-09 07:19:53,b'Like this Paleolithic fossil. Omg talaga! https://t.co/HYTyQbJJKS'
906415165570027520,2017-09-09 07:13:10,b'Well vice director ba naman ng NatMuseum prof mo. Perks! Huhu'
906414944475783168,2017-09-09 07:12:17,b'Guyth Im currently holding and studying archaeological eco and artifacts real time! Omg ang cool ng course nato! Seryoso di ako nahinga!'
906390802716278784,2017-09-09 05:36:21,"b""RT @DavidRoads: Don't take life to seriously :) https://t.co/VmoRZgQHPp"""
906390788405215232,2017-09-09 05:36:18,b'An2k na an2k na an2k na quo pewo gwadzsKuL is LyF kaya Lavhan!'
906305585339015168,2017-09-08 23:57:44,b'Lez do this! https://t.co/4vR46Hk2Id'
906304413169442816,2017-09-08 23:53:05,"b""RT @giasison: Be with someone who wants to always know how your day was. There's nothing more uplifting than someone who deeply cares."""
906192616131256321,2017-09-08 16:28:50,b'@juliannequinano And wait walang RL ang qualiiiiii! Ang alam ko walaaaaa!'
906191904211050496,2017-09-08 16:26:00,b'Bat di ko mapagkasya 500 pesos sa isang week bhe! Hahahah.'
906191172787347461,2017-09-08 16:23:06,"b'@juliannequinano Try mo nga iask "" mam are we going to follow IMFAD (intro, method, findings and discussion) format\xe2\x80\xa6 https://t.co/W9SaQuZBcp'"
906189350668427264,2017-09-08 16:15:52,b'@juliannequinano Yun ay if niffollow ng teacher mo ang required format for intl publications ha. Hindi na kasi tala\xe2\x80\xa6 https://t.co/q9CFndKDId'
906188741605187584,2017-09-08 16:13:26,b'@juliannequinano Actually onti pa nga ang max. na words for quali dapat 1500 to 3000 words lang. Unlike quanti 4000 to 6000 words.'
906188212112048128,2017-09-08 16:11:20,b'Ayun na nga so ako ang manager ng 2 team ng volleyball for the intramurals at wala akong ginawa kundi tumawa ng tumawa sa squammy jokes nila'
906187683088568325,2017-09-08 16:09:14,b'@juliannequinano Pero 15 page RL is so jurassic na.. seryoso ba yan? This time max na na RL is 3 or 4 pages. Di na\xe2\x80\xa6 https://t.co/hqJwf9rPpO'
906184384155344897,2017-09-08 15:56:07,b'Happy birthday @jnsarnrmn! I love you and I am so proud of you! https://t.co/y9NE9LCCBx'
906183487694151681,2017-09-08 15:52:34,"b'@juliannequinano Do a table of findings, dendogram then synoptic and argumentative technique \xf0\x9f\x98\x84'"
906098553587511296,2017-09-08 10:15:04,"b'RT @DavidRoads: For everything you have lost, you have gained something else.'"
906098542896230400,2017-09-08 10:15:01,b'RT @DavidRoads: The purpose of life is to live a life of purpose.'
906046042449231872,2017-09-08 06:46:24,b'Huuuuuuuu yeaaaah sabay sabay na tasks wwwuuuuu yeaaaah todooooo!'
905999918774419456,2017-09-08 03:43:07,"b'RT @Pontifex: Dear young people, do not be afraid of the future! Dare to dream big! Keep joy alive, a sign of a young heart that has encoun\xe2\x80\xa6'"
905817957661499392,2017-09-07 15:40:05,b'@emhjh0 Jhooooooooooo kain tayo isaw sa whole court hahaha'
905812510082686976,2017-09-07 15:18:26,b'@emhjh0 Hahahahah. Hahahaahhaha.'
905809748720730113,2017-09-07 15:07:27,b'@emhjh0 Omg jho nagpplay yung godbless u mama mary loves u sa radio ng fx ko now. Jusq nakakahiya tumawa. Hahahahahahhahahaha'
905809392003461120,2017-09-07 15:06:02,"b""Hiyang hiya ako sa 144 int'l publications ni dean yaw qu na."""
905807984177012738,2017-09-07 15:00:27,b'Opinions=Hating\nPeram highlighter haylayt ko tong part na to https://t.co/zFlUZssT5b'
905801982669078530,2017-09-07 14:36:36,b'Ayun pauwi pa lang me from gradschool. Pa zombiehan na naman po tayo bukas mga kapusssoooo!'
905799586681196544,2017-09-07 14:27:05,"b""RT @DavidRoads: The man who does not read good books has no advantage over the man who can't read them. - Mark Twain"""
905726532659712000,2017-09-07 09:36:47,"b'@emhjh0 Kaya natin to jho. Inaantok ako now bes, hanggang 9pm tong class ko. Pray 10 hail mary for me.'"
905724325679865862,2017-09-07 09:28:01,b'Keep your thoughts and words you need them more.'
905674656618749952,2017-09-07 06:10:39,"b'Ayun so i used highlighters to help me emphasize impt concepts, ended highlighting all content of the paper. Bat ganunnnnn! Lahat impt!'"
905673958229401602,2017-09-07 06:07:52,"b'RT @DavidRoads: Know when to cry, know when to laugh, know when to be silent. - Mark Crow'"
905673942500642816,2017-09-07 06:07:49,b'\xf0\x9f\x98\x82\xf0\x9f\x98\x82\xf0\x9f\x98\x82 https://t.co/ir7A6P1XfT'
905673810547924994,2017-09-07 06:07:17,b'RT @DavidRoads: Great spirits have always faced violent opposition from mediocre minds. - Einstein'
905628658869518336,2017-09-07 03:07:52,b'Dalhin nyo ako sa dagat pleaseeeeee. I need it now'
905600124595781632,2017-09-07 01:14:29,b'RT @realgreenfan: https://t.co/MawGRsIzw6'
905592178419785729,2017-09-07 00:42:55,"b""Me everytime I smell mom's cooking \xf0\x9f\x98\x84 https://t.co/gbX6hTnHfR"""
905547643299872768,2017-09-06 21:45:57,b'Oi @juliannequinano magiging mermaid kana soon. https://t.co/5vNyWirw9J'
905547555718610944,2017-09-06 21:45:36,"b'RT @DavidRoads: Accept what is, let go of what was and have faith in what could be.'"
905547227610857475,2017-09-06 21:44:17,"b""You don't deserve people who will make you doubt your worth. \xf0\x9f\x92\xaa"""
905441364174749696,2017-09-06 14:43:38,b'Oh dito naman tayo? Hihi.'
905433455479013376,2017-09-06 14:12:12,b'@ASCAdapon Lab yu'
905427068120252417,2017-09-06 13:46:49,b'Di na ako mag papa chani ng balbas hahaha!'
905416053928280064,2017-09-06 13:03:03,b'Masakit din pala ano.'
905413205991628800,2017-09-06 12:51:44,"b""RT @PrayInFaith: I'm a Christian. I'm not perfect. Just because I mess up sometimes doesn't mean I'm fake. There's no such thing as a perfe\xe2\x80\xa6"""
905400720521781248,2017-09-06 12:02:07,b'@emhjh0 Anu na'
905393462370983937,2017-09-06 11:33:17,"b""A remider to anyone who's following me to get info for you know... this my message for you\xf0\x9f\x92\xa9\xf0\x9f\x92\xa9\xf0\x9f\x92\xa9\xf0\x9f\x92\xa9\xf0\x9f\x92\xa9\xf0\x9f\x92\xa9\xf0\x9f\x92\xa9\xf0\x9f\x92\xa9\xf0\x9f\x92\xa9\xf0\x9f\x92\xa9\xf0\x9f\x92\xa9\xf0\x9f\x92\xa9\xf0\x9f\x92\xa9\xf0\x9f\x92\xa9\xf0\x9f\x92\xa9\xf0\x9f\x92\xa9\xf0\x9f\x92\xa9\xf0\x9f\x92\xa9\xf0\x9f\x92\xa9\xf0\x9f\x92\xa9\xf0\x9f\x92\xa9\xf0\x9f\x92\xa9\xf0\x9f\x92\xa9\xf0\x9f\x92\xa9"""
905392495399276544,2017-09-06 11:29:26,"b""RT @JesusGraces: Choose not to settle. Pursue your God-given goals, knowing it's never too late to accomplish everything God has placed in\xe2\x80\xa6"""
905381754818592768,2017-09-06 10:46:46,b'Amazed. \xf0\x9f\x98\x84'
905381624673480706,2017-09-06 10:46:15,"b""RT @smurrell: Secure leaders don't need the spotlight, stage, mic, or recognition. In secure leaders want all of the above."""
905376171142987776,2017-09-06 10:24:34,"b""RT @DavidRoads: Take responsibility for yourself.., because no one's going to take responsibility for you. -Tyra Banks"""
905374014457004033,2017-09-06 10:16:00,b'so much feels these past weeks :('
905176440336924672,2017-09-05 21:10:55,b'Prioritize. Prioritize. Prioritize.'
905175992561410048,2017-09-05 21:09:08,"b""RT @DavidRoads: You have enemies? Good. That means you've stood up for something, sometime in your life. -Churchill"""
905094872008351744,2017-09-05 15:46:47,b'Kakauwi lang at papasok na naman ng 4am bukas. Wapak!'
905091424747610112,2017-09-05 15:33:06,b'@emhjh0 Sorry friend may class kasi kanina'
904812306176983040,2017-09-04 21:03:59,"b'RT @DavidRoads: But even when I am afraid, I keep on trusting you. -Psalm 56:3'"
