id,created_at,text343806453515157504,2013-06-09 19:07:00,"b""Unfollowers are like an ex, they can't see you happy"""
343752434344140801,2013-06-09 15:32:21,"b""Not staring at a girl's boobs while talking to her - is the sign of depression"""
343726998088204289,2013-06-09 13:51:17,"b""Guys, don't be afraid to tell a girl your tweet sucks"""
343485290201108480,2013-06-08 21:50:49,"b""you're automatically my best friend, if you don't know what to do with your life"""
343446771126632449,2013-06-08 19:17:45,b'*tweet something funny*\n*like pics on facebook*\n*posts pic on Instagram*\n*die alone*'
343355565554147328,2013-06-08 13:15:20,"b'""Happiness"" is more like ""A penis"" especially if your accent is South Indian'"
343115913320603648,2013-06-07 21:23:03,"b""If you're happy and you know it, delete your twitter account"""
343097004290883585,2013-06-07 20:07:54,"b'follow your dreams, take sleeping pills'"
343083824588136448,2013-06-07 19:15:32,"b""If you ever see me sitting in the corner and not talking to anyone it's because I'm too shy &amp; also because I'm masturbating in that corner"""
343078683709419520,2013-06-07 18:55:06,b'RT @scratchysingh: What happens in my mind every time I follow back a girl who is following me - http://t.co/1Tyr1I3V2z'
342925263090380801,2013-06-07 08:45:28,"b'Ladki ko Khana banana aana chahiye, chutiya to har koi banati hai'"
342735015999844353,2013-06-06 20:09:30,b'The worst thing about getting old is pissing like a handpump'
342672260768858112,2013-06-06 16:00:08,b'Alcohol is the social media of real life'
342596825972342784,2013-06-06 11:00:23,b'Breaking: Too many people on twitter are depressed cause Rohit Sharma is playing well. RIP Rohit Sharma jokes'
342593584815550464,2013-06-06 10:47:30,"b'RT @DeepDarkFear: ME: ""Things can\'t possibly get worse.""\nLIFE: ""Challenge accepted.""'"
342401643188457472,2013-06-05 22:04:47,b'Facebook is just a competition for people who want to get married soon'
342347340138545152,2013-06-05 18:29:01,b'RT @_xLNc: You need to be absolutely fucked up in real life to be popular on twitter.'
342346473368846336,2013-06-05 18:25:34,"b""@west_gurl or it's my first time"""
342332318956019712,2013-06-05 17:29:19,b'The hardest part of dating is pretending you never slept with anyone yet'
342300400864600064,2013-06-05 15:22:29,b'RT @TweetsChoor: https://t.co/26zIbCK5YS https://t.co/s323tfwVwt https://t.co/DbicPsm2T4 https://t.co/an7qnOKW6l #TweetsChor'
342231515289235456,2013-06-05 10:48:46,b'The difference between a beautiful and an ugly girl is the brain'
342226758839455744,2013-06-05 10:29:52,b'Bees are what would happen if an ant mated with a fly'
342213050595696640,2013-06-05 09:35:23,b'@snehal_gandhi Kill. Me. Please.'
342194615438422017,2013-06-05 08:22:08,"b'Writing down ""Happy World Environment Day"" on papers made by cutting trees is the best fuck you to the environment'"
342171905039671297,2013-06-05 06:51:54,b'Kalki Koechlin face is 40% teeth &amp; 60% lips'
342016774935543808,2013-06-04 20:35:28,"b""RT @FinallyHeSleeps: Too bad you can't lose weight running your mouth."""
341960395734528001,2013-06-04 16:51:26,b'Twitter is just Facebook with boobs'
341954647289913344,2013-06-04 16:28:35,"b'""I hate retweeting, but I love getting a retweet"" - everyone on twitter'"
341947030966505472,2013-06-04 15:58:19,"b""RT @Egg_Culture: This is a test tweet.....I'm testing how much time you actually waste reading dumb tweets..."""
341930307886387202,2013-06-04 14:51:52,b'RT @UnfoundMan: Twitter is Theoretical Porn site.'
341920321772863489,2013-06-04 14:12:11,"b'""Please let me fuck your brain"" - tweets on my timeline'"
341913227678068738,2013-06-04 13:44:00,"b""RT @_xLNc: I don't judge a book by its cover because I never read any."""
341870185516503040,2013-06-04 10:52:58,"b'Pro Tip: Never ever hug an anaconda, no matter how lonely you feel'"
341826968410537984,2013-06-04 08:01:14,b'RT @eshurne: Tweet nonsense. Make others think.'
341648003272159232,2013-06-03 20:10:06,"b'""All you need is true love"" - Poor people'"
341597715614027776,2013-06-03 16:50:16,"b'Game of Thrones is the best show for people ""who don\'t watch porn""'"
341540670063906816,2013-06-03 13:03:35,"b'The biggest assholes are those, who have a problem with you but will never unfollow you'"
341529558488592384,2013-06-03 12:19:26,b'#IfMenHadBoobs they would play with them all day &amp; never come out of the house'
341499628010733569,2013-06-03 10:20:30,b'Boobs speaks louder than words'
341468673774608384,2013-06-03 08:17:30,b'Having a bad day? Throw fairness cream at black people'
341312914139000832,2013-06-02 21:58:34,"b""You never realize what you have till it\xe2\x80\x99s gone. Ex girlfriend's boobs is the best example"""
341301576834621441,2013-06-02 21:13:31,"b""My girlfriend says I'm not romantic, but I just smoked in the rain"""
341289561881714689,2013-06-02 20:25:47,"b'Making a girl laugh in DM is really hard especially when she is saying ""Please don\'t DM me or else I\'ll block you""'"
341261108914556928,2013-06-02 18:32:43,b'Trees are the most innocent animal in the world'
341239087652548608,2013-06-02 17:05:13,b'The optimist sees the rain &amp; the pessimist search for the girl with white top. People on twitter tweet about it &amp; very few enjoy the reality'
341231240650829824,2013-06-02 16:34:02,b'@Psilosophy hahahaha fuck'
341215338848985088,2013-06-02 15:30:50,"b'In a perfect world, mistakes learn from us'"
341158961799634945,2013-06-02 11:46:49,"b'""You are beautiful in your own way"" - a really nice quote to make ugly people happy'"
340945631159926784,2013-06-01 21:39:07,b'I hate drinking cause after that everything looks like boobs'
340886612705685505,2013-06-01 17:44:36,"b""I followed you, you followed me after that you unfollowed me now I've to hate you because it's twitter rule"""
340849054416269313,2013-06-01 15:15:21,b'Kamaal R Khan seems like the kind of guy who high five himself when no one is around'
340775451704324096,2013-06-01 10:22:53,"b'When nobody stars your tweets, star them yourself because ""God helps those who help themselves""'"
340749179880087554,2013-06-01 08:38:29,"b'Using an exclamation mark at the end of every tweet is a perfect way to show people, you need a psychiatrist'"
340728604289802240,2013-06-01 07:16:44,"b""There's nothing better than finding someone who is equally as poor as you are"""
340720608209956865,2013-06-01 06:44:57,"b'Inspirational tweet: being nice to everyone around you, especially to those who have tiny boobs'"
340561589868564485,2013-05-31 20:13:05,"b'Some people\'s following list is the best example of  ""meet hot singles girls that aren\'t in your area""'"
340554009905594368,2013-05-31 19:42:57,"b""Spoiler alert: Don't try so hard to gain followers, we all die in the end"""
340533277272199168,2013-05-31 18:20:34,"b""To all the newbies: Go back to facebook, before it's too late"""
340531584929239041,2013-05-31 18:13:51,b'@bitadru I know :('
340509256300249088,2013-05-31 16:45:07,b'Twitter is the worst video game for lonely people'
340422241160417280,2013-05-31 10:59:21,b'Neil Nitin Mukesh has the perfect face to be the brand ambassador of Fair &amp; Lovely'
340409638220603392,2013-05-31 10:09:16,b'something epic http://t.co/C6NHjKjn4B'
340380865186111488,2013-05-31 08:14:56,b'I hate smoking because then I have to tweet with one hand'
340362856866385921,2013-05-31 07:03:23,b'@floydimus that tweet really cracked me up :)'
340355639723302912,2013-05-31 06:34:42,"b'RT @floydimus: Dear Customer, Your Ac XXXXXXXXXXXX is credited with INR HAHAHAHA on 31 May - SALARY FOR MAY. Your Net Available Bal is INR \xe2\x80\xa6'"
340203145294663680,2013-05-30 20:28:45,"b'Just tweeted this with one hand, while I was smoking.\n\nYOUR MOVE, JESUS.'"
340180904905420800,2013-05-30 19:00:22,"b'""Never be yourself"" - Batman\'s mother'"
340170661890777089,2013-05-30 18:19:40,"b'You know what\'s a dog\'s favorite chocolate?\n-Kick cats\n\n""Hahahaha I\'m so funny"" *unfollowing myself*'"
340138335257378816,2013-05-30 16:11:13,b'What relationship have taught us:\n\n1) Money can buy happiness'
340124068508483584,2013-05-30 15:14:31,"b""RT @LOLendraSingh: When the all doors are closed, it's time to watch porn."""
340115076721807361,2013-05-30 14:38:48,b'RT @abcdefu: A college scene in Bollywood is incomplete without E=mc\xc2\xb2 scribbled on a blackboard somewhere in the background.'
340114241057079296,2013-05-30 14:35:28,"b""RT @AskThePankazzzz: Chill, buddy. It's just an unfollower. We're Indians, we move on after breakups, JEE results, bomb blasts &amp; stuff like\xe2\x80\xa6"""
340111666886885377,2013-05-30 14:25:15,"b'RT @Alllahdin: The Chaiwallah asked for 5 bucks for the tea. I paid him Rs 2.50 and walked away in Bond style saying ""Dhai Another Day"".'"
340106909648551936,2013-05-30 14:06:20,"b'RT @doctoratlarge: Most public toilets bring out the Shakespeare in me - to pee or not to pee, that is the question.'"
340049999608033282,2013-05-30 10:20:12,"b'As an adult, it\'s a little disappointing how few of life\'s problems can be solved by shouting ""BHENCHOD""'"
339820241859256322,2013-05-29 19:07:13,b'The best way to end a facebook conversation with your old friend is to ask him/her; teri shadi kab ho rahi hai?'
339797341517266944,2013-05-29 17:36:14,"b""If you ain't happy with your life then you're probably right"""
339728423956127744,2013-05-29 13:02:22,"b'In a perfect world, TV remote find us'"
339689869762764800,2013-05-29 10:29:10,b'Twitter is the unfollowing button of real life'
339673391701299201,2013-05-29 09:23:42,b'@jitesh13jain :)'
339665040732995584,2013-05-29 08:50:31,"b""RT @BHaramdev: I always wanted to be a Chartered Accountant &amp; work in Afghanistan but I've dropped the idea now because, 'Tally Ban'"""
339479748801605633,2013-05-28 20:34:14,"b""Nobody is beautiful on the inside. Don't believe me, ask your doctor"""
339459664993460224,2013-05-28 19:14:25,"b""RT @BigBec43: I'm at the point where I don't know if I've had an original thought or one of you fuckers tweeted it."""
339407702218383360,2013-05-28 15:47:56,"b'Twitter needs a ""I spit on your tweet"" button'"
339377467221483520,2013-05-28 13:47:48,b'The worst people are people who yell at you for touching their boobs'
339144027934957568,2013-05-27 22:20:11,"b'There are two types of people in the world, and both sucks'"
339041095507910661,2013-05-27 15:31:10,"b""RT @AskThePankazzzz: Girls who address their boyfriends as 'Jaanu', are the same girls, who ask for a 'Pipe' instead of 'straw' with their \xe2\x80\xa6"""
339039846280613888,2013-05-27 15:26:13,b'Adding relatives on facebook is one of the greatest idea that everyone hates'
339009605399085057,2013-05-27 13:26:03,b'Kamaal R Khan is the worst natural disaster happened to India'
338977199388516352,2013-05-27 11:17:17,b'#Thingsnottosayduringsex : http://t.co/BLESGuUAmF'
338773342167375874,2013-05-26 21:47:13,b'\xe2\x80\x9cLog in to twitter\xe2\x80\x9d = \xe2\x80\x9cTurn off your real life\xe2\x80\x9d'
338760432917549057,2013-05-26 20:55:55,b'Signs of depression include - \xe2\x80\x9dNot hating Monday\xe2\x80\x9d.'
338641061566087169,2013-05-26 13:01:35,b'@buddha_sadhu hahaha'
338415690681831424,2013-05-25 22:06:02,b'RIP Cleavage http://t.co/X5n0ZzXWe4'
338382868151672832,2013-05-25 19:55:37,b'Retweets are nothing just oxygen for your tweets'
338285592947347457,2013-05-25 13:29:05,"b""True love isn't hard to find. It's called money &amp; lot of fuckin' money"""
338262454020751361,2013-05-25 11:57:08,"b'RT @pritamJAYKAR: Careful, what you favorite\\RT. You might be encouraging the \xe2\x80\x9ccreepy\xe2\x80\x9d and \xe2\x80\x9cfilthy\xe2\x80\x9d in them.'"
338205866236977152,2013-05-25 08:12:16,"b""The problem with some people is that I've blocked them &amp; they are still tweeting"""
338058139763081219,2013-05-24 22:25:16,b'RT @JimmerThatisAll: Be yourself; everyone else is already Batman.'
338038192450179073,2013-05-24 21:06:00,b'Google is just a college for drop-out'
338027123044392960,2013-05-24 20:22:01,b'Steps to happiness: \n* Stay away from people\n* Never be yourself\n* Alcohol'
338017057671090178,2013-05-24 19:42:01,"b""There's a 100% chance Harbhajan Singh is doing something really weird right now"""
337982823027851264,2013-05-24 17:25:59,b'Breaking: Malinga was trying to play baseball'
337967182879277056,2013-05-24 16:23:50,"b'RT @Psilosophy: If I ever  have a daughter, when she\'s grown up, I will show her ""Taken"" &amp; say, ""Make smart life choices because I can\'t do\xe2\x80\xa6'"
337952773918310400,2013-05-24 15:26:34,b'@BeerOholic https://t.co/HMLllaFxz4'
337950562266017792,2013-05-24 15:17:47,"b""These days It's not really over until you block each other on facebook/twitter"""
337914562303098882,2013-05-24 12:54:44,"b'""Well, delete your twitter account"" - me as a psychologist'"
337871982181883904,2013-05-24 10:05:32,"b""RT @DesireMaze: Love acts as if it's knocking at you door and you act as if you hear it."""
337646214910722048,2013-05-23 19:08:25,"b'When God closes a door, we opens a bottle of whisky'"
337617981804773376,2013-05-23 17:16:14,b'abuse because gand marane gaya bhenchod sarcasm'
337531959477682176,2013-05-23 11:34:24,b'your tweet was so funny before I googled it'
337524045866229761,2013-05-23 11:02:58,b'Sleep is basically a screensaver mode for your body'
337237766809219072,2013-05-22 16:05:23,"b""Becoming a Twitter Celeb is probably the coolest way of telling people you're unemployed."""
337213141400309761,2013-05-22 14:27:32,"b""If you're having a bad day just remember it will get worse &amp; you're going to die soon."""
337206178092290049,2013-05-22 13:59:52,"b'RT @BHaramdev: Beta, bade hokar kya banna hai? | Usain Bolt | Woh bankar kya karoge? | Teri beti ko bhaga le jaaonga.'"
337192090138193921,2013-05-22 13:03:53,"b'RT @iAmJuddy: Take life seriously, not fucking Twitter.'"
337188963112599554,2013-05-22 12:51:28,"b'RT @LOLendraSingh: I always wanted to be a Page3 photo journalist, but mere paparazzi nahi hue.'"
337182328650612736,2013-05-22 12:25:06,"b'RT @gautamverma23: Blackberry users spend 5months rebooting their phone, 3 months cursing it and remaining months throwing and finding its \xe2\x80\xa6'"
337156938901118976,2013-05-22 10:44:12,b'Instead of making jokes you guys should be happy they are giving you worm welcome with Cadbury Bournville.'
336929492553576448,2013-05-21 19:40:25,"b'The last person who pointed out my typo just meet with an accident &amp; died, feeling really sad for him :('"
336912428220694532,2013-05-21 18:32:37,"b""RT @Ra_Bies: They'll give Sardar Singh, captain of Indian Hockey Team a coke &amp; sandwich while the IPL players will move for grand parties i\xe2\x80\xa6"""
336865966531178497,2013-05-21 15:27:59,"b'Retweet is like money, everybody wants it &amp; nobody wants to give it.'"
336850294866587648,2013-05-21 14:25:43,b'Life is too short to waste on twitter. *refreshing interactions repeatedly*'
336827855151439872,2013-05-21 12:56:33,"b""RT @Jazzzzzmina: Retweets: because sometimes they say what you're thinking so much better than you."""
336800160329912320,2013-05-21 11:06:30,b'Dara Singh: Jai Shree Ram\nVindoo Dara Singh: Jai Sreesanth\n *Close enough*'
336604684322226179,2013-05-20 22:09:45,"b""No thanks, emotions. I've alcohol"""
336590564730474496,2013-05-20 21:13:38,b'When none of your tweets get retweet go to sleep'
336575240878555137,2013-05-20 20:12:45,b'Every day is a new day to give up on your dreams'
336547776433364993,2013-05-20 18:23:37,"b""When I was a kid, I was afraid of ghosts. Now I'm just afraid of Capslock."""
336484039303245824,2013-05-20 14:10:21,"b""It's called social insult, when you tweet something &amp; don't get retweet."""
336439807062458368,2013-05-20 11:14:35,b'Money is like weekend it comes slow &amp; goes so fast.'
336438869190918144,2013-05-20 11:10:51,"b""May be you're sad because you don't have enough money to buy happiness."""
336434682042384385,2013-05-20 10:54:13,b'RT @doctoratlarge: Indian drivers think they should stop at the Zebra crossing only if a Zebra is crossing'
336430228660432896,2013-05-20 10:36:31,"b""RT @_xLNc: It's cute how my girlfriend thinks giving me the 'silent treatment' will serve as a punishment for me."""
336425502262837248,2013-05-20 10:17:44,"b'RT @UnfoundMan: ""Aagle Janam mohe Chutiya Nah di jio."" - KRK Mother'"
336420705807769601,2013-05-20 09:58:41,"b""RT @kamtweeting: Everything I was, was ruined by you. Everything I am is running away from you. Everything I'll be, will be afar from you."""
336407639711956992,2013-05-20 09:06:46,"b""#AutobiographyTitleOf Kamaal R Khan: Even dettol can't kill me."""
336396508880580608,2013-05-20 08:22:32,"b'Friend: ""Why aren\'t you dating someone?""\nMe: Is your girlfriend single?\nFriend: ..... *awkward silence*'"
336386650613624832,2013-05-20 07:43:21,"b'facebook is the best example, how education has been wasted on wrong people'"
336246720113545216,2013-05-19 22:27:19,"b""You can be anything you want to be as long as you are unmarried because after that you're an arsehole."""
336208470250516480,2013-05-19 19:55:20,"b""It's enough, I can't afford to be poor anymore."""
336206972598763522,2013-05-19 19:49:23,"b""RT @GreenSmoke_: Let's not fall in love, have sex, and leave."""
336202684375896066,2013-05-19 19:32:20,"b""RT @zeninmaking: I don't take my life seriously. My parents and relatives do that for me."""
336160862819733504,2013-05-19 16:46:09,b'Everyone is beautiful in their own way. Except ugly people. They suck.'
336151640291803137,2013-05-19 16:09:31,b'What kind of alcohol goes well with feelings?'
336150558698254336,2013-05-19 16:05:13,"b""RT @AdvancedMaushi: Don't, please don't judge me for the embroidery on my jeans, you don't know what I have been through in life."""
336145547683561473,2013-05-19 15:45:18,"b'RT @Ra_Bies: Airtel executive: ""Your bill for Rs 2182 is due, please pay it by due date"" Me: ""What if I ask you to watch 2182 one rupee vid\xe2\x80\xa6'"
336135361552072704,2013-05-19 15:04:49,"b""RT @DesireMaze: To reach upto her skirt, you'd have to go down on your knees."""
336129070226096129,2013-05-19 14:39:49,"b""RT @BeerOholic: Orgasms, otherwise people wouldn't know when to stop screwing each other!"""
336124773027418114,2013-05-19 14:22:45,"b'RT @EZ_G: I swear, unfollowers have commitment issues.'"
336121746811916288,2013-05-19 14:10:43,"b'RT @LOLendraSingh: For Real Men, a drunk girl is a responsibility.. Not an opportunity.'"
336114537046618112,2013-05-19 13:42:05,b'RT @SlipCarefully: Money is so expensive these days.'
336091301692981248,2013-05-19 12:09:45,b'If you really want to flirt on the timeline at least flirt with beautiful girls.'
336043705851064320,2013-05-19 09:00:37,"b'""If you can\'t handle me at my potato, then you sure don\'t deserve me at my french fries.""'"
335854677327478785,2013-05-18 20:29:29,"b'friendly reminder : Somewhere out there, right now, your twitter crush is sexting with her boyfriend.'"
335833868806524928,2013-05-18 19:06:48,"b""Twitter is more fun when you don't care about unfollowers."""
335778156793434112,2013-05-18 15:25:25,"b""Sreesanth's laptop seized from Mumbai hotel: At least give him a chance to delete his Mallu porn collection."""
335731714716483584,2013-05-18 12:20:53,b'Stop tweeting guys. These news channels are getting all of the latest news from us.'
335714546591342593,2013-05-18 11:12:39,"b""RT @BHaramdev: A recent research by some top scientists have proved that people, who type 'my' as 'ma' are 'Ma'darchods."""
335673629637488640,2013-05-18 08:30:04,"b""1) Nicknames.\n2) Retweet.\n3) Blowjob.\n\nThree things, which you can't give yourself."""
335502507243606016,2013-05-17 21:10:05,b'RT @FSUSteve: Women with a sense of humor are so fucking sexy.  Not the ugly ones though.'
335451572043644929,2013-05-17 17:47:41,"b'Whenever a girl mentions another girl for the Avi ""Aww so beautiful"" - I\'m always pretty sure one of them is thinking, ""bitch.""'"
335371612402634753,2013-05-17 12:29:57,"b""Sometimes I drink scotch just to remind myself, I'm not  poor after that I laugh &amp; laugh because I'm poor."""
335293447286181890,2013-05-17 07:19:21,b'Slumdog Millionaire : Basti ka Crorepati kutta\n#HindiNamesOfHollywoodMovies'
335289589654761474,2013-05-17 07:04:02,"b""She's the Man - Rakhi Sawant\n#HindiNamesOfHollywoodMovies"""
335146109091594240,2013-05-16 21:33:53,"b'Weird how my phone Autocorrects ""feelings"" to ""alcohol""'"
335122160534319104,2013-05-16 19:58:43,b'Twitter is a kidnapping van of social media.'
335099387602673665,2013-05-16 18:28:14,"b""It's pretty inconvenient to think who will use your cellphone after your death."""
334983464673746944,2013-05-16 10:47:36,"b'Meanwhile Rajasthan Royals has decided to change his theme song ""HALLA BOL!!"" to ""PAISA BOL!!""'"
334939083249971201,2013-05-16 07:51:14,b'I used to throw my bag at school seats just to book my place for me that was #SpotFixing good old days.'
334773000949874690,2013-05-15 20:51:17,"b'SERIOUSLY: what if \'\'who"" let the dog out?'"
334745057427091459,2013-05-15 19:00:15,"b""Facebook: Wonder if people gonna 'like' this? \nTumblr: Wonder if people gonna reblog this?\nTwitter: Wonder if she's a dude?"""
334588314927632384,2013-05-15 08:37:25,"b'My friend asked ""What\'s Twitter?"" I said ""It\'s a place where you can say things like Ashish Nehra is a vampire &amp; nobody knows about it yet.""'"
334444854916558848,2013-05-14 23:07:21,b'@Psilosophy hahaha abbe biwi nahi Twitter crush vidhwa ho jayengi xD'
334437591657091072,2013-05-14 22:38:30,b'Drinking alone cause forever a loan.'
334426578840875008,2013-05-14 21:54:44,"b""Money can't buy you love unless love is sex because money can buy sex."""
334421743055814657,2013-05-14 21:35:31,b'I wonder if twitter employees are also addicted to twitter'
334402948614475776,2013-05-14 20:20:50,"b""If you can't handle me at my worst, you're probably my Ex girlfriend."""
334383729713754113,2013-05-14 19:04:28,b'Life says fuck you in many forms &amp; twitter is one of them.'
334349530839523328,2013-05-14 16:48:34,b'RT @abcdefu: So hot that you may call me Al Paseeno.'
334330272021622786,2013-05-14 15:32:03,"b""RT @DesireMaze: If you can't 'nail it' then 'screw it'."""
334326167584768001,2013-05-14 15:15:44,b'RT @EZ_G: In lust we trust.'
334324728397430784,2013-05-14 15:10:01,b'RT @Psycholane: Throwing random coins everywhere I go because I want to change the world.'
334320120446992385,2013-05-14 14:51:42,"b""RT @BrainSeducer: \xe2\x80\x9cThis pizza looks very delicious, let's ruin it and put some ketchup on it\xe2\x80\x9d - People who put ketchup on their pizza."""
334274785213288449,2013-05-14 11:51:33,"b'RT @LOLendraSingh: One of my friend was blessed with baby girl 4 days ago, They named her ""Chandani"". Today she is, Chaar Din Ki Chandani.'"
334043124827561985,2013-05-13 20:31:01,"b""Whenever I lose a Pakastani follower I just assume they've joined Taliban."""
333993094724866049,2013-05-13 17:12:13,b'People fighting over copying tweets forever alone level 164774983091'
333861309990961152,2013-05-13 08:28:33,"b'The most important thing a parent can teach a child is respect women. And also never to use the word ""LMAO""'"
333665166002647040,2013-05-12 19:29:09,"b""Twitter is basically a therapy for people who can't afford therapy."""
333663913256296448,2013-05-12 19:24:10,"b'Sorry, but if you\xe2\x80\x99re pretty &amp; mostly favorite my all tweets then you\xe2\x80\x99re my new online girlfriend.'"
333623854268301314,2013-05-12 16:44:59,"b'People who still use blackBerry phones are brave, socially.'"
333537098533568512,2013-05-12 11:00:15,b'Pizza without extra cheese is exactly what disappointment tastes like.'
333320183450058752,2013-05-11 20:38:19,"b""RT @WilliamAder: I've outsourced my starring and retweeting to a firm in India, so if Sanjay isn't showing you enough love, let me know."""
333142624259149824,2013-05-11 08:52:45,b'Twitter: A great excuse to be forever alone.'
332931526314573824,2013-05-10 18:53:56,"b'after ""be yourself"" the best advice you can give to someone is \'\'always do what you love""'"
332866760007106560,2013-05-10 14:36:34,"b""Unless your laughter cure dark circles &amp; wrinkles, it's not the best medicine."""
332856755321176064,2013-05-10 13:56:49,b'RT @Firawesome: Stop telling lies about me and I\xe2\x80\x99ll stop telling people the truth about you.'
332797217230438400,2013-05-10 10:00:14,b'Twitter is just a side effect of being lonely.'
332772392722132993,2013-05-10 08:21:35,"b'1) Wake up.\n2) Read Tweets until your phone dies.\n3) Get up, plug in phone.\n4) Read Tweets until you die.'"
332771416917278720,2013-05-10 08:17:43,"b'RT @DesireMaze: She: Are you seeing someone? He: No, absolutely single and ready to mingle. She: No, I meant for your mental health?'"
332765990637150208,2013-05-10 07:56:09,b'RT @kamtweeting: Everything is for sale at the right smile.'
332578850657689601,2013-05-09 19:32:31,"b'Before WhatsApp I used to go outside her home to check her \'\'last seen""'"
332570344680484866,2013-05-09 18:58:43,b'Happiness is eating a whole pizza. Sadness is eating alone that whole pizza.'
332502653588340738,2013-05-09 14:29:44,"b""Mathematics: God's way of making childhood tough."""
332494395674873857,2013-05-09 13:56:56,"b""you ain't what you eat but you're basically the last movie you watched"""
332399387684773888,2013-05-09 07:39:24,b'If Chutiyappa was a religion Kamaal R Khan would be Dharma Guru of this religion.'
