id,created_at,text
1067593223076552705,2018-11-28 01:37:13,b'RT @shaunwkeaveny: Please circulate this: https://t.co/pqU27sSlbu'
1067593223068155904,2018-11-28 01:37:13,"b""RT @nineinchnails: 'Metal' performed w/ @numanofficial live in Las Vegas 6.16.18. \n\nCOLD AND BLACK AND INFINITE NORTH AMERICA 2018 returns\xe2\x80\xa6"""
1067477417890144260,2018-11-27 17:57:03,b'Pray For The Pain You Serve live at Brixton Academy! \n\nLive album is available now: https://t.co/709UEeOYfC https://t.co/YlWZXeV82f'
1067469172358160384,2018-11-27 17:24:17,"b'Another rare chance to get out and actually see something. We are now in Roskilde, Denmark so visited the Viking Bo\xe2\x80\xa6 https://t.co/PaGOgvnMLR'"
1067464219333931008,2018-11-27 17:04:37,"b'RT @DonovanSilver: These wonderful ""Voices of Greywood"" T Shirts are available now from my shop page.\n\nhttps://t.co/sTLG5HKyZP https://t.co\xe2\x80\xa6'"
1067125576329293826,2018-11-26 18:38:58,"b'Tonight we are in Berlin, playing at Huxleys. There is a unique and exciting atmosphere to this city. It\xe2\x80\x99s always g\xe2\x80\xa6 https://t.co/sBjY6NUl0T'"
1067017421024829440,2018-11-26 11:29:12,b'Are Friends Electric? at Brixton Academy back in 2017 :) \n\nThe live album is available now worldwide:\xe2\x80\xa6 https://t.co/jlQFz8v83H'
1066957548505436160,2018-11-26 07:31:17,"b'RT @DonovanSilver: My new EP \xe2\x80\x9cVoices of Greywood\xe2\x80\x9d is released today.\nIt is available to download from iTunes, Spotify etc. The CD version i\xe2\x80\xa6'"
1066829499575296006,2018-11-25 23:02:28,b'Warsaw. That was fun. Thank you so much. And thank you to our crew who loaded in and set up the entire show in just\xe2\x80\xa6 https://t.co/Z4fo7kQRNo'
1066820824307548163,2018-11-25 22:27:59,b'RT @ElfinHaloMoon: 3 babies in Poland watching dads show in Warsaw garynuman https://t.co/9Ms16RjW3k'
1066820747044229123,2018-11-25 22:27:41,b'RT @ElfinHaloMoon: My second baby persia persianumanofficial and my husband garynuman in Warsaw Poland xx https://t.co/r9JQxmQrLs'
1066717923086139392,2018-11-25 15:39:06,b'Remember the brilliant puppet version of the \xe2\x80\x98My Name Is Ruin\xe2\x80\x99 video? Met the lady who made the puppets and the vid\xe2\x80\xa6 https://t.co/J8PdAuqu6A'
1066715937116733440,2018-11-25 15:31:12,"b'Finally in Warsaw (late). Loved the show in Krefeld last night, crowd were amazing, but a long 15 hour drive to get\xe2\x80\xa6 https://t.co/CRo4eRhULj'"
1066675188861935616,2018-11-25 12:49:17,"b'RT @DonovanSilver: My new EP ""Voices of Greywood"" is released tomorrow, until then, here is the video for the title track.\n\nhttps://t.co/vC\xe2\x80\xa6'"
1066299599822958592,2018-11-24 11:56:50,"b'RT @DonovanSilver: If, like me, you had any problems getting my YouTube link to work yesterday then please try this one. https://t.co/MWg0h\xe2\x80\xa6'"
1065897852717711360,2018-11-23 09:20:26,b'I\xe2\x80\x99m happy to announce that \xe2\x80\x98Savage - Live at Brixton Academy\xe2\x80\x99 is available in every store now. \xf0\x9f\x99\x82 \n\nOrder the live a\xe2\x80\xa6 https://t.co/uxvdQTWuDq'
1065767359430971392,2018-11-23 00:41:54,b'Black Friday sale starts today. https://t.co/NUIUgb8U7j https://t.co/8RLfnKJhnL'
1065752924880539651,2018-11-22 23:44:32,"b'Prague tonight was so unexpected, so full of energy. I had no idea that was coming. Absolutely brilliant. Can\xe2\x80\x99t wai\xe2\x80\xa6 https://t.co/eHDo8Ym4l1'"
1065673079785951232,2018-11-22 18:27:16,"b'As we now return to our usual five man line up and wend our noisy way through Europe, a huge thank you from all of\xe2\x80\xa6 https://t.co/KCk5wigrO9'"
1065668007828119552,2018-11-22 18:07:06,b'Told you. Pic: https://t.co/Kl5dZyBq2h https://t.co/fg6Hdlmeor'
1065667209987538944,2018-11-22 18:03:56,b'Royal Albert Hall. Please forgive me for reliving the moment (but I might do it again). Pic: https://t.co/Kl5dZyBq2h https://t.co/uRomEVXa2z'
1065652505005211648,2018-11-22 17:05:30,b'Tomorrow - https://t.co/709UEeOYfC https://t.co/AWlUi6rMvS'
1065615025296019464,2018-11-22 14:36:34,b'The final leg of the Savage tour starts tonight. https://t.co/lZJ76BPIJl'
1065611425769553920,2018-11-22 14:22:16,b'We are playing in Prague tonight. So pleased to finally be here. Managed to squeeze in a quick trip to the bone chu\xe2\x80\xa6 https://t.co/RvdZcbx6j2'
1065543635037495296,2018-11-22 09:52:54,b'Listen back to my interview with @LizKershawDJ from 1hr 8mins in on @BBCSounds...\n\nhttps://t.co/l0cNhIab9E'
1065238666249936899,2018-11-21 13:41:03,b'Glasgow Royal Concert Hall review: https://t.co/fGWk21wVOz'
1065238134173110272,2018-11-21 13:38:57,b'Manchester Bridgewater Hall review 2: https://t.co/02dSotHr5K'
1065237326975180800,2018-11-21 13:35:44,b'Manchester Bridgewater Hall review: https://t.co/VgfrddDVKx'
1065236981968441350,2018-11-21 13:34:22,b'Shepherds Bush Empire review: https://t.co/7FlspG1mUh'
1065236651184664581,2018-11-21 13:33:03,b'Royal Albert Hall review: https://t.co/pXd6KUB2vf https://t.co/B5Ba82j1fC'
1065227532600000512,2018-11-21 12:56:49,"b'An interview I gave recently will be on BBC2 Scotland tomorrow evening at 7:30. Talking about many things, includin\xe2\x80\xa6 https://t.co/KBbhYiy7oz'"
1064893214170275842,2018-11-20 14:48:21,"b""RT @PabloTVShow: Hi @numanofficial - It's Pablo here! I'm so excited that it's #WorldChildrensDay today. Will you help us share our #DoYour\xe2\x80\xa6"""
1064720367107792896,2018-11-20 03:21:31,"b'London 2. Royal Albert Hall. I have never, in my entire life, enjoyed a show more. Nothing else to say other than t\xe2\x80\xa6 https://t.co/U5s8l16kCE'"
1064486802331979776,2018-11-19 11:53:25,b'The Savage show at Brixton Academy was one to remember. I\xe2\x80\x99m very happy that it\xe2\x80\x99s available now for everyone to enjo\xe2\x80\xa6 https://t.co/foZEbHKipz'
1064467165561217024,2018-11-19 10:35:23,"b'RT @DonovanSilver: The video for my first EP ""Time Track"" has been viewed over 2000 times now on YouTube, thank you.\nMy new video for ""Voic\xe2\x80\xa6'"
1064329376106450944,2018-11-19 01:27:52,b'London 1. Shepherds Bush tonight was amazing. I loved every second of that. I cannot wait for our show at the Royal\xe2\x80\xa6 https://t.co/yn8oEktwUW'
1064139215124992000,2018-11-18 12:52:14,"b'Knocked my guitar over last night (it\xe2\x80\x99s used to it :), but that was the only hiccup in an amazing night. Thank you\xe2\x80\xa6 https://t.co/KztX44KsFm'"
1064096123327922176,2018-11-18 10:01:00,b'\xe2\x80\x98Ghost Nation\xe2\x80\x99 was recorded live at Brixton Academy last year. It\xe2\x80\x99s available to stream/buy now. Get the full live\xe2\x80\xa6 https://t.co/tMljliphXB'
1063808322606895105,2018-11-17 14:57:23,"b'Manchester Bridgewater Hall. Tonight we also add the Kantos Choir to the show, and we\xe2\x80\x99re filming it, and we\xe2\x80\x99re back\xe2\x80\xa6 https://t.co/TGBSaEo228'"
1063438589260906498,2018-11-16 14:28:12,"b'RT @DonovanSilver: The CD version of my new EP ""Voices of Greywood"" is available to pre order now at,\nhttps://t.co/sTLG5HKyZP https://t.co/\xe2\x80\xa6'"
1063431265045700609,2018-11-16 13:59:05,b'Birmingham review. https://t.co/OLgVcW0Bnc https://t.co/CwWSRBNHjb'
1063428895221972993,2018-11-16 13:49:40,b'Rock Sins review of the new Savage - Live At Brixton DVD/CD. https://t.co/tZG7n5w1n0'
1063419357542457344,2018-11-16 13:11:46,"b'RT @GreenFutureNews: The Parliamentary motion against Trophy Hunting is supported by MPs from the Conservatives, Labour, Lib Dems, SNP, Pla\xe2\x80\xa6'"
1063383186120589312,2018-11-16 10:48:02,"b'\xe2\x80\x98Ghost Nation (Live)\xe2\x80\x99 is now up in full on my Youtube channel, it\xe2\x80\x99s also available to stream/buy worldwide.\n\nYou ca\xe2\x80\xa6 https://t.co/4u1YwAM9OW'"
1063249944809754624,2018-11-16 01:58:35,b'Our light show didn\xe2\x80\x99t really fit in to the Newcastle City Hall tonight so we had to chop it up and squeeze in what\xe2\x80\xa6 https://t.co/3jPwY6LDXf'
1063221265249562629,2018-11-16 00:04:37,"b'RT @SKShlomo: This legend @eddyTM gave @KasabianHQ, @2ManyDJs, @smdisco, @4PlanB and my own solo project their first ever radio plays - wha\xe2\x80\xa6'"
1063221079999741955,2018-11-16 00:03:53,"b'RT @trent_reznor: Sadly, my friend and frequent collaborator Mike Garson lost his home and studio in the recent fires.\nMike is a true artis\xe2\x80\xa6'"
1063046579341418497,2018-11-15 12:30:29,"b'So, I post things here and on Instagram about the shows, the orchestra, the EP, and other cool career stuff, and wh\xe2\x80\xa6 https://t.co/J8YEro0Bk5'"
1062854565807222784,2018-11-14 23:47:30,b'RT @cjsviolin: In case any of you were wondering how it went last night in #Birmingham. @numanofficial #skaparis https://t.co/zNznZowtsC'
1062779424142188544,2018-11-14 18:48:54,b'Birmingham last night. https://t.co/2bO7U6sIfe'
1062746379351662594,2018-11-14 16:37:36,b'Birmingham Symphony Hall review: https://t.co/0pBKeGLIGH'
1062537994547027968,2018-11-14 02:49:33,"b'It\xe2\x80\x99s easy to get a bit gushy in the heat of the moment, so I\xe2\x80\x99ve waited a few hours before saying anything, but fuck\xe2\x80\xa6 https://t.co/RNLQbR519U'"
1062387712769093632,2018-11-13 16:52:23,b'RT @JensonButton: https://t.co/wGhqvOdYcF'
1062357238000574464,2018-11-13 14:51:17,b'Birmingham Symphony Hall. I\xe2\x80\x99ve not been here before but it\xe2\x80\x99s really quite impressive. This show is nearly two hours\xe2\x80\xa6 https://t.co/BgBK8N6WpE'
1062163509826465792,2018-11-13 02:01:29,b'Great to see The Mission\xe2\x80\x99s Wayne Hussey tonight. Three years is way too long. https://t.co/4CDljvV7yE'
1062162581559930880,2018-11-13 01:57:48,b'Fantastic first night. Thanks to everyone that came to see us in Cardiff tonight. https://t.co/YNoCBDZ5N9'
1061972021167427584,2018-11-12 13:20:34,b'The rig is being built for tonight\xe2\x80\x99s show in Cardiff. A long way to go yet with the build but I\xe2\x80\x99m told we have 8 to\xe2\x80\xa6 https://t.co/f4Ar4t5D9Q'
1061929229141585920,2018-11-12 10:30:32,"b""A little preview of 'Pray For The Pain You Serve', which we performed live at Brixton Academy on the Savage Tour la\xe2\x80\xa6 https://t.co/NI10DB9mV7"""
1061642386110140417,2018-11-11 15:30:43,b'The rehearsals are over. Today we ease back in to bus life &amp; make our way to Cardiff for the first show of what I h\xe2\x80\xa6 https://t.co/kDqSiQmVJ2'
1061442551692046336,2018-11-11 02:16:39,b'Ronnie jumps on to the trampoline and then waits for Echo to give him a bounce. He loves it. https://t.co/mZzHu4Yu6u'
1061263730095349760,2018-11-10 14:26:05,b'Here we go. I can\xe2\x80\x99t tell you how exciting this is. It is actually making my spine tingle. https://t.co/G8GijFnQLS'
1061196059127484418,2018-11-10 09:57:11,"b'\xe2\x80\x98My Name Is Ruin (Live)\xe2\x80\x99 is up in full on Youtube as of today, it\xe2\x80\x99s also available to stream/buy worldwide.\xe2\x80\xa6 https://t.co/BVAgWL78KP'"
1060856369547542530,2018-11-09 11:27:22,"b'My latest EP \xe2\x80\x98The Fallen\xe2\x80\x99 is available worldwide now, thanks everyone for the early support. You can get the full E\xe2\x80\xa6 https://t.co/kLE8QrOdT7'"
1060855863362101248,2018-11-09 11:25:22,"b'My latest EP \xe2\x80\x98The Fallen\xe2\x80\x99 is available worldwide now, thanks everyone for the early support. You can get the full E\xe2\x80\xa6 https://t.co/5vSFZTEPp1'"
1060466527244304385,2018-11-08 09:38:17,"b'London Royal Albert Hall and Manchester Meet and Greets are now sold out, only 3 left for Shepherds Bush. See you s\xe2\x80\xa6 https://t.co/KCTeKObSHi'"
1060314227007782912,2018-11-07 23:33:06,b'Day 1 rehearsal. Fantastic. I am greatly relieved that it\xe2\x80\x99s all coming together and sounding rather epic. Can\xe2\x80\x99t wai\xe2\x80\xa6 https://t.co/TsV7xLGNb3'
1060121676304838656,2018-11-07 10:47:58,b'Last few days to get your Meet and Greet (including Soundcheck) places before the orchestra tour starts.\xe2\x80\xa6 https://t.co/k6hEqUBFF1'
1060106801704767488,2018-11-07 09:48:52,b'We are now in Manchester. First day of rehearsals today for the orchestra shows which start on Monday in Cardiff. https://t.co/eotdyFopv0'
1059834046551912448,2018-11-06 15:45:02,"b'Great news. Chris Payne, my good friend and former band keyboard/viola player, has agreed to be the special guest s\xe2\x80\xa6 https://t.co/BSwFJU4CWb'"
1059476866648731648,2018-11-05 16:05:43,"b'One of my favourites to perform on stage, the atmosphere was something special at Brixton Academy last year. \n\nSava\xe2\x80\xa6 https://t.co/9zNu2AYtol'"
1059175312196538369,2018-11-04 20:07:27,"b'RT @DonovanSilver: The first \'behind the scenes\' shot from the filming of my new video for ""Voices of Greywood.""\nMy huge thanks as always t\xe2\x80\xa6'"
1058446516170473472,2018-11-02 19:51:29,b'Flew in to the UK this afternoon. Getting ready for the orchestra shows and rehearsals. Been looking forward to thi\xe2\x80\xa6 https://t.co/bQ05FiEYBz'
1058374591398187012,2018-11-02 15:05:40,b'We\xe2\x80\x99ve just uploaded the full version of \xe2\x80\x98When the World Comes Apart\xe2\x80\x99 to my Youtube channel. \xf0\x9f\x99\x82\n\nPre-order the CD/DVD\xe2\x80\xa6 https://t.co/H3aSxQ3rZ1'
1057535548867465216,2018-10-31 07:31:37,"b'I\xe2\x80\x99m trying something new in January. Two intimate UK shows, no music, no light show, just me talking about my life,\xe2\x80\xa6 https://t.co/1gnOz8Y353'"
1056938780492525568,2018-10-29 16:00:16,b'When The World Comes Apart. Recorded live at Brixton Academy in October 2017. The live album is out 9th November.\xe2\x80\xa6 https://t.co/0HX4SWUrV5'
1055902195877474304,2018-10-26 19:21:15,"b'I\xe2\x80\x99m going to be doing a Q &amp; A at the Rockaway Beach festival on Jan 12th, earlier in the day, well before our main\xe2\x80\xa6 https://t.co/WVDfY68TAJ'"
1055506168083185665,2018-10-25 17:07:35,b'RT @BillyMorrison: One of the greatest #TBT posts I could think of for me. Sound checking \xe2\x80\x98You Are In My Vision\xe2\x80\x99 with @numanofficial and hi\xe2\x80\xa6'
1055250400364785665,2018-10-25 00:11:15,"b'Discovered a mistake in the Store text for our Euro tour Meet and Greets today. It said the shows were in March, bu\xe2\x80\xa6 https://t.co/aMg6kgxjSR'"
1054992469249658880,2018-10-24 07:06:20,b'I see the Cat\xe2\x80\x99s lost weight while we were away. https://t.co/NWGycvOvoj'
1054991222408994817,2018-10-24 07:01:22,b'Immediately after the orchestra UK shows are done we head straight back to Europe for the final leg of the Savage c\xe2\x80\xa6 https://t.co/Um4JdJavaT'
1054989133716905984,2018-10-24 06:53:04,b'Only three Meet and Greet tickets left for the Manchester orchestra show on Nov 17. https://t.co/JY3Ayr3Y8M'
1054798544937246720,2018-10-23 18:15:44,b'Just a few weeks away from this now and I\xe2\x80\x99ve just approved a huge light show and production. This will be the bigge\xe2\x80\xa6 https://t.co/lWsbRUOel3'
1053125559780225024,2018-10-19 03:27:54,"b'Happy Birthday Podster, 13 today. I remember the moment you were born like it was yesterday and I am so proud of ev\xe2\x80\xa6 https://t.co/ujDR9wrNhC'"
1052444548344020993,2018-10-17 06:21:48,"b'All three Rehearsal VIP sessions for the UK orchestral shows in November have now sold out. Thanks everyone, see yo\xe2\x80\xa6 https://t.co/sfOskOYTkp'"
1052126490018635776,2018-10-16 09:17:57,b'I\xe2\x80\x99m happy to announce that a live album we recorded at our concert at @O2academybrix last year will be available on\xe2\x80\xa6 https://t.co/7u8KpxhFBA'
1051101725535350784,2018-10-13 13:25:54,"b'Rehearsal VIP places for our Manchester band rehearsals (without the orchestra) on Nov 7th and 9th have sold out, j\xe2\x80\xa6 https://t.co/3qhiBFTy02'"
1050869141895184384,2018-10-12 22:01:42,"b'RT @DonovanSilver: After finishing the EP mixes late yesterday, I\xe2\x80\x99m taking an evening off to see the brilliant @cloudbustingKB before doing\xe2\x80\xa6'"
1050760360368558081,2018-10-12 14:49:26,"b'Echo, my youngest, gave me this little note and $1 for looking after Gemma after her operation yesterday (yes, anot\xe2\x80\xa6 https://t.co/WDB4SS1TnC'"
1049542053481201664,2018-10-09 06:08:19,b'At the dentist today. Repairing all the chipped teeth I got from accidentally smashing the mic into my face for the\xe2\x80\xa6 https://t.co/jJnJMCG0bk'
1049375900884557824,2018-10-08 19:08:05,b'RT @ElfinHaloMoon: End of tour  pool party at ours after everyone and all equipment was dropped off at our house after the LA. ShowXxx\nWith\xe2\x80\xa6'
1049177138941706241,2018-10-08 05:58:17,"b'Los Angeles. Best night of the tour, in a tour filled with great nights and fantastic crowds. Thank you to everyone\xe2\x80\xa6 https://t.co/2Qzdtb4Dbo'"
1049011489531727872,2018-10-07 19:00:03,"b'If you missed \xe2\x80\x98It Will End Here\xe2\x80\x99 on @BBClamacqshow\xe2\x80\x99s Roundtable, you can listen again below. Thank you to\xe2\x80\xa6 https://t.co/w5HTvAE94I'"
1048711802496802816,2018-10-06 23:09:12,"b'Los Angeles tonight. The 112th show of the Savage World Tour, and the final US show. In a few weeks we head back to\xe2\x80\xa6 https://t.co/kT2FcywTDO'"
1048496254391439360,2018-10-06 08:52:41,b'San Francisco. So good it gets a second mention \xf0\x9f\x98\x8d https://t.co/r9pQukVh8r'
1048493903765073920,2018-10-06 08:43:21,"b'San Francisco, Bimbo\xe2\x80\x99s 365 Club. Not played here before but loved it. Fantastic venue and staff, great crowd, can\xe2\x80\x99t\xe2\x80\xa6 https://t.co/NgwWWMeq5c'"
1048307765892935680,2018-10-05 20:23:42,b'San Francisco tonight \xf0\x9f\x98\x8d https://t.co/N4O2OKZ6qr'
1048264146020716549,2018-10-05 17:30:22,b'You can listen to \xe2\x80\x98It Will End Here\xe2\x80\x99 from \xe2\x80\x98The Fallen EP\xe2\x80\x99 right now on YouTube. Pre-order the EP here:\xe2\x80\xa6 https://t.co/jlhkD6cdMo'
1047976873664307200,2018-10-04 22:28:51,"b'Portland. Thank you, great crowd, very grateful. This amazing dressing room art greeted us as we arrived as well. I\xe2\x80\xa6 https://t.co/MTDvMgKV8C'"
1047919104278102016,2018-10-04 18:39:18,"b""Thank you @Steve_Lamacq and @bbcradio6 for the first play of my new track \xe2\x80\x98It Will End Here\xe2\x80\x99. It's taken from the f\xe2\x80\xa6 https://t.co/QAn4yjCnil"""
1047773821514731520,2018-10-04 09:02:00,b'Be sure to tune into @steve_lamacq\xe2\x80\x99s show on @BBC6Music today. :) \n\nhttps://t.co/XbDHnXP0jI https://t.co/2krFP9a7GN'
1047541086934261762,2018-10-03 17:37:12,b'https://t.co/e0ZhjgNdju'
1047387551315574784,2018-10-03 07:27:06,b'@IanPhillipsUK Andrew Winchester? Unless he was in my Mum\xe2\x80\x99s front room when I wrote it (and he wasn\xe2\x80\x99t) he\xe2\x80\x99s a figme\xe2\x80\xa6 https://t.co/lEzgivJAZp'
1047372605462695936,2018-10-03 06:27:43,b'Seattle. Awesome as always. Love playing here. https://t.co/CE0Rn92HE8'
1047024807966060544,2018-10-02 07:25:41,b'Vancouver. \xf0\x9f\x98\x8d\xf0\x9f\x98\x8d\xf0\x9f\x98\x8d https://t.co/qzpgK2UKUM'
1046453416975716353,2018-09-30 17:35:11,b'A person on Instagram called garynuman49 seems to be pretending to be me and trying to scam people out of money. Be\xe2\x80\xa6 https://t.co/TxEGRJOTee'
1046266617254952961,2018-09-30 05:12:54,"b'Salt Lake City. That was just incredible, absolutely brilliant. Thank you :) (this is in the elevator heading back\xe2\x80\xa6 https://t.co/1tXmufClXp'"
1046180674829316096,2018-09-29 23:31:24,b'Salt Lake City tonight. Playing at The Depot. https://t.co/WijZAM6ZFQ'
1045945843122003968,2018-09-29 07:58:16,"b'Englewood, Colorado. Fantastic, thank you so much. https://t.co/vTFlaImOTR'"
1045526533840998400,2018-09-28 04:12:05,b'Thanks Omaha. You really picked us up. We\xe2\x80\x99re very grateful. https://t.co/it10NXCRB2'
1044800363524706306,2018-09-26 04:06:32,"b'September 25, 2018. https://t.co/UnGVlAJCBt'"
1044578365028675584,2018-09-25 13:24:24,b'It\xe2\x80\x99s a very sad and somber team on the bus this morning as we make our way to Louisville. I don\xe2\x80\x99t have the words to\xe2\x80\xa6 https://t.co/EFjoUfixFV'
1044375829176700929,2018-09-24 23:59:35,b'We are all utterly devastated by the fatal accident involving our tour bus in Cleveland earlier today. Full stateme\xe2\x80\xa6 https://t.co/4T0mrYwkve'
1043768972624191488,2018-09-23 07:48:10,b'New York today. Managed to get out for an hour or two before the show. Babies fly home tomorrow \xf0\x9f\x98\xaa (they have Beyonc\xe2\x80\xa6 https://t.co/X6YRvPR2r1'
1043317558995308544,2018-09-22 01:54:24,"b'Grey\xe2\x80\x99s Puppets, My Name Is Ruin. Genius \xf0\x9f\x98\x80 https://t.co/ELjFbhTdo8 https://t.co/sV1OFFmgRR'"
1043242827164078081,2018-09-21 20:57:27,"b'Tonight we are in Washington DC at the 9:30 Club. Early show, Nightmare Air on at 6:30, we\xe2\x80\x99re on at 7:30. https://t.co/l08EsT2Rz1'"
1042992752533823488,2018-09-21 04:23:44,"b'Fantastic show in Boston tonight, our 100th Savage show so far https://t.co/Du6Snjs64x'"
1042992249825419264,2018-09-21 04:21:44,b'Raven took control of the lights on Cars. https://t.co/SyLlbUpcc0'
1042991849688821760,2018-09-21 04:20:09,b'She\xe2\x80\x99s back. Persia back on stage tonight. https://t.co/5HDzzl3oLd'
1042991146098552834,2018-09-21 04:17:21,b'Echo singing along in Boston tonight. https://t.co/tOAJd4gP1U'
1042904976077586432,2018-09-20 22:34:57,b'Tonight\xe2\x80\x99s show in Boston is the 100th show of the Savage Tour. Still a long way to go before it\xe2\x80\x99s over but tonight\xe2\x80\xa6 https://t.co/YOe1kbNTd4'
1042813773944442880,2018-09-20 16:32:32,b'The children flew out to Boston yesterday to join us for a few days. It was Raven\xe2\x80\x99s 15th birthday. Happy Birthday P\xe2\x80\xa6 https://t.co/iZQigumvtG'
1042277634179260418,2018-09-19 05:02:07,"b'I\xe2\x80\x99ve left my passport at home, so getting in to Canada this morning was a tad stressful. Glad we made it though, th\xe2\x80\xa6 https://t.co/TtyGvUuJqq'"
1041891734484148224,2018-09-18 03:28:41,b'Millvale tonight. That was brilliant. Thank you \xe2\x9d\xa4\xef\xb8\x8f https://t.co/jRyOVa2z64'
1041542587646177280,2018-09-17 04:21:18,b'RT @BillyIdol: Remembering @MarcBolan1977 today on the anniversary of his passing...here visiting his crash site memorial 2011... https://t\xe2\x80\xa6'
1041537797289639937,2018-09-17 04:02:16,"b'Columbus!!! That was fantastic, thank you all so much. One of the best crowds on the tour. https://t.co/zBb8Sozb5o'"
1041535116059791360,2018-09-17 03:51:37,b'So disappointed that I\xe2\x80\x99m going to miss @agnesobel play live in LA on the 25th. The most beautiful voice and music.\xe2\x80\xa6 https://t.co/D5JPf6bBHZ'
1041475283352805376,2018-09-16 23:53:51,"b'Playing the Newport Music Hall in Columbus, Ohio tonight. America\xe2\x80\x99s longest continually running rock club. Unlike t\xe2\x80\xa6 https://t.co/4lbVIDc80H'"
1041197999131643905,2018-09-16 05:32:02,"b'RT @ElfinHaloMoon: So this happened tonight !! garynuman was invted to play CARS with @beck tonight! \xf0\x9f\xa4\x97\xf0\x9f\xa4\x97 ! Thank you @beck ! Xxx @ Chicago,\xe2\x80\xa6'"
1041183559728484352,2018-09-16 04:34:39,b'Honoured to be invited to join @beck on stage tonight at RiotFest. Incredible band. https://t.co/uxyZKAYPip'
1041102640162197505,2018-09-15 23:13:06,"b'Promo today, pre set. RiotFest 2018. https://t.co/uImyGFapk7'"
1041101029260111877,2018-09-15 23:06:42,b'RiotFest today. The sun killed one of our computers for a minute or two but it was still a cool gig. Looking forwar\xe2\x80\xa6 https://t.co/Sgz4SW4fFG'
1040804604538220544,2018-09-15 03:28:49,b'Cincinnati tonight was epic. Loved it!! Terrible photo by my wife. She thinks it looks like the Complex sleeve from\xe2\x80\xa6 https://t.co/cBb4Qu3vXg'
1040663977330663424,2018-09-14 18:10:01,"b'RT @Protect_Wldlife: ""The greatest privilege that comes with free speech is the right to use your voice for those who don\'t have one"" ~ @Ri\xe2\x80\xa6'"
1040482476207075328,2018-09-14 06:08:48,"b'The legendary Steve Harris tonight in St Louis. Thanks everyone, we loved our time in your city. https://t.co/5C6UwtBU55'"
1040478918942310405,2018-09-14 05:54:40,b'\xe2\x80\x98Everything Comes Down To This\xe2\x80\x99 live from Montreux Festival. https://t.co/nxn78zwm1z https://t.co/RroJoTxgky'
1040374738609156096,2018-09-13 23:00:41,"b'\xe2\x80\x98My Name Is Ruin\xe2\x80\x99, live from the Montreux Festival. https://t.co/2oY9825MRV https://t.co/MSY0CeHNHt'"
1040370947209998336,2018-09-13 22:45:37,b'Tourist. St Louis tonight. https://t.co/mgdtzStnxs'
1039959269859319808,2018-09-12 19:29:46,"b'RT @JahDuran: *puts on floor-length leopard print overcoat, canes half a can of hairspray, hoovers up three lines of racket* \n\n""NORTH AMERI\xe2\x80\xa6'"
1039952827756564482,2018-09-12 19:04:10,b'A link to a CityBeat interview promoting the Cincinnati show on the current North American tour. https://t.co/Kbw1UOqWkW'
1039733347369603075,2018-09-12 04:32:01,b'This links to an Op-Ed I wrote for the Kansas City Star. https://t.co/B0Eds6Myvp'
1039730116425916416,2018-09-12 04:19:11,"b'Another great crowd, thanks Kansas. Loved every minute of that. Really appreciate you coming out to see us. https://t.co/RNN9tCqwR2'"
1039728880473571328,2018-09-12 04:14:16,"b'RT @livexlive: We\'re here to ruin your Tuesdsay with this amazing clip of ""My Name Is Ruin"" by @numanofficial, featuring his daughter Persi\xe2\x80\xa6'"
1039377781392588800,2018-09-11 04:59:08,b'Great crowd tonight in Oklahoma. Reslly enjoyed my brief time here. https://t.co/GbjnqL2zWU'
1039250790987247616,2018-09-10 20:34:31,b'RT @ElfinHaloMoon: garynuman with scott_booker #flaminglips manager at todays ACM@UCO masterclass in Oklahoma now. Talking about his life i\xe2\x80\xa6'
