id,created_at,text754099300913836032,2016-07-15 23:44:18,"b'Wow, I love @Listia! I just won this for free, 1966 ITALY - CONNECTING VENICE &amp; MANTUA (40) https://t.co/flu9O4lu5H'"
754048386739961856,2016-07-15 20:21:59,b'Go Dallas Mavericks We love the Mavericks https://t.co/4GgCOOJdo6'
754048219559129089,2016-07-15 20:21:19,b'Chelsea Clinton is a good mother.'
754048117037760512,2016-07-15 20:20:55,"b'Rooting for the Dallas Mavericks,  Go Dallas Mavericks all the way.  We love you,  become c champions. again.'"
754047877681442816,2016-07-15 20:19:58,"b'Go Devon you are a superstar, Go Chandler you are a superstar Dallas Mavericks Win to number 1.   We love you'"
754047660890390528,2016-07-15 20:19:06,b'Donald Trump would make a good President.  Trump for President.'
754047496284991488,2016-07-15 20:18:27,b'God bless Barack Obama and the Obama Family.   We love you'
754047365376569345,2016-07-15 20:17:56,b'God bless France We are praying for you'
754047123348480001,2016-07-15 20:16:58,b'Congratulations to Chelsea Clinton on her new son Aiden.  God bless'
754046991555039233,2016-07-15 20:16:26,b'Devon is a supersta. Chandler is a sperstar.   Go Dallas Mavericks Go Go Go WIN We love you WINr'
752154496847970304,2016-07-10 14:56:21,b'Happy Sunday to Aaron Arcania.  I love you'
739646061216714753,2016-06-06 02:32:17,"b'Wow, I love @Listia! I just won this for free, Vintage-- CHRISTMAS--Unused Set of 4 6\xc2\xa2 stamps https://t.co/X45eJ8dN9A'"
739206263788036097,2016-06-04 21:24:41,"b""God bless Mohommed Ali's family and friends.  We love you"""
739206005368578048,2016-06-04 21:23:40,b'Congratulations to Justin Theroux being a good Father.'
739205844529647616,2016-06-04 21:23:01,b'Congratulations to Brad Pitt being a good Father'
739205709225549824,2016-06-04 21:22:29,"b""Our condolences to the  Crouch family with Jan   Crouch's passing.   God bless you"""
739205314327678979,2016-06-04 21:20:55,"b""Our condolences to Mohammed lie's friends and family with his passing.  love ya."""
732648979113119744,2016-05-17 19:08:23,"b'Wow, I love @Listia! I just won this for free, Used Forever Stamps https://t.co/8ihQSGUlg9'"
725834058014556161,2016-04-28 23:48:19,"b'Wow, I love @Listia! I just won this for free, 50c France Postage Stamp # 2 https://t.co/6MMd5MhouN'"
725474449441443840,2016-04-27 23:59:22,"b'God bless all the good people in Washington,  Give them safety and wisdom Oh Lord we pray'"
725474290473148416,2016-04-27 23:58:44,b'OH Lord listen to your children praying send us  love send us power send us praise.'
725474116858314753,2016-04-27 23:58:02,"b'Oh Lord listen to your children praying,'"
725474014668312576,2016-04-27 23:57:38,b'They say I ama liar like Ted Cruz'
725473714570043393,2016-04-27 23:56:26,"b""God bless Nancy Williams Nancy Ortega and me Nanette Tron this mother's day"""
725473438798737408,2016-04-27 23:55:21,b'Dennis Hastert EX Speaker of the House.  Let justice prevail'
725473003190919168,2016-04-27 23:53:37,"b""Happy Mothers day to Chelsea Clinton , Gena Bush , Michelle Obama, and to Nancy Ortega and Nanette Tron,  Have a wonderful Mother's day"""
725472731702009856,2016-04-27 23:52:32,b'Long live President Obama'
725472593881387009,2016-04-27 23:51:59,"b'We love you Pope Francis,  a great man and Godly example.'"
725472456048152576,2016-04-27 23:51:26,b'Sorry Meryl Haggard died'
725472299009249280,2016-04-27 23:50:49,"b'Prince was a good man some great music, sorry to see him go'"
725472103680479235,2016-04-27 23:50:02,b'Nancy Regan was a good lady sorry to see her go'
725471834854985729,2016-04-27 23:48:58,b'We love you Dallas Mavericks WIN WIN WIN.'
725471650913751040,2016-04-27 23:48:14,b'No more HIllary for President'
725471521443991552,2016-04-27 23:47:43,b'Chelsea Clinton is a good mother'
725471405702148096,2016-04-27 23:47:16,b'Please buy my book Prayer Poems.  by Nanette Tron https://t.co/m9oLmomDiU'
725471258670821376,2016-04-27 23:46:41,b'God loves everyone and he sent Jesus to pay the price for us.'
725471144078270466,2016-04-27 23:46:14,b'Bless the Lord Oh MY Soul.'
725471059974086656,2016-04-27 23:45:53,"b'First daughter Barbara Bush does not have any children and she is not getting married,  OLD MAID'"
725470900716376065,2016-04-27 23:45:15,b'We lovve you President Obama'
725470807187558401,2016-04-27 23:44:53,b'Blessings to Nanette Tron today'
725470646818369536,2016-04-27 23:44:15,b'@TiptonDessie Have a good weekend and I love you'
725470523006685185,2016-04-27 23:43:45,b'Crooked Hillary quit'
725470466220007425,2016-04-27 23:43:32,b'Lieing Ted QUIT'
725470397525688321,2016-04-27 23:43:16,"b'Dear Shajan,  Have a good weekend and I love you.'"
725470303959175169,2016-04-27 23:42:53,"b'Dear @AscensionArcana Have a good weekend, and I love you.'"
725470129006350337,2016-04-27 23:42:11,b'Love one another'
725470041693528065,2016-04-27 23:41:51,b'Donald Trump would make a good President.'
725469941562896385,2016-04-27 23:41:27,"b'I have had a hard life, loce me'"
725469840907993088,2016-04-27 23:41:03,"b'Please buy my book Prayer Poems, https://t.co/TTUwVIWD4y'"
725469738730545152,2016-04-27 23:40:38,b'Crooked HIllary needs to qur running'
725469629221490690,2016-04-27 23:40:12,"b'Gena Bush is a good mother, PTL'"
725469101645131776,2016-04-27 23:38:07,b'Donald  Trump'
724044770130165761,2016-04-24 01:18:19,"b'Wow, I love @Listia! I just won this for free, Great Britian 26 https://t.co/SS2IDOyRlN'"
722908295753666563,2016-04-20 22:02:23,"b'Wow, I love @Listia! I just won this for free, 2 Qatar Postage Stamps # 1 https://t.co/qgZw4TO7gF'"
718535890616901632,2016-04-08 20:28:00,"b'Wow, I love @Listia! I just won this for free, 4 France Stamps # 6 https://t.co/i15peOFicU'"
718144398823923713,2016-04-07 18:32:21,"b'Wow, I love @Listia! I just won this for free, 2 Qatar 1 Gambia Postage Stamps # 8 https://t.co/WJl0Uackk3'"
712859581739835393,2016-03-24 04:32:23,"b'Wow, I love @Listia! I just won this for free, block of 4 stamps https://t.co/Z3tWSWKJRh'"
711992369034477568,2016-03-21 19:06:23,"b'Wow, I love @Listia! I just won this for free, Italy, 25 lire Used https://t.co/fralHL1r17'"
698642553780895745,2016-02-13 22:58:59,"b'Happy Valentinesday @shajanshekh27 Shajan,  love ya.'"
698642385333460992,2016-02-13 22:58:19,"b'Happy Valentinesday to @AscensionArcana Aaron and his wife,  Oh Happy Day'"
698642187739754496,2016-02-13 22:57:32,b'Happy Valentinesday to Jennifer Theroux and Justin Theroux.'
698642011578961920,2016-02-13 22:56:50,"b'Happy Valentinesday to Angelina Pitt and Brad Pitt,  Oh Happy DAy'"
698641879164805120,2016-02-13 22:56:18,"b'Happy Valentinesday to George and Laura Bush ,  Oh Happy DAy'"
698641756347207684,2016-02-13 22:55:49,"b'Happy Valtentinesday to President Bill Clinton and Hillary ,  Oh Happy DAy'"
698641605486473217,2016-02-13 22:55:13,b'Happy Valentines day to President Obama and Michelle and Sasha and Milia'
698641475333025792,2016-02-13 22:54:42,b'Happy Valentines day to Chelsea Markowitiz and Mark and Charlotte.  Oh Happy Day'
698641336627400704,2016-02-13 22:54:09,b'Happy Valentines Day to Jenna Bush Hagar and Henry Hagar and their two little girls Milsa and Poppy.'
697258272861110272,2016-02-10 03:18:21,"b'Wow, I love @Listia! I just won this for free, Stamps 932 https://t.co/yKwQ1RbeQM'"
697202943251107841,2016-02-09 23:38:29,"b'Wow, I love @Listia! I just won this for free, 5 Haler 1963 Ceskoslovenska Socialisticka Republika Coi https://t.co/T1RpvxxQok'"
697077088260591616,2016-02-09 15:18:23,"b'Wow, I love @Listia! I just won this for free, COLLECTORS: ONE (1) US Postage stamp - used /cancelled https://t.co/EgLijYX5yp'"
696590141863776256,2016-02-08 07:03:26,"b'Let the weak say I am strong, I am strong'"
696590008002572288,2016-02-08 07:02:54,b'Happy Valentines Day to President Ovama and Michelle @POTUS'
696589820588457984,2016-02-08 07:02:09,"b'Happy Valentines DAy to George and Laura Bush ,  Have a great one.'"
696589689021595648,2016-02-08 07:01:38,b'Happy Valentines DAy to Bill and Hillary Clinton We love you'
696589564274565120,2016-02-08 07:01:08,b'Happy Valentines Day to the Dallas Mavericks we love you.'
696589398419197952,2016-02-08 07:00:29,b'May the Dallas Mavericks win and become number 1 in 2016 https://t.co/grBcxnLuqn'
696589210367602688,2016-02-08 06:59:44,"b'Happy Valentines Day to @ChelseaClinton Chelsea and Mark,  Have a wonderful Valaentines next Sunday'"
696589016708177920,2016-02-08 06:58:58,"b'Have a good week @shajanshekh27 Shajan,  I love you.'"
696588871979565056,2016-02-08 06:58:23,"b'Buy my new book Prayer Poems,  https://t.co/m9oLmomDiU  Buy two today'"
696588658615259136,2016-02-08 06:57:32,"b'Have a great week @AscensionArcana Aaron we loce you,'"
696588483444416512,2016-02-08 06:56:51,"b'Have a good week @ChelseaClinton Chelsea, have another baby, we love you'"
696499855460425728,2016-02-08 01:04:40,b'Please buy a copy of my book Prayer Poems to each and everyone of you.  online https://t.co/m9oLmomDiU  thank you very much'
696499623888683008,2016-02-08 01:03:45,"b'Happy Valentinesday next Sunday to Bill and Hillary Clinton,  love ya,  Nanette'"
696499431680544768,2016-02-08 01:02:59,"b'Happy Valentines day to Chelsa Clinton and Mark Markowitiz next Sunday,  love ya, Nanette'"
696499267402215424,2016-02-08 01:02:20,"b'Happy Valentinesday next Sunday to Jenna Bush Hagar and Henry, love ya Nanette'"
696499003949617152,2016-02-08 01:01:17,"b""Shajan love ya ,  NanetteHap\\py  Valentine's Day next Sunday to @shajanshekh27"""
696498719177310209,2016-02-08 01:00:09,b'Happy Valentines Day next Sunday to @AscensionArcana Aaron Arcana  love ya'
696136190731268096,2016-02-07 00:59:36,b'God bless Nanette Tron today with love and health and peace and love and safety.'
695820199547633664,2016-02-06 04:03:57,b'LOrd bless my son Joshua with a beautiful girlfriend that loves him very much.'
695820001073213441,2016-02-06 04:03:10,"b'It is a good day with Nanette Tron ,  love ya MORE'"
695819911596146688,2016-02-06 04:02:49,b'Some days are better than others.   https://t.co/GEfkdrkhIr'
695819788015181824,2016-02-06 04:02:19,b'It is a good thing to give thanks unto the Lord and sing of his praises.  He is Most High'
695819634927210496,2016-02-06 04:01:43,b'Have a great weekend @shajanshekh27 Shajan.  love ya'
695819478131539969,2016-02-06 04:01:05,"b',Have a great weekend @AscensionArcana Aaron,  Love ya.'"
695819124727873536,2016-02-06 03:59:41,"b'Buy my new book Prayer Poems by Nanete Tron,  https://t.co/m9oLmomDiU   Buy two for gifts today'"
695818925850791936,2016-02-06 03:58:54,b'Congrats to Chelsea Clinton on being a great Mother'
695818815234420736,2016-02-06 03:58:27,"b'Congrats to Jennsa Bush Hagar on being a good Mother,'"
695818601350041602,2016-02-06 03:57:36,b'May the good Lord love on Matt today up in heaven may he have a great day and watch over me witha a smile.'
695818417920565248,2016-02-06 03:56:53,"b'God bless Nanette Tron with good health , love and peace today,  blessings'"
695597051262816260,2016-02-05 13:17:15,b'Buy Prayer Poems online https://t.co/m9oLmomDiU'
695596904478978049,2016-02-05 13:16:40,b'Buy Prayer Poems by Nanete Tron  at online https://t.co/m9oLmomDiU'
695596738401284096,2016-02-05 13:16:00,"b'Congrats to Jenna Bush Hagar being a good Mother,'"
695596632159571969,2016-02-05 13:15:35,b'Congrats to Chelsea Clinton being a good Mother'
693883697762668544,2016-01-31 19:48:59,b'No more HIllary for President.'
693883597946662912,2016-01-31 19:48:36,b'Blessings to the USA'
693883481747648512,2016-01-31 19:48:08,b'Have a great Sunday to @AscensionArcana Aaron  love ya brother.'
693883315103764480,2016-01-31 19:47:28,"b""It is a beautiful day in the neighborhood won't you be my neighbor.  Love you Mr. Rogers"""
693883103241109504,2016-01-31 19:46:38,b'Congrats to Chelsea Clinton on being a great Mom to Charlotte'
693882937150865408,2016-01-31 19:45:58,b'Congrats to Jenna Bush Hagar on being a great Mom to Mila and Poppy'
693589129431486464,2016-01-31 00:18:29,"b'Wow, I love @Listia! I just won this for free, Canada https://t.co/IsLx48yOQE'"
693567163341230081,2016-01-30 22:51:12,b'Congratulations to Jenna Bush Hagar being a great mother to Mila and Poppy.   OMg'
693566983795666944,2016-01-30 22:50:29,b'Congratualations to Chelsea Clinton being a great mother to Charlotte.'
693566845299724288,2016-01-30 22:49:56,"b'Buy Prayer Poems https://t.co/noonu1PBuB;,  buy two today'"
691360951220707328,2016-01-24 20:44:30,"b'Wow, I love @Listia! I just won this for free, Stamps (22 ) https://t.co/6djDPMgHsR'"
690906349434105856,2016-01-23 14:38:04,b'Blessings to Angelina Pitt and Brad Pitt and their family  OMG they are handsome and beautiful'
690906144231940096,2016-01-23 14:37:15,b'OMG Chelsea Clinton is a great Mother to Charlotte.   OMG'
690906030180466689,2016-01-23 14:36:48,b'OMG Jenna Bush Hagar is a great Mother to Mila and Poppy OMG'
690905890422059008,2016-01-23 14:36:15,b'Buy Prayer Poems Book by Nanette Tron online http:https://t.co/O8pwWWWRhD'
690828792718209025,2016-01-23 09:29:53,"b'Buy Prayer Poems online http:https://t.co/x5tTKwkjeC   Buy two today,  You will love it.'"
690753445687496706,2016-01-23 04:30:29,b'Amen Let my footsteps be established and ordained by the Almighty God. https://t.co/TNDvzORskF'
690753232038064128,2016-01-23 04:29:38,b'Dear Lord PLEASE Let the Dallas Mavericks be the BEST number one in 2016 IN JESUS NAME AMEN number 1 in 2016'
690751260081827840,2016-01-23 04:21:48,b'You will love Prayer Poems by Nanette Tron online http:https://t.co/x5tTKwkjeC.  today'
690750978585300992,2016-01-23 04:20:41,"b'Buy Prayer Poems, online http:https://t.co/SXWScRUFH5.html  Buy two copies today   bible study, Sunday School, Prayer Group, friends,'"
690732770641883136,2016-01-23 03:08:20,b'Amen and Amen \n\nCheers! https://t.co/Bb1d9gC7z2'
690732476537307136,2016-01-23 03:07:10,"b'Pray/er Poems buy a copy,  It will be blessed  online http:https://t.co/eusq8KDVfZ   t9day'"
690730572340047872,2016-01-23 02:59:36,"b'I love to love you baby, I love to love you baby'"
690730441792335872,2016-01-23 02:59:05,b'Blessings of good health to Angelina Pitt and Brad Pitt Peace and health to them'
690730316286193664,2016-01-23 02:58:35,b'Peace to the USA Amen'
690730223835320320,2016-01-23 02:58:13,b'Blessings to Kate Middleton and Prince William and Charlotte and Prince George.'
690730105526550528,2016-01-23 02:57:44,"b'Long live President Obama , He is a good man'"
690730007719641088,2016-01-23 02:57:21,"b'Congratulations to Jenna Bush Hagar being a good Mother to Mila and Poppy,  OMG'"
690729866191220737,2016-01-23 02:56:47,b'Congratulations to Chelsea Clinton being a good mother to Charlotte.'
690729747559526400,2016-01-23 02:56:19,b'Buy Prayer Poems online https://t.co/53AeZJQHqy.html.  Buy one today'
690729365227745280,2016-01-23 02:54:48,"b'Let Prayer Poems sell a million ,  online rosedogbookstore.comprayerpoems.comhtml  Buy two today thanks'"
690729213658169344,2016-01-23 02:54:12,"b'@AscensionArcana Have a happy and blessed weekend,  love ya, Nanette'"
690614892877844482,2016-01-22 19:19:56,b'Buy new book Prayer Poems online https://t.co/NoX68iEskQ. html'
690342365081505792,2016-01-22 01:17:00,"b""Let's make Prayer Poems Book sell one million copies.  Yeah one million .  Amen"""
690342107349979137,2016-01-22 01:15:58,b'Buy my new book Prayer Poems    online https://t.co/MrXAGranOr html'
690341881725714436,2016-01-22 01:15:05,b'God bless Widow Nanette Tron with love and healing and peace and friends.  Yeah!'
690341739459153921,2016-01-22 01:14:31,b'Congratulations to Jenna Bush Hagar on being a great mother to Mila and Poppy.'
690341591337340930,2016-01-22 01:13:55,b'OH Happy Thursday to EVERYONE'
690341509242212352,2016-01-22 01:13:36,b'Congratulations Chelsea Clinton aon being a great Mother to Charlotte.'
690341394121121792,2016-01-22 01:13:08,b'Go Dallas Mavericks win number 1 this year 2016 be number one.  yeah!'
689495532549472256,2016-01-19 17:11:59,b'OMG Chelsea Clinton is a good mother.'
689495462022291456,2016-01-19 17:11:43,b'OMG Jennsa Bush Hagar is a good Mother'
689495339301089280,2016-01-19 17:11:13,b'OMG Buy Prayer Poems Book online https://t.co/m9oLmomDiU https://t.co/mN2utn13JR html k Today'
689400824733163522,2016-01-19 10:55:39,"b'God bless Angelina Pitt she tries so hard,  Lord bless her today'"
689400707712086016,2016-01-19 10:55:11,b'OMG Chelsea Clinton is a good Mother to her daughter Charlotte. OMG'
689400612530683904,2016-01-19 10:54:49,b'OMG Jenna Bush Hagar is a good Mother to her girls Mila and Poppy. OMG'
689400470813564928,2016-01-19 10:54:15,"b""Let's make Prayer Poems new book sell one MILLION cOPIES help Matthew Tron's Widow Nanette ,  online roseodogbookstorelcomprayerpoems.comhtm"""
689302825612914688,2016-01-19 04:26:14,"b'Help Widow Nanette Tron of late Matthew Tron keep her place and support her son, rosedogbookstore.comprayerpoems.comhtml.  online'"
689278877609234432,2016-01-19 02:51:05,b'Buy Prayer Poems help me sell a million online https://t.co/hx8t34A1DC'
689278753176813568,2016-01-19 02:50:35,"b'Help Widow Tron , Nanette buy her new book Prayer Poems. online rosedogbookstore..comprayerpoems.com html  Buy two great book.  must read.'"
689263779268268033,2016-01-19 01:51:05,"b""PLease buy Widow Tron's book she needs the money Prayer Poems online https://t.co/MrXAGqSMpR html"""
689263570656231424,2016-01-19 01:50:15,"b""Happy Martin Luther King's DAy to all God bless and God bless the USA."""
689144595888734209,2016-01-18 17:57:30,b'MY DREAM for Nanette Tron Prayer Poems a BESSTSELLER one million copies sold in Jesus Name AMen https://t.co/MrXAGqSMpR html.  online'
689144307169628160,2016-01-18 17:56:21,b'My DREAM Bestseller Prayer Poems online https://t.co/MrXAGqSMpR html Buy two today.  love ya'
689144026621054976,2016-01-18 17:55:14,b'Dear @AscensionArcana My DREAM is to sell one million copies of my book Prayer Poems and make it a bestseller agree with me.'
689143752221274112,2016-01-18 17:54:08,"b'My Dream  is to make Prayer POems Book a BESTSELLER and to sell a million copies MY DREAM  online https://t.co/MrXAGqSMpR.  Buy two today,'"
689143215685959680,2016-01-18 17:52:00,b'I have a DREAM to become a bestselling author of my new book Prayer Poems online https://t.co/MrXAGqSMpR html.  Buy two today'
688881434698760193,2016-01-18 00:31:47,"b'God bless everyone this Monday is my prayer for you and me love, peace, joy and happiness  Amen'"
688881249125978112,2016-01-18 00:31:03,"b""May the Good Lord bless this Monday with love and peace and safety this Martin Luther's Kings DAy be blessed for all In Jesus Name Amen"""
688827488277901312,2016-01-17 20:57:25,b'I love to be loved'
688827424377708544,2016-01-17 20:57:10,b'OMG First daughter Barbara Bush is an Old Maid OMG'
688827337387802624,2016-01-17 20:56:49,b'OMG Jenna Bush Hagar is a good mother OMG'
688827267473014784,2016-01-17 20:56:33,b'OMG Chelsea Clinton is a good Mother OMG'
688511440899026944,2016-01-17 00:01:34,b'God bless Nanette Tron and Joshua Tron comforting them throught the loss of their husband and Dad Matthew Tron'
688511212074565633,2016-01-17 00:00:39,b'I love to be loved.  Love me.'
688511097070960640,2016-01-17 00:00:12,"b""LET'S MAKE PRAYER POEMS A BEST SELLER YEAH Online https://t.co/MrXAGqSMpR html.  Buy two now for friends..  They will love it like you.  THX"""
688486057331929088,2016-01-16 22:20:42,b'I am fine my good friend https://t.co/khKjf6iPVN'
688485909243666432,2016-01-16 22:20:06,b'Let\ns make Dallas Mavericks the BEST in 2016 Yeah  Amen  Yeah https://t.co/JLVPrqPihO'
688485678502420480,2016-01-16 22:19:11,"b""OMG  I am the author of Prayer Poems OMG Let's make it a best seller , please.  online https://t.co/MrXAGqSMpR html.  thank you"""
688430019295576064,2016-01-16 18:38:01,b'No more Hillary for President no'
688429923384471552,2016-01-16 18:37:38,b'Happy SAturday to @shajanshekh27 Shajan my friend toay'
688429804949905408,2016-01-16 18:37:10,b'ppy Saturday to @AscensionArcana Aaron my friend .'
688429622791278592,2016-01-16 18:36:27,b'I pray for you today a healthy and safe day with love and kisses.'
688429453756661760,2016-01-16 18:35:46,b'May the Dallas Mavericks be the BEST in 2016'
688429344033648640,2016-01-16 18:35:20,"b'No more gun violence,  Help us Barack Obama we are counting on you.'"
688429224026230784,2016-01-16 18:34:52,"b'I am blessed and I know that I am I am blessed blessed blessed,  Amen'"
688429120326217728,2016-01-16 18:34:27,b'Blessings to Angelina Pitt and Brad Pitt today'
688428944089939968,2016-01-16 18:33:45,b'Congratulations Jenna Bush Hagar on being a good mother'
688428856533848064,2016-01-16 18:33:24,b'Congratulations to Chelsea Clinton being a good mother'
688428769321684996,2016-01-16 18:33:03,b'Blessings to everyone this beautiful Saturday.'
688428683137171456,2016-01-16 18:32:43,b'Please buy my new book Prayer POems.  online at https://t.co/MrXAGqSMpR html.  thank you thank you.'
688081196748677120,2016-01-15 19:31:55,"b'Please pray for me Nanette Tron , I need your love and support, please'"
688081063495663618,2016-01-15 19:31:24,b'God is good all the time'
687940357166858240,2016-01-15 10:12:17,"b'Wow, I love @Listia! I just won this for free, lot of 2 stamps U.S.A.  https://t.co/EZfjpA4m4W'"
687928223750033409,2016-01-15 09:24:04,b'Joel Osteeen is the devil incarnate'
687928156372742144,2016-01-15 09:23:48,b'Please buy my new book Prayer Poems online bookstore.  https://t.co/MrXAGranOr html  Now you will be blessed'
687927938180853760,2016-01-15 09:22:56,b'OMG Barbara Bush is an Old Maid.  No marriage no children'
687927828722151424,2016-01-15 09:22:30,b'OMG Jenna Bush Hagar is a good mother  to Mila and Poppy'
687927512375160832,2016-01-15 09:21:14,b'OMG Chelsea Clinton is a good mother'
687849799643602946,2016-01-15 04:12:26,b'Go Dallas Mavericks Go. Go. Go.  in 2016 Dallas is number 1 yeah!'
687849561335803909,2016-01-15 04:11:29,b'Buy my new book Prayer Poems.  online bookstore.  https://t.co/MrXAGqSMpR html.  thank you'
687849381811245056,2016-01-15 04:10:46,b'God bless the USA'
687849313838350336,2016-01-15 04:10:30,b'Roland Valentine makes some good pictures.'
687849118278914048,2016-01-15 04:09:44,b'God is good all of the time'
687849009763897344,2016-01-15 04:09:18,b'Susan Cottrell is a good Speaker and a good writer.'
687813805150060544,2016-01-15 01:49:24,b'No more Hillary Clinton for President no more.'
687813673268559874,2016-01-15 01:48:53,b'Go Dallas Mavericks be number 1 yeah Go Dallas Mavericks in 2016'
687813538518138883,2016-01-15 01:48:21,"b'Go Texans Go Texasn Go, Go, Go,'"
687813445845037057,2016-01-15 01:47:59,b'OMG May the Dallas Mavericks win 4st place this 2016 OMG.  Yeah!'
687813303117066240,2016-01-15 01:47:25,b'OMG Dear God please help me to lose weight OMG'
687813211534397440,2016-01-15 01:47:03,b'OMG Lets stop gun violence OMG'
687813114822172672,2016-01-15 01:46:40,"b'OMG Prayer Poems is a good book,  Buy two today you will love it.  OMG'"
687812968105443329,2016-01-15 01:46:05,"b'OMG Jenna Bush Hagar is a good mother to her two girls, OMG'"
687812830209282048,2016-01-15 01:45:32,b'OMG Chelsea Clinton is a good mother OMG'
687765966625751040,2016-01-14 22:39:19,b'May 2016 be the year of Amazing.  love you MORE.'
687765723343532032,2016-01-14 22:38:21,b'OMG Matthew was a wonderful man with lots of love and blessings and peace.  love him to pieces.'
687765569655848961,2016-01-14 22:37:44,"b""Thank you for making Mathew's Memorial Service a blessed one.  It was was beautiful.  Love you.  It was great."""
685948098711961601,2016-01-09 22:15:45,b'NO more HIllary Clinton for President No'
685947904503103488,2016-01-09 22:14:59,b'OMG Buy my book Prayer Poems online https://t.co/MrXAGqSMpR html'
685947741306945536,2016-01-09 22:14:20,b'OMG Chelsea Clinton is a good mother OMG'
685947549149077505,2016-01-09 22:13:34,b'Bless me Lord Bless me Lord'
685939466461036549,2016-01-09 21:41:27,b'OMG Jenna Bush Hagar is a good mother OMG'
685939387524186113,2016-01-09 21:41:08,b'OMG Chelsea Clinton is a good mother'
685786371559002112,2016-01-09 11:33:06,b'@AscensionArcana I love you with the love of the Lord'
685785946982191104,2016-01-09 11:31:25,b'Dear Lord help me to lose weight and to be smart and do smart things.  andto be a blessing.'
685785753343795200,2016-01-09 11:30:39,b'God bless Nanette Tron she loves you and she loves her family'
685785660809031680,2016-01-09 11:30:17,b'Give peace a chance and let it begin with me.'
685785575895339008,2016-01-09 11:29:57,"b'Bless some people that you never gave a chance like me ,  give me a chance.'"
685785455543992320,2016-01-09 11:29:28,"b'Steve Jobs is now gone,  He was smart no children,  He is quiet now.'"
685785319266885632,2016-01-09 11:28:56,b'Amy Winehouse was a cocaine addict she passed away from a cocaine overdose.'
685785153117880322,2016-01-09 11:28:16,"b""PLease bless me the tragedy of my husband's passing,  I need your love."""
685785025850126336,2016-01-09 11:27:46,b'Please pray for healing for Nanette Tron she needs it.  blessings to Tron Family'
685784914759782400,2016-01-09 11:27:19,b'OMG Jenna Bush Hagar is a good MOther OMG'
685784837198761984,2016-01-09 11:27:01,b'OMG Chelsea Clinton is a good Mother OMG'
685784767179010048,2016-01-09 11:26:44,b'Please pray for Nanette Tron having to face life alone without her husband.  Love me.'
685784605639610368,2016-01-09 11:26:05,b'Please pray for me My husband died of a heart attack last week.   I miss him so much.  I loved him and he loved me.'
