id,created_at,text
887371016862924800,2017-07-18 17:58:31,b'What is going on in the world?'
887370927238983680,2017-07-18 17:58:10,b'I have divine health in Jesus name Amen'
887370800180887553,2017-07-18 17:57:39,"b""You don't know what you are missing until you met the Lord"""
887370681377325056,2017-07-18 17:57:11,"b'Please pray for blessings for me and my family and friends, we need them'"
887370535537168384,2017-07-18 17:56:36,b'Barbara Bush is not getting married'
887370420965564416,2017-07-18 17:56:09,b'I am blessed blessed blessed Hallelujah'
887370271707017218,2017-07-18 17:55:33,b'I am an Ordained Minister bless me love me .  I want to get married.'
887370115888680960,2017-07-18 17:54:56,b'God is good'
887370060918128640,2017-07-18 17:54:43,b'Please pray for my eyes'
887369965636112384,2017-07-18 17:54:21,b'Donald @FLOTUS He is a great President'
887043058885419008,2017-07-17 20:15:20,b'God bless me today with complete healing of my left eyes'
887042924231393280,2017-07-17 20:14:48,b'I love you with the Love of the Lord'
887042796200308736,2017-07-17 20:14:17,b'I am a Minister Of the Lord Please pray for me'
887042663941386242,2017-07-17 20:13:46,b'I want to get married Please say a prayer for me'
887042552708435969,2017-07-17 20:13:19,b'I am thankful for all blesings. PTL'
887042364451282946,2017-07-17 20:12:34,b'Donald Trump is a great President.  Love him'
887042248365486080,2017-07-17 20:12:07,"b'I am an Ordained Minister, I want to get married please pray for me and love me.  PLEASE'"
887042067079233536,2017-07-17 20:11:23,"b'God is good,  I can see better now, just had cataract surgery in my left eyes,   please pray for my complete healing.'"
876583766264881153,2017-06-18 23:33:50,b'Lets legalize pot'
876583621372588032,2017-06-18 23:33:16,b'Donald Trump is a great man'
876583489914769408,2017-06-18 23:32:44,b'I am an Ordained Minister love me'
876583255713206272,2017-06-18 23:31:48,"b""Let's legalize medical pot Yeah We need it"""
876583117787729920,2017-06-18 23:31:16,b'Go Dallas Mavericks Win'
876206983308881920,2017-06-17 22:36:38,"b""Let's legalize pot"""
876206700428218374,2017-06-17 22:35:31,b'I love to be loved'
876206163314044928,2017-06-17 22:33:23,b'I am an Ordained Minister love me'
876205295890026500,2017-06-17 22:29:56,b'Love ME'
875467314111578114,2017-06-15 21:37:27,"b""Everybody let's lgalize pot"""
875467150387007489,2017-06-15 21:36:48,"b""Let's legalize medical pot!!!"""
875467030530600965,2017-06-15 21:36:20,b'Go Mighty Dallas Mavericks WIN'
874419842631311360,2017-06-13 00:15:11,b'hell'
874419694232645632,2017-06-13 00:14:35,b'When God made HELL He made UT Psychiatrists'
874419515861413889,2017-06-13 00:13:53,b'Go Dallas Mavericks WIN'
874419376602173440,2017-06-13 00:13:19,b'Let\ns legalize medical pot'
872218589843116033,2017-06-06 22:28:11,b'Legalize pot'
872218479826481152,2017-06-06 22:27:45,"b'Dear Washington please, legalize medical pot'"
872218231767015428,2017-06-06 22:26:46,b'Win Dallas Mavericks win the championship please'
871844906226130945,2017-06-05 21:43:18,b'Barbara Bush is not getting married.'
871844559885619201,2017-06-05 21:41:55,b'I am an Ordained Minister I want to get married. love me'
871844365664124928,2017-06-05 21:41:09,b'Legalize Medical marijuana in Texas'
871844206385475584,2017-06-05 21:40:31,b'Prayer Poem by Nanette Tron is an excellant book buy one at https://t.co/ep1p8Dq50o'
871843955943645185,2017-06-05 21:39:31,b'I am an Oradianed Minister please pray for me bless me'
871843743162396673,2017-06-05 21:38:41,b'Donald Trump is a great President'
871843559053438976,2017-06-05 21:37:57,b'We love you Donald Trump praying for you'
871843407546781696,2017-06-05 21:37:21,"b""Let's legalize Medical Pot in the state of Texas today"""
871843227267207168,2017-06-05 21:36:38,b'Legalize medical pot in Texass Yes'
871843086342787073,2017-06-05 21:36:04,b'Go Dallas Mavericks Win every game YES'
871842886949773312,2017-06-05 21:35:16,b'God bless Washington and Donald Trump YES'
871842525795012609,2017-06-05 21:33:50,b'Dear Washington please legalize medical pot'
871112196448702464,2017-06-03 21:11:46,b'We love you Donald Trump keep up the good work'
871111889345945600,2017-06-03 21:10:33,b'Wisdom and protection to Donald Trump today'
871111561481379841,2017-06-03 21:09:15,b'Blessings and peace to Washington today'
871111253984280576,2017-06-03 21:08:02,b'Love and kisses to all'
871111103547285504,2017-06-03 21:07:26,b'Happy Birthday to Susan Cottrell'
871110579875856384,2017-06-03 21:05:21,b'Everybody needs a little love love me'
871110406151913472,2017-06-03 21:04:39,b'I am sorry for all of my sins and mistakes forgive and forget please'
871110125225779200,2017-06-03 21:03:32,b'I have been born again forgive and forget my sins'
871109913908400128,2017-06-03 21:02:42,b'I have a tattoo of an angel on my back and but'
871109717426294785,2017-06-03 21:01:55,b'Psychiatrists are demons from HRLL'
871109537746403328,2017-06-03 21:01:12,b'Give me some love I need you'
871109188256006144,2017-06-03 20:59:49,b'When God made hell he made UT psychiatrists'
871108933133385732,2017-06-03 20:58:48,b'Please bless me and love me'
871108142574194688,2017-06-03 20:55:40,b'Donald Trump is a great President'
871107909605666816,2017-06-03 20:54:44,b'Please pray blessings for me'
871107766449872896,2017-06-03 20:54:10,b'God loves all of his children'
871107253364867072,2017-06-03 20:52:08,b'I am an Ordained inister love me'
871107035575631872,2017-06-03 20:51:16,b'Go Dallas Mavericks WIN'
863466299124572160,2017-05-13 18:49:42,b'Smart people smoke pot'
863465834072739841,2017-05-13 18:47:51,"b""Let's make pot the norm"""
863465642644688897,2017-05-13 18:47:06,b'Donald Trump is a good President'
863465422955450372,2017-05-13 18:46:13,b'make pot legal in Texas'
863465093979406336,2017-05-13 18:44:55,b'pot is good'
863464914966503427,2017-05-13 18:44:12,b'legalize pot'
863464666386878465,2017-05-13 18:43:13,"b""Let's legalize medical pot"""
863464369954459649,2017-05-13 18:42:02,b'Legalize Pot'
863463131137413121,2017-05-13 18:37:07,b'Go Dallas Mavericks win'
863097437619191812,2017-05-12 18:23:59,b'I am a Minister love me'
863096830514614272,2017-05-12 18:21:34,b'I am an Ordained Minister of God'
863096675317026816,2017-05-12 18:20:57,b'Bless me Lord Bless me Lord'
863096410421555200,2017-05-12 18:19:54,b'No more hospital no more no more'
863096204707717120,2017-05-12 18:19:05,b'Donald Trump is a good President'
863095964864843777,2017-05-12 18:18:08,b'Go Dallas Mavericks Go'
862107801186967552,2017-05-10 00:51:31,b'legalize pot'
862107679325642753,2017-05-10 00:51:02,b'Pot is good'
862107599084417024,2017-05-10 00:50:43,b'I love you so love me too'
862107456297631744,2017-05-10 00:50:09,b'Medical pot for all'
862107321845129216,2017-05-10 00:49:37,b'Legalize pot YES'
862106978046414848,2017-05-10 00:48:15,b'God loves you and so do I'
862106872777760769,2017-05-10 00:47:50,b'Love Jesusu love your friends and family and give a cup of cool water'
862106633660493824,2017-05-10 00:46:53,b'I desire you blessing prayers.'
862106472544698368,2017-05-10 00:46:14,b'i love all of my friends and followers love me too'
862106324657733632,2017-05-10 00:45:39,b'I am not retarded'
862106131883315200,2017-05-10 00:44:53,b'Lay hands on the sick and they will recover'
862105811190992898,2017-05-10 00:43:37,b'Pray healing for me no more hospital no more no more'
862105619259695104,2017-05-10 00:42:51,"b'I love you with agape unconditional love, love me too'"
862105412530831360,2017-05-10 00:42:02,b'I am not retarded love me'
862105276249501696,2017-05-10 00:41:29,b'I am an Ordained Minister of the Lord love me'
862105147090010113,2017-05-10 00:40:58,"b""Everybody let's make pot legal"""
861733437006336000,2017-05-09 00:03:56,b'pray for pot legalization'
861733312737497090,2017-05-09 00:03:26,b'love to Donald Trump'
861733164263374848,2017-05-09 00:02:51,b'We need pot legalize it'
861733011070562304,2017-05-09 00:02:14,b'Chandler of the Dallas Mavericks is the BEST'
861732841213898753,2017-05-09 00:01:34,b'God bless Donald Trump and Washington'
861732693779914752,2017-05-09 00:00:59,b'Donald Trump is the best'
861732554357055488,2017-05-09 00:00:25,b'thank God for pot and all blessings'
861732363537133569,2017-05-08 23:59:40,b'make medical pot legal for everyone'
861732234927144961,2017-05-08 23:59:09,b'medicl pot legal in every state'
861732103741988864,2017-05-08 23:58:38,b'pot is good'
861732003951017990,2017-05-08 23:58:14,b'pot is the positive future'
861731875844476929,2017-05-08 23:57:44,b'love pot'
861731636261662720,2017-05-08 23:56:46,b'Make marijuana legal'
861731499468607489,2017-05-08 23:56:14,"b""Dear Washington let's legalize pot"""
861731360200949761,2017-05-08 23:55:41,b'pot is medicine'
861731255800516609,2017-05-08 23:55:16,b'legalize pot'
861731163517460480,2017-05-08 23:54:54,"b""Let's make medical ot legal"""
861730963012935685,2017-05-08 23:54:06,b'Chandler of the Dallas Mavericks is a superstar'
861730722213765121,2017-05-08 23:53:09,b'Go Dallas Mavericks win win win'
861338419972235265,2017-05-07 21:54:16,b'Donald Trump is good'
861338282470367232,2017-05-07 21:53:44,b'medical pot everywherere make it legal'
861338122461863940,2017-05-07 21:53:05,b'pot is smart'
861338020259262465,2017-05-07 21:52:41,b'love me with the love of God'
861337898737598465,2017-05-07 21:52:12,b'Everybody smoke pot if it is legal there'
861337753073721344,2017-05-07 21:51:37,b'I need a car love me'
861337605706838017,2017-05-07 21:51:02,b'I have had pain love me'
861337440589676544,2017-05-07 21:50:23,b'I am smart I am a friend'
861337229494546436,2017-05-07 21:49:33,b'If it is legala smoke ot'
861337017317285891,2017-05-07 21:48:42,b'Dear Washington please make pot legal'
861336883837718529,2017-05-07 21:48:10,b'Pot is beneficial legalize it'
861336757698273281,2017-05-07 21:47:40,b'Love you with the love of the LORD'
861336631290339328,2017-05-07 21:47:10,b'love you MORE'
861336307359993856,2017-05-07 21:45:53,b'i am not stupid I love and love you'
861336069517828098,2017-05-07 21:44:56,b'Pot is good'
861335910981545989,2017-05-07 21:44:18,b'forgive and forget like God'
861335792194654209,2017-05-07 21:43:50,b'If I have wronged you Forgive and forget please'
861335538359570432,2017-05-07 21:42:49,b'I am not retarded'
861335448890863617,2017-05-07 21:42:28,b'Love me'
861335346147188736,2017-05-07 21:42:04,b'Legalizie marijuana'
861335230921265154,2017-05-07 21:41:36,b'President Trump is a blessing'
861335101904486400,2017-05-07 21:41:05,b'President Trump is great'
861334881602850818,2017-05-07 21:40:13,b'Pot is healthy'
861334770285936640,2017-05-07 21:39:46,b'Medical marijuana is good legalize it'
861334606854987776,2017-05-07 21:39:07,b'love you with the love of the Lord'
861334453771276288,2017-05-07 21:38:31,b'I am not retarded love me'
861334351350554629,2017-05-07 21:38:06,b'I am an Ordained Minister I am smart love me'
861334216268820480,2017-05-07 21:37:34,b'We love the Dallas Mavericks'
861334086446714884,2017-05-07 21:37:03,"b'I love President Trump , Clinton , Bush and Bush Sr. Obama and the USA'"
861333878308581379,2017-05-07 21:36:14,b'Medical pot should be legal'
861333750545866754,2017-05-07 21:35:43,b'Legalize pot'
861333639338098688,2017-05-07 21:35:17,b'Go Dallas Mavericks We love YOU'
860936567870947329,2017-05-06 19:17:27,b'Dear Donald Trump We pray'
860936402485354496,2017-05-06 19:16:48,b'We love yuoou Donald Trump'
860936183974637568,2017-05-06 19:15:56,"b""Let's legalize pot"""
860936051610845184,2017-05-06 19:15:24,b'Pot is good'
860935964725850112,2017-05-06 19:15:04,b'I want to get married.'
860935868282011648,2017-05-06 19:14:41,b'God love me'
860935580926005248,2017-05-06 19:13:32,b'I want a jov bless me'
860935485937647616,2017-05-06 19:13:09,b'Lord bless my family and me'
860935406354784256,2017-05-06 19:12:50,b'I am not stupid'
860935296870952960,2017-05-06 19:12:24,b'I am not retarded'
860935225114849282,2017-05-06 19:12:07,b'Please forgive me for lies and mistakes'
860935122551541760,2017-05-06 19:11:43,b'No more facilities I am sorry'
860935028083175425,2017-05-06 19:11:20,b'No more hospital no more no more amen'
860934933887557633,2017-05-06 19:10:58,b'Blessings to me I have had a rou'
860934777049935873,2017-05-06 19:10:20,b'Pot is good medicine'
860934690223652864,2017-05-06 19:10:00,b'Legalize pot in every state'
860934588759240704,2017-05-06 19:09:36,b'Dear Washington legalize pot in Texas'
860934484170080256,2017-05-06 19:09:11,b'Blessings to Washington We love you'
860934367086071811,2017-05-06 19:08:43,b'God bless Washington'
860934289264914433,2017-05-06 19:08:24,b'God loves you'
860934197074178048,2017-05-06 19:08:02,b'My name is Nanette and I love the Lord'
860934053305995264,2017-05-06 19:07:28,b'Dallas Mavericks number 1'
860933920187191297,2017-05-06 19:06:56,b'I love you with the love of the Lord'
860933829854470144,2017-05-06 19:06:35,b'God loves you and so do I'
860933742751358976,2017-05-06 19:06:14,b'I want to get married'
860933658261303297,2017-05-06 19:05:54,b'Congrats to Trump on being great'
860933556503281664,2017-05-06 19:05:29,b'Go Chevron Go Devon Win'
860933264764280834,2017-05-06 19:04:20,b'Go Dallas Mavericks win'
860932224904024064,2017-05-06 19:00:12,b'Con grats to President Trump on being a great President'
850481707262390273,2017-04-07 22:53:34,b'God bless ;and take care of our military'
850481575351418884,2017-04-07 22:53:03,b'God bless Washington today'
850481425828782080,2017-04-07 22:52:27,b'I am a good mother'
850481359172841472,2017-04-07 22:52:11,b'Chelsea Clinton is a good mother'
850481264079646720,2017-04-07 22:51:49,b'Jenna Bush is a good Mother'
850481169569378308,2017-04-07 22:51:26,b'Marry me love me'
850481110844887041,2017-04-07 22:51:12,b'It is good to hear from you'
850481033845800960,2017-04-07 22:50:54,b'I voted for Trump I am not diplorabale'
850480909002342404,2017-04-07 22:50:24,b'Go Dallas Mavericks WIN'
850480724696330240,2017-04-07 22:49:40,b'I am the seed out of Abraham because of Christ'
850480575995678720,2017-04-07 22:49:05,b'Blessings and more blessings overtake me'
850480453308100612,2017-04-07 22:48:35,b'I am an Ordained Minister bless me Lord'
850480339185258497,2017-04-07 22:48:08,b'I want to get married love me'
850480246637948932,2017-04-07 22:47:46,b'Trump is a good Presiden'
850480138814992385,2017-04-07 22:47:20,b'God blesss Donald Trump'
850480038088671232,2017-04-07 22:46:56,b'Love me I need your love'
850149629538816000,2017-04-07 00:54:01,b'Through it all I learn to trust in Jesus'
850149488970924036,2017-04-07 00:53:27,b'I have had many tears and sorrows. love me'
850149365436088320,2017-04-07 00:52:58,b'I am smart I am not retarded'
850149142471081984,2017-04-07 00:52:05,b'I am not retarded'
850148612713709569,2017-04-07 00:49:58,b'I am a minister love me'
850148419469553669,2017-04-07 00:49:12,b'I love to be loved'
850022764803129345,2017-04-06 16:29:54,b'Blessings to all my friends and followers'
850022614248673281,2017-04-06 16:29:18,b'No more hospital for me NO'
850022509223313410,2017-04-06 16:28:53,"b'I am an Ordained Minister I want to get married, love me'"
850022339584675840,2017-04-06 16:28:13,b'Make pot legal in the state of Texas'
850022176136859649,2017-04-06 16:27:34,b'Dear Washington make marijuana legal in Texas'
850022026505056257,2017-04-06 16:26:58,b'G'
850021894485135360,2017-04-06 16:26:26,b'I love you with agape love'
850021757113294850,2017-04-06 16:25:54,"b'I love Bush Sr. Bush ,  Clinton, Carter, Obama and I love President Trump'"
850021553769205760,2017-04-06 16:25:05,b'Donald Trump is a good President'
850021376299683840,2017-04-06 16:24:23,b'Go Dallas Mavericks Go WIn'
849660976475635714,2017-04-05 16:32:17,"b'I love President Carter, Clinton, Bush , Obama and I love President Trump bless me'"
849660665417666562,2017-04-05 16:31:03,b'Go Dallas Mavericks WIn'
849660448710549505,2017-04-05 16:30:11,b'I love to be loved'
848989751252312065,2017-04-03 20:05:04,"b""Loving the baby and I don''''t mean mahbe"""
848989591537405954,2017-04-03 20:04:26,b'Blessings are good'
848989480702926848,2017-04-03 20:04:00,b'I love my friends and followers love me too'
848989297462173697,2017-04-03 20:03:16,b'Love you Lord and friends'
848989131371933696,2017-04-03 20:02:37,b'Love ya more'
848988936395513857,2017-04-03 20:01:50,b'Dear  friends I need your love'
848988768954712065,2017-04-03 20:01:10,b'God created you and me love me'
848988651384172549,2017-04-03 20:00:42,b'Bless the Lord Oh my soul'
848988437340454919,2017-04-03 19:59:51,b'I am thankful for all blessings'
848988322487840769,2017-04-03 19:59:24,b'No hospital no no no'
848988209182900225,2017-04-03 19:58:57,b'I love you with an everlasting love'
848988067545452546,2017-04-03 19:58:23,b'Let us reason together'
848987941594685442,2017-04-03 19:57:53,"b'I love President Carter, Clinton, Bush , Obama and I love President Trump bless me'"
848987739945148416,2017-04-03 19:57:05,b'Go Dallas Mavericks win win'
848987620071931904,2017-04-03 19:56:36,b'I love you Lord bless me'
848987498260955136,2017-04-03 19:56:07,b'I am an Ordained Minister and a widow I want to get married.'
848987267419000833,2017-04-03 19:55:12,b'My name is Nanette and I love the Lord marry me'
848987013151895554,2017-04-03 19:54:12,b'No more hospital for me'
848986891596812289,2017-04-03 19:53:43,b'Dear Jesus love me  and be friends with me'
848986717403189249,2017-04-03 19:53:01,b'blI love Donald Trump Gess Americaod'
848608531007844353,2017-04-02 18:50:14,b'Win Chandler of the Dallas Mavericks WIN'
848608324258025472,2017-04-02 18:49:25,b'God made me so love me'
848608176341700610,2017-04-02 18:48:50,b'God is not dead'
848608077318369282,2017-04-02 18:48:26,b'I want to get married love me'
848607856073068544,2017-04-02 18:47:33,"b'I have had many tears and sorrows, love me'"
848607690943324165,2017-04-02 18:46:54,b'I am an an Ordained Minister with Universal Life Church love me'
848607471140823045,2017-04-02 18:46:02,b'No hopital no'
848607318665293827,2017-04-02 18:45:25,b'No more hospital for me for me for me'
848607151581003778,2017-04-02 18:44:45,b'Jesus on the main line tell him what you want'
848606876359176193,2017-04-02 18:43:40,b'I voted for Trump I am not diplorable'
848606690064965636,2017-04-02 18:42:55,b'Go Dallas Mavericks win'
847980303792705536,2017-04-01 01:13:53,b'no hospital for me'
847980203573993472,2017-04-01 01:13:29,b'love me like as unto God I love you'
847980094199091200,2017-04-01 01:13:03,b'I want my own  house and to get married pray for me'
847979982383132672,2017-04-01 01:12:37,b'a car  Dear Lord supply'
847979747791515648,2017-04-01 01:11:41,b'No more hospital for me for me for me'
847979619949174784,2017-04-01 01:11:10,b'Donald Trump is a good man'
847979504899411968,2017-04-01 01:10:43,"b'Love God love your friends, family llove me thank you'"
847979324770832384,2017-04-01 01:10:00,b'zlovr mr eiyh yhr lovr of tyhr zlotf'
847979122710253568,2017-04-01 01:09:12,b'God love me be like unto God and forgive and forget'
847978995308273664,2017-04-01 01:08:41,b'Love me with agape love like God forget'
847978847840686080,2017-04-01 01:08:06,b'I love all of my friends and followers love me'
847978731754983425,2017-04-01 01:07:38,b'I am not biplar pathological liar love me'
847978332008460288,2017-04-01 01:06:03,b'When God made hell he made a psychiatrist I am not a liar diplorable schizaphrenic love me'
847978148541202434,2017-04-01 01:05:19,b'No more hospital for me Amen'
847977908622815232,2017-04-01 01:04:22,b'I voted for Trump I am not a diplorable'
847977800648855552,2017-04-01 01:03:56,b'I love President Trump he is great'
847977643517652992,2017-04-01 01:03:19,b'Say a little prayer for me for cateracts'
847905503179046912,2017-03-31 20:16:39,b'Peace to all of my friends and followers'
847905407775514625,2017-03-31 20:16:17,b'Lord bless me today'
847905333678936064,2017-03-31 20:15:59,b'God bless Donald Trump today'
847905219262504960,2017-03-31 20:15:32,b'I am an Ordained Minister and a Coin Collector bless me'
847905073803997184,2017-03-31 20:14:57,b'No more hospital no more no more'
847904905583099904,2017-03-31 20:14:17,b'I am thankful for all blessings'
847904626666033152,2017-03-31 20:13:10,"b'I love Trump, Bush Clinton , Carter and Obama God bless the USA'"
847561896890740736,2017-03-30 21:31:17,b'I am a 55 year old widow that wants to get married marry me'
847561725150756868,2017-03-30 21:30:36,b'Love me I want to get married'
847561494439055361,2017-03-30 21:29:41,b'I love all my friends and followers thank you for following me'
847561313454759936,2017-03-30 21:28:58,"b'I love President Carter, Clinton, Bush , Obama and I love President Trump'"
847561054884319233,2017-03-30 21:27:57,b'Dear friends and followers I am on SSI bless me'
847560839909396480,2017-03-30 21:27:05,b'Through it all I learn to trust in Jesus and I learn to trust in God'
847560637639086080,2017-03-30 21:26:17,b'I have had many tears and sorrows and questions'
847560517967282176,2017-03-30 21:25:49,b'I have had a bad day today love me I need your love'
847482064177733632,2017-03-30 16:14:04,b'Dear Friends and followers love me I need your love'
847481518435979264,2017-03-30 16:11:54,b'ing Good Morning I love you'
847140367829024773,2017-03-29 17:36:17,b'God bless Donald Trump and Washington today'
847140219744849920,2017-03-29 17:35:42,b'Blessings and peace to everyone and ME'
847140065310621696,2017-03-29 17:35:05,b'marry me'
847139967289737216,2017-03-29 17:34:41,b'love me I want to get married'
847139693712068608,2017-03-29 17:33:36,b'Peace and quiet and blesings for me'
847139547402133504,2017-03-29 17:33:01,b'lease forgive all of my sins no more hospital'
847139357832163330,2017-03-29 17:32:16,b'God forgives and forgets be like a God'
847139256925667328,2017-03-29 17:31:52,b'Win Dallas Mavericks win'
846828614096162817,2017-03-28 20:57:29,b'I want to live I am not suicidal'
846828511461609472,2017-03-28 20:57:05,b'I am not stupid I am not retarded'
846828405228220416,2017-03-28 20:56:39,b'I do not want all my friends and followers to be preachers and get paid'
846828159895027714,2017-03-28 20:55:41,b'I am not schizaphrenice bipolar stupid liar'
846828051400941570,2017-03-28 20:55:15,b'Dear Washington please forgive and forget my mistakes'
846827945599664129,2017-03-28 20:54:50,b'I want a house and a car bless me'
846827811461615617,2017-03-28 20:54:18,b'I am on SSI I need money love me'
846827709284147200,2017-03-28 20:53:53,b'I am an Ordained Minister love me'
846827569613848576,2017-03-28 20:53:20,b'I need a car bless me'
846827469923667968,2017-03-28 20:52:56,b'I am not retarded I am smart'
846827371885989888,2017-03-28 20:52:33,b'riends andMy name is Nanette a followers bless mend I love'
846827222191296513,2017-03-28 20:51:57,"b'I love everyone with agape love, love me'"
846827088556544004,2017-03-28 20:51:25,b'llas Mavericks'
846468085406191619,2017-03-27 21:04:52,b'I am not retarded love me'
846399115185573888,2017-03-27 16:30:49,"b""I don't want all of my friends and followers to get paid for preaching"""
846398874839339008,2017-03-27 16:29:51,"b'I love President Carter, President Clinton, Bush and Obama and I love President Trump  blesss me'"
846398466892972032,2017-03-27 16:28:14,b'God bless Washington and President Trump'
846398338480115713,2017-03-27 16:27:43,b'I want Prince Harry to get married'
846398225850519552,2017-03-27 16:27:17,b'Dear Washington please forgive me of my sins love me'
846398060032876545,2017-03-27 16:26:37,b'I am not a schizaphrenic bipolar liar love me'
846397923801907201,2017-03-27 16:26:05,b'Castro is gone'
846397763692703744,2017-03-27 16:25:26,b'I want to get married love me'
846397579835424768,2017-03-27 16:24:42,b'Psychiatrists told me I was the town crier of England love me'
846397429838757890,2017-03-27 16:24:07,b'Let Prince Harry marry an Acollege beauty'
846397311391596547,2017-03-27 16:23:38,b'I am not stupid'
846397186590085121,2017-03-27 16:23:09,b'Go Dallas Mavericks win the championship'
846396966263279616,2017-03-27 16:22:16,b'I am not retarded love me'
846175954485555200,2017-03-27 01:44:03,b'Dear Washington I am not bipolar schizaphrenic liar love me'
846175611513196544,2017-03-27 01:42:41,b'No more hospital PLEASE love me'
846175261775314948,2017-03-27 01:41:18,b'Dear Washington I was Englands town crier in a psychiatric hospital forgive and forget'
846167195361140736,2017-03-27 01:09:15,b'I want to get married love me'
846167088448331776,2017-03-27 01:08:49,b'I am not retarded I am not stupid love me'
846166948186488833,2017-03-27 01:08:16,b'I was a friend of the royal family Princess Dianaa love me'
846166427388260352,2017-03-27 01:06:11,b'Ame American college beauty for Prince Harry will make him diplomatic happy'
846166237604433920,2017-03-27 01:05:26,"b'They said I was the town crieder of England lies ,, lies and more lies'"
846165437486448640,2017-03-27 01:02:15,b'Let Prince Harry marry an American beauty from college'
846049743998521344,2017-03-26 17:22:32,b'Win Dallas Mavericks win'
846049630035103747,2017-03-26 17:22:05,b'Go Dzllzs Mavericks  Win the championship I love you'
846003655274835968,2017-03-26 14:19:24,b'I want to weigh 100 pounds love me'
