id,created_at,text672390158746968065,2015-12-03 12:21:20,"b'Please buy Prayer Poems book online bookstore. https://t.co/m9oLmomDiU by Nanette Tron, \nbuy one today you will love https://t.co/5SucbEfcIA'"
672389705409794049,2015-12-03 12:19:32,"b'I pray we  make Prayer Poems a bestseller , great book.  buy one at oneline bookstore. https://t.co/m9oLmomDiU.  Buy one today'"
672389465684381697,2015-12-03 12:18:35,b'Please pray blessings on my book Prayer Poems by Nanette Tron online bookstore. https://t.co/m9oLmomDiU.  Buy two today love you'
672389227212988418,2015-12-03 12:17:38,b'We want Justice. https://t.co/RlWPpI18Yb'
672389108669349888,2015-12-03 12:17:10,b'Dear Lord Jesus please forgive me of my wrongs and cast them into the sea of forgetfulness.  love me .'
672388951630483456,2015-12-03 12:16:33,b'When God made Hell he made Harris County Psychiatric Center and shots in the but.  God save me.  HELL  U of T psychiatrists demons'
672388762396057600,2015-12-03 12:15:47,"b'We love you President Obama ,  Make some good gun control laws for the USA.'"
672388631894429697,2015-12-03 12:15:16,"b'No more David King of Burger King in Texas ever again, He lies but David King does not have Texas on his agenda ever again.'"
672388241941594112,2015-12-03 12:13:43,"b'Burger King,   David King ownder will never come to Houston Texas ever again or anywhere in Texas ever again,  It is not on his agenda'"
672387676536832000,2015-12-03 12:11:29,"b""Paris Hilton's Bare Butt in Her &lt;em&gt;Paper&lt;/em&gt; Magazine Spread May Finally Just End the Internet Once and for All https://t.co/7Ru6DS00lQ"""
672320712598642688,2015-12-03 07:45:23,b'Bring Dirk of the Dallas Mavericks home and let them play in Europe.'
672320587205771265,2015-12-03 07:44:53,"b'@tomhaberstroh I love Dallas Mavericks too,  Hope they bring Dirk home and I would like to see them play in Europe too.'"
672320256531021824,2015-12-03 07:43:34,"b'That would be great.  Yes Bring Dirk home We need him Win,  Go Dallas https://t.co/3AYaasuvIE'"
672320064327016448,2015-12-03 07:42:49,b'God bless you in everything that you do hope your dreams come true.@lindsaylohan'
672319963491790849,2015-12-03 07:42:25,b'love ya girl https://t.co/4MT87dr1Dz'
672319912598110208,2015-12-03 07:42:12,b'God bless https://t.co/M2MWeR9qY7'
672319750739902466,2015-12-03 07:41:34,b'I heard Wonder Women worked for American ISIS  Is that still true https://t.co/k2vyvcpGKV'
672319571144019969,2015-12-03 07:40:51,b'@USATODAY Please pray for our government ant the President to make some good laws to help stop gun violence and save money.'
672319422577565696,2015-12-03 07:40:16,b'I did not know that that is not right the USA needs that money https://t.co/YSmUZZSUuN'
672319217895497728,2015-12-03 07:39:27,"b'We love you Katy Perry ,   https://t.co/F7sxIOHqT1'"
672319127818637313,2015-12-03 07:39:05,b'Pray that gun violence is stopped in our country today'
672318962923802625,2015-12-03 07:38:26,"b""Please pray blessings on my new book Prayer Poems by Nanette Tron\nat https://t.co/m9oLmomDiU.  Buy one today and Let's make it a bestseller."""
672318677853671424,2015-12-03 07:37:18,"b'OMG David King of Burger King will never come to Texas again ever..\nTexas is not on his agenda ever again,  He lies , He is not coming.'"
672259311817527296,2015-12-03 03:41:24,"b'Make Prayer Poems by Nanete Tron a best seller buy a copy today, https://t.co/m9oLmomDiU. You will love it.'"
672259115469565952,2015-12-03 03:40:37,"b'Prayer Poems a must read,  You will love,   https://t.co/m9oLmomDiU.    by Nanette Tron Buy one today!  Make it a bestseller, please.'"
672258877782495232,2015-12-03 03:39:41,b'Please buy my book Prayer Poems by Nanette Tron\nhttps://t.co/m9oLmomDiU.  You will love it.'
672258752880336897,2015-12-03 03:39:11,"b'David King of Burger Kind will not come to Texas anymore,  EVER he lies and says he will come, but Texas is never again on his agenda.'"
672190448333537280,2015-12-02 23:07:46,b'Give a pair to the Dallas Maverick Cheerleaders and a pair to each of the team for advertiswement.   Love it. https://t.co/vLJVWMEtcG'
672190274706145280,2015-12-02 23:07:04,"b'Happy Birthday Britney Spears.  We love you and we want you to get married.  love, Nanette'"
672159472995844096,2015-12-02 21:04:41,"b'Mr. David King will not come to Burger King in Texas , Texas is boycotted from David Kings agenda,  no more Texas,  He will lie no xomw'"
672158848967249920,2015-12-02 21:02:12,"b'Bring on Dallas , We want to see Dallas Mavericks play ,  Bring them on yeah!  love ya Dallas, https://t.co/zOkHW0SMDh'"
672158647154163712,2015-12-02 21:01:24,"b'David King of Burger King will not come to Houston Texas or Texas any more ever again,  He lies and sys he will but he will not.  Not in 30'"
672064472693891072,2015-12-02 14:47:11,"b""Dear Lord Please bless Nanette Tron's book Prayer Poems with Best seller,\nhttps://t.co/m9oLmomDiU.  Buy two today"""
672064255470919682,2015-12-02 14:46:19,"b""You don't know what your missing until you met Jesus Christ as your personal  Saviour"""
672064079914098688,2015-12-02 14:45:37,"b'loddotty dee,, lottydotty daa'"
672063980068712448,2015-12-02 14:45:13,b'Paris Jackson tried to kill herself she needs to see a psychiatrist'
672063882345635840,2015-12-02 14:44:50,"b'My name is Nanette Tron and I want to live I want to live,  I am not suicidal'"
672063769900539904,2015-12-02 14:44:23,"b'Go Mavericks Go Team Go Dirk, Go Devin, Go Wesley, Go Chandler,  Go Mighty Mavericks Go , Go, Go,'"
672063561896558593,2015-12-02 14:43:34,b'@AscensionArcana I love you man and I am praying that the people will blesss bless bless you'
672063363749429249,2015-12-02 14:42:46,"b""Sounds like you got time to maybe expand your horizon's . Maybe you can preach at one of the local church's  https://t.co/9HUS0cgMEH"""
672063139458846720,2015-12-02 14:41:53,"b'I will pray and the good Lord will bless, bless bless you with a good job at your church, nice paying in Jesus Name  https://t.co/JCFSioNhgo'"
672062903067918336,2015-12-02 14:40:57,"b""She had the first kisss,  I'll have the last"""
672062817327910912,2015-12-02 14:40:36,"b""one pepporoni pizza and crazy bread from Ce Ce's pizza might be our lunch today"""
671995286198333440,2015-12-02 10:12:15,"b'Wow, I love @Listia! I just won this for free, U.S. POSTAGE STAMPS....# 38 https://t.co/MoOvCebKvv'"
671976900898648064,2015-12-02 08:59:12,b'God love all the people with AIDS with love and healing and friends and comfort This AIDS day.  We are praying'
671976729292881920,2015-12-02 08:58:31,"b'Dear Lord Please help us find a cure for AIDS  and heal all the people with it,  Give them good healthy food, friends, love and good care'"
671976371481001986,2015-12-02 08:57:06,b'Cool may the good Lord give you love and happiness and good times https://t.co/GZYXDlwU3g'
671976061790359553,2015-12-02 08:55:52,"b'I will never steal your pillow,  Love ya too much.  @shajanshekh27'"
671975735267999744,2015-12-02 08:54:34,"b'@AscensionArcana  Are you going to preach again this Sunday did you get a big offering last Sunday?  How was your preaching?  love you ,'"
671975493525090304,2015-12-02 08:53:37,b'Ha that is funny https://t.co/qjHxjRlSBs'
671890677098123264,2015-12-02 03:16:35,b'Precious Memories how they lingers.'
671890394355929090,2015-12-02 03:15:27,"b'Go President Obama make them laws, gun laws good'"
671890225245777920,2015-12-02 03:14:47,b'Go Dirk of the Dallas Mavericks. Go'
671890154441707520,2015-12-02 03:14:30,"b'Go Dallas Mavericks Go Go Team We love you,   Glad you are winning.  God Mighty Dallas Go Go'"
671889862094626816,2015-12-02 03:13:20,"b""Love you baby and I don't mean maybe!"""
671889751809495040,2015-12-02 03:12:54,b'How do I know if it is love?'
671889675829645313,2015-12-02 03:12:36,"b'Love this country, Merry Christmas to all. and to all a goodnight'"
671889351362629633,2015-12-02 03:11:19,b'Free on @Listia: Elvis Presley Stamp......used =). Get it here - https://t.co/iSlhxHqYP0'
671800262202265600,2015-12-01 21:17:18,"b'Merry Christmas Merry Christmas, Merry Christmas.  I love you'"
671672027707650048,2015-12-01 12:47:45,b'Please buy Prayer Poems at https://t.co/ep1p8D8tBO.  You will love it.  by Nanette Tron'
671671880235880448,2015-12-01 12:47:09,b'Please pray for Nanette Tron and her new book Prayer Poems tht it become a best seller.'
671671731698860034,2015-12-01 12:46:34,"b'We love you too Aaron, God bless you,  How was your sermon Sunday?  Was it good? https://t.co/17cGVVlAoT'"
671233363454377984,2015-11-30 07:44:39,"b'Bring on the Dallas Mavericks we love them , we want to see them,  show us Dallas https://t.co/iNGZvLaGrB'"
671233215194091520,2015-11-30 07:44:04,b'Good Night sweet friends good night .  May the Lord give you blessings when you wake up tomorrow.'
671232981265162240,2015-11-30 07:43:08,b'@AscensionArcana I miss you.  How are you.'
671232778378285056,2015-11-30 07:42:19,b'I want to lose 50 pounds for Christmas please pray for me.'
671232613357629441,2015-11-30 07:41:40,"b'Buy Prayer Poems by  Nanette Tron today at https://t.co/m9oLmo52rm and be blessed and happy for the blessings, love and life.'"
671232364757041152,2015-11-30 07:40:41,b'Jesus be a friend to me show me blessings and kindness and money and friends and more friends.  I love you'
671232160985194496,2015-11-30 07:39:52,b'Friends are friends forever if the Lord is the Lord of them and a friends will not say never because the welcome will never end.  I love you'
671232013823811584,2015-11-30 07:39:17,"b'I love to be loved,  I love you shalom peace to you and blessings,  Let me be your friend.'"
671231870470914048,2015-11-30 07:38:43,b'Vote for more gun control laws to make our country safer.  stop the violence.'
671231721283657728,2015-11-30 07:38:07,"b'My name is Nanette Tron I want to live I want to live, I am not suicidal'"
671231566077669377,2015-11-30 07:37:30,b'Vote no Assisted suicide.'
671231509509054465,2015-11-30 07:37:17,"b'Dear Washington please legalize marijuana in every state for chronic pain, seizures and recreational use.  Please.'"
671231286661537792,2015-11-30 07:36:24,"b'forgive me for the lies I would like for you to be my friend,  I will be there for you'"
671231070814281728,2015-11-30 07:35:32,"b""Prayer Poems , Let's make it a bestseller by Nanette Tron Ordained Minister, https://t.co/m9oLmo52rm.  Buy one now."""
671230924470820864,2015-11-30 07:34:57,b'Pray for my new book Prayer Poems by Nanette Tron at https://t.co/m9oLmo52rm.  You will love it.'
671230778316075008,2015-11-30 07:34:23,"b'Nicole Smith had everything family , friends, money cars houses.  Why did she commit suicide?'"
671230624758431744,2015-11-30 07:33:46,b'Amy Winehouse was a cocaine addict she died of an overdose of cocaine no more rehab no more rehab no more.'
671230437507899392,2015-11-30 07:33:01,b'Amy'
671230393568358400,2015-11-30 07:32:51,"b'Paris Jackson is suicidal she needs a psychiatrist,  God help her.'"
671230267189800960,2015-11-30 07:32:21,b'OMG Jenna Bush is a good mother to Mila a year old and newborn Poppy.  Congrats.  Two beautiful and smart girls.'
671230076311240704,2015-11-30 07:31:35,"b'OMG Chelsea Clinton is a good mother to one year old Charlotte, Congrats'"
671229937895014400,2015-11-30 07:31:02,"b'I am glad the Dallas Mavericks are winning,  Dallas Maverick Proud.  All the way Dallas All the way'"
671197148587892736,2015-11-30 05:20:45,"b'I have had a lot of problems and a hard life, please pray for me .'"
671196886846611456,2015-11-30 05:19:42,"b""We want to see Charlotte Chelsea Clinton's daughter on television.  put her on."""
671196687134810112,2015-11-30 05:18:55,"b'I am glad that the Dallas Mavericks are winning,  Go Dallas, Go Dallas, Go Dallas,'"
671196558025691136,2015-11-30 05:18:24,b'It pays to get a second doctors opinion.'
671196463528026112,2015-11-30 05:18:01,"b'David King lies he is never planning to come to visit Texas ever ever again,  no more Texas visits.  He is lieing,  Has not been here in 30'"
671196219776069632,2015-11-30 05:17:03,"b'OMGJenna Bush is a good mother to her two daughters Mila and Poppy, congrats'"
671196071138316288,2015-11-30 05:16:28,b'OMG Chelsea Clinton is a good mother to her daughter Charlotte one year old.   Congrats.'
671195907359186944,2015-11-30 05:15:49,b'I love cyber week https://t.co/uTDRBGS0qq'
671195782565994496,2015-11-30 05:15:19,"b'David King of Burger King will never never come to Texas anywhere in Texas again,  He lies.  Never again and not in 30 years.'"
671106950520832001,2015-11-29 23:22:20,"b'Wow, I love @Listia! I just won this for free, Saint Pierre and Miquelon Stamp https://t.co/6oiUgnFrnk'"
671101799437344769,2015-11-29 23:01:52,"b""Prayer Poems by Nanette Tron a must read,  bestseller , let's make it one.  https://t.co/m9oLmo52rm"""
671101638531248128,2015-11-29 23:01:13,"b'Dear @POTUS President Obama please bless the Tron Family,  Matthew Joshua and Nanette and Prayer Poems at https://t.co/m9oLmo52rm'"
671101352647499776,2015-11-29 23:00:05,"b'Dear Lord Jesus Please bless my book Prayer Poems , May it be a best seller and sell millions Nanette Tron https://t.co/m9oLmo52rm Please'"
671100933338767360,2015-11-29 22:58:25,b'When God made HELL he made Harris County Psychiatric Hospital and shots in the but.  forgive me No more No more. Please.  love me.  I love'
671100644762255361,2015-11-29 22:57:16,"b""I can't believe Amy Winehouse ws a cocaine addict and died of an overdose.   No more rehab, no more no more"""
671100400028786688,2015-11-29 22:56:18,b'I am so glad the Dallas Mavericks are winning.  Way to go Dallas. OMG'
671100285826285568,2015-11-29 22:55:51,b'@LiveChat What is live chat?'
671100033568284673,2015-11-29 22:54:51,b'OMG  Paris Jackson is suicidal she needs a psychiatrist.'
671099933433417728,2015-11-29 22:54:27,"b'OMG Nanette Tron is an Ordained Ministere and author of Prayer Poems.  https://t.co/m9oLmo52rm.  Buy two today,  You will love it.'"
671099742261223426,2015-11-29 22:53:41,b'OMG MIchael Jackson was killed by his private doctor overdose of his\nmedicine. OMG'
671099551407865856,2015-11-29 22:52:56,b'We love you President Obama I voted for you'
671099335438958593,2015-11-29 22:52:04,"b'OMG Jenna Bush is a good Mother to her two little girls Mila and Poppy, Congrats.'"
671099131918737408,2015-11-29 22:51:16,b'OMG Chelsea Clinton is a good Mother to one year old Charlotte. Congrats'
670966346847490049,2015-11-29 14:03:37,"b'We want your prayers and support and friendship , Please.'"
670966208234168320,2015-11-29 14:03:04,b'Peace to the Tron FAmily'
670966112864071680,2015-11-29 14:02:41,b'I you can read you  will love Prayer Poems by Nanette Tron at https://t.co/m9oLmo52rm a Must read.  good book.'
670965873813946372,2015-11-29 14:01:44,b'Blessings to my new book Prayer Poems by Nanette Tron at https://t.co/m9oLmo52rm. online bookstore.  Buy two today. You Will love it.'
670965646738505728,2015-11-29 14:00:50,b'More of the love of God for me'
670965583106674689,2015-11-29 14:00:35,b'No more candy'
670965430467608577,2015-11-29 13:59:59,b'God bless the Tron Family this Christmas'
670965316701302785,2015-11-29 13:59:32,b'I love you with the Love of the Lord.'
670965233146585088,2015-11-29 13:59:12,"b""Don't eat too much cancy it is not good for you"""
670965158446039040,2015-11-29 13:58:54,b'Wishing Everyone a Happy Holiday Season'
670929570091134976,2015-11-29 11:37:29,b'WE Want to see the Dallas Mavericks Play Bring them on Yeah! https://t.co/fZwWhAnkOv'
670929417389129728,2015-11-29 11:36:53,"b'Blessings to the Obama Family,  MIchelle, Barack, Sasha and Malaia'"
670929221489958912,2015-11-29 11:36:06,b'Go Dallas Mavericks Go Go Go  https://t.co/Z1qkx2PYQ7'
670929009446899713,2015-11-29 11:35:15,b'Blessings to my new book Prayer POems by Nanette Tron at https://t.co/m9oLmo52rm\n  You will love it. Buy one today online'
670928747261009920,2015-11-29 11:34:13,"b""Nanette Tron Ordained Minister and Author of Prayer POems,  https://t.co/m9oLmo52rm.  Buy a copy today, and let's make it a bestseller"""
670928425998270464,2015-11-29 11:32:56,"b'Bring on Dallas,  We want to see the Dallas Mavericks.  Dirk is a great player, a superstar.  show us him. https://t.co/WuNqDEKo8r'"
670928116777410560,2015-11-29 11:31:42,"b'Dear President Clinton please forgive me of my mistakes,  forgive and forget NEW'"
670927941824589824,2015-11-29 11:31:01,"b'We love you President Obama , I voted for you'"
670927783099502592,2015-11-29 11:30:23,b'Paris Jackson is suicidal she needs a psychiatrist.'
670927561149517829,2015-11-29 11:29:30,b'OMG Chelsea Clinton is a mother to a one year old Charlottte and a good one..  Congrats'
670927339266703360,2015-11-29 11:28:37,"b'OMG Jenna Bush is a mother of two girls, Mila and Poppy, love ya Jenna'"
670927084034879489,2015-11-29 11:27:36,"b'Glad The Dallas Mavericks are winning,  Love you Dallas Mavericks Win Team'"
670870762916564992,2015-11-29 07:43:48,"b'Dear President Clinton I wish you and your family all the love in the world.  You are great, love, Nanette Tron'"
670870539645374464,2015-11-29 07:42:55,"b""Now that Thanksgiving is over let's all go on a big diet and lose some weight"""
670870374758879233,2015-11-29 07:42:16,b'Will Barbara Bush the former first daughter ever get married?  We are waiting on her.'
670870194189934592,2015-11-29 07:41:33,"b'I am glad Jennsa Bush Hagar had her latest addition to her family little Poppy Hagar.  now proud mother of two girls , smart and beautiful.'"
670869957761191936,2015-11-29 07:40:36,b'I am glad Chelsea Clinton is a mother and she has a nice new penthouse suite.  congrats.'
670869805705117696,2015-11-29 07:40:00,"b'I am glad the Dallas Mavericks are winning,  More power to them'"
670869456411860992,2015-11-29 07:38:37,b'@freedhearts Amen'
670869394763980800,2015-11-29 07:38:22,"b'PLease pray for the Tron Family, Peace love and health and healing and blessings.  We love you,  love us too'"
670869226446528512,2015-11-29 07:37:42,"b'@freedhearts Preach it Susan, Amen'"
670869140987633664,2015-11-29 07:37:22,b'Preach it Susan Amen https://t.co/SOgmhdtRUL'
670868704754823168,2015-11-29 07:35:38,"b'Forgive, forget give peole a second chance and reach out and love someone today the good Lord will bless you'"
670868544893165568,2015-11-29 07:34:59,"b'New book Prayer Poems by Nanette Tron, Ordained Minister, https://t.co/m9oLmo52rm\nYou will love it.'"
670868329637257216,2015-11-29 07:34:08,b'LOve yourself so that you can love other peole too https://t.co/bS8TYviYwz'
670868183566442496,2015-11-29 07:33:33,b'Dear Jesus please forgive me of my lies and wrongs and give me a blessed life and friends and broaden my horizons.'
670867989567291392,2015-11-29 07:32:47,"b'OMG Jenna Bush is a good mother to her two girls Mila and Poppy,  Beautiful and smart Congrats.'"
670867847409704960,2015-11-29 07:32:13,b'OMG Chelsea Clinton is a good Mother to daughter Charlotte one year old.  Congrats'
670867644518637568,2015-11-29 07:31:25,"b'OMG The Dallas Mavericks are doing GREAT ,  Way to go Dallas Way to Go.  Yeah!'"
670867467523268612,2015-11-29 07:30:43,b'Amen Hallelujah Amen....... Amen https://t.co/SCf660wc4E'
670867070729474048,2015-11-29 07:29:08,b'@freedhearts You are a blessing and we love to talk to you and see you.   love Nanette and Matt'
670692164096118785,2015-11-28 19:54:07,"b'Buy my new book Prayer Poems by Ordained Minister Nanette Tron,  https://t.co/m9oLmo52rm\nYou will love it.  I promise.'"
670691989541756928,2015-11-28 19:53:25,"b'I wish Blessings and peace to Washington today,  God bless the USA'"
670691869165228032,2015-11-28 19:52:57,"b""Let's all help Santa buy presents and make this a very Merry Christmas"""
670691759312273409,2015-11-28 19:52:30,"b'Dear @shajanshekh27 Shajan , Hope you had a Happy Thanksgiving, love ya'"
670691636909899776,2015-11-28 19:52:01,"b'Dear @AscensionArcana Hope you had a Happy Thanksgiving,  love ya'"
670691517430947840,2015-11-28 19:51:33,"b'Dear Jesus please bless the USA with peace, love and protection and good times and wisdom and new innovating ideas'"
670691346332655620,2015-11-28 19:50:52,b'Hope everyone had a Happy Thanksgiving.'
670691249981001728,2015-11-28 19:50:29,"b'Say no to Assisted Suicide,   BAD'"
670691179206455296,2015-11-28 19:50:12,"b'Lord Jesus Please legalize Marijuana in every state in the US  for seizures, chronic pain and recreational use.  We need it.'"
670690973165494272,2015-11-28 19:49:23,"b'Stop Gun violence,  We need our country safe and protect our children'"
670690786284068864,2015-11-28 19:48:38,"b'OMGNanette Tron is the author of Prayer Posme,  Buy one today, https://t.co/m9oLmo52rm https://t.co/uDM5AfId0k'"
670690563629441026,2015-11-28 19:47:45,"b'OMG Jenna Bush is a mother to two daughters, Mila and Poppy.  Congrats.'"
670690435824775168,2015-11-28 19:47:15,"b'OMG Chelsea Clinton is a mother to a One year old daughter, Charlotte'"
670690299975499776,2015-11-28 19:46:42,"b'Happy Holidays to Washington,  We love you,  Safety and peace and wisdom to you'"
670690181830328320,2015-11-28 19:46:14,b'We love you MIchelle Obama Have Happy Holidays'
670690098606940162,2015-11-28 19:45:54,"b'We love you President Obama,  Have Happy Holidays'"
670689760055304192,2015-11-28 19:44:34,b'Dear Lord Jesus please bless and heal the victims and their families https://t.co/C0wZwm9BXb'
670689379485110274,2015-11-28 19:43:03,b'@kellyfreebies Peace and Christmas joy to you'
670496158394003456,2015-11-28 06:55:16,b'thanks for following me.'
670496102236487680,2015-11-28 06:55:02,"b'I would like to say thank you to all of my friends and followers ,  You re what makes life special for me.  I love and I need you,  thanks'"
670493206451220480,2015-11-28 06:43:32,"b""Dallas Mavericks love tht you win,  Ya'll are doing great.  Go Dallas"""
670493095390265344,2015-11-28 06:43:05,b'OMG Jenna Bush Hagar is the mother of two little girls now MIla and newborn Poppy.  Congrats'
670453451910983680,2015-11-28 04:05:34,b'OMG Buy the book Prayer Poems a MUST https://t.co/m9oLmo52rm by Nanette Tron.  You will love it. https://t.co/Y7oephblab'
670453217138995201,2015-11-28 04:04:38,"b'OMB When is Barbar Bush going to get married ,  she needs children.'"
670453077221253121,2015-11-28 04:04:04,b'OMG Go Dirk of the Dallas Mavericks OMG you are the best.'
670452835084066822,2015-11-28 04:03:06,"b'OMG The Dallas Mavericks are winning and doing good,  OMG'"
670452725210079232,2015-11-28 04:02:40,b'OMG  Barbara Bush is not getting married and she is not pregnant. OMG'
670452473769934848,2015-11-28 04:01:40,b'OMG Nanettte Tron is an Ordained Minister and author of Prayer Poems.  https://t.co/m9oLmo52rm.  Buy a copy today! https://t.co/l9DqAZ2Mh1'
670452211462373377,2015-11-28 04:00:38,b'OMG Chelsea Clinton is the mother of a one year old Charlotte. OMG'
670452080327438336,2015-11-28 04:00:07,b'OMG Is Chelsea Clinton pregnant again?'
670452001436774400,2015-11-28 03:59:48,"b'OMG Jenna Bush is the mother of two little girls, Mila and Poppy.  OMG'"
670451844389478400,2015-11-28 03:59:10,b'OMG'
670436611499364352,2015-11-28 02:58:38,b'OMG is Chelsea Clinton pregnant again?'
670436525566468097,2015-11-28 02:58:18,"b'OMG Dallas  Maverick Fever the team is doing so so good.  Go Dallas, Win,'"
670436389146796032,2015-11-28 02:57:45,"b'OMG Dallas  Mavericks are doing so good, Dallas Mavericks number 1,   Go Dallas, Go, Go Dirk.OMG'"
670435100144857088,2015-11-28 02:52:38,b'OMG Lord bless Nanette Tron and her new book Prayer Poems at https://t.co/m9oLmo52rm'
670434925582094336,2015-11-28 02:51:56,b'OMG What the world needs now is love sweet love. For everyone'
670434734737068032,2015-11-28 02:51:11,"b'OMG Our Country is blessed with good things and a strong military , we can defeat ISIS'"
670434604654977024,2015-11-28 02:50:40,b'OMG the Texasn are winning Go Texans'
670434502607577088,2015-11-28 02:50:16,b'OMG the Dallas Mavericks are doing pretty good. OMG'
670434420978016257,2015-11-28 02:49:56,b'OMG Chelsea Clinton is a great mother to Charlotte one year old now.'
670434322579660800,2015-11-28 02:49:33,b'OMG Jenna Bush is a great mother to Mils and Poppy.  OMG'
670434182338912256,2015-11-28 02:48:59,b'OMG It is getting to be nightfall Goodnight everyone sleep tight and peaceful.  Buy Prayer Poems https://t.co/m9oLmo52rm'
670433752049442817,2015-11-28 02:47:17,b'OMG Washington is blessed with peace and prosperity.  Merry Christmas Washington'
670433642922049536,2015-11-28 02:46:51,b'OMG  It pays to get a second opinion.  of someone you are paying.'
670433548684382208,2015-11-28 02:46:28,b'OMG Nanette Tron is an Ordained Minister and the author of Prayer Poems.  https://t.co/m9oLmo52rm'
670433412885286912,2015-11-28 02:45:56,b'OMG  We need to stop gun violence in the USA'
670433313954406400,2015-11-28 02:45:32,"b'OMG Prayer Poems is a good book.  Buy one today,  https://t.co/m9oLmo52rm. You will get a blessing.'"
670433168235831296,2015-11-28 02:44:58,"b'OMG Nanette Tron is the author of Prayer Poems ,  buy one today.  https://t.co/m9oLmo52rm.   OMG https://t.co/ehGZ6PuyRs'"
670432941638590464,2015-11-28 02:44:03,"b'Merry, Merry, Merry, Christmas, Merry, Merry, Merry Christmas'"
670432851784048640,2015-11-28 02:43:42,b'OMGChristmas is coming soon!'
670432767692439553,2015-11-28 02:43:22,b'OMGPresident Obama is a good President.'
670432678454370305,2015-11-28 02:43:01,b'OMG Chelsea Clinton is a good mother'
670432609068011520,2015-11-28 02:42:44,"b'OMG Barbara Bush is not getting married and she has no children, OMG'"
