id,created_at,text839169463035518976,2017-03-07 17:42:45,b'lonely and single needing love and a friend love me.'
839169358781906945,2017-03-07 17:42:20,"b'I am single I need a friend, love me.'"
839169252812865536,2017-03-07 17:41:55,b'God forgives and foargets people hate me and discipline me please love me.'
839169080464719872,2017-03-07 17:41:14,b'I am not stupid schizoid effective bipolrqr paranoid but I am on ssi love me.'
839168861622632448,2017-03-07 17:40:22,b'bless me lord bless me Lord.'
839168763425615872,2017-03-07 17:39:58,b'my mother Nancy Ortega hates me love me.'
839168636942225408,2017-03-07 17:39:28,b'MY mother hates me love me.'
839168542062804993,2017-03-07 17:39:06,b'I am so poor I can not afford a new house and car and I am tired of walking and being disciplined.'
839168225418018816,2017-03-07 17:37:50,b'the people of the church are of the devil'
839168103091175429,2017-03-07 17:37:21,b'God love me.'
839168023890178048,2017-03-07 17:37:02,b'Donald Trump is a good President He mhad my vote'
839167895326294016,2017-03-07 17:36:31,b'love me I want to have loe I love to be loved'
839167770189262848,2017-03-07 17:36:02,b'Psychiatrist hate people.'
839167681005780993,2017-03-07 17:35:40,b'When God made hell he made University of Texas Psychiatrists.'
839167534968492036,2017-03-07 17:35:05,b'I do not want to die or have pain any more ever again please pray for me and love me.'
839167370262380544,2017-03-07 17:34:26,b'Oh sweet Jesus I do not want to go home to heaven'
839167250326224897,2017-03-07 17:33:58,b'When God made blessings he made me to want them'
839167127072477185,2017-03-07 17:33:28,b'I am on SSI and treated badly please pray for me.'
839167014161760257,2017-03-07 17:33:01,b'Dear Lord please love me'
839166874613084160,2017-03-07 17:32:28,b'It is an okay day today with Nanette Carrillo'
839166667578048513,2017-03-07 17:31:39,b'Happy Birthday to Nancy Ortega 83 today'
839166553719508992,2017-03-07 17:31:12,b'love me.'
839166490880401408,2017-03-07 17:30:57,b'I have been to psychiatric centers and state hospital please quit hating me'
839166306918219776,2017-03-07 17:30:13,b'Dear Lord please bless me'
839166189171531776,2017-03-07 17:29:45,b'Quit being mean to me I love everyone'
839166073542934529,2017-03-07 17:29:17,b'Dallas Ma ericks gonna be number 1'
839165959831171074,2017-03-07 17:28:50,b'Go Dallas Mavericks Win today the Championship'
839165816398569472,2017-03-07 17:28:16,b'Go Chandler of the Dallas Mavericks We love you'
839165727152156676,2017-03-07 17:27:54,b'Go Dallas Mavericks Go Win'
839165629290643456,2017-03-07 17:27:31,b'Dear God please deliver me from evil'
839165517457997827,2017-03-07 17:27:04,b'Heal me Jesus with they prescious holy power'
839165368186912768,2017-03-07 17:26:29,b'I want to live I want to live.'
839165218219507714,2017-03-07 17:25:53,b'God bless me I need a blessing'
839165010811240448,2017-03-07 17:25:04,b'I am not suicidal I want to live to be 1010 IN Jeus name'
839164859870818305,2017-03-07 17:24:28,b'I am not retarded in Jesus name'
839164710322900997,2017-03-07 17:23:52,b'Please pray for me they say that I am schizphrenice bipolar retarded. please pray for me.'
839164548099805186,2017-03-07 17:23:13,b'Congratulations to Chelsea Clinton on being a good mother'
838542358874624002,2017-03-06 00:10:52,b'@Knicks_Feed Go Dallas Mavericks. Go Go\n\nGo Dallas Mavericks Go Go'
838541954292068352,2017-03-06 00:09:15,b'I want to live.'
838541870917685252,2017-03-06 00:08:56,b'My name is Nanete Carrillo I want to live  PTL'
838093190183911425,2017-03-04 18:26:02,b'Dear Washington please make pot legal in every state.'
837794280294993921,2017-03-03 22:38:16,b'I have been in a psychiatric hospital several times it was hell bless me.'
837793963478245376,2017-03-03 22:37:01,b'I love chocolate yogurt'
837793671609122816,2017-03-03 22:35:51,b'God bless America land that I love.'
837793191705337857,2017-03-03 22:33:57,"b'Oh sweet Jesusu heal me now, please'"
837557283642998784,2017-03-03 06:56:32,b'I am nan Ordained Minister and I need a new car bless me'
837557125526126599,2017-03-03 06:55:54,b'DEar Washington I am not suicidal or retarded I am on SSI and I want to live love me bless me.'
837556874270560256,2017-03-03 06:54:54,b'DEar Washington I want to live I want to live please let me live love me Nanette Tron'
837556661883555840,2017-03-03 06:54:03,b'Dear Washington please bless Nanette Tron with friends I never had a friend before'
837556363811139585,2017-03-03 06:52:52,b'I never though life could ble so horrible LOve me.'
837556246391595010,2017-03-03 06:52:24,b'I am in an awful way bless me'
837556160295129091,2017-03-03 06:52:04,b'DEar Washington please bless me I love you'
837556033639731202,2017-03-03 06:51:34,"b'President Donald Trump please bless me I love you and I am glad you are the President love,'"
837555987955343360,2017-03-03 06:51:23,b'DEar Washington please bless me'
837555861312544768,2017-03-03 06:50:53,b'Dear Lord Jesus bless me and love me and give me a car a new Lexus car please'
837555694035316737,2017-03-03 06:50:13,b'MY name is Nanette Carrillo love me and bless me'
837555497809014784,2017-03-03 06:49:26,b'I have seen many tears and sorrows and I have had questions bless me'
837555362936975360,2017-03-03 06:48:54,b'My name is Nanete and I love employment no more ssi'
837555238580051968,2017-03-03 06:48:24,b'I am on SSI and everyone hates me love me I need a blessing from Washington please'
837555063757250560,2017-03-03 06:47:42,b'I need a new car and I am an Ordained Minister bless me.'
837554889785892864,2017-03-03 06:47:01,b'MY name is Nanette Carrillo and my mother put me on SSI please pray for my health and finances'
837554675326955520,2017-03-03 06:46:10,b'My name is Nanette Carrillo and I love the Dallas Mavericks Win Win'
837554472813371393,2017-03-03 06:45:21,b'Go Dallas Mavericks Win Win I love you'
837553888169345026,2017-03-03 06:43:02,"b'So I have made mistakes, love me and bless me with money I am an Ordained Minister'"
837553671713910787,2017-03-03 06:42:10,b'Donlad ATrump for President in 22020'
837553533805182976,2017-03-03 06:41:38,b'Dear Washington please bless me I love Donald Trump'
837553331463581697,2017-03-03 06:40:49,b'Bless me Lord bless me Lord.'
837553161392947200,2017-03-03 06:40:09,b'I am on SSI and I want ajobe and no SSI please bless me.'
837552885625827328,2017-03-03 06:39:03,b'DEar Washington bless me Nanette Tron I want some kind of legal employment'
837552242647433217,2017-03-03 06:36:30,"b'President Donald Trump please bless me I love you and I am glad you are the President love,'"
837551883166203904,2017-03-03 06:35:04,b'Donald Trump please bless me.'
837551780586127360,2017-03-03 06:34:40,b'Donald Trump please bless me I voted for you'
837551508564525056,2017-03-03 06:33:35,b'Washington bless Nanette Tron Carrillo'
837551359310213120,2017-03-03 06:32:59,b'God bless Nanette Tron'
837551236245159937,2017-03-03 06:32:30,b'Why does everyone feel it necesaaary to be mean to me.'
837551103168241664,2017-03-03 06:31:58,b'Dear Washington please blesss me with an offering I ama a Minister'
837550868341764098,2017-03-03 06:31:02,b'I have been to hell and back love me'
837550738490314756,2017-03-03 06:30:31,b'please pray for me and bless me I am not retarded.  love me'
837550506654367744,2017-03-03 06:29:36,b'I ama an Ordained Minister please give to me and bless me.'
837550352115236864,2017-03-03 06:28:59,b'I am smart please do not call me retarded or stupid ever again'
837550189514612737,2017-03-03 06:28:20,b'PLease pray for me my blood sugar is high'
837550063014436865,2017-03-03 06:27:50,b'LOrd bless me with love and peace and kisses and friends and people that want to give me money'
837549837407023106,2017-03-03 06:26:56,b'Bless me Lord bless me Lord bless me Lord'
837549704208474112,2017-03-03 06:26:25,b'Why do people hate me and call me a pathological liar'
837549525833154561,2017-03-03 06:25:42,b'I am smat I am smart love me I am on SS'
837549351232626692,2017-03-03 06:25:00,b'My name is Nanette and I want a job.  bless me'
837549211893686273,2017-03-03 06:24:27,b'I am sorry I have made mistakes I want a job.'
837548901766848513,2017-03-03 06:23:13,b'mY Name is Nanette and I need money bless me.'
837548755511496707,2017-03-03 06:22:38,b'Dear Jesus and Washington bless Donald Trump'
837548628264665088,2017-03-03 06:22:08,b'I love to be loved'
837548483552792577,2017-03-03 06:21:34,"b'I am looking for a man love me, Nanette Tron'"
837548283622916096,2017-03-03 06:20:46,b'Congratulations to smart Donald Trump We love you'
837548106782666752,2017-03-03 06:20:04,"b'I am not retarded I am smart please pray for me. love me,'"
836689811792674817,2017-02-28 21:29:30,b'They kingdom come they will be done on earth as it is in heaven give us this day our daily bread and forgive us our debts as we forgive our'
836689330848612356,2017-02-28 21:27:36,"b'Our Father which art in heaven Hallowed be thy name,'"
836689060492152832,2017-02-28 21:26:31,b'Nt bnw ua Bbwrw bs U bwws gwkubf bs  hiv please agree with me.'
836688893953060864,2017-02-28 21:25:51,b'They say that I am a pathological schizoid bipolar harasser and liar please pray a miracle and blessings for me and my family'
836688617707868167,2017-02-28 21:24:46,b'My name is Nanette and I love the Lord.'
836041795846959104,2017-02-27 02:34:31,b'everybody needs friends.'
836041583975874560,2017-02-27 02:33:41,b'Everybody needs a little love.'
836041478015156227,2017-02-27 02:33:15,b'jPlease no more shots of medicine in the but please bless me. and help me and love me.'
836041320854663170,2017-02-27 02:32:38,b'twittfPlease pray for me everyone hates me and I do not have any friends.\nhttps://t.co/gE6pWGbO6R'
836010740913930241,2017-02-27 00:31:07,b'Lord please help me know help me lord.'
836010581194846208,2017-02-27 00:30:29,b'nd work.DEar Jesus please heal me and let me live to be 100 a'
836010446524141573,2017-02-27 00:29:57,b'tttPlease pray for me I have no friends and I am schizaphrenic paranoid suicidal   please pray for me/witter.com\nhttps://t.co/gE6pWGbO6R'
836009195073843200,2017-02-27 00:24:59,b'https://t.co/9eYOrQZAmr'
835917727080513537,2017-02-26 18:21:31,b'Bless the Lord all ye servancts of the Lord.'
835917558515650562,2017-02-26 18:20:51,b'bless me Lord bless me lord.'
835917379536302081,2017-02-26 18:20:08,b'Please pray for me miracles of health and healing'
835917266176847874,2017-02-26 18:19:41,b'Please raise the minimum wage to 15.00 an hour.'
835917127081213952,2017-02-26 18:19:08,b'I am not schizaphrenic grandiose and delusional.'
835917012295696384,2017-02-26 18:18:40,b'they say I am schizaphrenic grandiose and delusional please pray for me.\n\\'
835916686192705536,2017-02-26 18:17:23,b'Lord Please bless me that say I am schizaphrenic delusional and grandioise.'
835916522841337857,2017-02-26 18:16:44,b'One Day at a time Lord Jesus that is all I am asking forom you.God bless American'
835639991657181184,2017-02-25 23:57:54,b'LOve God and Love the Lord.'
835639888712253441,2017-02-25 23:57:29,b'Love God We love the Lord.'
835639803584610304,2017-02-25 23:57:09,b'God bless American'
835639734932287489,2017-02-25 23:56:52,b'Love me they say I am bipolar.'
835639672382623745,2017-02-25 23:56:37,b'Shalom peace to everyone.'
835639602455117824,2017-02-25 23:56:21,b'Love God and Love the Lord.  I love lyou.'
835639507512922112,2017-02-25 23:55:58,b'I love God and I want the minimym wage to go up to 14.00 an hour.'
835639331981299712,2017-02-25 23:55:16,b'Love the Lord.'
835639213576097792,2017-02-25 23:54:48,b'Shalom peace to all.'
835639158446166017,2017-02-25 23:54:35,b'Love me and bless me.  I love the lord.'
835639072957792259,2017-02-25 23:54:15,b'I am bipolar love me.'
835639003705655296,2017-02-25 23:53:58,b'I am schizaphrenice bipolar love me.'
835638363185156096,2017-02-25 23:51:25,b'God bless everyone.'
835638310152388610,2017-02-25 23:51:13,b'Please pray for the peace of Jerusalem;'
835637185395163136,2017-02-25 23:46:45,b'Strangers in many ways.'
835637089857339393,2017-02-25 23:46:22,b'Love God'
835636909380669440,2017-02-25 23:45:39,b'Prayer Poems book.'
835636850622623745,2017-02-25 23:45:25,b'Love God and love yourself.'
835636738445950978,2017-02-25 23:44:58,b'Pray for the peace of Jerusalem Amen'
835636637312888833,2017-02-25 23:44:34,b'Congratulations on Chelsea Clinton on being a good mother'
835636515480952833,2017-02-25 23:44:05,b'Congratulations to Gena Bush on being a good mother'
835636398929625088,2017-02-25 23:43:37,b'The lord is good.'
835636318008930304,2017-02-25 23:43:18,b'God is good all the time.'
835636231035830273,2017-02-25 23:42:57,b'Congratulations to Trump on being a good President'
835636055059673094,2017-02-25 23:42:15,b'God bless the USA'
835635928928555008,2017-02-25 23:41:45,b'Please pray for me my blood sugar was highDear Jesus God bless America.'
835308543393820673,2017-02-25 02:00:50,b'Dear Jeusu Iam how about this nice town. God bless America'
835308225117433856,2017-02-25 01:59:34,b'$15.00 an hour miimum wage a year.'
835308113569923076,2017-02-25 01:59:08,b'Dear Trump please raise the minimum wage to 15.00 an hour this year. Amen'
835307949287477250,2017-02-25 01:58:29,b'Dear Jesus please raise   the minimum wage to 15.00 an hour this year.   How about it Trump?'
835306105806946304,2017-02-25 01:51:09,b'RT @pacowacodog: Dear Jesus please bless my body with good blood sugar.'
835305691762028545,2017-02-25 01:49:30,b'Dear Jesus please bless my body with good blood sugar.'
835305555958906880,2017-02-25 01:48:58,b'I love everyone and I want friends.'
835305182573563904,2017-02-25 01:47:29,b'I think every person in the United States should be an American except illegal Aliens'
835304962036989952,2017-02-25 01:46:36,b'God is good all the time.I think the minimum wage should go up to 15.00 in every state'
835219296225746944,2017-02-24 20:06:12,"b'I am available, are you interested in me.'"
835219201132482560,2017-02-24 20:05:49,b'Do not lie and be sweet.'
835219135877562368,2017-02-24 20:05:34,b'God is good all the time.'
835219079946506241,2017-02-24 20:05:20,b'Love you lord.'
835219010572730370,2017-02-24 20:05:04,b'I love my son Joshua.'
835218947742044160,2017-02-24 20:04:49,b'I loved my late husband Matthew Tron'
835218828766425088,2017-02-24 20:04:21,b'God bless the uSa.'
835218765633753088,2017-02-24 20:04:05,b'Lord love me. we lovve you Lord.'
835218682259333121,2017-02-24 20:03:46,b'Lord bless our Country.'
835218620590526468,2017-02-24 20:03:31,b'God bless they Usa'
835218484929916929,2017-02-24 20:02:59,b'Give us this day our daily bread and forgive us our debts as we for give our debtors.'
835218345209257984,2017-02-24 20:02:25,b'Thy kingdom come thy will be done on earth as it is in heaven.'
835218231732416512,2017-02-24 20:01:58,b'Our Father whiich art in heven hallowed be thy name.'
835218120390365185,2017-02-24 20:01:32,b'I am an American and I qm proud of it.'
835218012089233408,2017-02-24 20:01:06,b'I need a blessing. today.'
835217645091831808,2017-02-24 19:59:38,b'I do not have many pfriends. bless me.'
835217579912347651,2017-02-24 19:59:23,b'My blood sugar is uncontrolled.  God bless me with wiwdom.'
835217475683893248,2017-02-24 19:58:58,b'Tattosos hurt.'
835217414543577090,2017-02-24 19:58:43,b'Please pray for me I do not feel well.'
835217335275388928,2017-02-24 19:58:24,b'MOney is a blessing.'
835217249371832320,2017-02-24 19:58:04,b'I am Nanette Tron they say that I ama  pathological liar. please pray for me. love ya more.'
835217088738443264,2017-02-24 19:57:26,b'Do not lie.'
835217046342336512,2017-02-24 19:57:16,b'Pray without ceasing for this is the will of God'
835216949294612480,2017-02-24 19:56:52,b'Congratualations to Chelsea Clinton on being a good mother'
835216829186461696,2017-02-24 19:56:24,b'Congratulations to Donald Trump on being a good President.'
820482700725329922,2017-01-15 04:08:14,"b""Let's just prise the Lord"""
820482562577473536,2017-01-15 04:07:41,b'I love to be loved by you'
820482481065488384,2017-01-15 04:07:21,b'May 2017nbe the BEST'
820482380947394561,2017-01-15 04:06:58,b'Happy New ear!'
820480377697562626,2017-01-15 03:59:00,b'May the next 8 years be the BEST for ;the USA.   God bless America'
820480218762739712,2017-01-15 03:58:22,b'Pray for the peace of Jerusalem'
820480067763634176,2017-01-15 03:57:46,b'Best Wishes to Donald Trump inaugeratoon day'
820479918429634561,2017-01-15 03:57:10,b'Congratulations to President Trump . We love you'
796797384412057600,2016-11-10 19:31:14,b'Donald Trump is going to be the best President yet'
796797238160855040,2016-11-10 19:30:40,b'Donald Trump is the BEST'
796796829803413504,2016-11-10 19:29:02,b'Congrats to Donald Trump'
794675256942362625,2016-11-04 22:58:40,b'Trump is the best person for President. Vote for Trump'
794674856067530754,2016-11-04 22:57:04,b'We love Donald Trump'
794674696650391552,2016-11-04 22:56:26,b'We love Washington Trump for President'
794674538541944833,2016-11-04 22:55:48,b'God bless all the good people in Washington.'
794674387270176768,2016-11-04 22:55:12,b'God bless President Obama give him wisdom'
794674211847544837,2016-11-04 22:54:31,b'Dear Mark Cuban  we love the Dallas mavericks'
794673963557408769,2016-11-04 22:53:31,b'Please vote for Trump'
794673802772942848,2016-11-04 22:52:53,b'Donald Trump will be the best President God created.'
794673583238811648,2016-11-04 22:52:01,b'Dont forget to vote for Donald Trump'
794673398165147648,2016-11-04 22:51:17,b'Donald Trump for President. Yes'
794673195274170372,2016-11-04 22:50:28,b'OMG Jenna Bush is a good mother  OMG'
794673054362300416,2016-11-04 22:49:55,b'OMG Chelsea Clinton is a good mother OMG'
793889915436015616,2016-11-02 18:58:00,b'Lord listen to your children praying'
793889518671638528,2016-11-02 18:56:25,b'Blessings to All'
793889338270416896,2016-11-02 18:55:42,b'r Lord bless Mark Cuban and the Dalls Mavericks. Yes'
793889089590177792,2016-11-02 18:54:43,b'God bless Washington and all the good people there'
793888907699990528,2016-11-02 18:53:59,b'We love the Dallas Mavericks.'
793888678275710976,2016-11-02 18:53:05,b'Dallas Mavericks are number 1'
793888558461259776,2016-11-02 18:52:36,b'Go Dallas Mavericks WIN We love you'
793888349673041920,2016-11-02 18:51:46,b'OMG Jenna Bush is a good mother. OMG'
793887766471933953,2016-11-02 18:49:27,b'Congrats to Chelsea Clinton on being a good mother OMG'
793521224391417857,2016-11-01 18:32:57,b'love those Dallas Mavericks. and Mark Cuban'
793520915384459264,2016-11-01 18:31:43,b'Dear Mark Cuba love those Dallas Mavericks'
793520697440030722,2016-11-01 18:30:51,b'Donald Trump the BEST President God has ever created.  love HIm'
793520411170385922,2016-11-01 18:29:43,b'Vote for Donald Trump Wem love HIM'
793520158203445248,2016-11-01 18:28:43,b'Buy my new book Prayer Poems. online https://t.co/m9oLmomDiU'
793519867789914112,2016-11-01 18:27:34,b'Congraats to Jenna Bush on being a good mother OMG'
793519637220601856,2016-11-01 18:26:39,b'Congrats to Chelsea Clinton on being a good mother OMG'
793519360664965120,2016-11-01 18:25:33,b'Go Dallas Mavericks Win We love you'
793168010487799809,2016-10-31 19:09:24,b'I love the Dallas Mavericks.'
793167730811645952,2016-10-31 19:08:18,b'Go Dallas Mavericks Win Win'
791346392220340225,2016-10-26 18:30:57,b'Vote for Donald Trump'
791346235420520448,2016-10-26 18:30:19,b'God love Donald Trump Trump for President'
791346060836741124,2016-10-26 18:29:38,b'God bless all the good peole in Washington'
791345885527420928,2016-10-26 18:28:56,b'Buy my new book Prayer Poems online at https://t.co/m9oLmomDiU  thank you'
791345692455243776,2016-10-26 18:28:10,b'Congrats to Jenna Bush on being a good mother'
791345409302016000,2016-10-26 18:27:02,b'Congrats to Chelsea Clinton on being a  good mother'
791345083236823040,2016-10-26 18:25:44,"b'Dear Mark Cuban We love the Dallas, Mavericks.'"
790655399066075136,2016-10-24 20:45:11,b'OMG Nanette has a book Prayer Poems Buy One today online https://t.co/m9oLmomDiU'
790655127501705216,2016-10-24 20:44:06,b'OMG Jenna Bush is a good mother'
790654413337538560,2016-10-24 20:41:16,b'OMG Chelsea Clinton is a good mother OMG'
790294236511952896,2016-10-23 20:50:03,b'Lord bless President Obama with wisdom safety and health and Prosperity.'
790294064415449089,2016-10-23 20:49:22,b'God bless President O Obama'
790293740678057984,2016-10-23 20:48:05,b'God bless the USA.'
790293647883329537,2016-10-23 20:47:43,b'Donald Trump is good make a great President.'
790293528236535808,2016-10-23 20:47:14,b'Vote for Donald Trump Yes.'
790293403716100096,2016-10-23 20:46:45,b'God bless Washington with Peace and Wisdom today'
790293217975476224,2016-10-23 20:46:00,"b'Buy my new book Prayer Poems online https://t.co/m9oLmomDiU, thank you'"
790293034260836352,2016-10-23 20:45:16,b'Go Texans Go Yeah Texans'
790292888672350208,2016-10-23 20:44:42,b'We love the Dallas Mavericks.'
790292760586625024,2016-10-23 20:44:11,b'Dear Mark Cuban we love the Dallas Mavericks.'
790292563924135936,2016-10-23 20:43:24,b'OMG Jenna Bush is a good mother'
790292438271143936,2016-10-23 20:42:54,b'OMG Chelsea Clinton is a good mother'
789947599394512896,2016-10-22 21:52:38,b'Nanette Tron is a good mother'
789947437926354944,2016-10-22 21:52:00,"b'Please pray for Nanette Tron, blessings, love and mercy Amen'"
789947213313040386,2016-10-22 21:51:06,b'Buy my book Prayer Poems online https://t.co/m9oLmomDiU thank you'
789947061911171072,2016-10-22 21:50:30,b'Go Texans Go Go Go Texans Go o ooooooo'
789946889386852352,2016-10-22 21:49:49,b'OMG Jenna Bush is a good mother OMG'
789946730099777536,2016-10-22 21:49:11,b'OMG Chelsea Clinton is a good mother'
789946276980756480,2016-10-22 21:47:23,b'Dear Mark Cubano the Dallas Mavericks are number 1'
789946084399255553,2016-10-22 21:46:37,b'We love the Dallas Mavericks and Mark Cubano'
789521879446937601,2016-10-21 17:40:59,b'Please buy Prayer Poems online https://t.co/m9oLmomDiU. thank you'
789521704766668800,2016-10-21 17:40:17,"b'Please buy my new book Prayer Poems, thank you'"
789521563166978048,2016-10-21 17:39:43,b'Washington is good'
789521431583260672,2016-10-21 17:39:12,b'God bless President Obama and His Family'
789521303245946880,2016-10-21 17:38:41,b'God bless all the good people in Washington'
789521154805424130,2016-10-21 17:38:06,b'Yeah Texans'
789521031538941953,2016-10-21 17:37:37,b'Yeah Dallas Mavericks.'
789520907853148160,2016-10-21 17:37:07,b'Go Texans Go Go Go'
789520781638144001,2016-10-21 17:36:37,b'OMG Jenna Bush is a good mother'
789520655741890560,2016-10-21 17:36:07,b'Dallas Mavericks are the BEST'
789520541178748928,2016-10-21 17:35:40,b'OMG Chelsea Clinton is a good mother'
788789635946123264,2016-10-19 17:11:18,b'OMG Chelsea Clinton is a good mother have another baby'
788137664356585472,2016-10-17 22:00:36,b'We love the Mavericks yes the BEST'
788137478305656832,2016-10-17 21:59:52,b'We love the Dallas Mavericks'
788137317575733248,2016-10-17 21:59:14,b'Donald Trump is the BEST'
788137092605890560,2016-10-17 21:58:20,b'We love you President Obama'
788136928226836481,2016-10-17 21:57:41,b'We love you Donald Trump'
788136647107813376,2016-10-17 21:56:34,b'Congrats Jenna Bush on being a good mother'
788136466564067328,2016-10-17 21:55:51,b'Congrats to Chelsea Clinton on being a good mother'
788136321390739456,2016-10-17 21:55:16,b'We love the Dallas Mavericks yeah'
788136080235036674,2016-10-17 21:54:19,"b'Buy my new book Prayer Poems online https://t.co/m9oLmomDiU, thank you'"
788135902442696704,2016-10-17 21:53:36,"b'Dear Mark Cubano We love you and the Dallas Mavericks, from a friend'"
787725647770587136,2016-10-16 18:43:24,b'Love them Texans'
787725489242714112,2016-10-16 18:42:46,b'Congrats to Jenna Bush on being a good mother have another baby'
787725330060484608,2016-10-16 18:42:08,"b'Congrats to Chelsea cclinton on being a good mother, have another baby'"
787725115156856832,2016-10-16 18:41:17,b'Vote for Donald Trump'
787724964438822912,2016-10-16 18:40:41,b'Fo Dallas Mavericks Go'
787355374810566656,2016-10-15 18:12:04,b'God bless the Obama Family'
787355267864289280,2016-10-15 18:11:38,b'We love the United States'
787355183432937473,2016-10-15 18:11:18,b'Go Texans Go Go Go'
787355079787425792,2016-10-15 18:10:54,b'God bless Washington and President Obama today'
787354957779316736,2016-10-15 18:10:24,b'Lord bless Washington ;today'
787354861935337474,2016-10-15 18:10:02,b'OMG Jenna Bush is a good mother OMG'
787354750220021761,2016-10-15 18:09:35,b'OMG Chelsea Clinton is a good mother'
787354633702215680,2016-10-15 18:09:07,b'Go Dallas Mavericks Win Win'
787354487916593152,2016-10-15 18:08:32,b'Dear Mark Cubano we love the Dallas Mavericks'
787005011146387456,2016-10-14 18:59:51,b'God bless Nancy Ortega and Joshua Tron today'
787004818858520576,2016-10-14 18:59:05,b'Dear Washington please make Donald Trump President'
787004443929645056,2016-10-14 18:57:35,b'Vote for Donald Trump'
787004281148678144,2016-10-14 18:56:57,b'God bless Washington today'
787003976067588097,2016-10-14 18:55:44,b'Jenna Bush you are a good mother have another baby'
787003609711980544,2016-10-14 18:54:17,b'Dear Chelsea Clinton you are a good mother have another baby'
787003290428936193,2016-10-14 18:53:00,b'Dear Mark Cubano We love you and the Dallas Mavericks'
