id,created_at,text
354827783878356993,2013-07-10 05:01:50,"b'Google Alerts RSS delivery is temporarily not available. To keep receiving Google Alerts in the meantime, you c...'"
354645231444041728,2013-07-09 16:56:26,"b'Google Alerts RSS delivery is temporarily not available. To keep receiving Google Alerts in the meantime, you c...'"
353547208353792000,2013-07-06 16:13:17,"b'Top 20 foods for beautiful skin: This is must have beverage, if you want to have a healthy skin. This drink ha... http://t.co/FiSRy3VrrX'"
353547204339838977,2013-07-06 16:13:16,"b""'Drunk Mode': One of the top health and fitness apps this week: Top health and fitness apps around the globe i... http://t.co/nJp55RsUhT"""
353519473912844288,2013-07-06 14:23:05,"b""New All-In-One Fitness Tracker App Proves Simple Is Best | Greatist: Why can't there just be one fix-all solut... http://t.co/AOPlTC3vej"""
353478272807477248,2013-07-06 11:39:22,"b'Famous fitness coach to speak at SEMO: Kicking off the series will be Jillian Michaels, one of the leading hea... http://t.co/S8VazPRdqg'"
353478271343673344,2013-07-06 11:39:21,b'Council focused on improving health: ALL three county councils in Swansea Bay say they are fully focused on im... http://t.co/v3KcoDRc3w'
353411374665310209,2013-07-06 07:13:32,b'Sylvester Stallone: His fitness regime through the ages: Sylvester Stallone as Rambo Hollywood biggie Sylveste... http://t.co/Aj5rnyAI6G'
353411373461549057,2013-07-06 07:13:32,b'Health &amp; Fitness News Best Friends Lose Nearly 300 Pounds Together: Tom Morello/Thinkstock(NEW YORK) -- Seven ... http://t.co/Ww8njSEF5Z'
353345444023246852,2013-07-06 02:51:33,"b""How to 'green' your fitness routine: From powering up a treadmill to overusing plastic water bottles, your wor... http://t.co/XNEHe05jZl"""
353345442156781569,2013-07-06 02:51:32,b'Fitness instructor Tracy Anderson says the exercise habit requires focus: Tracy Anderson added to her fitness ... http://t.co/OxVIayWNHM'
353278236119138304,2013-07-05 22:24:29,"b'Fitness center issued raw food challenge: July 5, 2013 (WPVI) -- If you are looking for a way to jump-start a ... http://t.co/gHWxrcZNUd'"
353209563543121920,2013-07-05 17:51:36,b'Diabetes meeting planned for July 11: People can attend the Flint: Better Health Together (FBHT) monthly coali... http://t.co/G3idycWXdR'
353209562343538689,2013-07-05 17:51:36,"b'13 Tricks to Wake Up Slimmer: The great news is, you can drop weight without dieting: Experts say making small... http://t.co/zJASKenjJP'"
353173105914556418,2013-07-05 15:26:44,"b""Team Toyota Health and Fitness: Hunter Kemper Triathlon Tip ...: When competing against the world's best, tria... http://t.co/2S2k7E2p8j"""
353173104836624384,2013-07-05 15:26:44,b'Health and fitness calendar - The Frederick News-Post : Health: Health and fitness calendar Associated Press |... http://t.co/29ivc4YnO0'
353162140431024130,2013-07-05 14:43:10,b'Redbridge GPs give health advice for fasting during Ramadan: Redbridge GPs give health advice for fasting duri... http://t.co/2lyi8MuZYZ'
353137790856335363,2013-07-05 13:06:24,"b""Beyonce's motto - stay fit, healthy: Singer-songwriter Beyonce Knowles' fitness trainer Marco Borges says the ... http://t.co/lsdbSAkQA4"""
353137789417701376,2013-07-05 13:06:24,"b'Flat Apple Shares How Screen Time Can Be Healthy: ... tragic health impacts of a sedentary lifestyle, poor die... http://t.co/eOjhvYZXhm'"
353094129959436289,2013-07-05 10:12:55,"b'Advice for seasonal allergy sufferers: Dr Brian McGirr, from DOCTORnow, a private general medical health pract... http://t.co/pQMKvUOIxT'"
353092792450433024,2013-07-05 10:07:36,b'Emergency numbers: Mental health advice | YOU: Keep this list of emergency numbers in your home. It could be u... http://t.co/ceVqLYe1zK'
353092791003389952,2013-07-05 10:07:36,b'Needing mental health advice for DS - Page 2 - College Confidential: While waiting for his appointment please ... http://t.co/1Dt4iF7Epi'
353070917829672960,2013-07-05 08:40:41,b'From Idea to M2M Application: M2M and connected devices provide a seemingly endless amount of opportunities fo... http://t.co/MZUSbr3jbY'
353024944281628672,2013-07-05 05:38:00,b'http://t.co/gAoAguiEfi Prepares for Subsidized Health Insurance Exchange Effect: http://t.co/gAoAguiEfi online f... http://t.co/55eg1upfC9'
353000343359070210,2013-07-05 04:00:14,b'Pump in the night: Dashing out of the office to hit the treadmill before the lunchtime rush is quickly becomin... http://t.co/ZwTiNbDGLH'
352957847937626113,2013-07-05 01:11:23,b'Why arguing is bad for your health: Researchers claim the fact that arguments seem to lead to health problems ... http://t.co/R8O2qc1fIJ'
352933619838361600,2013-07-04 23:35:06,"b'Empowered Health video: Fitness SE02_EP20: Empowered Health video: Fitness SE02_EP20. Vancouver Sun July 3, 20... http://t.co/m6vCjtLSPu'"
352933618496188417,2013-07-04 23:35:06,"b'City, schools, hospital, health center joins for community project: The first year, which focuses on research ... http://t.co/xbPBp4cMgG'"
352866469366874113,2013-07-04 19:08:16,"b""Man Blames Legionnaires' Outbreak On Unsanitary Conditions: (Memphis) A former member of 24 Hour Fitness says ... http://t.co/NrcIqCciR3"""
352866468226011136,2013-07-04 19:08:16,b'Keep active this summer to improve overall health: A ll Americans should be regularly physically active to imp... http://t.co/6uEs26s4uZ'
352824400598417408,2013-07-04 16:21:06,b'Rhonda Walker Foundation to hold third annual health and fitness ...: Looking for a way to get fit this summer... http://t.co/LV1NBnBr1A'
352824399214280705,2013-07-04 16:21:06,"b'Microsoft launches Bing health and fitness app | mobihealthnews: HF---egg-nutrition_131D9C82 Last week, Micros... http://t.co/wka4IsS1ZZ'"
352820691868987392,2013-07-04 16:06:22,"b""Men's Health Expert Offers Advice: But the fact that it is no longer June doesn't mean that men can ignore the... http://t.co/KmkhJQWchC"""
352797218387931139,2013-07-04 14:33:06,"b'Health &amp; Fitness News ""Extreme Weight Loss"": Husband, Wife Lose Combined ...: Parents of 5-year-old twins, the... http://t.co/LzX87MIZRV'"
352797216903143424,2013-07-04 14:33:05,"b'Stem-cell therapy wipes out HIV in two patients: But many people still do not get therapy early enough, prompt... http://t.co/CcGvgG0OCU'"
352745757255802882,2013-07-04 11:08:36,b'Dear Zambia \xe2\x80\xa2 View topic - Health Advice to my fellow men ...: Health Advice to my fellow men \xe2\x80\x93 Kashasu. Post ... http://t.co/JPzJ8pXAOf'
352745755997511681,2013-07-04 11:08:36,b'FB health advice online service | Facebook: FB health advice online service. 646 likes \xc2\xb7 430 talking about thi... http://t.co/lLd46MtNLa'
352726607561105408,2013-07-04 09:52:31,b'Soroptimist International of West Maui to introduce Health and Fitness Expo: The first annual Soroptimist Inte... http://t.co/TSGoo3Qn3x'
352610919756468225,2013-07-04 02:12:49,"b'Doctor rejects dairy dietary advice: ""This recommendation to drink three cups a day of milk - it\'s perhaps the... http://t.co/VYz0t6rGKr'"
352587834701524995,2013-07-04 00:41:05,"b'Northampton Community Arts Trust to put theater, gallery where Universal ...: Universal Health and Fitness at ... http://t.co/qcDlB0WWol'"
352587833401282560,2013-07-04 00:41:04,"b""Stay healthy by treating gardening like it's a sport: Brick, a veteran gardener and the president and founder ... http://t.co/7Z1UPeneAk"""
352544283577954304,2013-07-03 21:48:01,b'Miranda Kerr And Other Celebrities Turned Health Gurus: Her 2009 book Knockout: Interviews With Doctors Who Ar... http://t.co/tL9fD4w137'
352520615330189312,2013-07-03 20:13:58,b'Fitness Tech and Quantified Health: A New Era: A recent study found that \xe2\x80\x9cexercisers who use tech to support w... http://t.co/j5LUdmiaWr'
352520614071910401,2013-07-03 20:13:58,b'Argus app brings all your health and fitness information into one place: Argus monitors your daily activities ... http://t.co/lKrFAeN1Vh'
352476504556453889,2013-07-03 17:18:42,b'Miranda Kerr And Other Celebrities Turned Health Gurus: Her 2006 book Ageless: The Naked Truth About Bioidenti... http://t.co/HH7sQflbmA'
352452880130772992,2013-07-03 15:44:49,"b'Mobile operator finds more people use smartphones for diet than exercise: In the US Cellular survey, of those ... http://t.co/NEb2WeEuqO'"
352452878335623168,2013-07-03 15:44:49,"b'Health &amp; Fitness File, July 3: COMMUNITY BLOOD DRIVE: Donors must be in good health, age 17 and older (age 16 ... http://t.co/ck1Vg29sNv'"
352402323890376704,2013-07-03 12:23:55,"b""Russian health folklore and 'cure' for the common cold: Russian culture is packed with folklore about health a... http://t.co/rhBtHo3F7l"""
352402322615304195,2013-07-03 12:23:55,"b'Flying chickens, robot waiters: bizarre dining in Bangkok: BANGKOK\xe2\x80\x94From chickens catapulted across tables to m... http://t.co/a45sU63Q0G'"
352397629356916736,2013-07-03 12:05:16,b'South Bay: County health officer offers advice to stay safe during the ...: With the heat wave projected to la... http://t.co/rRfkBrhgLg'
352397628098609154,2013-07-03 12:05:16,"b""Here's the Worst Health Advice a Woman Could Ever Get - PolicyMic: Crisis pregnancy centers dispense dangerous... http://t.co/fAuigF2wvS"""
352378790476914688,2013-07-03 10:50:25,"b""Strategy Analytics: Fitness Apps focus on iPhone and Wearable Tech: OEM's, outside of Apple, are struggling to... http://t.co/DDWC7rEdnN"""
352378789134729217,2013-07-03 10:50:24,"b'How a diet plan tailored to our needs helped us improve our health and shed 16st: Michelle, 49, from Gourock, ... http://t.co/ZeBL2PqWXi'"
352333648156037121,2013-07-03 07:51:02,"b'Flying chickens, robot waiters: bizarre dining in Bangkok: From chickens catapulted across tables and service ... http://t.co/DlJeoAmwSd'"
352308472479621122,2013-07-03 06:11:00,"b'Health &amp; Fitness News Going the Distance: Biking 900 Miles, Raising $156k for ...: Ingram Publishing/Thinkstoc... http://t.co/5DwGXoMelt'"
352264514013638656,2013-07-03 03:16:19,"b'Is sugar actually bad for you?: At least, it is if you believe some of the health advice on the Internet. The ... http://t.co/0ntQjk7iwE'"
352264512839233536,2013-07-03 03:16:19,"b""Good night's sleep 'protects heart': Seven or more hours' sleep a night boosts the benefits to the heart of a ... http://t.co/EokdX2YIYP"""
352240185397882881,2013-07-03 01:39:39,b'Health Aware: Zumba zooms to top of popular fitness classes: Edward Health and Fitness Center will host a Zumb... http://t.co/0Uav19aYET'
352240182260543489,2013-07-03 01:39:38,b'Aspire Zone to unveil health and fitness journal: DOHA: Aspire Zone Foundation (AZF) will soon publish a new h... http://t.co/L8UdK4vtZb'
352174068805545984,2013-07-02 21:16:55,b'Rhonda Walker Foundation to hold third annual health and fitness event: The Rhonda Walker Foundation will be h... http://t.co/ssJ4EEutJ9'
352174067572424706,2013-07-02 21:16:55,"b""KeyPoint Partners report: Retail real estate market just had a 'recovery year': Restaurants, supermarkets, and... http://t.co/bQyKkV624q"""
352130354741645312,2013-07-02 18:23:13,b'Health and fitness - New apps and features in Windows 8.1 (pictures ...: The latest update to Windows fixes so... http://t.co/MUxXa0dcb4'
352130353357533184,2013-07-02 18:23:13,"b'Health and fitness calendar \xc2\xbb The Commercial Appeal: Health and fitness calendar. Posted June 30, 2013 at 9:24... http://t.co/ZrIsYWPncT'"
352123220402503680,2013-07-02 17:54:52,b'Healthcare a crucial issue: This is true in terms of providing occupational health advice and assistance to ma... http://t.co/B8VWH4CVia'
352123218733187074,2013-07-02 17:54:52,"b'Handy pointers for a healthy holiday: Preparing and planning a trip has been transformed into a DIY activity, ... http://t.co/qa34embypV'"
352101253968433153,2013-07-02 16:27:35,"b'Health &amp; Fitness: New labels help prevent child poisonings: ""Also, consider that there is not a lot of evidenc... http://t.co/BEI50Vv06n'"
352101252747894784,2013-07-02 16:27:35,"b'Health &amp; Fitness: Health of children improves, more live in poverty: Families in the United States are making ... http://t.co/priHYRGOxF'"
352052261708496897,2013-07-02 13:12:54,"b'Winchester charity teams up with NHS to help the elderly: Philip Voce, charity chairman, said \xe2\x80\x9cThe lunch clubs... http://t.co/T7SQqiaZ0i'"
352052260576034816,2013-07-02 13:12:54,"b""Here's the Worst Health Advice a Woman Could Ever Get: Here's the Worst Health Advice a Woman Could Ever Get. ... http://t.co/j1GFjGXGAF"""
352048135645827074,2013-07-02 12:56:30,b'Free health advice on the line Tasmania News - The Mercury - The ...: Free health advice on the line KEREN Fra... http://t.co/eiFlcdMuhD'
352027179040780288,2013-07-02 11:33:14,"b""ABC's \xe2\x80\x9cExtreme Weight Loss\xe2\x80\x9d Comes to University of Colorado's Anschutz ...: AHWC will be their home for nutrit... http://t.co/ZWRVZUPchO"""
352027177774104577,2013-07-02 11:33:14,b'Fight Baby Flab with a Focused Fitness Plan: With many new mums under pressure to get back into pre-baby shape... http://t.co/8IRlWRE2fy'
351984182274174979,2013-07-02 08:42:23,b'Pregnant? Oral health a priority: Many moms-to-be receive advice from well-meaning friends and relatives. Yet ... http://t.co/3GuhA5iV4a'
351984180990717952,2013-07-02 08:42:22,"b""No waiting rooms, no copay: 6 apps to get a doctor's advice: If you're not already a member of a participating... http://t.co/MbQ48UYc29"""
351960505415503872,2013-07-02 07:08:18,"b'Healthy Living: Focus on 4 pillars of fitness: When creating a well-rounded exercise program, it is important ... http://t.co/xu7mG3U4yM'"
351960504090112005,2013-07-02 07:08:17,b'Mobile Heath Tests Supply Chain Fitness: Staggering projected growth of mobile health and fitness applications... http://t.co/NpfB0pJEcO'
351892087257567232,2013-07-02 02:36:26,"b'Set one fitness goal, then make it happen: Except for the firecrackers, I pretty much like everything associat... http://t.co/lcnJJDvGSq'"
351892085722447873,2013-07-02 02:36:25,b'The future of health and fitness: Catherine Afarian of genetic testing company 23andMe predicts that as techno... http://t.co/G2JTbgnLNT'
351849145218244611,2013-07-01 23:45:47,"b""No waiting rooms, no copay: 6 apps to get a doctor's advice: 24/7 is affiliated with a service called Consult ... http://t.co/EwhFhsfoBQ"""
351823570508333056,2013-07-01 22:04:10,"b'Fitness Inspiration: This Photo of Jada Pinkett Smith: looked happy, healthy, and very fit in her bikini: jada... http://t.co/F5JTnHUY7t'"
351823569199710208,2013-07-01 22:04:10,b'Fitness Calendar: Plenty of benefits planned from Race for the West to Defeat ...: SUPPORT WEST: The Race for ... http://t.co/rGedOOEJdj'
351781204955103232,2013-07-01 19:15:49,"b'Medicare Advantage Advice: Many people turning 65 are very healthy, and they enroll in a Medicare Advantage pl... http://t.co/avs29j7ERM'"
351781203600351236,2013-07-01 19:15:49,"b""Health experts at ChemistDirect offer advice on hair loss in men and women: Whether it's thinning hair, a bald... http://t.co/RjrkTyW7Sq"""
351778165171036161,2013-07-01 19:03:44,b'Juice Avenger: Finding Health and Fitness on a Tight Time Budget: I created this blog and community so that ot... http://t.co/6zAk7GkFwX'
351778163023560707,2013-07-01 19:03:44,"b""BRIAN PARR'S HEALTH AND FITNESS: Just do it together | Aiken ...: It's common to see people walking or running... http://t.co/7Ja8MIjms2"""
351757085081468928,2013-07-01 17:39:59,"b'How My iPhone Keeps Me Healthy: As of June 2013, there were 900,000 iphone apps and with health and fitness ap... http://t.co/hfgdPKXK5q'"
351757083793817602,2013-07-01 17:39:58,"b'How the sexes differ for fitness: ""They\'re not going to beat the men but will probably get pretty good at it a... http://t.co/hfmVLOgNIf'"
351713183741915138,2013-07-01 14:45:32,b'Online USA Doctors Offers Patients Medical Advice for Some of the Most ...: The spiraling costs of health insu... http://t.co/2Cpp2ABiDF'
351713182445875202,2013-07-01 14:45:31,b'Daughters turn to their mothers for beauty advice says research: Among the most common pieces of advice women ... http://t.co/NsPtxi1dQ4'
351699539725516802,2013-07-01 13:51:19,b'Gut health advice - Fitness Inventor: Hi I occasionally have problems with loose stools and possibly im not ..... http://t.co/FZDuFAcMud'
351699538362384384,2013-07-01 13:51:18,"b'Free sexual health advice, support and guidance for young people ...: Free sexual health advice, support and g... http://t.co/s6N4XRrVPr'"
351685923173449729,2013-07-01 12:57:12,"b'Dr. Derek: Adding a ""Cheat Day"" Into Your Diet: Our health and fitness expert Doctor Derek Alessi joined us li... http://t.co/FSeGWa5OgJ'"
351685922007420930,2013-07-01 12:57:12,"b'Fitness enthusiasts take part in festival, promote resources: 2013-07-01T08:21:05Z. Tweet \xc2\xb7 0 Comments E-mail ... http://t.co/soDiFbLShH'"
351642093225127936,2013-07-01 10:03:02,b'Daughters turn to their mothers for beauty advice says research: mum beauty advice Mothers are the major style... http://t.co/msvpDBxHNh'
351642092004585473,2013-07-01 10:03:02,"b""Health Advice: Managing irritability: Health Advice: Managing irritability. Britain's leading health and wellb... http://t.co/CMgeUvxFwu"""
351616760568487936,2013-07-01 08:22:23,"b""BRIAN PARR'S HEALTH AND FITNESS: Just do it together: It's common to see people walking or running in pairs an... http://t.co/xyru2FDsuL"""
351616759238897664,2013-07-01 08:22:22,"b""July Must Haves For Health and Fitness: This month, we're all trying to keep warm and toasty. We're prepping t... http://t.co/54vHLhB71S"""
351547450898653184,2013-07-01 03:46:58,"b'Health and fitness calendar: Health and fitness calendar. Posted June 30, 2013 at 9:24 p.m.. Discuss; Print; A... http://t.co/Af28zyauAT'"
351478830915006465,2013-06-30 23:14:18,"b'3 free or cheap summer exercise options for kids: Buchholz High School student Casey Dixon, 17, works out. Fre... http://t.co/jVHgAUGScR'"
351430384912838656,2013-06-30 20:01:47,"b""Meet Missoula's Largest Team of Physical Therapists \xc2\xab Health and ...: Welcome to Health and Fitness 101, a blo... http://t.co/cQ9YbkUYXo"""
351430383767785472,2013-06-30 20:01:47,b'Health and fitness testing at Syracuse University - NewsChannel 9 ...: Free wellness testing is available to c... http://t.co/kpwdIKsquu'
351412599532961792,2013-06-30 18:51:07,"b""Health &amp; Fitness Fair held for local families: That's why health professionals organized a Health &amp; Fitness Fa... http://t.co/gkTKmHvttV"""
351412597687468032,2013-06-30 18:51:06,"b'Snoring Contest Announced by IFMC Inc.: LOS ANGELES, CA, June 30, 2013 /24-7PressRelease/ \xe2\x80\x93 Today at the Healt... http://t.co/sfAQ91mqmz'"
351352169896742914,2013-06-30 14:50:59,b'Personal Health Advice Needed... - General chat - YouAndYourWedding: Everything you need to know about plannin... http://t.co/12jWTnGJpZ'
351352168776863745,2013-06-30 14:50:59,"b'NHMRC Health Advice Panel | School of Population Health: NHMRC Health Advice Panel. Posted on June 28, 2013 by... http://t.co/bzkQT1ev9t'"
351342319892578304,2013-06-30 14:11:51,"b""Climbing adds depth to fitness routines: But newbies who think it's purely recreational and then realize that ... http://t.co/UBu0js4cDq"""
351342318395203584,2013-06-30 14:11:50,"b'Health watch: Fitness bonding: She uses Bollywood dance moves to stay fit, and regularly throws fitness bashes... http://t.co/RLR2H6qxfy'"
351297538927763460,2013-06-30 11:13:54,"b""Accident Advice Helpline Have Issued a Tip Surrounding Employers' Health and ...: Accident Advice Helpline, a ... http://t.co/wJyCN5eQ5B"""
351297537547841537,2013-06-30 11:13:54,b'HIV treatment: WHO introduce new advice to prevent deaths from AIDS: The World Health Organisation is introduc... http://t.co/cZqG4zqM3r'
351275268108845057,2013-06-30 09:45:24,b'Notable Gifts: Cameron Foundation awards nearly $1.3 million in grants: \xe2\x80\x9cThe Anthem Blue Cross and Blue Shield... http://t.co/7WG9PSNdOE'
351275266997354496,2013-06-30 09:45:24,b'Calcium power for bone health: Osteoporosis has now become a major health concern and one of the most common d... http://t.co/X5tPZ2IcDg'
351230010461396993,2013-06-30 06:45:34,b'New AIDS Advice: LONDON (AP) - Young children and certain other people with the AIDS virus should be started o... http://t.co/YEmM8XdPHz'
351205865375809536,2013-06-30 05:09:38,"b'Fitness camp caters to kids, adults with special needs: She is spending part of her summer concentrating on we... http://t.co/i7OtJV72Vj'"
351135944163852288,2013-06-30 00:31:47,b'10 best sexy workouts for better sex life: Mike Jackson - Nutritional Consultant and Physique Transformation S... http://t.co/OTIFHjWkeR'
351135940883918848,2013-06-30 00:31:46,b'Galilee Baptist Church hosts 2nd annual Health Fair Saturday: Wallace said more than 15 people had full health... http://t.co/LaTPnk0VOQ'
351095954050519040,2013-06-29 21:52:53,b'Looking for a Health and Safety Consultant - Ask OSHCR: Consultants who provide commercial advice on health an... http://t.co/sIy1KwL3I5'
351069313937063936,2013-06-29 20:07:01,b'Cuyahoga County Sheriff requires fitness test for promotion: The Ohio State Highway Patrol provides physical f... http://t.co/TNQZYQyN5P'
351069310942322689,2013-06-29 20:07:00,b'Summer events abound at the YWCA: H.E.A.L.T.H. is a fitness class created for individuals who have 50 pounds o... http://t.co/zQ2upJkcgo'
351023192439144449,2013-06-29 17:03:45,b'Safe sex advice on offer at Summerites Pride in the Park gig: Music lovers will be offered sexual health advic... http://t.co/8RfqX3Md0H'
351004921832816642,2013-06-29 15:51:09,b'Sexual health helpline | FPA: Our sexual health helpline can give you confidential information and advice and ... http://t.co/XWcLgEXzil'
351004920213815297,2013-06-29 15:51:08,b'People Tweeting Health Advice - Radio Adelaide: People Tweeting Health Advice. Doctors have started using soci... http://t.co/aS7FGQJA7s'
350997777834192897,2013-06-29 15:22:46,"b""Is City Area's New Fitness Capital?: Once upon a time, about three years ago, there weren't a lot of health an... http://t.co/n4AoXMWOrI"""
350997776676552705,2013-06-29 15:22:45,b'Bike sharing offers fitness benefits for short commutes: NEW YORK - With bike sharing plans rolling on asphalt... http://t.co/FN9gHqMpsI'
350950447961485312,2013-06-29 12:14:41,"b'Dentist in Honolulu Offers Dental Advice For Healthy Smiles: HONOLULU, HI, June 29, 2013 /24-7PressRelease/ --... http://t.co/HgjU7FIynK'"
350926561534410752,2013-06-29 10:39:46,"b'Program promotes health , fitness and discipline: A new program in Blue Springs is aiming to teach girls about... http://t.co/fEzOcjmXwE'"
350926560250957825,2013-06-29 10:39:46,b'Models Eat Cotton Balls To Feel Full!: If cotton balls are what it takes to be beautiful in the modelling indu... http://t.co/oMRqaEcYjo'
350883139972907008,2013-06-29 07:47:14,b'WHO revises MERS-CoV surveillance advice: The World Health Organization (WHO) yesterday updated its surveillan... http://t.co/LIhMiXdnzc'
350857581574635520,2013-06-29 06:05:40,"b""Demi Lovato launches mental-health scholarship in dad's honor: E-mail *. do not change. Contact Email. Contact... http://t.co/yAGmAeDGi5"""
350812196462268416,2013-06-29 03:05:20,"b""Give Your Veggies and Dip a Makeover: Don't get me wrong, I love baby carrots and hummus, but it's time to giv... http://t.co/wVxNyczziI"""
350812195602436096,2013-06-29 03:05:19,"b""Give Your Veggies and Dip a Makeover: Don't get me wrong, I love baby carrots and hummus, but it's time to giv... http://t.co/auxtWkkkCo"""
350812194264461312,2013-06-29 03:05:19,b'Audio: Advice on coping with flood-related mental health issues: Audio: Advice on coping with flood-related me... http://t.co/wPzhNvN1gY'
350812194176385025,2013-06-29 03:05:19,b'Audio: Advice on coping with flood-related mental health issues: Audio: Advice on coping with flood-related me... http://t.co/wikTRiShui'
350787022144806912,2013-06-29 01:25:18,"b'Renowned Facial Plastic Surgeon Opens Center for Health, Wellness &amp; Fitness: Ross A. Clevens, MD, FACS, is ple... http://t.co/phyhj0WqhM'"
350787020483854336,2013-06-29 01:25:17,"b'Three Ways To Stay In Shape As You Get Older: San Diego, California (NAPSI) - As a professional golfer, it has... http://t.co/ykY7SUkorW'"
350067349988188161,2013-06-27 01:45:34,b'Southern Cross Uni brings social and economic benefits: Players and officials are given a full health and fitn... http://t.co/ek80EryWZN'
350037849283895296,2013-06-26 23:48:21,b'Bay Area health and fitness events - SFGate: Big Data in HealthA panel discussion about how big data is used i... http://t.co/GlDwkO8whL'
350037847002198017,2013-06-26 23:48:20,b'Health and Fitness \xe2\x80\x94 http://t.co/nyuCTTOO3a: Health and Fitness: This blog will address the health and fitness ... http://t.co/hCi4duJgTq'
349997736910790657,2013-06-26 21:08:57,"b'Healthways SilverSneakers Fitness Program Accepting Nominations: ""SilverSneakers continues to be the nation\'s ... http://t.co/GT3nAMtFtV'"
349997735287590912,2013-06-26 21:08:57,b'Coke giving $1.5M to SA for health and wellness: The Coca-Cola Foundation is giving $1.5 million in grants to ... http://t.co/IrJp1seoBr'
349963096875479041,2013-06-26 18:51:18,b'Research: try this online health advice system | 0 replies ...: Would you like to receive health advice from a... http://t.co/otM9loaqQW'
349952117068414976,2013-06-26 18:07:41,"b""VIDEO: Water company wants customers to tap into safety advice: Anglian Water's Keep Water Healthy campaign wi... http://t.co/OQTS2mGL5W"""
