id,created_at,text206298673053831168,2012-05-26 08:20:11,"b'Spencer teacher lauded for fitness efforts: Kelly Dugan, a first-grade teacher at Spencer Elementary, part of Ok... http://t.co/QIQ8w6g0'"
206298672097533952,2012-05-26 08:20:10,"b'http://t.co/oscVr4KQ Updates Senior Nutrition and Fitness Guides: http://t.co/oscVr4KQ, a truste... http://t.co/WwlEQg6h'"
206298275760979968,2012-05-26 08:18:36,b'Memorial Day: Eating healthy is possible | http://t.co/M1OLeiwK: Memorial Day has been linked to the tradition of... http://t.co/nH46U3ZO'
206235196322889729,2012-05-26 04:07:57,"b'HEALTH &amp; FITNESS: It includes tai chi, Zumba, nutrition counseling, yoga and aerobics. For a complete schedule, ... http://t.co/FuFlZvqE'"
206200667684081664,2012-05-26 01:50:44,"b'Macaw Health and Fitness App from U.S. Preventive Medicine Wins ...: From Yahoo! Finance: JACKSONVILLE, Fla. and... http://t.co/DKCyK5rG'"
206156512874348544,2012-05-25 22:55:17,b'National Senior Health and Fitness Day May 30: By Anonymous The Geneseo Park District is honoring a total of 25 ... http://t.co/2bIGQF7x'
206156511771246592,2012-05-25 22:55:17,"b'Health and Fitness Menu: One more evening of slug chomping and these kale seedlings are done for. Luckily, there... http://t.co/2H76ubS7'"
206060626123038720,2012-05-25 16:34:16,b'Swanson Health Products Headlines Health and Fitness Expo Held in Conjunction ...: Swanson Health Products was t... http://t.co/LZ0RnQzk'
206060625145769985,2012-05-25 16:34:16,b'Franciscan Alliance Omni Health and Fitness Sites Earn Medical Fitness ...: Franciscan Omni Health and Fitness S... http://t.co/192fDGh7'
206020759842328577,2012-05-25 13:55:51,"b""Families Celebrate Fit Lifestyles at the PJCC: Sunday's fourth annual Family Health and Fitness Day at the Penin... http://t.co/tJdQl0iN"""
205972612331995136,2012-05-25 10:44:32,"b'Bipasha directs fitness DVD: Ask her why she decided to go solo this time around and she says, ""After exercising... http://t.co/qyqsZa1U'"
205972611077914625,2012-05-25 10:44:31,b'Swanson Health Products Headlines Health and Fitness Expo Held in Conjunction ...: For the fifth consecutive yea... http://t.co/3kKIJWae'
205892040771379200,2012-05-25 05:24:22,"b""Health and Fitness - Soon I'll Be Reaching Out on the Radio: \xe2\x80\x9cHomosexuality is destroying the fabric of our soci... http://t.co/Pz5wnsoH"""
205892039647297536,2012-05-25 05:24:22,"b'Westchester To Mark National Senior Health And Fitness Day: ... do strength training, swim, watch a cooking demo... http://t.co/vx0MRQz0'"
205887078737780737,2012-05-25 05:04:39,"b'Best Health And Fitness Apps - Business Insider: Summer is almost here, so in a last ditch effort to get your di... http://t.co/Ra8xuSkQ'"
205861469970116608,2012-05-25 03:22:53,b'Macaw Mobile Health &amp; Fitness App from U.S. Preventive Medicine Wins CTIA E ...: Macaw Mobile App was recognized... http://t.co/JGv1wYBI'
205861468611149824,2012-05-25 03:22:53,"b'Fitness, Senior Health, Fitness: In celebration of the national Senior Health and Fitness Day, The Cloisters of ... http://t.co/absKAJZJ'"
205842000686235649,2012-05-25 02:05:31,b'Chain restaurants not exactly helping in fighting the obesity ...: By George Guerin/Fitness Blogger... http://t.co/A4ukuc5v'
205800268934287362,2012-05-24 23:19:42,"b'Annual Senior Health and Fitness Day set for May 25: By Anonymous On Friday, May 25, 2012 Harris Hospital will h... http://t.co/if790VOY'"
205800267818614784,2012-05-24 23:19:42,"b""Health and Fitness Menu: To celebrate the festival's 10th anniversary, PICA invites back some artistic greats an... http://t.co/hJkoZ1Zu"""
205765432752349186,2012-05-24 21:01:16,b'Health and Fitness Menu: The cabaret cellist and soprano songwriter sits down with a Culturephile correspondent ... http://t.co/y1nMoH1w'
205729517183041536,2012-05-24 18:38:33,"b'Fitness can help override a family history of high blood pressure: The research, funded by the National Institut... http://t.co/FZrpEqnE'"
205729516205776896,2012-05-24 18:38:33,b'Macaw Health and Fitness App from US Preventive Medicine Wins CTIA E-Tech Award: Unlike other available health a... http://t.co/21dahDcm'
205724755108708352,2012-05-24 18:19:38,"b'Personal Trainer - Results Health and Fitness - Chandler, AZ: Results Health and Fitness is a unique fitness cen... http://t.co/XmviKUgd'"
205724753246425090,2012-05-24 18:19:38,"b""Rocky's Retreat\xc2\xae Announces Landmark Canine Health and Fitness ...: Rocky's Retreat\xc2\xae Canine Health and Fitness Ce... http://t.co/s58m5Rla"""
205622255554805760,2012-05-24 11:32:20,"b'Club offers exercise on your own schedule: As a member of multiple other gyms at one time or another, Walbert sa... http://t.co/lQj8f65c'"
205622241134776322,2012-05-24 11:32:17,"b'Chattanooga area health news: In conjunction with the 19th annual National Senior Health and Fitness Day, a seni... http://t.co/cTlE2ZmL'"
205229332367548416,2012-05-23 09:31:00,b'SCAN Health Plan Arizona Joins in Celebrating National Senior Health &amp; Fitness Day: PHOENIX -- SCAN Health Plan ... http://t.co/RI34cFMz'
205206727757529088,2012-05-23 08:01:11,b'Cherie Bronsky: Health and wellness defines department: By SUN CITY COMMUNITY ASSOCIATION Sun City residents wil... http://t.co/W8yXGNIk'
205146349702877184,2012-05-23 04:01:15,b'Port Chester Senior Center Site for National Senior Health and ...: Port Chester Senior Center is one of several... http://t.co/Sv6CxjPt'
205085529488891904,2012-05-22 23:59:35,b'Get moving on National Senior Health and Fitness Day: By SUN CITY COMMUNITY ASSOCIATION May 30 is National Senio... http://t.co/jLmojpR4'
205085528461295616,2012-05-22 23:59:34,"b'Health and Fitness Menu: Top food news stories from around Portland, including new hours at Boke Bowl, a new Tow... http://t.co/3WFzklv6'"
205045068711723008,2012-05-22 21:18:48,"b'Health &amp; Fitness: Pneumonia biggest killer of young kids: (MCT) Around the globe, the leading cause of death for... http://t.co/dQ0CD9RP'"
205045067629600769,2012-05-22 21:18:48,"b'Health &amp; Fitness: Test offers red flag for autism at 6 months: (MCT) A simple ""pull-to-sit"" test on infants at s... http://t.co/APVWnlF1'"
204984243682676736,2012-05-22 17:17:06,b'UPMC to host National Senior Health &amp; Fitness Day at Pittsburgh ...: People 65 and older will receive a free pas... http://t.co/qIjIHzkT'
204984242126589952,2012-05-22 17:17:06,b'Employees exercise on health and fitness day - http://t.co/zXR3jJxb: News ...: Alabama Employee Health and Fitnes... http://t.co/xWVOidNq'
204976580123037697,2012-05-22 16:46:39,b'Fast-Growing Nutritional Retailer Once Again Opens Door to Franchising: Zink says the most successful franchisee... http://t.co/zfSBX4oh'
204976578592129024,2012-05-22 16:46:39,"b'Digital Shelf Space\'s Flagship Product GSP Rushfit Reaches #2 on the Top Rated ...: (the ""Company"" or ""DSS"") (CV... http://t.co/ZqvJrMjI'"
204936221321994241,2012-05-22 14:06:17,"b'CKO Kickboxing Health Fitness Franchise Continues Rapid Growth with New San ...: SAN DIEGO, May 22, 2012 /PRNews... http://t.co/gO7Vu1ok'"
204936182314967040,2012-05-22 14:06:08,"b'MapMyFITNESS Launches Groundbreaking Applications and Redesigned Website: AUSTIN, Texas, May 22, 2012 /PRNewswir... http://t.co/LQDe7XjU'"
204858488705396736,2012-05-22 08:57:24,"b'Leigh Hickombottom Joins Sunwarrior as an Ambassador: Leigh Hickombottom, a health and fitness expert and model,... http://t.co/Dou6nqze'"
204858487782653952,2012-05-22 08:57:24,b'How to achieve a healthier workplace: Did you know that May is recognized nationally and globally as Employee He... http://t.co/A8KqJlBo'
204784275214708736,2012-05-22 04:02:30,"b'National Senior Health and Fitness Day to be held at McLeod Health &amp; Fitness: On Wednesday, May 30, an estimated... http://t.co/IeIj0egc'"
204749156953243649,2012-05-22 01:42:57,"b""NFL referree Ron Winter of Kalamazoo appointed to Gov. Rick Snyder's Council ...: Rick Snyder appointed National... http://t.co/3FkM7JQv"""
204694369679314944,2012-05-21 22:05:15,b'Administrative Law Judge Ruling: Some Health Claims for Pomegranate Products ...: An order Judge Chappell issued... http://t.co/4pgvrYR0'
204694368563638272,2012-05-21 22:05:15,"b""Austin ranks near top on health and fitness survey: The American College of Sports Medicine's annual American Fi... http://t.co/Do5CTRqe"""
204654860338081793,2012-05-21 19:28:15,"b'My Town: Senior Health and Fitness Day in Ravenna | http://t.co/GbK3f9bo ...: RAVENNA, Ohio - The Ravenna Athleti... http://t.co/UpbEytfJ'"
204617284369661952,2012-05-21 16:58:56,"b""What's true fitness?: There's information overload on health and fitness, but what works and what doesn't? Here ... http://t.co/72hSy2rj"""
204617283358818304,2012-05-21 16:58:56,b'WellPoint Announces Strategic Relationship With FitOrbit to Enhance Efforts to ...: We believe FitOrbit enhances... http://t.co/9I3JwiDv'
204527302560849921,2012-05-21 11:01:23,"b'Positive impact: Local doctors hit walking trail for community health: The second Saturday of each month, local ... http://t.co/nz9GKka5'"
204514910934269952,2012-05-21 10:12:09,"b'Exercising and Dieting Not Enough to Stop UK Obesity Freight Train - Dr Berardi: BRADFORD, England, May 21, 2012... http://t.co/HoEruL6i'"
204514909998952448,2012-05-21 10:12:08,"b""700 employees 'give and gain' to boost the health and fitness of youngsters in ...: ... Community (BITC), the ca... http://t.co/Wwlrkbjd"""
204505162755227648,2012-05-21 09:33:24,b'Fitness factions: Health and fitness magazines take ... - http://t.co/n4yqVe3Y: AP Breaking News &amp; Headlines. Fin... http://t.co/X429y1HR'
204505161610170368,2012-05-21 09:33:24,b'Health and Fitness: Working the core part four - Multimedia ...: The fourth in a series of exercises to strength... http://t.co/BusbqLp0'
204451397276680192,2012-05-21 05:59:46,"b'Canton ramps up for big run: We looked at the Arnold Classic in Columbus, the health and wellness trend, the exp... http://t.co/37ELubry'"
204451396253253632,2012-05-21 05:59:46,"b'Health &amp; Fitness Calendar: May 21, 2012: Healthy Memphis Common Table: 11:30 am-1:15 pm Tuesday meeting at Unive... http://t.co/IEbN81uf'"
204384738524401666,2012-05-21 01:34:53,b'May is National Physical Fitness and Sports Month: May is National Physical Fitness and Sports Month and this ye... http://t.co/VKWORw0n'
204384737031237633,2012-05-21 01:34:53,"b""Health and Fitness Menu: Checking in on Portland's status in the national food scene, the June issue of Bon Appe... http://t.co/4JrdsIcS"""
204264880889540609,2012-05-20 17:38:37,"b""Fitness factions: Health and fitness magazines take different ...: I'm one of those women who likes reading men'... http://t.co/fI68cCPd"""
204237898881572864,2012-05-20 15:51:24,"b'Twelfth annual health and fitness expo: ULSTER COUNTY, NY -- A major push for Ulster County to become healthier ... http://t.co/iUaiyE3S'"
204228326880051200,2012-05-20 15:13:22,b'Health and Fitness For Children | The Geek From Kansas: Introducing your children early in life to proper health... http://t.co/M9V4XEhk'
204174819581886464,2012-05-20 11:40:45,"b'Dalton chiropractor promotes fitness as instructor, author: BY CAITLIN HEANEY (STAFF WRITER) BUTCH COMEGYS / STA... http://t.co/LMzgvVmQ'"
204174818474602498,2012-05-20 11:40:44,"b'Home Health Care San Diego \xe2\x80\x93 Firstat Nursing Services Supports National Senior ...: On May 30th, over 1000 organ... http://t.co/lvCgj4NL'"
204105987991408640,2012-05-20 07:07:14,b'Heath Department: May change to be mindful of inactivity: The last Wednesday of the month is National Senior Hea... http://t.co/7ihqfzt5'
203952189700440064,2012-05-19 20:56:05,b'May is National High Blood Pressure and Stroke Awareness Month: Be sure to work with your doctor to improve your... http://t.co/9ryFxtnH'
203810566911963137,2012-05-19 11:33:20,"b'Digital Agency ymarketing Joins President Obama in Supporting National ...: Throughout the month of May, Orange ... http://t.co/cpDY2iaO'"
203810565880152064,2012-05-19 11:33:20,b'Twitter updates: Marathon runners gear up for steamy weather: 50 vendors from around the nation set up shop Frid... http://t.co/llFAsRem'
203723790864220161,2012-05-19 05:48:31,"b""Santa Ana's Health &amp; Fitness Fair set for Saturday: By RON GONZALES / THE ORANGE COUNTY REGISTER SANTA ANA - The... http://t.co/wECMb2HQ"""
203723789744357376,2012-05-19 05:48:31,b'Free activities offered on National Employee Health and Fitness Day ...: Free activities offered on National Emp... http://t.co/FpXLwtxz'
203628921089044482,2012-05-18 23:31:32,"b'Doctors, Dieticians and Fitness Leaders Join to Fight Childhood Obesity: Led by the University of Texas Health S... http://t.co/a9WmbyDX'"
203628919935602689,2012-05-18 23:31:32,"b'Sustainable Health &amp; Wellness opens in The Mill at 2 Tunxis: Now we have 2200 square feet, including five treatm... http://t.co/AYOB0ZLP'"
203538426409127937,2012-05-18 17:31:57,"b'Nashville District strides toward better health, fitness: DeLapp said it is important for the Corps of Engineers... http://t.co/ubrsS15B'"
203487854272323584,2012-05-18 14:10:59,b'Fitness factions: Health and fitness magazines take different approaches when ...: By Julie Deardorff Chicago Tr... http://t.co/eVnZ0XBf'
203281410239369216,2012-05-18 00:30:39,"b""Women's Health &amp; Fitness Expo on May 19 emphasizes slimming ...: Every year around this time, Kingston hosts a c... http://t.co/YzIbD8qk"""
203280857379766272,2012-05-18 00:28:27,b'Fitness factions: Health and fitness magazines take distinctly different approaches when motivating women and me... http://t.co/D4K0zv9A'
203280856045985792,2012-05-18 00:28:27,"b'Shrewsbury Health and Racquet Club Honored: In 2009, in the midst of one of the direst US economies, Darline Yat... http://t.co/3dEhw6IX'"
203194797664641026,2012-05-17 18:46:29,"b""David 'Y' plans health/fitness celebration for senior citizens: By Anonymous The Paul and Carol David YMCA is tu... http://t.co/wcjFEOuX"""
203194796620267520,2012-05-17 18:46:29,"b'Health and Fitness Menu: Furthermore, sometimes you have to look more deeply at whether plants you grow are heal... http://t.co/S68QXeUX'"
203160727702347778,2012-05-17 16:31:06,"b'Fitness day promotes healthy employees: As part of National Employee Health and Fitness Day, area companies spen... http://t.co/aiY1DlPW'"
203132975578226690,2012-05-17 14:40:50,b'Skechers Fitness Claims Shot Down; Turns Out You Really Have to Exercise: The Federal Trade Commission announced... http://t.co/tMPsNIJR'
203132961619574785,2012-05-17 14:40:46,b'Eastgate Senior Activity Center Hosts National Senior Health &amp; Fitness Day May 30: National Senior Health and Fi... http://t.co/XvO1BTOp'
203103519824297984,2012-05-17 12:43:47,"b'National Health and Fitness Day Walk set for May 18 at the State ...: Get your walking shoes ready, and make you... http://t.co/qfvdIdA6'"
203103518842822656,2012-05-17 12:43:47,b'U.S. Preventive Medicine\xc2\xae Health &amp; Fitness App to ... - Yahoo! News: From Yahoo! News: \xe2\x80\x9cMacaw\xe2\x84\xa2\xe2\x80\x9d The Ultimate Hea... http://t.co/DnDSaqz2'
203024362587160576,2012-05-17 07:29:14,"b'Weight loss, fitness are expo focus Saturday in Lake Katrine: Diana Lopez of BodyHoops demonstrates some moves a... http://t.co/CwVzcvw9'"
202955028145774593,2012-05-17 02:53:44,"b'Fun+health=Expo: Jade Olson, 15, (left) and Brianna Sullivan,14, carry a 125 foot fire hose up steps at Mason Ci... http://t.co/CR8qDvzf'"
202955027088801792,2012-05-17 02:53:43,"b""Fitness factions: Blending men's and women's health advice: Rather than sending the message that exercise builds... http://t.co/6WmQ0KYt"""
202918367382876160,2012-05-17 00:28:03,"b""May is Employee Health and Fitness Month: At 11 Wednesday morning NewsChannel 13's Benita Zahn joined a group fr... http://t.co/Q3uGfR12"""
202918366321704960,2012-05-17 00:28:03,"b""National Employee Health and Fitness day: Plainview Intermediate School Principal Julie Altom said this year's s... http://t.co/q5PJ07kZ"""
202866434328629251,2012-05-16 21:01:41,b'Skechers Settles Deceptive Ad Case With FTC for $40M: When it comes to cracking down on health and fitness claim... http://t.co/83UtSS98'
202866433284247554,2012-05-16 21:01:41,b'May is National Physical Fitness and Sports Month: Since 1983 (the very same year that The Heartland Spa and Fit... http://t.co/li3Buu1v'
202833253621694464,2012-05-16 18:49:50,b'Docudharma:: Health and Fitness News: ... conditions and the current treatments available. You can now find past... http://t.co/9IGZcclH'
202800949176172546,2012-05-16 16:41:28,"b'Leading Exercise Physiologist Chris Eschbach, Ph.D. Joins Valencell: He is certified as a Health Fitness Special... http://t.co/SHLmDntO'"
202800947972411392,2012-05-16 16:41:28,b'10 Wearable Devices To Keep Patients Healthy: Marianne Kolbasuk McGee 05/16/2012 Wearable devices equipped with ... http://t.co/M0TnnTLu'
202682606167400448,2012-05-16 08:51:13,b'The new wellness revolution: New Delhi: Gone are the days when health and fitness supplements were considered as... http://t.co/mgZXuIpo'
202682605160775680,2012-05-16 08:51:13,"b""Lions' Ndamukong Suh, Tony Scheffler open health club: By Rod Beard Ndamukong Suh and Tony Scheffler, part owner... http://t.co/ObvaFdeb"""
202557044627210241,2012-05-16 00:32:17,"b'Test your health and fitness at the library: Now library patrons can find their body fat composition, heart rate... http://t.co/BEgHCRQx'"
202557043444428800,2012-05-16 00:32:17,b'Ben-Gal Laura Vikmanis is speaker at senior health fair: Leigh Taylor/The Community Press The Clippard Family YM... http://t.co/vOXhnEsg'
202491948555173888,2012-05-15 20:13:37,b'Getting Healthy and Hot in Virginia Beach: A breakfast dish that could not be more complete and healthy after al... http://t.co/fwOh71vk'
202434030501773313,2012-05-15 16:23:28,"b'Are You Happy with Your Sex Life? Exclusive Survey from Yahoo! Shine &amp; FITNESS ...: Launched in 1992, FITNESS ma... http://t.co/Qc17dWB8'"
202381414799388672,2012-05-15 12:54:24,b'Nitric Oxide Supplements Now Available From All Natural Health And Wellness ...: Natural Nitric Oxide supplement... http://t.co/wvlj0TDZ'
202381413775974400,2012-05-15 12:54:23,"b""'Building a Healthier Community': Conference to address health, well-being of ...: The event, sponsored by Chrys... http://t.co/tJpsGDyb"""
202268855094099968,2012-05-15 05:27:07,"b'Fitness is a full-time job: On Friday, about 80 members who represent the public and private sectors are teaming... http://t.co/654LtjIa'"
202268854137786368,2012-05-15 05:27:07,b'Healthy workplace will improve production and bottom line COMMENTARY TJ Fjelseth: HELPING EMPLOYEES get healthie... http://t.co/NVkbNRMo'
202251487173296128,2012-05-15 04:18:06,"b""It's National Employee Health and Fitness Month - Standard Speaker: And May, designated as National Employee Hea... http://t.co/W1L46wJT"""
202251486187634690,2012-05-15 04:18:06,"b'Health And Fitness | Replica Handbags,Designer Handbags ...: Marketing in the Pingdingshan two clinic, Overall h... http://t.co/1SclcaZk'"
202236563009179649,2012-05-15 03:18:48,"b'Health, fitness expo set at Lake, MC high schools: US Army Recruiting Company Waterloo will join hands with loca... http://t.co/KR2Crgur'"
202147735850323968,2012-05-14 21:25:50,"b'Fitness Fights High Blood Pressure Genes: The new study, published in Hypertension, included more than 6000 heal... http://t.co/0nrC4zLs'"
202147733732204544,2012-05-14 21:25:50,"b'Proactive Partners Announces Company Name Change to Midtown Health: CHICAGO, May 14, 2012 (BUSINESS WIRE) -- A l... http://t.co/xQDyKhiW'"
202105542095802369,2012-05-14 18:38:10,"b'Governor Fallin Leads ""Walk For Wellness"": HisMore &gt;&gt; Governor Mary Fallin has declared that May is Oklahoma\'s E... http://t.co/eNXlZzpa'"
202105540447436800,2012-05-14 18:38:10,"b'Nationwide 2K Event Will Support Homeless Veterans and Promote Employee Wellness: WASHINGTON, May 14, 2012 (BUSI... http://t.co/mHPyRG5a'"
202098656835403778,2012-05-14 18:10:49,b'Free activities offered on National Employee Health and Fitness Day ...: Free activities offered on National Emp... http://t.co/pDtwpjtp'
202022037982679040,2012-05-14 13:06:21,"b""Carly Q. Romalino: Gloucester County seniors' event to offer health screening ...: By Carly Q. Romalino/Gloucest... http://t.co/gsFVcsxp"""
202022036976041984,2012-05-14 13:06:21,"b""Celebrating 25 years of health and fitness: Week four will offer '25 things to do' \xe2\x80\x93 a gym challenge, with progr... http://t.co/jLAOjCvV"""
201946723696902144,2012-05-14 08:07:05,b'WellBalance Weight Loss Camps Develops Innovative Health Score Measure: WellBalance fitness and weight loss heal... http://t.co/68KYqUFL'
201941097474310144,2012-05-14 07:44:44,b'10 Health And Fitness Myths You Still Believe: By Jessica Smith for http://t.co/oQJ5Qhpr Top experts set the reco... http://t.co/2S9pUmrd'
201924102393561088,2012-05-14 06:37:12,b'Health &amp; Fitness Calendar: Race expo and health fair takes place 10 am-8 pm Friday in Student Activity Center an... http://t.co/PC4K38k9'
201840546224947200,2012-05-14 01:05:10,b'Public health hero: Pharr Yarns: The hope is that by funding employee programs that promote wellness and fitness... http://t.co/uufBySpH'
201840544735969280,2012-05-14 01:05:10,"b'Fitness Lady celebrates Women\'s Health Week: Fitness Lady celebrates National Women\'s Health Week with ""Footstep... http://t.co/mgqkUdRa'"
201795251818602497,2012-05-13 22:05:11,"b""Health and Beauty Tips for Surviving Exams: Yes I've prioritised revision over sleep and fitness...but NO I won'... http://t.co/FKecoUkN"""
201646086195130370,2012-05-13 12:12:28,"b'Upcoming health &amp; wellness events: There will also be a men-only event, Man 2 Man: Health and Fitness Empowermen... http://t.co/qEdO4bV4'"
201551728540262400,2012-05-13 05:57:31,"b'Living at Your Peak set for Sept. 13-15: VAIL, Colorado \xe2\x80\x94 Health enthusiasts from around the country will gather... http://t.co/CvZ5IUye'"
201551727411986433,2012-05-13 05:57:31,b'Health Yorktown Run Benefits Local Schools: by Rick Pezzullo (email) Youngsters eagerly wait the start of the Fu... http://t.co/wXuhUwG6'
201490628075462656,2012-05-13 01:54:43,"b'Philly Fit Bash Comes to Feasterville: A fun, family health and fitness expo will be held May 20 at B&amp;R Fitness ... http://t.co/0bR5G57G'"
201490626859110401,2012-05-13 01:54:43,"b'Fitness, fun on tap at Corning YMCA Healthy Lifestyles event: Karen Immerman, an occupational therapist at St. J... http://t.co/dVNNmzTA'"
201482820168855552,2012-05-13 01:23:42,b'6th Annual Santa Ana Health and Fitness Fair set for May 19 | New ...: Councilwoman Michele Martinez ignited the... http://t.co/GIRusZAj'
201326926240034816,2012-05-12 15:04:14,"b'Private fitness clubs unfazed by massive Grand Forks Park District club: Planet Fitness saw a ""huge"" wave of res... http://t.co/wNswgN35'"
201275062618292224,2012-05-12 11:38:09,b'Grand Reopening Weekend Set For Newly Remodeled Life Time Fitness Matthews ...: By Business Wire 05/12/12 - 06:0... http://t.co/BPiK9qgt'
201214577596317697,2012-05-12 07:37:48,"b'Diet and fitness quotes from celebrities: ""Health and wellness are very important to me, Adam\'s knowledge of per... http://t.co/VXn0m9JR'"
201092062764994560,2012-05-11 23:30:58,"b'Health and Fitness Jobs: What You Need, Where to Go, and What ...: While the unemployment rate has decreased to ... http://t.co/1Sm0xFdQ'"
201089553581350913,2012-05-11 23:21:00,b'Celebrate Employee Health and Fitness Day May 16 | myVU ...: Vanderbilt employees compete in a walking relay. (I... http://t.co/VLzubobT'
201024219365126145,2012-05-11 19:01:23,"b""Silicon Valley is getting healthy, crunching abs, not just apps: Also driving Silicon Valley's health kick: The ... http://t.co/pDmV8Rzq"""
201024217683210241,2012-05-11 19:01:23,"b""Priority Health and Governor's Council Team Up to Promote Workplace Wellness ...: To combat these issues, partly... http://t.co/X5AgMWiz"""
201016063998164992,2012-05-11 18:28:59,"b'Barefoot Running, The Naked Truth \xc2\xab Health and Fitness 101: The aim of our blog is to interpret, distill, and th... http://t.co/WslmmPyz'"
200979081704116224,2012-05-11 16:02:01,b'Jackson area sees boost in fitness centers as economy shows signs of health: To buy reprints or merchandise of t... http://t.co/2Or5TBhV'
200872681573322753,2012-05-11 08:59:13,"b""Priority Health and Governor's Council Team Up to Promote Workplace Wellness ...: \xe2\x80\x9cEmployee Health and Fitness M... http://t.co/nAaISnC6"""
200872680436674560,2012-05-11 08:59:13,b'Staff walks to promote health and fitness: The event is a Bergen County Cancer Coalition and Bergen County Dept.... http://t.co/AqPozGAM'
200786751290220544,2012-05-11 03:17:46,"b'Health and Fitness Menu: Recent Paris-based festival \xe2\x80\x9cKeep Portland Weird\xe2\x80\x9d imported a host of Portland artists, ... http://t.co/XzSAz2JC'"
200704223778832385,2012-05-10 21:49:50,"b'Barefoot Running, The Naked Truth \xc2\xab Health and Fitness 101: The aim of our blog is to interpret, distill, and th... http://t.co/zLw5BGOb'"
200690721244708864,2012-05-10 20:56:11,"b'Fitness in Middle Age Lowers Medical Costs Later: Study: By Ellin HolohanHealthDay Reporter THURSDAY, May 10 (He... http://t.co/JsNwfr2A'"
200683090908151808,2012-05-10 20:25:52,"b'Health and Fitness File, May 9: Aurora Wellness Center. SLEEP DISORDERS: Dr. Mathew Mathai, medical director of ... http://t.co/BWb5vm1B'"
200683088362209280,2012-05-10 20:25:51,b'Health and Fitness Resources You May Have Missed | http://t.co/YBb7XxRL: Ready for some Friday R and R? This week... http://t.co/f1dOoaQb'
