id,created_at,text331738748016525313,2013-05-07 11:54:15,"b'PLEASE HELP Dog training advice, dog health advice?_National ...: We were informed that the dog was good with ... http://t.co/6HnGEQrB2R'"
331738746972155904,2013-05-07 11:54:15,"b""Health advice: sensitive stomach - Telegraph: Britain's leading health and wellbeing experts answer your quest... http://t.co/syPmkT6tpd"""
331702483560837121,2013-05-07 09:30:09,"b'Scholarships for Maori nurses working on health phonelines: Two new $10,000 scholarships were handed out on Tu... http://t.co/2KfsQHz7La'"
331678381844332544,2013-05-07 07:54:23,b'Creating an online fitness support network can be powerful: Keep learning. There are endless online resources ... http://t.co/aykIGP6iOq'
331537517729939459,2013-05-06 22:34:38,"b""Children's health: Physical inactivity and depression linked: Fitness &amp; Exercise \xc2\xb7 physical activity \xc2\xb7 Adolesc... http://t.co/WjyYFpjtC9"""
331537516387770368,2013-05-06 22:34:38,"b'MMS Holds Career and Health Fair: All of the students had looked forward to the annual Career and Health Fair,... http://t.co/OPzY3mSPcQ'"
331482096042397696,2013-05-06 18:54:24,b'Caravus | Best Health and Fitness Apps: A rapidly growing area in the world of smartphone apps relates to heal... http://t.co/mHxIfQjBno'
331482094893137920,2013-05-06 18:54:24,"b'Health and fitness calendar \xc2\xbb The Commercial Appeal: Health and fitness calendar. Posted May 5, 2013 at 6:20 p... http://t.co/jGL0a7fy8u'"
331471629278380034,2013-05-06 18:12:49,"b'I Lost 98 Pounds -- And I Still Eat Pizza: Being a health and fitness blogger, people are always surprised whe... http://t.co/Vujt3Knxld'"
331471627973976064,2013-05-06 18:12:49,"b'Walking to physical fitness: Together, healthy habits such as physical activity, a balanced diet will help you... http://t.co/VlREHDLYZD'"
331404441880252417,2013-05-06 13:45:50,"b'Ah bollocks, some sexual health advice please... (full thread ...: Name changed regular as really fucking emba... http://t.co/sp1FLfBRqC'"
331347087012806656,2013-05-06 09:57:56,b'Health advice: sensitive stomach: The best advice is to eat a meal you often have the night before your race \xe2\x80\x93... http://t.co/oXMLHZsgr4'
331347085750321152,2013-05-06 09:57:56,"b'Health advice: baby weight: ... questions, for publication only, to stellahealth@telegraph.co.uk. To contact a... http://t.co/UM0GyOX1F2'"
331255696031092736,2013-05-06 03:54:47,"b'Health and fitness calendar: Health and fitness calendar. Posted May 5, 2013 at 6:20 p.m.. Discuss; Print; A; ... http://t.co/PZiJlOfX9W'"
331186392237473794,2013-05-05 23:19:23,"b""BRIAN PARR'S HEALTH AND FITNESS: Missed opportunities for children's activity: The Physical Activity Guideline... http://t.co/yZd5kPyW1f"""
331119189098127361,2013-05-05 18:52:21,b'24-hour health and fitness center opens in Lampasas: LAMPASAS \xe2\x80\x94 The quick progress of construction on Lampasas... http://t.co/T8BuJ1mCBm'
331070504289042433,2013-05-05 15:38:53,"b'Health Advice from MetLife: Get Health Advice from MetLife on a variety of topics, such as how to choose a phy... http://t.co/LIN4tIkxrR'"
331070503072714753,2013-05-05 15:38:53,"b'PLEASE HELP Dog training advice, dog health advice? - Yahoo! Answers: PLEASE HELP: Today we went to meet a lad... http://t.co/1m24ynmnRT'"
331051689538887682,2013-05-05 14:24:08,b'Why fitness must be on par with maths and science in schools: Professor Niall Moyna of the Centre for Preventi... http://t.co/RwDgOfs1WI'
330983393296801792,2013-05-05 09:52:44,b'Charity Festival Benefits the Wounded Warrior Project: \xe2\x80\x9cThis is just our way to give back for all the people w... http://t.co/mBxFQ5pxdY'
330983392327917569,2013-05-05 09:52:44,"b'Digital fitness trackers still young but gaining traction: A separate report, by Transparency Market Research,... http://t.co/Vbft6gEF7e'"
330915712363266050,2013-05-05 05:23:48,"b'YMCA promotes fun and fitness: The West Chatham YMCA promoted fun, health and physical fitness Saturday. The o... http://t.co/uRbBjhgoCG'"
330915711134363648,2013-05-05 05:23:48,"b""Health: Six easy steps to employee health: If your place of employment hasn't already begun a worksite wellnes... http://t.co/YLkEtrvsEK"""
330847076659363841,2013-05-05 00:51:04,"b'Jump for Joy Foundation hosting camp to tackle obesity: Designed as a health and fitness fair for kids, Tackli... http://t.co/e8aGkCrQSd'"
330847075426246656,2013-05-05 00:51:04,"b'Running at Night Latest Fitness Craze: By IndiaTimes | May 5, 2013, 6:00 am IST - Posted 1 min ago Health &amp; Fi... http://t.co/8d3tjKnfkw'"
330812665968611328,2013-05-04 22:34:20,"b'All Hands Department : Health and Fitness - The US Navy: Lt. Cmdr. Pablo Capistrano, from Chicago, and Senior ... http://t.co/4pudFXajVO'"
330812664869683200,2013-05-04 22:34:20,b'Health and Fitness Expo kicks of New Jersey Marathon weekend ...: Thousands of people will attend the Novo Nor... http://t.co/vVvctSZ87I'
330777500827414530,2013-05-04 20:14:36,b'Health Fair Benefits Wounded Warrior Project: The Wounded Warrior Project will see all benefits from the famil... http://t.co/qVSo5UXYrk'
330777497216098305,2013-05-04 20:14:35,"b""Getting Fit: Eating to the Build: I'm sure you've heard the 80/20 rule with health and fitness. If not, it's v... http://t.co/USWvsA3F52"""
330705904544669698,2013-05-04 15:30:06,"b'YMCA Urges Seniors to Age Healthy: YMCA of the Suncoast, which includes the East Lake location, is a launching... http://t.co/p4dcP2HKNk'"
330659100511850497,2013-05-04 12:24:07,"b""Seven 'potentially serious' NHS 111 helpline incidents: Trained advisers who answer the phones offer basic hea... http://t.co/jr2NANy1wq"""
330634774454628352,2013-05-04 10:47:27,"b""Tadda! Meet fitness enthusiast and new Free Press columnist LaTasha Lewis: \xe2\x80\x9cI'm on the preventative side of he... http://t.co/cwu8zFmCGU"""
330634773368295425,2013-05-04 10:47:27,"b""Hudson Valley Best Bets for this weekend: The 13th Annual Women's Health and Fitness Expo will be held from 8:... http://t.co/JJDtLIsgWd"""
330566620265193472,2013-05-04 06:16:38,"b'Health District Looking For Committee Members: It currently offers health and wellness programs, innovative se... http://t.co/2yfWCk5wBa'"
330566619208232960,2013-05-04 06:16:38,b'YMCA powers fitness for the community: \xe2\x80\x9cThe Y is a great place to come together as a community to not only pro... http://t.co/XDY8sHrNZK'
330496141965799426,2013-05-04 01:36:35,"b'Reminder: Healthy Melrose events on Saturday, May 4: The Spin For Health outdoor spinning event is a big draw ... http://t.co/ouW61OapRo'"
330496140577497088,2013-05-04 01:36:34,b'Aspire Zone to launch health column - Gulf times: Aspire Zone is set to launch a brand-new column featuring he... http://t.co/Mci6adsaRX'
330481019822174208,2013-05-04 00:36:29,"b""Wedding Detox Tips | Health and Fitness Tips | Fit How To - YouTube: Wedding season is here, and whether you'r... http://t.co/3OjR6WBsjo"""
330481018844872704,2013-05-04 00:36:29,"b""Wedding Detox Tips | Health and Fitness Tips | Fit How To - YouTube: Wedding season is here, and whether you'r... http://t.co/bAQfBKaaW2"""
330481018836484098,2013-05-04 00:36:29,b'Congressman Veasey Recognizes May as Health and Fitness Month: Dallas-Fort Worth \xe2\x80\x93 Congressman Marc Veasey has... http://t.co/QEbjl0lGJQ'
330424075690323969,2013-05-03 20:50:13,b'Riverside Park gets fitness equipment from San Juan Regional Medical Center: The hospital donated the fitness ... http://t.co/kJRBijXgtK'
330424074436227072,2013-05-03 20:50:12,b'Local YMCAs to Celebrate Older Adults on National Senior Health &amp; Fitness Day: To celebrate and encourage seni... http://t.co/XetusGlKvY'
330403144494374914,2013-05-03 19:27:02,"b""What is male menopause? :: Men's health advice :: http://t.co/UYZeGQ3zkt: Expert advice on recognising the symp... http://t.co/Noq7pIt9nH"""
330403143412228096,2013-05-03 19:27:02,b'Weight/Health Advice? (Knowledgeable answers only please)? - Yahoo ...: Im having extreme difficulty losing we... http://t.co/kYm22lN8Uu'
330353649131855872,2013-05-03 16:10:22,"b'New Specialty Certifications Help Parents, Professionals Target Childhood ...: Specialty Certifications in bot... http://t.co/6sskhs0pz4'"
330353647777107968,2013-05-03 16:10:21,"b""Top 25 Health and Fitness Apps: Fitness. They say it's important for those of us who enjoy fresh air, exercise... http://t.co/UDeL16Exi6"""
330277611076984832,2013-05-03 11:08:13,"b'Binge Drinking is Very Dangerous: By IndiaTimes | May 3, 2013, 12:52 pm IST - Posted 3 hours ago Health &amp; Fitn... http://t.co/QX0zjtaCIR'"
330277609843867648,2013-05-03 11:08:13,b'Fitness coach sponsors cheerleading academy: A HEALTH and fitness coach has stepped in to help raise funds for... http://t.co/PChfohKCT7'
330210848830259200,2013-05-03 06:42:56,"b""New Faces at the Madison Area YMCA in Development, Health &amp; Fitness and ...: Madison Area YMCA's Sports Direct... http://t.co/LFGlaPrC99"""
330145311177711616,2013-05-03 02:22:30,"b""What health and fitness benefits does the following activities ...: Hi. I'll like to know how much beneficial ... http://t.co/dwcX7T3CDf"""
330141949354979331,2013-05-03 02:09:09,b'Five percent of broadband households have digital fitness devices: Parks Associates Health Apps According to a... http://t.co/HivHerZmey'
330141947845038080,2013-05-03 02:09:08,b'Bend it like Karen: She can see through excuses and knows by experience that it is indeed possible to make hea... http://t.co/rPu1Fzylev'
330070975175602177,2013-05-02 21:27:07,"b""When Friends Give Health Advice - MDJunction: When Friends Give Health Advice: I'm in the midst of another fla... http://t.co/bfNwG3tJVY"""
330070973934075904,2013-05-02 21:27:07,b'Dorset CCG - Bank holiday health advice: People in Dorset are urged to be familiar with the full range of loca... http://t.co/Cao6eBJfrX'
330070816110829568,2013-05-02 21:26:29,b'Anytime Fitness Recognizes Employee Health Month: While organizations should make employee wellness a priority... http://t.co/XQhM0wplbo'
330070815011897344,2013-05-02 21:26:29,"b""12 for '12 wins state award for public health service: Gannett Central Wisconsin Media will receive a statewid... http://t.co/PtEPf8rz43"""
330027933697703936,2013-05-02 18:36:05,b'New service set up to offer sexual health advice in Wirral: AN increase in demand for information about sexual... http://t.co/eNPZEUeCcL'
330005348234715136,2013-05-02 17:06:20,b'Fitness profile: Debbie Cerminaro - Reading Eagle: I started at Valhalla Health and Fitness Club in September ... http://t.co/EeOoSgnH7K'
330005347181940736,2013-05-02 17:06:20,b'Health And Fitness Challenge Unveils New Website To Help People Lose Weight: Health and Fitness Challenge is a... http://t.co/InouAotJI8'
329932297623183360,2013-05-02 12:16:04,"b'Pazoo Signs Former Australian Powder Tumbling Champion and Former Cirque ...: CEDAR KNOLLS, N.J., May 1, 2013 ... http://t.co/oGPKt57bQI'"
329932296520077312,2013-05-02 12:16:03,b'Jessica Palmer-Christie: Pocket money fitness: The fact is we need our health to sustain our working lives amo... http://t.co/ectg3InW8M'
329864184219185154,2013-05-02 07:45:24,"b'Viper Battalion promotes health, physical fitness at Zumbathon: Soldiers, Families and friends of 1-395th Eng.... http://t.co/kAhvffsa9B'"
329864183187374080,2013-05-02 07:45:24,"b'NORCO: Senior health event set for May 29: The City of Norco Parks, Recreation and Community Services Departme... http://t.co/oKOjTEImTn'"
329812901101727745,2013-05-02 04:21:37,b'Health Reviser Acquires Mobile Health and Fitness Developer ...: Being an active participant in many health an... http://t.co/MABgIes4CE'
329754362131910657,2013-05-02 00:29:01,"b""Fluoride nod in the 'best interest' of Mackay: Mackay Mayor Deirdre Comerford says the decision to add fluorid... http://t.co/6FwJxtTJwT"""
329728381782462464,2013-05-01 22:45:46,b'Summer Day Camp at Princeton Health and Fitness: The Princeton Health and Fitness Center offers a day camp for... http://t.co/WW5mf9vE7U'
329728380092162048,2013-05-01 22:45:46,"b'Jawbone Makes Health Tracking Push With $110 Million Buy: On Tuesday, Jawbone took another step toward becomin... http://t.co/JPZaR5A2ZZ'"
329662049909108737,2013-05-01 18:22:12,b'Success Story: Leading By Example: Matthew Johnson knows health and fitness. A former collegiate baseball and ... http://t.co/duJuXp1k4K'
329662048751464448,2013-05-01 18:22:11,b'Healthways SilverSneakers\xc2\xae Fitness Program Publishes Fitness Trends ...: Measured against the Medicare Health ... http://t.co/pMB45cBYlw'
329592418339016705,2013-05-01 13:45:30,b'Miles of health and fitness: The club was organized with the hope to spread the importance of fitness and heal... http://t.co/97CUlwLLd2'
329592417164603393,2013-05-01 13:45:30,"b'Health, Beauty and Fitness: Let us take away the stresses and strains of everyday life with a relaxing massage... http://t.co/wOQ3ru2aj6'"
329524222235918336,2013-05-01 09:14:31,b'Common fitness myths debunked: Not everything you hear about fitness and exercise is truth. Agency. THERE are ... http://t.co/uFWAExzgEI'
329524220994387968,2013-05-01 09:14:31,"b'Healthy Alternatives: It is becoming painfully clear that, as a city, we need to do better in regards to our h... http://t.co/luIrRQR3Fs'"
329479738722766848,2013-05-01 06:17:45,"b'WTHR Health and Fitness Expo - Indianapolis Colts: Wed., Jun. 12, 2013 2:00PM - 8:00PM EDT Open Mini-Camp Prac... http://t.co/vp5pS3B79N'"
329457168115978240,2013-05-01 04:48:04,b'Jawbone Acquires BodyMedia to Add Health Monitoring to Fitness Devices: ... expertise in wearable health senso... http://t.co/LbpGVZO3KH'
329388191712948224,2013-05-01 00:13:59,b'SCAN Health Plan Arizona Celebrates Older Americans Month with Free ...: In honor of Senior Health &amp; Fitness D... http://t.co/EoCkoS7L2m'
329388190286880768,2013-05-01 00:13:58,b'Common fitness myths debunked: Agency. THERE are many myths surrounding health and fitness that influence peop... http://t.co/HCJschkLPr'
329318961659379713,2013-04-30 19:38:53,"b'Jawbone Acquires BodyMedia for More Than $100 Million, as Wearable Tech ...: Looking to gain even more tractio... http://t.co/vJ2GGV6sss'"
329318960438865920,2013-04-30 19:38:53,b'Some health and fitness fads can endanger your life: A number of us have been led to think that disinfectants ... http://t.co/4rI9gVmg2v'
329273393465671680,2013-04-30 16:37:49,"b""Mental tasks 'impaired in the air': Passengers should follow health advice to avoid side-effects such as jet l... http://t.co/sSwesAW0gZ"""
329248641254580224,2013-04-30 14:59:27,b'Fitness boost: Award for jog and blog site author: What started as an online journal on parenting and caring f... http://t.co/UVkLq06guF'
329248640260521984,2013-04-30 14:59:27,b'Fitness can be as easy as ABC if you follow tips: Nikki Caputa is a health and fitness coach who works one-to-... http://t.co/ZFeTdMzsBi'
329178590354735104,2013-04-30 10:21:06,b'Genesis Health Clubs prepares to build $2M McPherson facility: Genesis Health Clubs is planning to construct a... http://t.co/FDI9RAp4NY'
329178587561328642,2013-04-30 10:21:05,b'Health Reviser Acquires Mobile Health and Fitness Developer Company FitPal ...: Being an active participant in... http://t.co/jBJeb7AQ8h'
329145176440336385,2013-04-30 08:08:19,"b""4 Apps for Employee Health and Wellness - Mashable: After all, it's the tracking and trending of data that hel... http://t.co/6kn9RMplPQ"""
329145175274299392,2013-04-30 08:08:19,b'Health and Fitness Calendar - The Frederick News-Post : Health: Send nonprofit health and fitness news to Heal... http://t.co/f8bUx9Ld5m'
329134122037559296,2013-04-30 07:24:24,b'Success of East Lancashire chemists scheme: Chemists have been able to offer more preventative health services... http://t.co/IKX9bOYoXn'
329043334490386432,2013-04-30 01:23:38,"b""Denise Richards denies she's too skinny: 'I'm such an advocate for health and ...: I have a very healthy lifes... http://t.co/18uNEhDmXD"""
329043333282406402,2013-04-30 01:23:38,"b""Viper Battalion promotes health, physical fitness at 'Zumbathon': Lt. Col. Kip Korth, commander of 1-395th Eng... http://t.co/imv0tJr8Sk"""
328975159358812160,2013-04-29 20:52:44,b'Olympic gold medalist Summer Sanders named as Jamba Juice spokesperson: The Healthy Living Council is comprise... http://t.co/vmBdYFYTep'
328975156481511425,2013-04-29 20:52:44,"b'4 Apps for Employee Health and Wellness - Mashable: Runtastic is an app primarily designed for individuals, an... http://t.co/KJb0vvKVKx'"
328903844488683520,2013-04-29 16:09:21,"b'Work at Utz? New fitness center part of operations in Hanover: ""We are getting serious about health and fitnes... http://t.co/PjvORd7nPj'"
328903843272343553,2013-04-29 16:09:21,"b'Health Reviser Acquires Mobile Health and Fitness Developer Company FitPal ...: Health Reviser, developer of h... http://t.co/UE2dI5LUth'"
328810794638798848,2013-04-29 09:59:37,b'Expressing support for designation of May 2013 as \xe2\x80\x9cHealth and ...: 195: Expressing support for designation of ... http://t.co/XcXTZlbNNc'
328810793493745664,2013-04-29 09:59:36,b'WTHR Health and Fitness Expo: Day Two - 13 WTHR Indianapolis: Turnout has been great for the inaugural WTHR He... http://t.co/74oNT9ALKf'
328767838103957504,2013-04-29 07:08:55,"b""Four Central Arkansas Fitness Centers Sold to Group Led by Stephens Execs for ...: That's the price paid for t... http://t.co/PDlYHAvREM"""
328767837000826880,2013-04-29 07:08:55,"b'Top 10 fitness Tweeters to follow: When it comes to connecting, Twitter is one of the fastest ways to share an... http://t.co/ZT6QVm88rT'"
328735124558606336,2013-04-29 04:58:55,"b""12 Pieces Of Health Advice You'll Actually Listen To - BuzzFeed: Thug Kitchen provides a new way to preach hea... http://t.co/ySc06IxpDG"""
328735123363209216,2013-04-29 04:58:55,"b'Health advice from history that was so, so, wrong | http://t.co/BtIple5nIq: Totally insane. THIS ACTUALLY HAPPE... http://t.co/FiPUNw0LOP'"
328701082526171136,2013-04-29 02:43:39,"b""Why fat-shaming doesn't work: Fat shaming as a 'motivational technique' has divided the health and fitness com... http://t.co/rGxmDNYnec"""
328567790388776960,2013-04-28 17:54:00,b'Boomer times to kick on into retirement - Sydney Morning Herald: Opportunities might be in areas such as succe... http://t.co/871wjZpGso'
328567789013053440,2013-04-28 17:54:00,"b'Retreat for rejuvenation: Qi Gong (pronounced chi gung) is an ancient Chinese practice focused on balance, ali... http://t.co/blm3SRim4l'"
328499010321129472,2013-04-28 13:20:41,"b""Harlan Fitness Fair promotes a good lifestyle: \xe2\x80\x9cHarlan's first annual Health and Fitness Fair was an awesome w... http://t.co/O3HnwZlrBn"""
328476834108956672,2013-04-28 11:52:34,"b'Alpine PT Kicks its Soccer Outreach Into High Gear \xc2\xab Health and ...: The aim of our blog is to interpret, dist... http://t.co/cTHantyMrV'"
328476832670298112,2013-04-28 11:52:34,"b'SuperTalk Mississippi: Health and Fitness Expo | News Mississippi: JACKSON, Miss.--The SuperTalk Mississippi H... http://t.co/kN2zFhO4Zh'"
328400532135874560,2013-04-28 06:49:22,"b""The Worst Health Advice You've Ever Gotten! | The Dr. Oz Show: The Worst Health Advice You've Ever Gotten! We ... http://t.co/ctctA5Joxq"""
328365511769456640,2013-04-28 04:30:13,"b'Beckley YMCA to celebrate Healthy Kids Day May 7: \xe2\x80\x9cSummer is the time for kids to get up, get out and grow, bu... http://t.co/y0KOFACAKC'"
328230840473632769,2013-04-27 19:35:05,"b""Fun and Fitness for Kids Saturday: Healthy Kids Day is part of the Y's national initiative to improve the heal... http://t.co/Lrd3VIoOqd"""
328230839366340608,2013-04-27 19:35:04,"b'Fitness Plus celebrates National Health and Fitenss Day - Daily Journal: CAPE GIRARDEAU, Mo. \xe2\x80\x93 Fitness Plus wi... http://t.co/6DNGNJz0oW'"
328164398961152000,2013-04-27 15:11:04,b'WTHR Health and Fitness Expo kicks off: The inaugural WTHR Health and Fitness Expo kicked off Saturday morning... http://t.co/W05uoR2OTy'
328095901727985664,2013-04-27 10:38:53,b'RUNNERS GLOW - Manteca Bulletin: \xe2\x80\x9cDale and I sat down and tried to come up with something fun; something more ... http://t.co/YREjxyoiVC'
328095900381634560,2013-04-27 10:38:53,b'Top 10 summer sports to get you in shape: Fitness can be achieved through fun sports too. There are several fu... http://t.co/RL3VG9kxze'
328066807296581632,2013-04-27 08:43:16,"b""Twitter / DrOz: For expert health advice, be ...: Instantly connect to what's most important to you. Follow yo... http://t.co/esV6sNTJwE"""
328066806143143936,2013-04-27 08:43:16,b'Timely health advice - Local Health - Portsmouth News: SEVERAL members of the public who took advantage of a f... http://t.co/1RQ0fuvtYo'
327962254068822018,2013-04-27 01:47:49,b'BodyMedia to Modify Fitness Tracking Devices to Monitor Chronic Diseases: BodyMedia is one of several vendors ... http://t.co/o8mMQdTIUH'
327962253007671296,2013-04-27 01:47:49,b'Health and Fitness: The basics on how to get strong: The health and performance benefits of weight training ar... http://t.co/Zk5xApIO7n'
327823485424504832,2013-04-26 16:36:24,b'Westfield Y to host UnitedHealthcare Health Bee for seventh graders: Students from eight middle schools to com... http://t.co/bj9A8dEL4j'
327823484443041795,2013-04-26 16:36:24,"b""Jessica Alba's Extreme Weight Loss Trick; Don't Try This at Home!: But they uniformly do not help you lose wei... http://t.co/c2DLGRsYwr"""
327809635354542080,2013-04-26 15:41:22,"b'Microsoft Healthvault: Your Personal Health And Fitness Application ...: Microsoft Healthvault, the one place ... http://t.co/ofIlk5mERL'"
327809634310189056,2013-04-26 15:41:21,"b'Preparations underway for WTHR Health and Fitness Expo - 13 ...: After months of planning, WTHR is hosting a H... http://t.co/FoqVDA18tI'"
327753783255896066,2013-04-26 11:59:25,"b'Beach Cities Health District Board seeks applicants for advisory committees: As a public agency, it offers an ... http://t.co/NvDxuSzMws'"
327753782291214336,2013-04-26 11:59:25,"b""Saturday's 'Healthy Kids Day' to exercise body, mind at Madison YMCA: For information about \xe2\x80\x9cHealthy Kids Day\xe2\x80\x9d... http://t.co/dwpZvJALba"""
327732433439059968,2013-04-26 10:34:35,"b""Medical: Most teens, tweens seek parents' health advice: Visit http://t.co/GYvPUynoME for breaking news and hea... http://t.co/McSRAWELKS"""
327686750447226880,2013-04-26 07:33:04,"b'Community health fair is today: Health professionals, businesses that provide health-related services, exhibit... http://t.co/wJW2nstqDa'"
327686749155364865,2013-04-26 07:33:03,b'Mayor creates Fitness Challenge: \xe2\x80\x9cThe goal is to encourage and support all individuals in the community who wa... http://t.co/HIhlMGeLyg'
327620494163578880,2013-04-26 03:09:47,"b""Changes OK'd for fitness business: Planning commission approved exterior work for the former La Bella Viaggio ... http://t.co/IURc72q3Ul"""
327552109295841280,2013-04-25 22:38:03,"b'Bush\'s ""Machinehead"" Voted Ultimate Workout Song In Gold\'s Gym\'s 3rd Annual ...: DALLAS, April 25, 2013 \xe2\x80\x94 /PRN... http://t.co/JKRVCNtz6z'"
327552108079509505,2013-04-25 22:38:02,"b""Man 2.0: The Fitness Book That's Redefining Masculine: \xe2\x80\x9cWe have this mentality that we don't want to go back a... http://t.co/p3kgqjO2XB"""
327477609137053696,2013-04-25 17:42:00,b'Health and fitness briefs | News OK: IN BRIEF Trail Riders to host ride at bell cow lake this weekend.newsok.c... http://t.co/fuuoawYa55'
327477607161552896,2013-04-25 17:42:00,"b'Colosseum Health and Fitness - Yelp: 1 Review of NJ Fitness ""I am a member of the COLOSSEUM HEALTH &amp; FITNESS f... http://t.co/cm4q6cclB2'"
327429686906998787,2013-04-25 14:31:35,b'Doctors abandon new telephone advice line: DOCTORS have ditched a new telephone health advice line system just... http://t.co/w4hmLwmp1n'
327429685225074689,2013-04-25 14:31:34,"b'Phone line will offer healthy advice to Herefordshire residents: Elizabeth Shassere, director of public health... http://t.co/JbQQtvnYz3'"
327404450442518529,2013-04-25 12:51:18,"b""13th Annual Women's Health &amp; Fitness Expo: Managing Stress for a Better Life: This year's Women's Health and F... http://t.co/itDPxhqrkm"""
327404447804309506,2013-04-25 12:51:17,"b'Ande Ka Funda: Health Benefits of Eggs: By IndiaTimes | April 25, 2013, 6:00 am IST - Posted 10 hours ago Heal... http://t.co/1oMw6X54lJ'"
327397084498112512,2013-04-25 12:22:02,b'Bay of Plenty flooding - public health advice - Lakes DHB: Bay of Plenty flooding - public health advice. Ther... http://t.co/v4Ut0g1ruK'
327397083470520320,2013-04-25 12:22:02,"b""Medical: Most teens, tweens seek parents' health advice \xc2\xbb Kitsap Sun: Teens and tweens are basically healthy, ... http://t.co/KnDLK6avib"""
327335852671918080,2013-04-25 08:18:43,"b'Ande Ka Funda: Health Benefits of Eggs: Ande Ka Funda: Health Benefits of Eggs. By IndiaTimes | April 25, 2013... http://t.co/jJsEqMjwwf'"
327269246038052864,2013-04-25 03:54:03,b'Boxing: Deirdre puts body on line for youth: Te Puke Senior Sergeant Deirdre Lack will be representing Oceanbl... http://t.co/qFSO5lftWf'
327203649782681601,2013-04-24 23:33:23,b'Schools win $20000 to promote health and fitness: The student council at Carson Elementary School in Northside... http://t.co/07BdBs2zS9'
327203648578928640,2013-04-24 23:33:23,b'Auburn awarded $3000 in healthy video challenge: The money will be used to support health and nutrition progra... http://t.co/0il5Blbf2z'
