id,created_at,text273652089153019905,2012-11-28 04:58:36,"b'Two day CIM Fitness Expo is free, open to the public, with information for ...: From injury treatment and preven... http://t.co/IIu7VvDj'"
272641993908289537,2012-11-25 10:04:51,b'Kiddie Academy Launches National Health and Fitness Initiative ...: From Yahoo! Finance: Kiddie Academy location... http://t.co/NpXAXCwh'
272641991584669696,2012-11-25 10:04:50,b'Mobilewalla ranks apps for healthy living: These highly rated health and fitness apps can help you get through t... http://t.co/3CsnuNr1'
272308883324825600,2012-11-24 12:01:11,b'Health and fitness calendar: Nov. 26: Walking workshop: The South Texas Walking Club hosts a workshop on tips an... http://t.co/frE8Yms9'
272308882305605633,2012-11-24 12:01:11,"b'Rambo Takes on Holiday Health and Fitness: Just to set the tone for this column, if you feel that holiday health... http://t.co/5MYB6Bm9'"
271468727285989376,2012-11-22 04:22:42,"b""Fitness gym trainer finds rewarding challenge working with special needs patrons: That's why Jason Cronan, owner... http://t.co/0OQ30XQa"""
271468726279348224,2012-11-22 04:22:42,b'http://t.co/Xjmi47uM Welcomes Priory Park Health and Fitness Club to its Network: The Priory Park Health and Fitn... http://t.co/Gweu5JkN'
271027040050896897,2012-11-20 23:07:36,"b""Don't let travel plans derail your health and fitness plans: Without a doubt, air travel presents many challenge... http://t.co/vM6eKxS2"""
271027037890805760,2012-11-20 23:07:35,"b""Celebrity Trainer David Kirsch On Eating Healthy, Even During Thanksgiving: David Kirsch is one of New York's be... http://t.co/xFMChUHQ"""
270981567722172416,2012-11-20 20:06:54,b'Students use health and fitness as a way to raise money - http://t.co/YSJU9ftU: ERMA \xe2\x80\x93 Students from one local hi... http://t.co/gxbwwrJg'
270981564219944961,2012-11-20 20:06:54,b'Health and Fitness: Lifting weights increases bone health ...: Slips and falls are common with the ice and outdo... http://t.co/A2vPbEMg'
270871292239032322,2012-11-20 12:48:43,"b'Health and fitness briefs for Tuesday, Nov. 20: Produced by http://t.co/huNHox6K All rights reserved. This materi... http://t.co/yVl3DFFc'"
270871291429539842,2012-11-20 12:48:43,"b'Fall River Fitness Challenge aims to build healthy lifestyles: Dara Midwood, a health and wellness professional ... http://t.co/nBonPLbu'"
270446387764817920,2012-11-19 08:40:18,"b'Kristen Bell is busy, healthy and expecting: Bell has always been a picture of fitness and health, and she has s... http://t.co/E7kG7KIG'"
270446386909159425,2012-11-19 08:40:17,b'Connected Health: This week in health and fitness tech : Shiny Shiny: the-shine-pebble1.jpeg The health and fitn... http://t.co/ecP5qzDD'
269848378723143680,2012-11-17 17:04:01,b'Saturday Morning Drill: 80s Fitness Revived: When it comes to health and fitness each decade has its own claim t... http://t.co/2n2qv5aI'
269848377334837248,2012-11-17 17:04:01,b'MetroPCS Dallas Marathon Supports New Health and Fitness: Grants Help Kick-start and Grow Community Programs Ben... http://t.co/9uku1iAr'
269768545133543425,2012-11-17 11:46:47,"b'Smartphone apps for health and fitness an exploding craze: When Jon Mead, a devoted cyclist, visits a new city, ... http://t.co/LpcKXOOb'"
269735504189202432,2012-11-17 09:35:30,"b'SA Web site offers health, fitness resources: Its initiatives to promote health and fitness include Fitness in t... http://t.co/ZeyZRyMW'"
269735503312609281,2012-11-17 09:35:30,b'Philadelphia Marathon kicks off with Health and Fitness Expo: People that have registered for the Philadelphia M... http://t.co/gBY2Cllq'
269617076245774336,2012-11-17 01:44:54,b'Alcohol intake plugs 100 calories per day into diets of U.S. adults: The National Health and Nutrition Examinati... http://t.co/cBXcCuIR'
269617075423678464,2012-11-17 01:44:54,"b'Health &amp; fitness: Nov. 19: Jingle paws: The Helotes Humane Society hosts this 5K run/walk. Dogs, with proof of r... http://t.co/3AnBcISK'"
269114279310020608,2012-11-15 16:26:58,"b'To Do: Philadelphia Marathon Health and Fitness Expo: This weekend, the Pennsylvania Convention Center will host... http://t.co/5K568wGu'"
269114277259014144,2012-11-15 16:26:58,"b""The latest topics in health and fitness: The Courier-Journal's Health &amp; Fitness section will be showcasing holid... http://t.co/al0eGB6t"""
269109369768124416,2012-11-15 16:07:28,"b'12 days of Christmas health and fitness guide: Although online shopping is handy, the 12 days of Christmas healt... http://t.co/kv3vo401'"
269109368807649280,2012-11-15 16:07:27,"b'Smartphone apps for health and fitness an exploding craze: MapMyRide, MapMyRun, Livestrong, Run4Good, MyFitnessP... http://t.co/XerALfxI'"
268639238462005249,2012-11-14 08:59:20,b'What are Tabata workouts? Should I be doing them at the gym?: The question: A friend keeps on telling me that Ta... http://t.co/0GYlhl9n'
268639237090463744,2012-11-14 08:59:19,b'Hilton Head Health Hosts Health and Fitness ... - Yahoo! News: From Yahoo! News: Recognized as one of the nation... http://t.co/9wvJ0JSn'
267644864861204480,2012-11-11 15:08:03,b'Domination on the Football Field (By a 9-Year-Old Girl) | Greatist: Domination on the Football Field (By a 9-Yea... http://t.co/2ubRV99U'
267644863900700673,2012-11-11 15:08:02,"b'Getting started: Jatomi Fitness, the newest addition to the Malaysian health club market, is dedicated to helpin... http://t.co/WTz3HvA2'"
267399888160043009,2012-11-10 22:54:36,"b'Intensity Of Exercise, Not Duration, Key To Fitness In Children: \xe2\x80\x9cKids have to get out and do a high-intensity a... http://t.co/m02z2C31'"
267399887212122113,2012-11-10 22:54:35,"b'Can a fit, sexy avatar inspire you to exercise and lose weight?: Researchers from the University of Missouri loo... http://t.co/56fbG1ZL'"
267100860587327488,2012-11-10 03:06:22,"b""Mayfield's Center Elementary students raise funds for health and fitness: \xe2\x80\x9cThis is the second year for this fund... http://t.co/9ArWdw5D"""
267100859710713856,2012-11-10 03:06:22,"b""Bay Area health and fitness events: Children's Hospital Oakland celebrates its century with activities teaching ... http://t.co/8kkbB9C0"""
266400114048917504,2012-11-08 04:41:51,"b'She gets a pat on the back for putting health front and center: URBANA, Ill. \xe2\x80\x94 When someone asks you to think ab... http://t.co/AXXdvkfU'"
266400113176477696,2012-11-08 04:41:51,b'Cardio Kool Kids promotes fitness: I dislike this. Add to. Share Flag as inappropriate. Loading... Alert icon. S... http://t.co/OZH9lial'
264247053008375810,2012-11-02 06:06:21,"b'Winners of Physical Fitness and Health awards: Susan Davis, senior director of alumni relations at Columbia Coll... http://t.co/BkJVOx5q'"
264247052135960576,2012-11-02 06:06:21,b'Community members recognized for fitness awards: Twelve Columbia residents were honored by Mayor Bob McDavid as ... http://t.co/LNJr55jz'
263896566895607808,2012-11-01 06:53:39,b'Health and fitness briefs | http://t.co/huNHox6K: HEALTH Put your facial hair to good use How would you look with... http://t.co/4F9dvq0q'
263896566056751104,2012-11-01 06:53:38,"b'Health and fitness agenda: World Diabetes Day | Bangkok Post: news: Coming up, World Diabetes Day aims to reach ... http://t.co/Pdfe20BX'"
263574048670380032,2012-10-31 09:32:04,b'Digital Health and Fitness Technology Expands by Nearly 25 ...: From Yahoo! Finance: The Consumer Electronics As... http://t.co/42VvXZ0h'
263574047718273024,2012-10-31 09:32:04,"b'Aiming To Be A Full-Service Fitness Platform, Runtastic Launches New Indoor ...: Continuing to build out what it... http://t.co/cifwfVMv'"
263352539599220738,2012-10-30 18:51:52,"b'Queen Creek rolls out fall with art, health and fitness events: Light refreshments will be served and Dr. Kris B... http://t.co/4nO2zBtq'"
263352538621939712,2012-10-30 18:51:52,b'13 Healthy Halloween Recipes from Around the Web | Greatist: Want to stay healthy this Halloween? Ditch the ... ... http://t.co/GbGKPdBY'
262764885866323969,2012-10-29 03:56:45,b'Health and Fitness: Slider Crunches and Wipers - Multimedia ...: Chris and Laura take us through Slider Crunches... http://t.co/wSAdAyNx'
262764884972957697,2012-10-29 03:56:45,b'Repair SHOP promotes health and fitness | Hattiesburg American ...: Most everybody knows the basics of fitness a... http://t.co/13EF6COz'
262688920452603904,2012-10-28 22:54:53,b'Hard slog worth it when trousers fit: Otago Daily Times Queenstown bureau chief Tracey Roxburgh is undertaking t... http://t.co/wnPrZs5g'
262688919064309760,2012-10-28 22:54:53,"b'Flu shot may reduce heart disease, Canadian study claims: A Toronto-based researcher presented a study at the 20... http://t.co/iSkSpbF3'"
262238679383285761,2012-10-27 17:05:47,"b'Health and Fitness: Save time while slimming down with supersets: As a personal trainer, one of the main reasons... http://t.co/O21Eed4P'"
262238678166949888,2012-10-27 17:05:47,"b""Gamification maven moves into the health market, prepares fitness title: \xe2\x80\x9cThey've signed on to help the company ... http://t.co/zl1OVJTr"""
261394973004554240,2012-10-25 09:13:12,"b'HEALTH AND FITNESS NEWS AND NOTES: In an analysis of studies including more than 180,000 subjects, researchers h... http://t.co/GBGdmsHz'"
261394971893055488,2012-10-25 09:13:12,"b'Top health/fitness apps: South Beach Diet, The Mindfulness App: Here are details on a selection of top ten iTune... http://t.co/4ioDSg9q'"
261388791133110272,2012-10-25 08:48:38,"b'Innovative fitness and obesity programs at Massachusetts schools reap rewards: On Monday, Governor Deval Patrick... http://t.co/3YBnPYoy'"
261388788281012224,2012-10-25 08:48:38,b'Salem County kids practice healthy eating and fitness with new county-wide ...: Enlarge Britney Lillya/South Jer... http://t.co/LMgVoRo2'
261176874485551104,2012-10-24 18:46:33,b'Foundation Communities Inc. Named as Winner of Humana Communities ...: Foundation Communities had previously rec... http://t.co/TZzCamEn'
261136563101110273,2012-10-24 16:06:22,b'PIX11 Health &amp; Wellness Expo Returns to Jacob Javits Convention Center on 10 ...: The event will bring together ... http://t.co/HM76AhMw'
261136562157412353,2012-10-24 16:06:22,b'Eat Right: The Ultimate Guide to Nuts [Infographic] | Greatist: Related Posts. Certified: The New Organizations ... http://t.co/ALJTLair'
260660457495465984,2012-10-23 08:34:30,b'Health and Fitness 4-H Club News | The News Leader | newsleader ...: The Health &amp; Fitness 4-H Club held their cl... http://t.co/WuyyQrQn'
260660456656605184,2012-10-23 08:34:30,"b""Ohio State Women's fitness group dabbles in different exercises: So last winter, OSU students and co-founders Ta... http://t.co/oxRMivAG"""
259713336399241216,2012-10-20 17:50:59,"b'Salem Health and Wellness Foundation to kick-off new Healthy Kids, Bright ...: The Health Kids, Bright Futures k... http://t.co/t2Jv0AZF'"
259713335359070208,2012-10-20 17:50:59,b'Health and Fitness: Is it wise to wear a back belt?: Based on these findings we suggest that specific educationa... http://t.co/MNfqKGGj'
259489782512635904,2012-10-20 03:02:39,b'Lifestyle fair focuses on health and fitness | http://t.co/M1OLeiwK: EAST BRUNSWICK \xe2\x80\x94 The township is holding its... http://t.co/ofHC0YjE'
259489781631827968,2012-10-20 03:02:39,"b'Health and beauty buffs under one roof: The annual In Shape health, beauty and fitness fair at the Beirut Intern... http://t.co/AbC8W3fi'"
259397307215273984,2012-10-19 20:55:12,b'Detroit Marathon Health and Fitness Expo starts today: The Detroit Free Press/Talmer Bank Marathon Health &amp; Fitn... http://t.co/f8bkyHuN'
259397306296705025,2012-10-19 20:55:11,"b""100 Fitness Men of All Time Inspire Health Greatness: This week, Men's Health announced its list of \xe2\x80\x9c100 Fittest... http://t.co/Walqilud"""
258446434477674496,2012-10-17 05:56:46,"b""Health Startup's App Tracks What Ails You: That data is typically fed into an online dashboard that spits out he... http://t.co/ilQyuA0M"""
258446433601085440,2012-10-17 05:56:46,"b""Fitness calendar: Free back seminar \xe2\x80\x93 The Women's Club Health and Fitness Center, 2105 Bow St., will host a free... http://t.co/KEFr7hv6"""
257804244231536642,2012-10-15 11:24:56,"b""Skesa - promoting excellence in health and wellness: The majority of SKESA's members are certified through CSEP'... http://t.co/lKxoySrX"""
257804243388477441,2012-10-15 11:24:56,"b""Fitness for everyone: Have you tried to improve your fitness before, but weren't sure where to start, or just ha... http://t.co/uyjH8WCn"""
257741714998059008,2012-10-15 07:16:28,"b'St. Louis County goes lean with fitness program: In January, county officials worked with health-care and fitnes... http://t.co/2votFGM4'"
257741714087882752,2012-10-15 07:16:27,"b'Health and fitness calendar for Oct. 15, 2012: Health and fitness calendar for Oct. 15, 2012. The Commercial App... http://t.co/BePZDNSB'"
257669988587040768,2012-10-15 02:31:27,"b'Are fit athletes less prone to injury?: Trainers, coaches and athletes have long believed that fit athletes are ... http://t.co/cpyktX4s'"
257669987467132928,2012-10-15 02:31:26,b'Age should not affect surgery - report: Assumptions about fitness in older people should not be used to decide w... http://t.co/EcqefCyo'
257226333631942656,2012-10-13 21:08:31,b'Health and Fitness: Health and Fitness. Two mistakes women make at the gym. By Kyler Cross Special to the Tribun... http://t.co/lbu55Mfw'
257226332650487808,2012-10-13 21:08:31,"b'Health and Fitness News | KTXL FOX40: The latest news and studies to keep you and your family healthy, including... http://t.co/LBpJM11N'"
256536833322799104,2012-10-11 23:28:41,"b'Fitness Programs Help Tween and Teen Girls Get Health Boost: WASHINGTON HEIGHTS \xe2\x80\x94 On a recent day after school, ... http://t.co/iK0GYhvH'"
256536832349728768,2012-10-11 23:28:41,"b""Free Flu Shots, Health Measurements, More at Expo: Durham, NC - Duke's Health and Fitness Expo will take place i... http://t.co/nMYRmHJD"""
256423664013160448,2012-10-11 15:59:00,b'Power Plate for Health and Fitness: Power Plate works using vibration technology where energy is transferred fro... http://t.co/KF82bpuv'
256423662901661696,2012-10-11 15:59:00,"b'Today is National Depression Screening Day: A public opinion poll this month by Screening for Mental Health, Inc... http://t.co/sQ0K3npU'"
255702462575570944,2012-10-09 16:13:12,b'Fitness calendar: The Fitness Calendar is printed each Tuesday inside the Health section. Deadline is noon Frida... http://t.co/5GYVbCaG'
255702461396942849,2012-10-09 16:13:12,"b'larklife Gets Wireless with Health &amp; Fitness Tracking: Unlike other fitness trackers, like Nike Fuelband, larkli... http://t.co/og7obFar'"
255556748977532929,2012-10-09 06:34:11,"b""Men's mental fitness gets a workout: \xe2\x80\x9cThe Work Out app is geared at promoting mental health and fitness in a way... http://t.co/WZkn1PDy"""
255556747731804160,2012-10-09 06:34:11,"b'Dallas trainer shares advice on healthy fitness: The commonplace perception of fitness is the more workouts, the... http://t.co/R5MzjNxU'"
255321729805717504,2012-10-08 15:00:18,b'HEALTH AND FITNESS: Exercise and breast cancer: HEALTH AND FITNESS: Exercise and breast cancer. By BRIAN PARR Co... http://t.co/tyFpfN2W'
255206546777190400,2012-10-08 07:22:36,"b""'Fitness guru' remembered at memorial road race: The race benefits the John D. Zumbo Memorial Scholarship Fund, ... http://t.co/4WSA54Le"""
255159594211495936,2012-10-08 04:16:02,"b""C'mon mummy, work off that baby bump!: Exercising helps to lose those last baby kilos, tone up, regain core stre... http://t.co/2GiBHoNI"""
255159593288740865,2012-10-08 04:16:02,"b'Health &amp; Fitness - Groupon: Find exclusive great local, shopping and travel deals at 50 to 90% off in your favor... http://t.co/EFjmR9ec'"
254909184330575875,2012-10-07 11:41:00,"b""Indian-American dons bikini to promote women's health in India: She won first place in the women's pro bikini ch... http://t.co/9QgC5eD4"""
254909183328153600,2012-10-07 11:40:59,"b'Wellness Weekend: Even before being able to work out at the new Anytime Fitness, people can attend a health and ... http://t.co/VhcFViQC'"
254818801625989120,2012-10-07 05:41:51,"b'Feature Columns - Aiken Standard: HEALTH AND FITNESS: Before you get a flu shot. Monday, October 1, 2012 10 08 a... http://t.co/STcxZXay'"
254818800761982976,2012-10-07 05:41:51,"b""SmartDebit Acquire Contract with Health and Fitness Digital Media ...: From Yahoo! News: SmartDebit, the UK's le... http://t.co/s5A32t2C"""
254700483174887425,2012-10-06 21:51:41,"b'Bike or dance your way to fitness this weekend: On Saturday mornings, certified Jazzercise instructor Donna Thom... http://t.co/g5ECipXX'"
254700482298261504,2012-10-06 21:51:41,b'Health and Fitness: Health and Fitness. Is the bench press overrated? By Kyler Cross Special to the Tribune. Ema... http://t.co/iTZhpLvA'
254582908004757504,2012-10-06 14:04:29,b'Stay Fit to Reduce Breast Cancer Risks: West Des Moines Resources: Some gyms and fitness resources in West Des M... http://t.co/K5N31jqu'
254582906796793857,2012-10-06 14:04:29,b'HEALTH and FITNESS: Tuesday. Reiki: Briana Brooks leads an open forum to help explore this holistic approach to ... http://t.co/EPuOpfVo'
253894102276517888,2012-10-04 16:27:25,b'UCLA Public Health Researchers Get $20M Grant to Promote Health and ...: UCLA Public Health Researchers Get $20M... http://t.co/QgbcvAXP'
253894101290844160,2012-10-04 16:27:25,"b""http://t.co/BmtaKdyc Launches Corporate Health &amp; Wellness Fitness ...: CoreFitnessByJana's unique approach to C... http://t.co/dfNh1n4M"""
253675988704165888,2012-10-04 02:00:43,b'SHAPE and SheKnows Launch Social Health and Fitness Survey: SHAPE and http://t.co/MMAmZwVH have partnered to find... http://t.co/UwNO8bK1'
253675987714322433,2012-10-04 02:00:43,b'Healthy Living Can Prevent Breast Cancer: Lower Southampton Resources: Lower Southampton has a great variety of ... http://t.co/1chnjl6N'
253273915605020672,2012-10-02 23:23:01,b'Newark Museum Festival Puts The Fun Into Health And Fitness: Newark Museum Festival Puts The Fun Into Health And... http://t.co/CvnMcw2N'
253273914577391616,2012-10-02 23:23:01,"b'Recall News: DETAILS: Suspension Trainer Devices imported by Fitness Anywhere LLC of San Francisco, Calif.; sold... http://t.co/rmMsjHeY'"
252957735669346304,2012-10-02 02:26:38,b'Healthy Living Can Prevent Breast Cancer: Tucker Resources: You might be able to find help fighting breast cance... http://t.co/RxRkPOlK'
252957734683684864,2012-10-02 02:26:38,b'Exercise without weight loss can still boost self-esteem of overweight teens: A little bit of exercise can do a ... http://t.co/wOLcW70f'
252199991920185344,2012-09-30 00:15:38,"b""Celebrate Women's Health and Fitness! \xc2\xab Orthopedics, Spine ...: Celebrate Women's Health and Fitness! National W... http://t.co/uDr8OHa1"""
252141636279209985,2012-09-29 20:23:45,b'Former US President Clinton lauds Italian fitness equipment company: MILAN \xe2\x80\x94 Former U.S. President Bill Clinton ... http://t.co/e5WcuO3B'
252106481107873792,2012-09-29 18:04:03,"b""24 Health and Fitness Resources You May Have Missed | Greatist: It's week 3 of the #zensperiment. Read how we me... http://t.co/F75dR3bB"""
252106480076091392,2012-09-29 18:04:03,"b'Health and Fitness: The 80/20 Rule: Blame it on the internet, the health and fitness community, or the inherent ... http://t.co/d2xWNbb3'"
252055618528088064,2012-09-29 14:41:57,"b'PRAB Kicks off Yearlong Healthy Living Campaign for Preschool Families: Preschoolers made a salad, watched a pla... http://t.co/4DDC0Vsz'"
252055617546633216,2012-09-29 14:41:56,"b""This year's flu vaccine guards against new strains: \xe2\x80\x9cPeople cannot become complacent this year,\xe2\x80\x9d said Dr. Howard... http://t.co/NBPe3Mxe"""
252002389123534849,2012-09-29 11:10:26,"b'New approach at YMCA merges health care with fitness: The shiny, natural-light-drenched Healthy Living Center fo... http://t.co/J86e9KDN'"
251946717195427841,2012-09-29 07:29:12,b'Elementary students take on Ultimate Fitness Challenge (VIDEO): The fitness course was set up and overseen by re... http://t.co/Vrg6xn59'
251946716322988032,2012-09-29 07:29:12,"b""7News Health and Fitness Expo 2013 - Boston News, New England ...: BOSTON -- Channel 7's free Health and fitness... http://t.co/XhD4hr7v"""
251690181923586048,2012-09-28 14:29:50,"b'3 Second Health\xe2\x84\xa2 Natural Liquid Multi-Vitamin Shot to Make Worldwide Debut ...: 28, 2012 \xe2\x80\x94 /PRNewswire/ -- 3 Sec... http://t.co/HG00Uunu'"
251690180845662208,2012-09-28 14:29:49,"b""Weston tables bill for national fitness day: WEST Vancouver's representative in Ottawa is calling for the creati... http://t.co/RvRneBxD"""
251566507832791040,2012-09-28 06:18:24,"b'Tai Chi offered at the Y: The eight-week sessions will begin on Tuesday, at 8 a.m. at The YWCA and at 7:30 p.m. ... http://t.co/52mVa9IW'"
251566506956173312,2012-09-28 06:18:23,b'Clarksville Health and Fitness Expo 2012: Lifestyle \xc2\xb7 Health &amp; Fitness \xc2\xb7 Community Events \xc2\xb7 Pet of the Day \xc2\xb7 Fas... http://t.co/pdJfKs44'
250807693365895168,2012-09-26 04:03:08,b'Choice Health and Fitness Officially Open for Business: Choice Health and Fitness Officially Open for Business. ... http://t.co/4zbIlZPR'
250807691885281280,2012-09-26 04:03:08,"b""Forney's Anytime Fitness trainers answer your fitness questions: The trainers at Anytime Fitness in Forney have ... http://t.co/od2jnyP0"""
250616017875767296,2012-09-25 15:21:29,b'Over-50s turn out in force to boost health and fitness: Scores of people aged 50 and over took part in a day of ... http://t.co/RBMOjiP5'
250538346210799616,2012-09-25 10:12:51,b'Footballers give lesson on health and fitness: Bolton Wanderers stars Keith Andrews and Andy Lonergan visited SS... http://t.co/S1zMTzIc'
250538344746983425,2012-09-25 10:12:50,"b'Use it or lose it: Mr Adena had always been very active in his work - gardening and landscaping, but said it was... http://t.co/bF2eYSgk'"
250252175215828992,2012-09-24 15:15:42,"b""The Dr. Is In \xe2\x80\x93 Women's Health and Physical Activity: The goal of National Women's Health and Fitness Day, obser... http://t.co/kXpWnZ5T"""
250252174049832960,2012-09-24 15:15:42,"b""Health Calendar, click here: CCC invites individuals to Women's Health and Fitness Day at 12 noon Wednesday in r... http://t.co/dRCFknU1"""
250232306869100545,2012-09-24 13:56:45,b'Diet and fitness confessions of a model: Fitness model Manning Sumner lifts the lid on the lengths models go to ... http://t.co/hURVMIE1'
250232302964183041,2012-09-24 13:56:44,"b""Students get health advice at West Notts College: The 'Healthy Welcome' roadshows, designed for new and returnin... http://t.co/1K7dFTNa"""
250150577068191744,2012-09-24 08:31:59,b'Ventura County Reporter - Best Of Health and Fitness: Best Of Health and Fitness. 09/20/ ... Ionia Kershaw at Zu... http://t.co/pG9xtA2L'
250150576158031872,2012-09-24 08:31:59,"b""The Lazy Girl's Guide To Health And Fitness: But I Don't Wanna Go ...: The Lazy Girl's Guide To Health And Fitne... http://t.co/wdJM1V0p"""
250079497758572544,2012-09-24 03:49:33,b'Let the battle of the bulge begin: Despite several attempts at getting fit - and multiple promises to maintain i... http://t.co/F2jJgwb0'
250079496869396480,2012-09-24 03:49:32,"b""Have allergy problems? Here's some advice: Chair Exercises To Strengthen Your Abdominal Muscles. Age or fitness ... http://t.co/yDOHKlWz"""
250032165696462849,2012-09-24 00:41:28,b'Health and Fitness: Ways to reduce muscle soreness: Health and Fitness: Ways to reduce muscle soreness. By Kyler... http://t.co/0BoM4k6N'
250032164626911234,2012-09-24 00:41:28,"b'A Triathlon in Space, Why We Actually Procrastinate, and More ...: As always, Links We Love brings you our favor... http://t.co/ffeoea57'"
248736724769992705,2012-09-20 10:53:51,"b'OU Fitness and Recreation launches new program: OU Fitness and Recreation created the Shift Gears Program, which... http://t.co/NsA4rsUJ'"
248736723692056576,2012-09-20 10:53:50,"b'Runway to Health &amp; Beauty Expo 2012: The busy entrepreneur, dance instructor and mother of two, Hernandez, creat... http://t.co/9KY0NxWF'"
248379843455115264,2012-09-19 11:15:44,"b'Liberty-Perry gets big fitness grant: Five years ago, Brant began a health and fitness program at the middle sch... http://t.co/jW53tvtS'"
248379842553331712,2012-09-19 11:15:43,"b'Weighty problem burgeons in Florida: Personal trainer Danielle Close, right, works with Charline McHugh during a... http://t.co/HzOC2Kqb'"
248222526621237248,2012-09-19 00:50:36,"b'Get your healthy on at the Health, Wellness and Sports Expo: Going to the doctor, starting a new diet or trying ... http://t.co/GDRQWCMr'"
248222525203562497,2012-09-19 00:50:36,b'Bay Area health and fitness events: Kickoff celebration of a new series of monthly workshops for teens that focu... http://t.co/tA8Ghzxm'
248209893889302528,2012-09-19 00:00:24,b'A cancer survivor in the wilderness - The Orange County Register: More from Health and Fitness \xc2\xb7 A joint effort ... http://t.co/i00zUxDX'
248209892224159745,2012-09-19 00:00:24,b'News: Morning Workouts Could Curb Appetite | Greatist: Greatist News examines and explains the trends and studie... http://t.co/2HRJVaiV'
248059362436870145,2012-09-18 14:02:15,"b'Innovative Business Leaders and Health, Fitness and Education Experts Unite ...: Students present to a panel of ... http://t.co/sQLcBq34'"
