id,created_at,text941387890768187394,2017-12-14 19:22:17,b'My stress level is: laying on the floor of my office trying not to hit something because nothing is working out lat\xe2\x80\xa6 https://t.co/dps86bNe4Y'
941046920826556425,2017-12-13 20:47:24,"b'We\xe2\x80\x99re going to get up to 6 inches of snow by tomorrow. I don\xe2\x80\x99t have ice melt, a snow shovel, or a snow brush for my\xe2\x80\xa6 https://t.co/aJFpxlqwpl'"
940665118509199361,2017-12-12 19:30:15,b'Lots of Coffee | Vlogmas Day 8 &amp; 9: https://t.co/ceAP9PHqCP via @YouTube'
940665083272757248,2017-12-12 19:30:07,b'I added a video to a @YouTube playlist https://t.co/ceAP9PHqCP Lots of Coffee | Vlogmas Day 8 &amp; 9'
940655044726345730,2017-12-12 18:50:13,"b'I understand sponsored posts, but now throwing \xe2\x80\x9crecommended\xe2\x80\x9d posts into my feed? Really Instagram?? Me no likey. Not one bit.'"
940303063344123904,2017-12-11 19:31:34,b'Editing Day | Vlogmas Day 7: https://t.co/1SzLqfiNNb via @YouTube'
940303036609695744,2017-12-11 19:31:28,b'I added a video to a @YouTube playlist https://t.co/1SzLqfiNNb Editing Day | Vlogmas Day 7'
940292564451844096,2017-12-11 18:49:51,"b'If you are a creeper, I will block you. End of story. Not putting up with that shit. Thanks and have a nice day.'"
940245582068797440,2017-12-11 15:43:10,b'Driving All Day &amp; Hello Geese! | Vlogmas Day 6: https://t.co/j3Y3kV7QSn via @YouTube'
940245568240193539,2017-12-11 15:43:07,b'I added a video to a @YouTube playlist https://t.co/j3Y3kV7QSn Driving All Day &amp; Hello Geese! | Vlogmas Day 6'
940241878624153601,2017-12-11 15:28:27,"b'From now on it\xe2\x80\x99s all Christmas nails, all the time!\xf0\x9f\x8e\x84 https://t.co/Sd26HsKzwB'"
939630869312081920,2017-12-09 23:00:31,"b""Me: Why doesn't it feel like Christmas?\nAnswering myself: Because you haven't played Mariah Carey's Christmas album yet. Duh."""
939516874420903938,2017-12-09 15:27:32,b'You know you\xe2\x80\x99ve done something right when your kids are singing Bad Romance in their room in the morning.'
938884281061003266,2017-12-07 21:33:50,b'Running Errands &amp; Candle Haul | Vlogmas Day 5: https://t.co/csGEYLWA9L via @YouTube'
938884263872737282,2017-12-07 21:33:46,b'I added a video to a @YouTube playlist https://t.co/csGEYLWA9L Running Errands &amp; Candle Haul | Vlogmas Day 5'
938769200679673856,2017-12-07 13:56:33,b'Reading Under The Tree &amp; Health Update | Vlogmas Day 4: https://t.co/nwDFxvPqqW via @YouTube'
938769184108040192,2017-12-07 13:56:29,b'I added a video to a @YouTube playlist https://t.co/nwDFxvPqqW Reading Under The Tree &amp; Health Update | Vlogmas Day 4'
938509703465795584,2017-12-06 20:45:24,"b'Hi you guys!! I promise Vlogmas Days 4&amp;5 are coming, I just haven\xe2\x80\x99t been able to edit all day!'"
938197673307406337,2017-12-06 00:05:30,"b'So I think I figured out why Day 3 of Vlogmas got demonetized. Bots apparently don\xe2\x80\x99t get context. At all. Also, the\xe2\x80\xa6 https://t.co/OseGPGwbXa'"
937759513825902592,2017-12-04 19:04:25,"b""Karaoke &amp; Murphy's Law | Vlogmas Day 3: https://t.co/Ag89hHp5jx via @YouTube"""
937759496541233152,2017-12-04 19:04:21,"b""I added a video to a @YouTube playlist https://t.co/Ag89hHp5jx Karaoke &amp; Murphy's Law | Vlogmas Day 3"""
937653818334109697,2017-12-04 12:04:25,b'Chess Match &amp; Christmas Fun | Vlogmas Day 2: https://t.co/xpxVBGxMOo via @YouTube'
937653805667311616,2017-12-04 12:04:22,b'I added a video to a @YouTube playlist https://t.co/xpxVBGxMOo Chess Match &amp; Christmas Fun | Vlogmas Day 2'
937172929825116160,2017-12-03 04:13:32,b'Getting Ready for the Weekend | Vlogmas Day 1: https://t.co/AqPehfNuLk via @YouTube'
937172906404139008,2017-12-03 04:13:27,b'I added a video to a @YouTube playlist https://t.co/AqPehfNuLk Getting Ready for the Weekend | Vlogmas Day 1'
937125610467536897,2017-12-03 01:05:31,b'I\xe2\x80\x99m finishing editing Day 1 of Vlogmas right now! It\xe2\x80\x99ll be up for you soon!'
936973429164699648,2017-12-02 15:00:48,b'I forgot my headphones and can\xe2\x80\x99t edit Vlogmas day 1. Trying not to die of boredom at this chess match.'
936453318037180416,2017-12-01 04:34:04,b'@tinawbrr @CaitlinWelborn @KathleenLights1 @KLPolish It\xe2\x80\x99s the constellation in the movie Serendipity if I remember correctly! \xf0\x9f\x98\x8d'
936306921728077824,2017-11-30 18:52:20,"b'Getting ready for Vlogmas! Can\xe2\x80\x99t believe it\xe2\x80\x99s here already. \xf0\x9f\x8e\x84 I\xe2\x80\x99ll be filming on December 1st,\xe2\x80\xa6 https://t.co/zS0i4PP5mu'"
936240555901808641,2017-11-30 14:28:37,b'I love showing up early for a doctors appt and having to wait well past the appt time to even be brought into a roo\xe2\x80\xa6 https://t.co/HDuD6ACBbO'
935854286222880773,2017-11-29 12:53:43,b'Emma has claimed the furry tree skirt as her own. \xf0\x9f\x90\xb1 https://t.co/5j7xkNDMNW'
935477455841910784,2017-11-28 11:56:20,"b'Good Morning! I\xe2\x80\x99ve spent most of Thanksgiving break in a mini hibernation, but today it\xe2\x80\x99s back to the normal world https://t.co/9BRnIu11bs'"
935113797848707072,2017-11-27 11:51:17,b'Me at Prince Harry and Meghan Markle\xe2\x80\x99s engagement https://t.co/i3HKiwbLRC'
934026643978555392,2017-11-24 11:51:19,b'Me? Black Friday Shopping? \xf0\x9f\x98\x82\xf0\x9f\x98\x82\xf0\x9f\x98\x82\xf0\x9f\x98\x82\xf0\x9f\x98\x82 No. I\xe2\x80\x99m going to eat pumpkin pie for breakfast and spend the day playing video games with my kids.'
933819964955545629,2017-11-23 22:10:03,b'Happy Thanksgiving everyone!!! We had a wonderful day hosting thanksgiving at my house with my mom. Pie has been ea\xe2\x80\xa6 https://t.co/026envJdu9'
933453007383072768,2017-11-22 21:51:54,"b'If I make it through this entire weekend without throat punching someone, it will be a Thanksgiving miracle.'"
932790210055819264,2017-11-21 01:58:11,b'There\xe2\x80\x99s no chocolate bit in the end of my peppermint drumstick! https://t.co/rg3MFJALF9'
932455121396666368,2017-11-20 03:46:39,b'I\xe2\x80\x99m going to admit that BTS at the AMA\xe2\x80\x99s made my entire month. \xf0\x9f\x98\x84\xf0\x9f\x98\x84\xf0\x9f\x98\x84'
931255334630580224,2017-11-16 20:19:08,b'Yep. Hearing any song from the A Walk to Remember soundtrack still makes me all \xf0\x9f\x98\xad\xf0\x9f\x98\xad\xf0\x9f\x98\xad'
931108352754581504,2017-11-16 10:35:05,b'Got up at 4:30 am this morning. https://t.co/5I8QsDDAbD'
930767180651814914,2017-11-15 11:59:23,b'My new tree should be here today! \xf0\x9f\x92\x97 Yay for shipping taking less time than expected.'
929077250309476354,2017-11-10 20:04:12,"b'I started re arranging everything, and now my office is this. https://t.co/whNcW2bQjQ'"
929048997293150208,2017-11-10 18:11:56,b'Debating on moving all the furniture in my filming room...'
928956703978262528,2017-11-10 12:05:12,b'Actually. I just rechecked the weather. It\xe2\x80\x99s 14. https://t.co/8PtaSH3LEi'
928955342528053248,2017-11-10 11:59:47,b'The wind chill is 18. https://t.co/tW85PNUROg'
928948420835934209,2017-11-10 11:32:17,b'Why does YouTube insist on demonitizing my makeup videos 12-25 hrs after they go up? Why? \xf0\x9f\xa4\xaf For goodness sakes they\xe2\x80\xa6 https://t.co/WZRGG6i4sv'
928637371767279616,2017-11-09 14:56:17,b'Maybelline X Gigi Hadid Collection Review | Is It Worth It?: https://t.co/3JJwTvgDNA via @YouTube'
928637342952370176,2017-11-09 14:56:10,b'I added a video to a @YouTube playlist https://t.co/3JJwTvgDNA Maybelline X Gigi Hadid Collection Review | Is It Worth It?'
928343124191170560,2017-11-08 19:27:03,b'https://t.co/3zEr7DrCX9'
928341008412061696,2017-11-08 19:18:38,b'This is what happens when I sit down and think \xe2\x80\x9cI\xe2\x80\x99m going to do a natural look today...\xe2\x80\x9d https://t.co/TomNiQ2H3p'
928228049824428032,2017-11-08 11:49:47,b'Good Morning! Birthday day is over and it\xe2\x80\x99s back to normal here today. Lots of editing to do! https://t.co/Hi7dPcIu08'
928103004372459522,2017-11-08 03:32:54,b'The twitter happy birthday balloons are awesome! \xf0\x9f\x8e\x81'
927990922733871104,2017-11-07 20:07:31,b'Tried some new makeup today and it looks so bad I\xe2\x80\x99m going to have to redo my entire face today. \xf0\x9f\x91\x80 Video coming tonight or tomorrow morning \xf0\x9f\x92\x8b'
927922181182492673,2017-11-07 15:34:22,"b""Aaaand my new video just got demonetized. I'm guessing because I said the word shit, even though I bleeped it out i\xe2\x80\xa6 https://t.co/5CEsxlzRyq"""
927875919133511687,2017-11-07 12:30:32,b'https://t.co/CLaSU9eouF'
927629928597721088,2017-11-06 20:13:04,b'One of these days iphone front facing cameras will have the same quality as the back camera. I\xe2\x80\xa6 https://t.co/i9gDVxNA4y'
927588561569943552,2017-11-06 17:28:41,b'October Favorites 2017 + Halloween Chat https://t.co/CvT2Z176jc'
927588546923384834,2017-11-06 17:28:38,b'I added a video to a @YouTube playlist https://t.co/CvT2Z176jc October Favorites 2017 + Halloween Chat'
926061415168868352,2017-11-02 12:20:21,b'Good Morning! \xe2\x98\xba\xef\xb8\x8f Freshly washed brushes make me happy. https://t.co/Ixg6vTg4iF'
925685000510550016,2017-11-01 11:24:37,"b""Happy that it's November. October was just not a good month this year."""
925076815185629184,2017-10-30 19:07:54,"b""Yes dude who drives a giant F-350. I AM judging you when you still can't park between the lines on the third attempt."""
925037281236389888,2017-10-30 16:30:48,"b""I'm exhausted, my jaw and teeth hurt, and my house looks like a dumpster fire. https://t.co/3eM133cLiY"""
924995994651152389,2017-10-30 13:46:45,"b""Really hoping this is my last dentist visit for a while. My dentist is great, but I'd rather not visit."""
923946839472332802,2017-10-27 16:17:47,b'My. Entire. Day. https://t.co/aLaaCCbUSQ'
923645204875436032,2017-10-26 20:19:11,"b""I appreciate that so many of you watch and love my videos, and it's even more special so close to my birthday! https://t.co/HbRLAm8jh6"""
923644133021020160,2017-10-26 20:14:56,"b'I wanted to thank you all so much!!! After 3 years on Youtube, I finally reached 1,000 subscribers!!!'"
923620732504027137,2017-10-26 18:41:57,"b""After my husband's birthday yesterday and an emergency statcare visit for a kid this morning, I am just exhausted."""
923144086558789632,2017-10-25 11:07:56,b'The high for today is only 49 degrees. Can we be done with this whole winter thing now? https://t.co/cSdq6fi8Lt'
922953566565871618,2017-10-24 22:30:52,b'\xf0\x9f\x91\xbb My Beetlejuice Halloween Makeup Tutorial just went up! \xf0\x9f\x8e\x83 https://t.co/38eaiJHrF1'
922952562239770624,2017-10-24 22:26:53,b'Beetlejuice Halloween Makeup Tutorial! https://t.co/fcXGB0gn6J'
922952472909549568,2017-10-24 22:26:31,b'I added a video to a @YouTube playlist https://t.co/fcXGB0gn6J Beetlejuice Halloween Makeup Tutorial'
922903881843167232,2017-10-24 19:13:26,"b""Yet again I find myself wearing Halloween makeup to my kids' school... easy Beetlejuice tutorial going up later ton\xe2\x80\xa6 https://t.co/DxL88azIU5"""
922776493125767169,2017-10-24 10:47:14,b'Nope. Never going to be a morning person. https://t.co/SbTP2NDaB8'
922261358737002496,2017-10-23 00:40:17,b'I am only okay with Justin Timberlake doing the halftime show if Britney Spears is there and they wear the matching\xe2\x80\xa6 https://t.co/0MCWnXPywj'
922085221851369472,2017-10-22 13:00:23,b'October Sephora Play Unboxing!! https://t.co/JDCTYKSHnr'
922085176351641601,2017-10-22 13:00:12,b'I added a video to a @YouTube playlist https://t.co/JDCTYKSHnr October Sephora Play Unboxing'
921028841203748864,2017-10-19 15:02:42,b'Harley Quinn Makeup Tutorial | Easy Halloween Makeup https://t.co/a5pILNeNJ5'
921028804956643333,2017-10-19 15:02:33,b'I added a video to a @YouTube playlist https://t.co/a5pILNeNJ5 Harley Quinn Makeup Tutorial | Easy Halloween Makeup'
920993059072077824,2017-10-19 12:40:31,b'This very easy Harley Quinn tutorial will be up in a couple hours!! \xf0\x9f\x98\x9c\xf0\x9f\x92\x8b https://t.co/2dX9fUz9Gt'
920397166102958081,2017-10-17 21:12:39,b'My stress level has gone from about a 14 to a 96 in the past two hours. https://t.co/vDd7I0ZiEQ'
920329556380307456,2017-10-17 16:43:59,b'Me waiting for the ups truck https://t.co/jDvMnDfXc3'
920106407906758661,2017-10-17 01:57:17,b'Watching my amazon order tracking like... https://t.co/3CW6PhXkAd'
919723412511186944,2017-10-16 00:35:23,b'I was doing some testing for a Halloween makeup look and dumped a full bottle of my nyx foundation all over my carpet and pj pants. \xf0\x9f\x98\xad\xf0\x9f\x98\xad\xf0\x9f\x98\xad'
918942824317489153,2017-10-13 20:53:37,b'My neighbors and their kids screaming at each other outside is driving me nuts. It sounds like a football stadium outside my office.'
918582500074643456,2017-10-12 21:01:49,"b'Fall &amp; Halloween Home Decor Haul | Home Goods, Bath &amp; Body Works, Target - I pretty much went everywhere!! https://t.co/xXXriZjYLt'"
918582483360407554,2017-10-12 21:01:45,"b'I added a video to a @YouTube playlist https://t.co/xXXriZjYLt Fall &amp; Halloween Home Decor Haul | Home Goods, Bath &amp; Body Works,'"
918478767181484032,2017-10-12 14:09:37,"b""I'm getting kind of obsessed with binge watching Top Chef. It's becoming a problem."""
918193414642061312,2017-10-11 19:15:43,b'\xf0\x9f\x8d\x81\xf0\x9f\x8e\x83\xf0\x9f\x8d\x82 https://t.co/4ZzVnCzhEf'
917426243909423104,2017-10-09 16:27:16,"b""Yep. Totally being the girl who instagrams her lunch. But I've been loving super spicy ramen\xe2\x80\xa6 https://t.co/gnqD2a5Yvj"""
916379155800952832,2017-10-06 19:06:30,b'Watching other people drive makes me twitchy. How do you have something the size of a Yukon or Suburban and have no idea how to drive it?'
916326241355157507,2017-10-06 15:36:15,"b""Me this morning: I'm going to film today!\n\nMe now: I'm sick AND my period just started. The fates are against me. https://t.co/4aDBPSyDxz"""
915957578441641985,2017-10-05 15:11:19,"b""Whyyyyy did I have to get sick in October? \xf0\x9f\x98\xb7 I just don't have the energy to film today. Or to function like a norm\xe2\x80\xa6 https://t.co/fFVhEvAsWB"""
915595932997177344,2017-10-04 15:14:16,b'Eating soup for lunch and hoping the veggies magically make me better.'
915545276684881920,2017-10-04 11:52:58,"b""Really, really hoping this feeling isn't me getting sick."""
915258787249999873,2017-10-03 16:54:34,b'September Sephora Play Unboxing!: https://t.co/hZy4u7lAFA via @YouTube'
915258768249823234,2017-10-03 16:54:29,b'I added a video to a @YouTube playlist https://t.co/hZy4u7lAFA September Sephora Play Unboxing!'
914477902972047360,2017-10-01 13:11:36,b'All I need to hear right now is that Marilyn Manson is recovering well.'
913534152061980673,2017-09-28 22:41:29,"b'RT @robbie_strand: McDonald\'s called out order 369 and i yelled out ""Damn she fine"" and nobody laughed or danced, I hate where we\'re at in\xe2\x80\xa6'"
913454021301735424,2017-09-28 17:23:04,"b""Empties Review! | Products I've Used Up + Storytime: https://t.co/UDLyZrOGY8 via @YouTube"""
913016984736092160,2017-09-27 12:26:26,b'So happy my car is up and running again!!'
912664838194724864,2017-09-26 13:07:08,b'Very grateful to the two men who helped push my van off the road when the radiator started steaming today!!'
912449711046500352,2017-09-25 22:52:18,b'My mom sent me home with some new fall magazines today! I have a date with these after a hot\xe2\x80\xa6 https://t.co/kZ8hLGupaL'
912380550136156161,2017-09-25 18:17:29,b'\xf0\x9f\x91\x80 And genetically soft and weak teeth. Amen for good dentistry and good insurance.'
912379880771346434,2017-09-25 18:14:49,"b""Yay my tooth is fixed! My gap is a bit bigger, but that's okay. We're not even going to talk about the cavities. I have two follow up appts"""
912324216745275392,2017-09-25 14:33:38,"b'Waiting for the novocaine to kick in. A gentle reminder for you guys, get your ass to the dentist regularly. https://t.co/8p8Lf4Zqxt'"
912306668125466626,2017-09-25 13:23:54,"b'At the dentist this morning! Not the most fun thing in the world, but hopefully they can fix that chip.'"
912251393427288065,2017-09-25 09:44:15,b'Out of bed stupid early this morning to get ready for a very busy day. https://t.co/fD1rSIT05H'
911342034404937728,2017-09-22 21:30:47,b'NYX Epic Ink Liner VS Kat Von D Tattoo Liner: https://t.co/QUINamjBdw via @YouTube'
911342017623490566,2017-09-22 21:30:43,b'I added a video to a @YouTube playlist https://t.co/QUINamjBdw NYX Epic Ink Liner VS Kat Von D Tattoo Liner'
911239451527041027,2017-09-22 14:43:09,"b""I needed a change of scenery so much, so I'm editing today's video at the library before running\xe2\x80\xa6 https://t.co/LEnCbSuy3Q"""
910583413169631232,2017-09-20 19:16:18,"b""Bless the teachers and admin at my kids' school. They have to deal with these parents, and most of them are worse than the kids."""
910132573124403200,2017-09-19 13:24:49,b'No Foundation Makeup Tutorial: https://t.co/uYg2Jrq03c via @YouTube'
910132569391366144,2017-09-19 13:24:48,b'I added a video to a @YouTube playlist https://t.co/uYg2Jrq03c No Foundation Makeup Tutorial'
909857788158935040,2017-09-18 19:12:55,"b""There's a special place in hell for the parents who sneak around the school pickup rules. I see you. \xf0\x9f\x91\x80"""
909815221828689921,2017-09-18 16:23:47,b'Yay! Made my dentist appt and will be getting my poor chipped tooth taken care of next Monday or soon after.'
909422768898404352,2017-09-17 14:24:19,b'When you chip a tooth and no dentists are open on Sundays because you live in BFE. https://t.co/GgWQRP1bxR'
909201744986562565,2017-09-16 23:46:02,b'You guys!! This tastes like an ice cream version of a snickers bar! And... for my friends like\xe2\x80\xa6 https://t.co/FDc4jeV8IE'
909150051548753921,2017-09-16 20:20:38,b'Very grateful for restaurants with single bathrooms that I can hide in for a minute during a panic attack/ migraine combo.'
908464897838784512,2017-09-14 22:58:04,"b""I'm not stress eating... https://t.co/ngz6XU6aif"""
908408564812787712,2017-09-14 19:14:13,"b'I just got the ""oh that poor thing has lost her mind"" look from someone who spotted me trying to vlog while waiting to pickup my kids. \xf0\x9f\x91\x80'"
907958263785967617,2017-09-13 13:24:53,b'NYX Tame &amp; Frame VS. Anastasia Beverly Hills Dipbrow: https://t.co/JiRs5FKMHK via @YouTube'
907682996798590978,2017-09-12 19:11:05,"b""But I don't think anyone will pay that much for my kidney!!  #AppleEvent"""
907676055628079105,2017-09-12 18:43:30,"b'Okay, but how much is being a talking poo going to cost? #AppleEvent'"
907673799952388096,2017-09-12 18:34:32,b'Which kidney do I like the least? #AppleEvent'
907671547061706753,2017-09-12 18:25:35,"b'Face ID to unlock the iPhone x? Ok, I like.  #AppleEvent'"
907668042653618186,2017-09-12 18:11:39,b'AR is nice and all... but can we not do the glass back thing again? I have a broken Phone 4 with packing tape on it somewhere #AppleEvent'
907663810068144128,2017-09-12 17:54:50,b'Finally the phones!! I ate like half a pint of ice cream already.  #AppleEvent'
907658457964318720,2017-09-12 17:33:34,b'This is going to be expensive... #AppleEvent'
907657755284185088,2017-09-12 17:30:46,"b""Cellular Apple Watch? Now it's worth getting  #AppleEvent"""
907653949485973504,2017-09-12 17:15:39,"b'The more they talk about the buildings and stores, the more I see the cost of the iPhone going up. \xf0\x9f\x98\xac #AppleEvent'"
906234294405931008,2017-09-08 19:14:27,b'My period is trying to kill me this week. \xf0\x9f\x98\xb4 I need more energy and to actually remember to take my iron supplements.'
905508530676957185,2017-09-06 19:10:31,b'Few things make me happier than blasting k pop in the school parking lot during parent pickup. \xf0\x9f\x98\x9c'
905508148655656960,2017-09-06 19:09:00,"b'RT @LouisePentland: Just read a really nasty comment about me, then saw this and thought it was brilliantly timed.... https://t.co/zaaypZ1z\xe2\x80\xa6'"
905475293015678976,2017-09-06 16:58:27,"b""L'Oreal Lash Paradise Mascara Review: https://t.co/hTzEsfriX3 via @YouTube"""
905186905616261120,2017-09-05 21:52:30,b'@TeamYouTube Thank you! I appreciate it!'
905182363407265792,2017-09-05 21:34:27,"b""@TeamYouTube I can't appeal, as I'm a small youtuber and my there's no way my video will get 1,000 views in 7 days,\xe2\x80\xa6 https://t.co/VL2Uasvfrh"""
905177560547565568,2017-09-05 21:15:22,"b""@TeamYouTube My review video was demonetized, and I'm not eligible for a manual review. Is it because the name of the palette is Naked Heat?"""
905175861976076290,2017-09-05 21:08:37,"b""Wait, please don't tell me it's because the title is Urban Decay Naked Heat... would @youtube demonetize a video because of a product name?"""
905173851709087744,2017-09-05 21:00:38,"b'So @youtube, what option does my family-friendly makeup channel have to get this fixed?'"
905173663544172544,2017-09-05 20:59:53,"b""And they won't manually review it because it doesn't have 1,000 views."""
905173523970347008,2017-09-05 20:59:20,"b'I believe the worst thing I said was ""holy jesus"" when I dropped the palette on the floor.'"
905173354897973249,2017-09-05 20:58:39,"b""This is absolute crap. My newest video that's an eye shadow palette review has been demonetized by Youtube."""
905126371919368192,2017-09-05 17:51:58,"b""With Irma now a Category 5, if they tell you to evacuate, go immediately. I remember Andrew in 1992, and you don't want to play with that."""
904727688497295360,2017-09-04 15:27:44,b'Happy Labor Day!! I hope you get to enjoy an extra day off school or work today. Let me know if\xe2\x80\xa6 https://t.co/UdoYIMVSWN'
904726199641014274,2017-09-04 15:21:49,b'Urban Decay Naked Heat | First Impressions + Swatches: https://t.co/hZuIKm7Rei via @YouTube'
904726192082886656,2017-09-04 15:21:47,b'I added a video to a @YouTube playlist https://t.co/hZuIKm7Rei Urban Decay Naked Heat | First Impressions + Swatches'
904502902332547072,2017-09-04 00:34:31,"b""Editing tonight's video with my new tea cup! https://t.co/8mphkkyj3M"""
903412635026239488,2017-09-01 00:22:11,b'10 Minute Makeup Routine | Get Ready With Me: https://t.co/d8IqlBVhEG via @YouTube'
903412624079163393,2017-09-01 00:22:08,b'I added a video to a @YouTube playlist https://t.co/d8IqlBVhEG 10 Minute Makeup Routine | Get Ready With Me'
903335791446945795,2017-08-31 19:16:50,b'The tutorial for this quick 10 minute makeup routine will be up on my channel later tonight!!\xe2\x80\xa6 https://t.co/H7j3pqxnun'
902974112095719424,2017-08-30 19:19:39,b'Me watching other parents fight to get in the line at school pickup. https://t.co/HxTl2pUmVC'
902925788940521472,2017-08-30 16:07:38,b'August Favorites 2017: https://t.co/CwwBGyWW0Y via @YouTube'
902925733357645824,2017-08-30 16:07:25,b'I added a video to a @YouTube playlist https://t.co/CwwBGyWW0Y August Favorites 2017'
902897344932446208,2017-08-30 14:14:36,b'Getting lots done this morning and ramping things WAY up next month. September is going to be crazy.'
902721817412075521,2017-08-30 02:37:07,b'My ragweed allergy is trying to kill me tonight. \xf0\x9f\x8d\x82 Yay for pumpkins &amp; scarfs &amp; a swollen face &amp; not being able to see or breathe! #fall'
902611001538994178,2017-08-29 19:16:47,b'I love horrifying other parents at pickup with my music choices. \xf0\x9f\x8e\xb6To the window.. to the wall...\xf0\x9f\x8e\xb6'
901174936869498881,2017-08-25 20:10:22,b'ULTA HAUL! | August 2017: https://t.co/mLKnFfwawl via @YouTube'
901174929491714050,2017-08-25 20:10:20,b'I added a video to a @YouTube playlist https://t.co/mLKnFfwawl ULTA HAUL! | August 2017'
901162177742110720,2017-08-25 19:19:40,"b'Negatives of being short. That mysterious ""rash"" on my neck was caused by my seatbelt. \xf0\x9f\xa4\xa6\xf0\x9f\x8f\xbc\xe2\x80\x8d\xe2\x99\x80\xef\xb8\x8f'"
901050210570338304,2017-08-25 11:54:45,b'Blasting AC/DC in the school drop off line is the highlight of my morning so far. \xf0\x9f\x98\x8e'
900841418146664449,2017-08-24 22:05:05,"b""I know I'm tired because I just had to convince myself to get up and make enchiladas."""
900798582881693697,2017-08-24 19:14:52,"b""Today's lesson class: if you act like a meany butt, you might get punched in the head. \xf0\x9f\xa4\xb7\xf0\x9f\x8f\xbc\xe2\x80\x8d\xe2\x99\x80\xef\xb8\x8f"""
900770904023629824,2017-08-24 17:24:53,b'My daughter argued with her teacher for 45 minutes on the second day of school... I wish the brave man the best thi\xe2\x80\xa6 https://t.co/arxZZitrut'
900513425377439745,2017-08-24 00:21:45,b'Tomorrow is a full on work day all day. \xf0\x9f\x98\x9c'
900438163084242945,2017-08-23 19:22:42,"b""I seriously have the heated seat back on and the music going. I just need a subwoofer in the back of this van and we'd be good. \xf0\x9f\x98\x8e"""
900437139980210177,2017-08-23 19:18:38,"b""Doing school pickup has proven that just because you can afford a nice car doesn't mean you know how to drive it. \xf0\x9f\x91\x80\xe2\x98\x95\xef\xb8\x8f"""
900426076811296770,2017-08-23 18:34:40,b'I may have bought 5 new lip products this week. I think I need a support group.'
900380026599858177,2017-08-23 15:31:41,b'Enjoying a lunch out with my little squish while the rest of the kids are in school! \xf0\x9f\x98\x8e'
900077270542536706,2017-08-22 19:28:38,b'Brand new August Sephora Play Unboxing just went up!! Link is in my bio \xf0\x9f\x92\x8b https://t.co/xGqhGaR4JX'
900062747865612288,2017-08-22 18:30:56,b'August Sephora Play Unboxing: https://t.co/y1UBauICTp via @YouTube'
900062735488225280,2017-08-22 18:30:53,b'I added a video to a @YouTube playlist https://t.co/y1UBauICTp August Sephora Play Unboxing'
